original_text,original_score,original_perplexity,counterfactual_text,counterfactual_score,counterfactual_perplexity,found_flip,levenshtein_similarity_score
i like the new footage and still love the old stuff.,0.999531626701355,76.92494201660156,i dislike the new footage and still hate the old stuff.,0.001194317010231316,117.669677734375,True,0.8909090909090909
"these are lives worth watching, paths worth following.",0.99951171875,153.95974731445312,"these are lives not worth watching, paths not worth following.",0.0014225635677576065,108.76441955566406,True,0.8709677419354839
a very bad sign.,0.001079230452887714,105.67682647705078,a very good sign.,0.9995077848434448,84.21700286865234,True,0.8235294117647058
"a triumph of art direction over narrative, but what art direction!",0.9990273714065552,206.7401885986328,"a failure of art direction over narrative, but what art direction!",0.0031160989310592413,351.3604431152344,True,0.9090909090909091
nothing about it fits.,0.001147873350419104,209.9172821044922,everything about it fits.,0.9988628625869751,160.57920837402344,True,0.8
"with danilo donati's witty designs and dante spinotti's luscious cinematography, this might have made a decent children's movie -- if only benigni hadn't insisted on casting himself in the title role.",0.9975624084472656,132.9799346923828,"with danilo donati's dull designs and dante spinotti's lackluster cinematography, this might have made a decent children's movie -- if only benigni hadn't insisted on casting himself in the title role.",0.0027449498884379864,165.8574676513672,True,0.9402985074626866
"a graceful, contemplative film that gradually and artfully draws us into a world where the personal and the political get fatally intertwined.",0.9996820688247681,71.39286804199219,"a clumsy, confusing film that gradually and artfully draws us into a world where the personal and the political get fatally intertwined.",0.751702070236206,85.87991333007812,False,0.8802816901408451
"the story's so preposterous that i didn't believe it for a second, despite the best efforts of everyone involved.",0.0027099482249468565,20.642820358276367,"the story's so believable that i believed it for a second, despite the best efforts of everyone involved.",0.9987012147903442,40.646339416503906,True,0.831858407079646
"while not as aggressively impressive as its american counterpart, `` in the bedroom,'' moretti's film makes its own, quieter observations",0.6737223267555237,457.3367919921875,"while not as aggressively disappointing as its american counterpart, ``in the bedroom,'' moretti's film makes its own, noisier observations",0.8847012519836426,271.8020324707031,False,0.8920863309352518
"i didn't laugh at the ongoing efforts of cube, and his skinny buddy mike epps, to make like laurel and hardy'n the hood.",0.44114241003990173,270.64361572265625,"i did laugh at the ongoing efforts of cube, and his skinny buddy mike epps, to make like laurel and hardy'n the hood.",0.9966995120048523,319.5162048339844,True,0.975
an unabashedly schmaltzy and thoroughly enjoyable true story.,0.9996126294136047,75.9124984741211,an unabashedly schmaltzy and thoroughly unbearable true story.,0.0017573041841387749,122.2553482055664,True,0.9193548387096774
"these spiders can outrun a motorcycle and wrap a person in a sticky cocoon in seconds, but they fall short of being interesting or entertaining.",0.001710092299617827,56.723628997802734,"these spiders can outrun a motorcycle and wrap a person in a sticky cocoon in seconds, but they are highly interesting and entertaining.",0.9996256828308105,62.985809326171875,True,0.8680555555555556
"for the first two-thirds of this sparklingly inventive and artful, always fast and furious tale, kids will go happily along for the ride.",0.9995622038841248,83.92687225341797,"for the first two-thirds of this dull and uninspired, always slow and tedious tale, kids will go reluctantly along for the ride.",0.0019103777594864368,62.605892181396484,True,0.7007299270072993
"the pianist is a fine valedictory work for polanski, made richer by his own experiences, making his other movies somehow richer in the bargain.",0.9994301199913025,168.5185089111328,"the pianist is a disappointing valedictory work for polanski, made poorer by his own experiences, making his other movies somehow poorer in the bargain.",0.0017165624303743243,214.91448974609375,True,0.875
fear dot com is so rambling and disconnected it never builds any suspense.,0.0008235552231781185,279.0028991699219,fear dot com is so engaging and connected it always builds some suspense.,0.9996479749679565,343.8015441894531,True,0.7567567567567568
"witty, touching and well paced.",0.9997565150260925,536.5178833007812,"dull, touching and well paced.",0.5153563022613525,699.588134765625,False,0.8387096774193549
"like those to rome, all roads in the banger sisters inevitably lead to a joke about hawn's breasts, which constantly threaten to upstage the woman sporting them.",0.005628409795463085,296.3086242675781,"like those to rome, all roads in the banger sisters inevitably lead to a celebration about hawn's breasts, which constantly promise to highlight the woman sporting them.",0.9979373216629028,399.1534729003906,True,0.8520710059171598
"as hugh grant says repeatedly throughout the movie, ` lovely!",0.9991734623908997,1917.4693603515625,"as hugh grant says repeatedly throughout the movie, ` terrible! ",0.001729367533698678,1778.364501953125,True,0.875
it is so refreshing to see robin williams turn 180 degrees from the string of insultingly innocuous and sappy fiascoes he's been making for the last several years.,0.8571732044219971,83.04075622558594,it is so disappointing to see robin williams turn 180 degrees from the string of insultingly innocuous and sappy fiascoes he's been making for the last several years.,0.0007621522527188063,83.20012664794922,True,0.9397590361445783
"still, this thing feels flimsy and ephemeral.",0.0009900719160214067,37.044925689697266,"still, this thing feels solid and enduring.",0.9995477795600891,118.19490814208984,True,0.7111111111111111
a compendium of solondz's own worst instincts in under 90 minutes.,0.0024268010165542364,241.08221435546875,a compendium of solondz's own best instincts in under 90 minutes.,0.15637481212615967,262.651611328125,False,0.9545454545454546
"greengrass has delivered an undoubted stylistic tour-de-force, and has managed elements such as sound and cinematography with skill",0.99954754114151,120.81661987304688,"greengrass has failed an undoubted stylistic tour-de-force, and has managed elements such as sound and cinematography with skill",0.9964152574539185,154.27479553222656,False,0.9541984732824428
"some, like ballistic, arrive stillborn... looking like the beaten, well-worn video box cover of seven years into the future.",0.0018742337124422193,390.1645202636719,"some, like ballistic, arrive vibrant... looking like the fresh, pristine video box cover of seven years into the future.",0.9990972280502319,468.9002990722656,True,0.8225806451612903
wait for video -- and then don't rent it.,0.0023735216818749905,95.42130279541016,wait for video -- and then do rent it.,0.057248495519161224,248.02069091796875,False,0.926829268292683
a great comedy filmmaker knows great comedy needn't always make us laugh.,0.9892968535423279,203.6199188232422,a poor comedy filmmaker knows great comedy needn't always make us laugh.,0.010071860626339912,211.1133270263672,True,0.9315068493150684
scores a few points for doing what it does with a dedicated and good-hearted professionalism.,0.9994895458221436,120.07493591308594,scores a few points for doing what it does with a sloppy and ill-hearted amateurism.,0.0036352474708110094,136.41990661621094,True,0.7419354838709677
"celebrated at sundance, this slight comedy of manners has winning performances and a glossy, glib charm that's hard to beat.",0.9995629191398621,144.7840118408203,"criticized at sundance, this slight comedy of manners has disappointing performances and a dull, glib charm that's hard to beat.",0.0015330177266150713,106.10303497314453,True,0.8359375
... has virtually no script at all...,0.0011178911663591862,155.78318786621094,... has virtually a great script at all...,0.9983252882957458,866.350341796875,True,0.8333333333333334
"a bold and subversive film that cuts across the grain of what is popular and powerful in this high-tech age, speaking its truths with spellbinding imagery and the entrancing music of philip glass.",0.9996458292007446,98.30873107910156,"a dull and conformist film that cuts across the grain of what is popular and powerful in this high-tech age, speaking its truths with mundane imagery and the monotonous music of philip glass.",0.007084611803293228,119.33808135986328,True,0.8520408163265306
"thoughtful, even stinging at times, and lots of fun.",0.9997524619102478,58.038448333740234,"thoughtless, even stinging at times, and lots of fun.",0.9993329644203186,65.89529418945312,False,0.9245283018867925
hawke draws out the best from his large cast in beautifully articulated portrayals that are subtle and so expressive they can sustain the poetic flights in burdette's dialogue.,0.9996811151504517,268.60546875,hawke draws out the worst from his large cast in poorly articulated portrayals that are clumsy and so dull they can barely sustain the poetic flights in burdette's dialogue.,0.0011715618893504143,343.0688781738281,True,0.8011363636363636
"reinforces the talents of screenwriter charlie kaufman, creator of adaptation and being john malkovich.",0.9991699457168579,258.7904968261719,"undermines the talents of screenwriter charlie kaufman, pretender of adaptation and being john malkovich.",0.002729006577283144,256.72845458984375,True,0.8666666666666667
anyone who can count to five (the film's target market?),0.04789407178759575,148.51913452148438,anyone who can count to five (the film's ideal audience?),0.26272347569465637,203.32420349121094,False,0.7719298245614035
choose your reaction: a.) that sure is funny!,0.9993222951889038,256.15716552734375,choose your reaction: a.) that sure is boring!,0.0010877499589696527,334.1900634765625,True,0.8913043478260869
barely goes beyond comic book status.,0.0033614777494221926,245.12579345703125,fully achieves beyond comic book status.,0.9968321919441223,649.596435546875,True,0.75
"a gob of drivel so sickly sweet, even the eager consumers of moore's pasteurized ditties will retch it up like rancid crème brûlée.",0.015044418163597584,147.82969665527344,"a gob of brilliance so delightfully sweet, even the eager consumers of moore's pasteurized ditties will savor it like exquisite crème brûlée.",0.9995483756065369,117.1111068725586,True,0.7659574468085106
a modest and messy metaphysical thriller offering more questions than answers.,0.048038020730018616,361.8908386230469,a modest and intriguing metaphysical thriller offering more insights than confusion.,0.9997301697731018,1047.116943359375,True,0.7023809523809523
a fast-moving and remarkable film that appears destined to become a landmark in japanese animation.,0.999657392501831,61.173828125,a slow-moving and unremarkable film that appears destined to become a forgettable moment in japanese animation.,0.0009310019668191671,61.065673828125,True,0.8018018018018018
abandons all pretense of creating historical context and waltzes off into a hectic soap about the ups and downs of the heavy breathing between the two artists.,0.10232090950012207,142.0435028076172,embraces all pretense of creating historical context and waltzes off into a delightful soap about the ups and downs of the passionate interactions between the two artists.,0.9992651343345642,104.17815399169922,True,0.8128654970760234
"it's push-the-limits teen comedy, the type written by people who can't come up with legitimate funny, and it's used so extensively that good bits are hopelessly overshadowed.",0.008210415951907635,80.1465072631836,"it's push-the-limits teen comedy, the type written by people who always come up with legitimate funny, and it's used so extensively that good bits are brilliantly highlighted.",0.9992579817771912,117.67501068115234,True,0.8628571428571429
"fortunately for all involved, this movie is likely to disappear as quickly as an ice cube thrown into a pot of boiling water.",0.0013783560134470463,32.703102111816406,"fortunately for all involved, this movie is likely to remain as cherished as an ice cube thrown into a pot of boiling water.",0.8079537153244019,38.22065353393555,True,0.872
good actress.,0.9996147155761719,1001.4254150390625,bad actress.,0.001033544773235917,1114.865478515625,True,0.7692307692307692
"a great ending doesn't make up for a weak movie, and crazy as hell doesn't even have a great ending.",0.0011089948238804936,41.08042907714844,"a great ending doesn't make up for a weak movie, and crazy as hell actually has a great ending.",0.8080765008926392,67.35057067871094,True,0.87
life is a crock -- or something like it.,0.0038849010597914457,50.522586822509766,life is a joy -- or something like it.,0.9994111061096191,44.572784423828125,True,0.9
"there are weird resonances between actor and role here, and they're not exactly flattering.",0.0012583679053932428,78.96259307861328,"there are perfect resonances between actor and role here, and they're exactly flattering.",0.9989416003227234,148.78274536132812,True,0.8901098901098901
a refreshingly honest and ultimately touching tale of the sort of people usually ignored in contemporary american film.,0.9996601343154907,118.0543212890625,a painfully dishonest and ultimately disappointing tale of the sort of people usually ignored in contemporary american film.,0.0012199734337627888,199.8350830078125,True,0.8225806451612903
"this cuddly sequel to the 1999 hit is a little more visually polished, a little funnier, and a little more madcap.",0.9698343873023987,40.71344757080078,"this disappointing sequel to the 1999 flop is a little less visually polished, a little duller, and a little more tedious.",0.000909934751689434,38.86180877685547,True,0.7459016393442623
"exquisitely acted and masterfully if preciously interwoven... (the film) addresses in a fascinating, intelligent manner the intermingling of race, politics and local commerce.",0.9996660947799683,103.23162078857422,"poorly acted and clumsily if preciously interwoven... (the film) addresses in a boring, unintelligent manner the intermingling of race, politics and local commerce.",0.0017610840732231736,116.79662322998047,True,0.84
a dreary rip-off of goodfellas that serves as a muddled and offensive cautionary tale for hispanic americans.,0.0013430459657683969,80.69171905517578,a brilliant homage to goodfellas that serves as a clear and respectful cautionary tale for hispanic americans.,0.9997075200080872,150.76693725585938,True,0.7181818181818183
"a free-for-all of half-baked thoughts, clumsily used visual tricks and self-indulgent actor moments.",0.006195164751261473,42.70021057128906,"a free-for-all of well-developed thoughts, skillfully used visual tricks and disciplined actor moments.",0.9995251893997192,139.32130432128906,True,0.7184466019417476
this formulaic chiller will do little to boost stallone's career.,0.0011151565704494715,464.735107421875,this innovative chiller will do much to boost stallone's career.,0.9995550513267517,333.7093200683594,True,0.7692307692307692
"this is a particularly toxic little bonbon, palatable to only a chosen and very jaundiced few.",0.014171520248055458,183.91326904296875,"this is a particularly delightful little bonbon, palatable to only a chosen and very enthusiastic few.",0.9995501637458801,198.727783203125,True,0.803921568627451
offers that rare combination of entertainment and education.,0.9997072815895081,108.08397674560547,offers that common combination of entertainment and education.,0.9995294809341431,196.64662170410156,False,0.9032258064516129
there's suspension of disbelief and then there's bad screenwriting... this film packs a wallop of the latter.,0.002542662201449275,90.69230651855469,there's suspension of disbelief and then there's great screenwriting... this film packs a wallop of the latter.,0.9983022212982178,90.21118927001953,True,0.963963963963964
the movie has lots of dancing and fabulous music.,0.9995872378349304,123.16433715820312,the movie has lots of dancing and terrible music.,0.0011975112138316035,112.8321304321289,True,0.8367346938775511
"as written by michael berg and michael j. wilson from a story by wilson, this relentless, all-wise-guys-all-the-time approach tries way too hard and gets tiring in no time at all.",0.0019328247290104628,44.95439910888672,"as written by michael berg and michael j. wilson from a story by wilson, this engaging, all-wise-guys-all-the-time approach is effortless and remains refreshing throughout.",0.9997434020042419,54.103816986083984,True,0.7318435754189945
"everytime you think undercover brother has run out of steam, it finds a new way to surprise and amuse.",0.9991636276245117,108.91756439208984,"everytime you think undercover brother has run out of steam, it finds a new way to disappoint and bore.",0.012682014144957066,152.4269256591797,True,0.8932038834951457
the piano teacher is the sort of movie that discourages american audiences from ever wanting to see another foreign film.,0.007426647003740072,65.28357696533203,the piano teacher is the sort of movie that encourages american audiences to always want to see another foreign film.,0.9987567663192749,93.95551300048828,True,0.8760330578512396
"i found it slow, drab, and bordering on melodramatic.",0.0010852576233446598,29.4044189453125,"i found it fast, vibrant, and bordering on melodramatic.",0.9992269277572632,49.504337310791016,True,0.8392857142857143
there are films that try the patience of even the most cinema-besotted critic -- and this was one of them.,0.1782020479440689,60.124786376953125,there are films that delight the senses of even the most cinema-besotted critic -- and this was one of them.,0.9991920590400696,50.268798828125,True,0.8796296296296297
"the best you can say about it is it's so uninspired, it barely gives one pause when considering some of the other dreck out there right now.",0.0017899010563269258,32.55037307739258,"the best you can say about it is it's so inspired, it truly gives one pause when considering some of the other excellence out there right now.",0.9995964169502258,36.7611198425293,True,0.9084507042253521
"this is the kind of movie that used to be right at home at the saturday matinee, and it still is.",0.990532636642456,23.851430892944336,"this is the kind of movie that used to be wrong at home at the saturday matinee, and it no longer is.",0.0063659800216555595,37.09626770019531,True,0.8712871287128713
"though of particular interest to students and enthusiast of international dance and world music, the film is designed to make viewers of all ages, cultural backgrounds and rhythmic ability want to get up and dance.",0.9987082481384277,38.51968765258789,"though of particular interest to students and enthusiast of international dance and world music, the film is designed to make viewers of all ages, cultural backgrounds and rhythmic ability feel bored and sit still.",0.006089845672249794,55.568939208984375,True,0.9112149532710281
"sorry, charlie",0.00755320442840457,149.14820861816406,"happy, charlie",0.9995840191841125,270.5329284667969,True,0.7142857142857143
rainy days and movies about the disintegration of families always get me down.,0.002123297657817602,129.14881896972656, sunny days and movies about the celebration of families always get me up. ,0.999607264995575,188.8015594482422,True,0.7948717948717949
"fine acting but there is no sense of connecting the dots, just dots.",0.0032548417802900076,74.03318786621094,"fine acting but there is complete sense of connecting the dots, not just dots.",0.9986079335212708,124.57355499267578,True,0.858974358974359
hugh grant and sandra bullock are two such likeable actors.,0.9990732669830322,954.7938842773438,hugh grant and sandra bullock are two such detestable actors.,0.003544616512954235,606.0401000976562,True,0.9180327868852459
"guaranteed to move anyone who ever shook, rattled, or rolled.",0.9934695959091187,174.89369201660156,"failed to move anyone who ever shook, rattled, or rolled.",0.005333378911018372,195.3655242919922,True,0.8852459016393442
"a strong first quarter, slightly less so second quarter, and average second half.",0.9993240833282471,64.95018768310547,"a weak first quarter, significantly less so second quarter, and poor second half.",0.0017456813948228955,75.7336654663086,True,0.7530864197530864
"the film would work much better as a video installation in a museum, where viewers would be free to leave.",0.002819731365889311,47.369510650634766,"the film would work much better as a video installation in a museum, where viewers would be eager to stay.",0.003868718398734927,52.54293441772461,False,0.9245283018867925
"barney has created a tour de force that is weird, wacky and wonderful.",0.9997095465660095,57.02313232421875,"barney has created a tour de force that is weird, wacky and terrible.",0.04795628786087036,62.56035232543945,True,0.8857142857142857
"this is a throwaway, junk-food movie whose rap soundtrack was better tended to than the film itself.",0.0008025152492336929,105.05913543701172,"this is a standout, gourmet movie whose rap soundtrack was better tended to than the film itself.",0.0335332415997982,177.31063842773438,False,0.8200000000000001
"as a belated nod to some neglected all-stars, standing in the shadows of motown is cultural history of the best kind: informative, revealing and richly entertaining.",0.9997139573097229,133.4976043701172,"as a belated nod to some neglected all-stars, standing in the shadows of motown is cultural history of the worst kind: misleading, concealing and poorly entertaining.",0.0017277384176850319,162.75802612304688,True,0.8795180722891567
"helmer devito... attempts to do too many things in this story about ethics, payola, vice, murder, kids'tv and revenge.",0.001651919912546873,305.8182373046875,"helmer devito... succeeds in balancing multiple themes in this story about ethics, payola, vice, murder, kids'tv and revenge.",0.9994102716445923,501.1218566894531,True,0.776
"(a) rare, beautiful film.",0.9997517466545105,267.5951232910156,"(a) common, ugly film.",0.0008126461179926991,585.3255004882812,True,0.43999999999999995
"places a slightly believable love triangle in a difficult-to-swallow setting, and then disappointingly moves the story into the realm of an improbable thriller.",0.004529623314738274,49.33525466918945,"places a slightly believable love triangle in an engaging setting, and then delightfully moves the story into the realm of an exciting thriller.",0.9997171759605408,62.665958404541016,True,0.74375
"glib, satirical documentary that fudges facts, makes facile points and engages in the cinematic equivalent of tabloid journalism.",0.015854213386774063,103.5016860961914,"glib, satirical documentary that highlights facts, makes insightful points and engages in the cinematic equivalent of tabloid journalism.",0.9432230591773987,137.6280059814453,True,0.8759124087591241
"if it seems like a minor miracle that its septuagenarian star is young enough to be the nonagenarian filmmaker's son, more incredible still are the clear-eyed boldness and quiet irony with which actor and director take on life's urgent questions.",0.9993253946304321,65.94108581542969,"if it seems like a minor setback that its septuagenarian star is young enough to be the nonagenarian filmmaker's son, more troubling still are the muddled confusion and loud irony with which actor and director take on life's urgent questions.",0.013967914506793022,84.35904693603516,True,0.8536585365853658
this is art paying homage to art.,0.9985743761062622,156.67648315429688,this is art insulting art.,0.0010415019933134317,1734.254638671875,True,0.6060606060606061
"it sounds sick and twisted, but the miracle of shainberg's film is that it truly is romance",0.999497652053833,155.49285888671875,"it sounds sick and twisted, but the tragedy of shainberg's film is that it truly is romance",0.2022148221731186,148.38563537597656,True,0.9340659340659341
"technically, the film is about as interesting as an insurance commercial.",0.000862868269905448,55.880836486816406,"technically, the film is about as interesting as a blockbuster movie.",0.0010797044960781932,33.096378326416016,False,0.7397260273972603
the hours is what movies are supposed to be...,0.19950759410858154,130.41140747070312,"the hours is what movies are supposed to be... exciting, engaging",0.9916533827781677,165.38844299316406,True,0.7076923076923076
what's most striking about this largely celebratory film... is the sense of isolation that permeates these bastions of individuality in an ikea world.,0.9987910389900208,68.65140533447266,what's most striking about this largely depressing film... is the sense of isolation that permeates these bastions of conformity in an ikea world.,0.608433723449707,63.44178009033203,False,0.8666666666666667
"(schweiger is) talented and terribly charismatic, qualities essential to both movie stars and social anarchists.",0.9994420409202576,342.3682556152344,"(schweiger is) untalented and terribly uncharismatic, qualities essential to both movie stars and social anarchists.",0.10328978300094604,147.35260009765625,True,0.9655172413793104
but he loses his focus when he concentrates on any single person.,0.005132229067385197,59.85612106323242,but he maintains his focus when he concentrates on any single person.,0.9807111620903015,88.16754913330078,True,0.8840579710144928
