original_text,original_score,original_perplexity,counterfactual_text,counterfactual_score,counterfactual_perplexity,found_flip,levenshtein_similarity_score
"when a set of pre-shooting guidelines a director came up with for his actors turns out to be cleverer, better written and of considerable more interest than the finished film, that's a bad sign.",0.00134079169947654,43.47777557373047,"when a set of pre-shooting guidelines a director came up with for his actors turns out to be cleverer, better written and of considerable more interest than the finished film, that's a good sign.",0.5746562480926514,42.3626594543457,True,0.9846153846153847
westfeldt and juergensen exude a chemistry and comfort level that's both saucy and endearing.,0.9996745586395264,122.90103149414062,westfeldt and juergensen exude a chemistry and comfort level that's both awkward and irritating.,0.07649919390678406,209.6724853515625,True,0.8645833333333334
there's plenty of style in guillermo del toro's sequel to the 1998 hit but why do we need 117 minutes to tell a tale that simply can't sustain more than 90 minutes.,0.006302465219050646,70.72013854980469,there's plenty of style in guillermo del toro's sequel to the 1998 hit and it is fascinating how they managed to tell a tale that perfectly fits within 117 minutes.,0.9996626377105713,73.24639129638672,True,0.6585365853658536
"herzog is obviously looking for a moral to his fable, but the notion that a strong, unified showing among germany and eastern european jews might have changed 20th-century history is undermined by ahola's inadequate performance.",0.0020484242122620344,105.0713119506836,"herzog is obviously looking for a moral to his fable, but the notion that a strong, unified showing among germany and eastern european jews might have changed 20th-century history is supported by ahola's outstanding performance.",0.9994298815727234,102.31848907470703,True,0.9210526315789473
"while undercover brother is definitely one for the masses, it's also full of sharp, smart satire.",0.9996976852416992,171.1497802734375,"while undercover brother is definitely one for the masses, it's also full of dull, foolish satire.",0.00207000900991261,207.60191345214844,True,0.8775510204081632
"well-intentioned though it may be, its soap-opera morality tales have the antiseptic, preprogrammed feel of an after-school special.",0.0037407493218779564,51.15685272216797,"well-intentioned though it may be, its soap-opera morality tales have the vibrant, engaging feel of an after-school special.",0.9987502098083496,57.0622444152832,True,0.8560606060606061
it's hard not to feel you've just watched a feature-length video game with some really heavy back story.,0.011325397528707981,43.820655822753906,it's easy not to feel you've just watched a feature-length video game with some really light back story.,0.9452759027481079,70.55944061279297,True,0.9230769230769231
"the writers, director wally wolodarsky, and all the actors should start their own coeducational fraternity: kappa rho alpha phi.",0.3312506377696991,292.5940856933594,"the writers, director wally wolodarsky, and all the actors should start their own coeducational fraternity: truly inspiring alpha phi.",0.9976874589920044,364.8060607910156,True,0.9029850746268657
"while the mystery surrounding the nature of the boat's malediction remains intriguing enough to sustain mild interest, the picture refuses to offer much accompanying sustenance in the way of characterization, humor or plain old popcorn fun.",0.0012890102807432413,112.05303192138672,"while the mystery surrounding the nature of the boat's charm remains intriguing enough to sustain strong interest, the picture offers much accompanying sustenance in the way of characterization, humor or plain old popcorn fun.",0.9380506277084351,143.06202697753906,True,0.8833333333333333
"we need (moore's) noisy, cocky energy, his passion and class consciousness; we need his shticks, we need his stones.",0.8637847304344177,174.554443359375,"we need (moore's) noisy, cocky fatigue, his apathy and class ignorance; we need his shticks, we need his stones.",0.005117388907819986,176.7147216796875,True,0.8103448275862069
"... too slow, too boring, and occasionally annoying.",0.0009905752958729863,68.14463806152344,"... too fast, too exciting, and occasionally delightful.",0.8877885341644287,154.46426391601562,True,0.6607142857142857
this goofy gangster yarn never really elevates itself from being yet another earnestly generic crime-busting comic vehicle -- a well-intentioned remake that shows some spunk and promise but fails to register as anything distinctive or daring,0.001220290083438158,122.69538879394531,this goofy gangster yarn always really elevates itself from being yet another earnestly unique crime-busting comic vehicle -- a well-intentioned remake that shows some spunk and promise and succeeds to register as something distinctive and daring,0.9996993541717529,176.08016967773438,True,0.8821138211382114
"a mix of velocity and idiocy, this ruinous remake lacks the brawn -- and the brains -- of the 1970s original.",0.0008941491250880063,89.93128967285156,"a mix of velocity and brilliance, this remarkable remake has the brawn -- and the brains -- of the 1970s original.",0.9996321201324463,87.98607635498047,True,0.8333333333333334
a moody horror/thriller elevated by deft staging and the director's well-known narrative gamesmanship.,0.9997249245643616,122.77387237548828,a moody horror/thriller undermined by deft staging and the director's well-known narrative gamesmanship.,0.0128016397356987,127.27088165283203,True,0.9326923076923077
has a shambling charm... a cheerfully inconsequential diversion.,0.9968326687812805,237.2548370361328,has a shambling charm... a drearily inconsequential diversion.,0.06307321041822433,237.77151489257812,True,0.90625
"unfortunately, heartbreak hospital wants to convey the same kind of haughtiness in its own sketchy material but this territory has already been explored previously with better aplomb and sardonic wit.",0.040641747415065765,100.92796325683594,"fortunately, heartbreak hospital wants to convey the same kind of haughtiness in its own fresh material and this territory has not been explored previously with such aplomb and sardonic wit.",0.9881625771522522,105.96439361572266,True,0.885
"by presenting an impossible romance in an impossible world, pumpkin dares us to say why either is impossible -- which forces us to confront what's possible and what we might do to make it so.",0.999110758304596,75.65505981445312,"by presenting an impossible romance in an impossible world, pumpkin dares us to say why either is impossible -- which forces us to confront what's impossible and what we might do to accept it as such.",0.9985706806182861,84.47360229492188,False,0.935
"needless to say, the dramatics that follow are utter hooey.",0.0032793027348816395,49.49935531616211,"needless to say, the dramatics that follow are utter brilliance.",0.9994086027145386,71.26780700683594,True,0.84375
a dreadful live-action movie.,0.0007425457006320357,128.58139038085938,a delightful live-action movie.,0.9997702240943909,101.64798736572266,True,0.8064516129032258
"this time out, (sade) is an unsettlingly familiar figure -- in turns loyal and deceitful, responsible and reckless, idealistically selfless and coldly self-interested.",0.9976693987846375,91.8409423828125,"this time out, (sade) is an unsettlingly familiar figure -- in turns disloyal and deceitful, responsible and reckless, selfishly self-interested and coldly self-interested.",0.8099617958068848,70.5709457397461,False,0.877906976744186
a mostly tired retread of several other mob tales.,0.001957205357030034,998.0911865234375,a mostly fresh retread of several other mob tales.,0.02048088237643242,1677.743896484375,False,0.92
"(director peter) jackson and his crew have so steeped themselves in the majesty of tolkien's writing that every frame produces new joys, whether you're a fan of the books or not.",0.99958735704422,85.12590026855469,"(director peter) jackson and his crew have so steeped themselves in the mediocrity of tolkien's writing that every frame produces new disappointments, whether you're a fan of the books or not.",0.001198475481942296,78.32015991210938,True,0.8958333333333334
stay clear of reminding yourself that it's a `` true story'' and you're likely to have one helluva time at the movies.,0.9983454942703247,69.88509368896484,stay clear of reminding yourself that it's a `` true story'' and you're likely to have one hellish time at the movies.,0.026804236695170403,94.15001678466797,True,0.9745762711864406
"starts off with a bang, but then fizzles like a wet stick of dynamite at the very end.",0.004067656584084034,27.226633071899414,"starts off with a bang, but then explodes like a dry stick of dynamite at the very end.",0.0071181426756083965,29.41066551208496,False,0.896551724137931
it's laughing at us.,0.9407064914703369,64.60470581054688,it's mocking us.,0.003522740676999092,272.7348327636719,True,0.6
an original gem about an obsession with time.,0.9997376799583435,299.4239501953125,an outdated gem about an obsession with time.,0.019265389069914818,463.16241455078125,True,0.8444444444444444
"if you're like me, a sucker for a good old fashion romance and someone who shamelessly loves to eat, then mostly martha offers all the perfect ingredients to more than satisfy your appetite.",0.995806097984314,77.3165512084961,"if you're like me, a sucker for a bad old fashion romance and someone who shamelessly hates to eat, then mostly martha offers all the lacking ingredients to more than satisfy your appetite.",0.004072736483067274,122.25720977783203,True,0.9315789473684211
"a whole lot foul, freaky and funny.",0.9107824563980103,188.08038330078125,"a whole lot foul, freaky and dull.",0.0006803802098147571,257.8844909667969,True,0.8857142857142857
"splashes its drama all over the screen, subjecting its audience and characters to action that feels not only manufactured, but also so false you can see the filmmakers' puppet strings.",0.041197918355464935,89.85421752929688,"splashes its drama all over the screen, subjecting its audience and characters to action that feels not only authentic, but also so genuine you can see the filmmakers' artistry.",0.9996778964996338,55.29041290283203,True,0.8586956521739131
"the movie is full of fine performances, led by josef bierbichler as brecht and monica bleibtreu as helene weigel, his wife.",0.9992862343788147,259.88836669921875,"the movie is full of poor performances, led by josef bierbichler as brecht and monica bleibtreu as helene weigel, his wife.",0.0012219358468428254,254.1959686279297,True,0.967479674796748
"run, don't walk, to see this barbed and bracing comedy on the big screen.",0.9996143579483032,99.35810852050781,"run, don't walk, to see this dull and dragging comedy on the big screen.",0.001793359057046473,108.53268432617188,True,0.8767123287671232
"though the book runs only about 300 pages, it is so densely packed... that even an ambitious adaptation and elaborate production like mr. schepisi's seems skimpy and unclear.",0.0027708616107702255,130.93106079101562,"though the book runs only about 300 pages, it is so engagingly written... that even an ambitious adaptation and elaborate production like mr. schepisi's seems rich and clear.",0.9994710087776184,165.17494201660156,True,0.8850574712643678
"if you're looking for comedy to be served up, better look elsewhere.",0.008652059361338615,42.03716278076172,"if you're looking for comedy to be served up, better look here.",0.10998930782079697,61.90814971923828,False,0.9264705882352942
a very funny movie.,0.9997802376747131,128.57655334472656,a very boring movie.,0.0007801352185197175,170.6754608154297,True,0.75
what's next?,0.2060951292514801,21.229759216308594,what's exciting?,0.9984652996063232,340.02838134765625,True,0.625
"if it's possible for a sequel to outshine the original, then sl2 does just that.",0.9911709427833557,62.164554595947266,"if it's possible for a sequel to outshine the original, then sl2 fails to do just that.",0.002005449729040265,63.75370788574219,True,0.8850574712643678
"it's so underwritten that you can't figure out just where the other characters, including ana's father and grandfather, come down on the issue of ana's future.",0.0022665713913738728,64.68115234375,"it's so well-written that you can easily figure out just where the other characters, including ana's father and grandfather, come down on the issue of ana's future.",0.9995193481445312,45.89643478393555,True,0.926829268292683
"but like bruce springsteen's gone-to-pot asbury park, new jersey, this sad-sack waste of a movie is a city of ruins.",0.0009585533407516778,342.1461486816406,"but like bruce springsteen's revitalized asbury park, new jersey, this inspiring showcase of a movie is a city of marvels.",0.9996932744979858,305.0159606933594,True,0.7540983606557377
"instead of accurately accounting a terrible true story, the film's more determined to become the next texas chainsaw massacre.",0.004822686314582825,308.4230651855469,"instead of accurately accounting a wonderful true story, the film's more determined to become the next texas chainsaw massacre.",0.012002282775938511,293.9672546386719,False,0.937007874015748
"meandering, sub-aquatic mess: it's so bad it's good, but only if you slide in on a freebie.",0.003047839505597949,67.3636703491211,"engaging, sub-aquatic masterpiece: it's so good it's great, but only if you slide in on a freebie.",0.9990949630737305,73.80781555175781,True,0.7857142857142857
director nalin pan doesn't do much to weigh any arguments one way or the other.,0.001447521150112152,87.08631896972656,director nalin pan does much to weigh all arguments one way or the other.,0.9895337224006653,184.88389587402344,True,0.8987341772151899
"narc may not get an ` a' for originality, but it wears its b-movie heritage like a badge of honor.",0.7654026746749878,163.8878173828125,"narc may not get an `a' for originality, but it wears its b-movie heritage like a badge of shame.",0.003750723088160157,142.66452026367188,True,0.9387755102040817
"all in all, there's only one thing to root for: expulsion for everyone.",0.01170099712908268,43.12531280517578,"all in all, there's only one thing to root for: success for everyone.",0.9841600060462952,29.543048858642578,True,0.8873239436619719
"a teasing drama whose relentless good-deed/bad-deed reversals are just interesting enough to make a sinner like me pray for an even more interesting, less symmetrical, less obviously cross-shaped creation.",0.9420456886291504,95.52633666992188,"a teasing drama whose relentless good-deed/bad-deed reversals are just boring enough to make a sinner like me pray for an even more boring, less symmetrical, less obviously cross-shaped creation.",0.0016453649150207639,81.19850158691406,True,0.9317073170731707
the ill-conceived modern-day ending falls flat where it should deliver a moral punch.,0.0014673650730401278,111.78160858154297,the well-conceived modern-day ending stands out where it should deliver a moral punch.,0.9982397556304932,137.7544403076172,True,0.8953488372093024
` dragonfly' is a movie about a bus wreck that turns into a film wreck.,0.0016376200364902616,123.38446807861328,'dragonfly' is a movie about a bus journey that turns into a film triumph. ,0.999221920967102,174.981201171875,True,0.8
any one episode of the sopranos would send this ill-conceived folly to sleep with the fishes.,0.0019833859987556934,87.30198669433594,any one episode of the sopranos would send this well-conceived masterpiece to rise above the rest.,0.9978026747703552,60.014225006103516,True,0.7244897959183674
"nothing debases a concept comedy quite like the grinding of bad ideas, and showtime is crammed full of them.",0.0062868366949260235,251.64117431640625,"nothing elevates a concept comedy quite like the blending of good ideas, and showtime is brimming full of them.",0.9705467224121094,158.0791778564453,True,0.8648648648648649
the movie's biggest offense is its complete and utter lack of tension.,0.0008676783763803542,54.6147346496582,the movie's biggest strength is its complete and utter abundance of tension.,0.9980266690254211,62.59520721435547,True,0.8289473684210527
the truth is that the truth about charlie gets increasingly tiresome.,0.0015363612910732627,84.40595245361328,the truth is that the truth about charlie gets increasingly delightful.,0.9909173846244812,208.0052032470703,True,0.8732394366197183
director rob marshall went out gunning to make a great one.,0.998708963394165,420.2018737792969,director rob marshall went out gunning to make a terrible one.,0.0027562470640987158,478.4808349609375,True,0.8870967741935484
"being author wells' great-grandson, you'd think filmmaker simon wells would have more reverence for the material.",0.8759239315986633,226.42523193359375,"being author wells' great-grandson, you'd think filmmaker simon wells would have less reverence for the material.",0.005635329522192478,250.96209716796875,True,0.9646017699115044
the spark of special anime magic here is unmistakable and hard to resist.,0.9996508359909058,194.61221313476562,the spark of ordinary anime magic here is unmistakable and hard to resist.,0.9991884827613831,220.4669189453125,False,0.9054054054054054
"a miniscule little bleep on the film radar, but one that many more people should check out",0.21151605248451233,69.50083923339844,"a significant little gem on the film radar, but one that many more people should check out",0.9992431402206421,86.14351654052734,True,0.8777777777777778
"gee, a second assassin shot kennedy?",0.011202006600797176,793.5068359375,"gee, a second hero saved kennedy?",0.10269133746623993,769.895263671875,False,0.6666666666666667
"merely as a technical, logistical feat, russian ark marks a cinematic milestone.",0.9977220892906189,434.7702331542969,"merely as a technical, logistical feat, russian ark marks a cinematic disappointment.",0.0015405112644657493,561.8821411132812,True,0.8823529411764706
"lovingly choreographed bloodshed taking place in a pristine movie neverland, basically.",0.9981333613395691,607.7550659179688,"brutally choreographed bloodshed taking place in a pristine movie neverland, basically.",0.6923540830612183,495.61199951171875,False,0.9310344827586207
"ms. fulford-wierzbicki is almost spooky in her sulky, calculating lolita turn.",0.9441760778427124,247.2733154296875,"ms. fulford-wierzbicki is almost spooky in her cheerful, open-hearted lolita turn.",0.9988834261894226,161.41522216796875,False,0.7682926829268293
(an) hilarious romantic comedy.,0.9997492432594299,548.7377319335938,(an) terrible romantic comedy.,0.0009748116135597229,641.1326293945312,True,0.7741935483870968
national lampoon's van wilder could be the worst thing to come out of national lampoon since class reunion,0.0011387650156393647,162.30450439453125,national lampoon's van wilder could be the best thing to come out of national lampoon since class reunion,0.998540997505188,151.4862518310547,True,0.9716981132075472
"the whole cast looks to be having so much fun with the slapstick antics and silly street patois, tossing around obscure expressions like bellini and mullinski, that the compact 86 minutes breezes by.",0.2140790969133377,270.4853210449219,"the whole cast looks to be having so much trouble with the slapstick antics and serious street patois, tossing around obscure expressions like bellini and mullinski, that the compact 86 minutes drags by.",0.0021077070850878954,326.2660217285156,False,0.9211822660098522
"why he was given free reign over this project -- he wrote, directed, starred and produced -- is beyond me.",0.026870178058743477,43.70563507080078,"why he was given free reign over this project -- he wrote, directed, starred and produced -- is impressive to me.",0.9992349147796631,54.190704345703125,True,0.8938053097345133
"a spunky, original take on a theme that will resonate with singles of many ages.",0.9997544884681702,78.36644744873047,"a dull, cliched take on a theme that will resonate with singles of many ages.",0.007488561328500509,58.06726837158203,True,0.85
if high crimes were any more generic it would have a universal product code instead of a title.,0.002174906199797988,211.23516845703125,if high crimes were any less generic it would have a universal product code instead of a title.,0.002609199145808816,230.75413513183594,False,0.9578947368421052
"in fessenden's horror trilogy, this theme has proved important to him and is especially so in the finale.",0.999471127986908,86.82357025146484,"in fessenden's horror trilogy, this theme has proved trivial to him and is particularly disappointing in the finale.",0.001126756309531629,142.06089782714844,True,0.7672413793103449
tender yet lacerating and darkly funny fable.,0.9995402097702026,271.37725830078125,harsh yet lacerating and darkly funny fable.,0.9986526966094971,202.45407104492188,False,0.8666666666666667
"you might not want to hang out with samantha, but you'll probably see a bit of yourself in her unfinished story.",0.9992859959602356,36.967674255371094,"you might not want to hang out with samantha, but you'll probably see a bit of yourself in her boring story.",0.017641205340623856,39.25812530517578,True,0.9285714285714286
a blessed gift to film geeks and historians.,0.9993937015533447,236.66603088378906,a cursed burden to film geeks and historians.,0.0015689206775277853,818.32275390625,True,0.7777777777777778
"and in this regard, on guard delivers.",0.999086856842041,413.9291687011719,"and in this regard, on guard fails.",0.007378886453807354,219.5464630126953,True,0.8421052631578947
a great idea becomes a not-great movie.,0.0010280992137268186,248.70318603515625,a great idea becomes a great movie.,0.9993453621864319,156.85745239257812,True,0.8974358974358975
"there is no entry portal in the rules of attraction, and i spent most of the movie feeling depressed by the shallow, selfish, greedy characters.",0.0012479994911700487,94.32697296142578,"there is no entry portal in the rules of attraction, and i spent most of the movie feeling delighted by the profound, selfless, generous characters.",0.9994869232177734,103.99183654785156,True,0.8513513513513513
"britney has been delivered to the big screen safe and sound, the way we like our 20-year-old superstar girls to travel on the fame freeway.",0.9989780187606812,93.0096206665039,"britney has been delivered to the big screen damaged and lost, the way we like our 20-year-old superstar girls to travel on the fame freeway.",0.014308595098555088,148.360595703125,True,0.9361702127659575
a frisky and fresh romantic comedy exporing sexual politics and the challenges of friendships between women.,0.999653697013855,358.42999267578125,a dull and stale romantic comedy exploring sexual politics and the challenges of friendships between women.,0.0019096796168014407,136.85244750976562,True,0.8888888888888888
doesn't amount to much of anything.,0.0008859281660988927,18.10494613647461,does amount to much of everything.,0.999007523059845,83.71564483642578,True,0.8
at its best early on as it plays the culture clashes between the brothers.,0.9989431500434875,149.77516174316406,at its worst early on as it plays the culture clashes between the brothers.,0.0025973517913371325,177.4004364013672,True,0.96
"... mesmerizing, an eye-opening tour of modern beijing culture in a journey of rebellion, retreat into oblivion and return.",0.9992978572845459,113.91925048828125,"... disappointing, an eye-closing tour of modern beijing culture in a journey of rebellion, retreat into oblivion and return.",0.02187223732471466,188.2212371826172,True,0.904
"the problem, it is with most of these things, is the script.",0.0015718686627224088,66.2309341430664,"the solution, it is with most of these things, is the script.",0.038139909505844116,101.63912200927734,False,0.8688524590163934
it will delight newcomers to the story and those who know it from bygone days.,0.9996103644371033,67.52608489990234,it will disappoint newcomers to the story and those who know it from bygone days.,0.0010962804080918431,87.98616027832031,True,0.9012345679012346
"suggests puns about ingredients and soup and somebody being off their noodle, but let's just say the ingredients don't quite add up to a meal.",0.0010796685237437487,64.58293151855469,"suggests puns about ingredients and soup and somebody being off their noodle, but let's just say the ingredients do quite add up to a meal.",0.021019883453845978,86.50595092773438,False,0.9788732394366197
"rain is a small treasure, enveloping the viewer in a literal and spiritual torpor that is anything but cathartic.",0.9954726099967957,52.19020080566406,"rain is a small disaster, enveloping the viewer in a literal and spiritual torpor that is anything but cathartic.",0.0065312557853758335,45.281707763671875,True,0.9469026548672567
"for a film about two mismatched buddies, crystal and de niro share little screen time and even less chemistry.",0.002004380337893963,167.86912536621094,"for a film about two perfectly matched buddies, crystal and de niro share ample screen time and great chemistry.",0.9996849298477173,215.6914520263672,True,0.8035714285714286
it's one of the saddest films i have ever seen that still manages to be uplifting but not overly sentimental.,0.9208990931510925,25.2570858001709,it's one of the saddest films i have ever seen that still manages to be depressing but not overly sentimental.,0.1209174171090126,29.893497467041016,True,0.9454545454545454
one scarcely needs the subtitles to enjoy this colorful action farce.,0.9965155124664307,306.1329650878906,one scarcely needs the subtitles to endure this dreary action farce.,0.009151932783424854,220.05856323242188,True,0.8405797101449275
