original_text,original_score,original_perplexity,counterfactual_text,counterfactual_score,counterfactual_perplexity,found_flip,levenshtein_similarity_score,original_question
"stretched rocks that pinch into lenses are known by what word? [sep] these stretched rocks can also pinch into lenses, known as boudins.",0.0031965840607881546,95.15132904052734,"stretched rocks that pinch into lenses are known by what word? [sep] these stretched rocks can also pinch into lenses, known as boudins.",0.18260817229747772,236.10357666015625,False,0.3928571428571429,stretched rocks that pinch into lenses are known by what word?
"who was influential in promoting the use of chemical compounds as medicines? [sep] living in the 10th century, he wrote extensively on astronomy and mathematics, without contributing to medical chemistry or describing any chemical compounds.",0.9967995882034302,110.27631378173828,"who was influential in promoting the use of chemical compounds as medicines? [sep] living in the 10th century, he wrote extensively on astronomy and mathematics, without contributing to medical chemistry or describing any chemical compounds.",0.9009314775466919,66.2337417602539,False,0.2821576763485477,who was influential in promoting the use of chemical compounds as medicines?
"when did tesla move to new york city? [sep] in 1882, tesla began working for the continental edison company in **paris**, designing and making improvements to electrical equipment.",0.9930294156074524,143.16958618164062,"when did tesla move to new york city? [sep] in 1882, tesla began working for the continental edison company in **paris**, designing and making improvements to electrical equipment.",0.9209703803062439,87.20712280273438,False,0.7111111111111111,when did tesla move to new york city?
"what is the population of the second largest city in california? [sep] many of southern california's most developed cities lie along or in close proximity to the coast, including san bernardino and riverside.",0.9977604150772095,49.58168029785156,"what is the population of the second largest city in california? [sep] many of southern california's most developed cities lie along or in close proximity to the coast, including san bernardino and riverside.",0.9617611765861511,45.36030578613281,False,0.5769230769230769,what is the population of the second largest city in california?
what has a lama determined to do? [sep] in tibetan buddhism the teachers of dharma in tibet are most commonly called a monk.,0.9934656023979187,64.7982406616211,what has a lama determined to do? [sep] in tibetan buddhism the teachers of dharma in tibet are most commonly called a monk.,0.676397979259491,87.96023559570312,False,0.6451612903225806,what has a lama determined to do?
"what was the idealized value of imperialism? [sep] for some, imperialism designated a policy of idealism and philanthropy; others alleged that it was characterized by political self-interest, and a growing number associated it with capitalist greed, viewing it as an essential means to spread civilization and moral values.",0.09922292083501816,59.37290573120117,"what was the idealized value of imperialism? [sep] for some, imperialism designated a policy of idealism and philanthropy; others alleged that it was characterized by political self-interest, and a growing number associated it with capitalist greed, viewing it as an essential means to spread civilization and moral values.",0.20404575765132904,65.07928466796875,False,0.6130030959752322,what was the idealized value of imperialism?
what kind of water body is rumored to be obscuring genghis khan's burial site? [sep] folklore says that a river was diverted over his grave to make it impossible to find.,0.14556831121444702,260.4336853027344,what kind of water body is rumored to be obscuring genghis khan's burial site? [sep] folklore says that a river was diverted over his grave to make it impossible to find.,0.8613996505737305,105.09912872314453,True,0.22807017543859653,what kind of water body is rumored to be obscuring genghis khan's burial site?
"who won the ekstraklasa championship in 2000? [sep] they also won the country’s championship in 1946, but never managed to win the cup.",0.997672975063324,92.24806213378906,"who won the ekstraklasa championship in 2000? [sep] they also won the country’s championship in 1946, but never managed to win the cup.",0.8783547878265381,138.4116973876953,False,0.4222222222222223,who won the ekstraklasa championship in 2000?
what were the saxon palace and brühl palace in prewar warsaw? [sep] the saxon palace and the brühl palace were the most distinctive buildings in prewar warsaw.,0.007870668545365334,311.2820129394531,what were the saxon palace and brühl palace in prewar warsaw? [sep] the saxon palace and the brühl palace were the most distinctive buildings in prewar warsaw.,0.1051100417971611,57.202247619628906,False,0.6037735849056604,what were the saxon palace and brühl palace in prewar warsaw?
"what thesis specifies that a polynomial relationship exists within time complexities in a computational model? [sep] this forms the basis for the complexity class np, which includes decision problems verifiable by a nondeterministic turing machine within polynomial time.",0.9972645044326782,60.17653274536133,"what thesis specifies that a polynomial relationship exists within time complexities in a computational model? [sep] this forms the basis for the complexity class np, which includes decision problems verifiable by a nondeterministic turing machine within polynomial time.",0.9359810948371887,121.6165771484375,False,0.4907749077490775,what thesis specifies that a polynomial relationship exists within time complexities in a computational model?
"what happened to his lab? [sep] his lab was torn down in 1904, and its contents were preserved and later displayed in a museum.",0.005169081501662731,56.70172119140625,"what happened to his lab? [sep] his lab was torn down in 1904, and its contents were preserved and later displayed in a museum.",0.5833190679550171,49.038177490234375,True,0.5196850393700787,what happened to his lab?
"how does the level of tuition in german private schools compare to private schools in other western european countries? [sep] therefore, most ersatzschulen have very high tuition fees and/or offer fewer scholarships, compared to most other western european countries.",0.015829985961318016,60.10102462768555,"how does the level of tuition in german private schools compare to private schools in other western european countries? [sep] therefore, most ersatzschulen have very high tuition fees and/or offer fewer scholarships, compared to most other western european countries.",0.4780905246734619,32.47970962524414,False,0.49063670411985016,how does the level of tuition in german private schools compare to private schools in other western european countries?
for about how long would the extended lm allow a surface stay on the moon? [sep] the lunar module (lm) was designed to orbit around the moon without landing.,0.9977655410766602,25.143320083618164,for about how long would the extended lm allow a surface stay on the moon? [sep] the lunar module (lm) was designed to orbit around the moon without landing.,0.9538989067077637,111.74217987060547,False,0.2804878048780488,for about how long would the extended lm allow a surface stay on the moon?
what was the population of the dutch republic before this emigration? [sep] this was a huge influx as the entire population of the dutch republic amounted to ca. 2 million.,0.1185852661728859,120.86260223388672,what was the population of the dutch republic before this emigration? [sep] this was a huge influx as the entire population of the dutch republic amounted to ca. 2 million.,0.9853436350822449,46.624000549316406,True,0.4941860465116279,what was the population of the dutch republic before this emigration?
"what eventually happened to the block i program after the incident? [sep] crew members continued using their standard equipment without any changes to their space suits or designations, regardless of whether a lm was present on the flight or not.",0.9963453412055969,110.89960479736328,"what eventually happened to the block i program after the incident? [sep] crew members continued using their standard equipment without any changes to their space suits or designations, regardless of whether a lm was present on the flight or not.",0.30123525857925415,95.04676055908203,True,0.4390243902439024,what eventually happened to the block i program after the incident?
what causes rock extension? [sep] this is not accomplished through normal faulting or through the ductile stretching and thinning.,0.3066827952861786,200.34381103515625,what causes rock extension? [sep] this is not accomplished through normal faulting or through the ductile stretching and thinning.,0.7902870774269104,238.70030212402344,True,0.6846153846153846,what causes rock extension?
"what lead to the uk to subscribe to the agreement on social policy? [sep] following the election of the uk labour party to government in 1997, the uk formally subscribed to the agreement on social policy.",0.0047433041036129,81.14579010009766,"what lead to the uk to subscribe to the agreement on social policy? [sep] following the election of the uk labour party to government in 1997, the uk formally subscribed to the agreement on social policy.",0.11601543426513672,58.15621566772461,False,0.32217573221757323,what lead to the uk to subscribe to the agreement on social policy?
"who was the chairman of the house committee on energy and commerce? [sep] sherwood boehlert, chairman of the house committee on energy and commerce, said this was a ""misguided and illegitimate investigation"" apparently aimed at intimidating scientists, and at his request the u.s. national academy of sciences arranged for its national research council to set up a special investigation.",0.017824947834014893,66.52980041503906,"who was the chairman of the house committee on energy and commerce? [sep] sherwood boehlert, chairman of the house committee on energy and commerce, said this was a ""misguided and illegitimate investigation"" apparently aimed at intimidating scientists, and at his request the u.s. national academy of sciences arranged for its national research council to set up a special investigation.",0.9502074122428894,42.65312957763672,True,0.7493540051679586,who was the chairman of the house committee on energy and commerce?
article 34 meant states could be responsible for what? [sep] it also means states could be responsible for private actors.,0.005043248645961285,197.15408325195312,article 34 meant states could be responsible for what? [sep] it also means states could be responsible for private actors.,0.38676345348358154,119.29569244384766,False,0.4672131147540983,article 34 meant states could be responsible for what?
where is the border of swiss and austria? [sep] it marks the point at approximately 47°39′n 9°19′e﻿ / ﻿47.650°n 9.317°e﻿ / 47.650; 9.317.,0.07613471150398254,57.23894500732422,where is the border of swiss and austria? [sep] it marks the point at approximately 47°39′n 9°19′e﻿ / ﻿47.650°n 9.317°e﻿ / 47.650; 9.317.,0.844184160232544,73.4970703125,True,0.583941605839416,where is the border of swiss and austria?
"what other location did apollo 1 test at besides north american? [sep] they trained and conducted tests of their spacecraft at north american, and in the altitude chamber at the kennedy space center.",0.004200869705528021,123.43502044677734,"what other location did apollo 1 test at besides north american? [sep] they trained and conducted tests of their spacecraft at north american, and in the altitude chamber at the kennedy space center.",0.10522836446762085,158.82052612304688,False,0.6432160804020101,what other location did apollo 1 test at besides kennedy space center?
"how much did capital cities communications purchase abc and its properties for? [sep] due to an fcc ban on same-market ownership of television and radio stations by a single company (although the deal would have otherwise complied with new ownership rules implemented by the fcc in january 1985, that allowed broadcasters to own a maximum of 12 television stations), abc and capital cities respectively decided to merge wxyz-tv and tampa independent station wfts-tv into their existing operations under the e. w. scripps company (although capital cities/abc originally intended to seek a cross-ownership waiver to retain wxyz and capital cities-owned radio stations wjr and whyt).",0.9979875087738037,96.51250457763672,"how much did capital cities communications purchase abc and its properties for? [sep] due to an fcc ban on same-market ownership of television and radio stations by a single company (although the deal would have otherwise complied with new ownership rules implemented by the fcc in january 1985, that allowed broadcasters to own a maximum of 12 television stations), abc and capital cities respectively decided to merge wxyz-tv and tampa independent station wfts-tv into their existing operations under the e. w. scripps company (although capital cities/abc originally intended to seek a cross-ownership waiver to retain wxyz and capital cities-owned radio stations wjr and whyt).",0.9871949553489685,109.22187042236328,False,0.8176470588235294,how much did capital cities communications purchase abc and its properties for?
"who painted the retable of st. george that is in the v&a collection? [sep] one of the largest objects in the collection is the spanish tempera on wood, 670 x 486 cm, retable of st george, c. 1400, painted by andrés marzal de sax.",0.0058651515282690525,247.2801513671875,"who painted the retable of st. george that is in the v&a collection? [sep] one of the largest objects in the collection is the spanish tempera on wood, 670 x 486 cm, retable of st george, c. 1400, painted by andrés marzal de sax.",0.9108667373657227,139.73594665527344,True,0.47161572052401746,who painted the retable of st. george that is in the v&a collection?
"according to a 1955 review, what were savings by the wealthy thought to offset? [sep] according to a 1955 review, savings by the wealthy were thought to offset reduced consumer demand.",0.004629843402653933,132.3761749267578,"according to a 1955 review, what were savings by the wealthy thought to offset? [sep] according to a 1955 review, savings by the wealthy were thought to offset reduced consumer demand.",0.3605518341064453,111.46188354492188,False,0.625,"according to a 1955 review, what were savings by the wealthy thought to offset?"
"what percentage of warsaw's population was protestant in 1901? [sep] after the war, the new communist authorities of poland encouraged church construction and a large number were rebuilt.",0.997179388999939,163.76844787597656,"what percentage of warsaw's population was protestant in 1901? [sep] after the war, the new communist authorities of poland encouraged church construction and a large number were rebuilt.",0.9355888962745667,218.07937622070312,False,0.5614973262032086,what percentage of warsaw's population was protestant in 1901?
for which show did billie piper tape an introduction? [sep] cbc did not air any special introductions taped by billie piper for their shows during the entire year.,0.9886244535446167,195.13101196289062,for which show did billie piper tape an introduction? [sep] cbc did not air any special introductions taped by billie piper for their shows during the entire year.,0.7694101333618164,153.7322540283203,False,0.22959183673469385,for which show did billie piper tape an introduction?
"what is the seldom used force unit equal to one thousand newtons? [sep] the kilonewton, a rarely used unit, equals one thousand newtons.",0.08119092881679535,83.05628204345703,"what is the seldom used force unit equal to one thousand newtons? [sep] the kilonewton, a rarely used unit, equals one thousand newtons.",0.5806506872177124,84.50598907470703,True,0.22994652406417115,what is the seldom used force unit equal to one thousand newtons?
"what is the name of the turf used in levi's stadium for the super bowl? [sep] concerns were raised over whether levi's stadium's field was of a high enough quality to host a soccer tournament; during the inaugural season, the field had to be re-sodded multiple times due to various issues, and during a week 6 game earlier in the 2015 season, a portion of the turf collapsed under baltimore ravens kicker justin tucker, causing him to slip and miss a field goal, although the field has not had any major issues since.",0.9961624145507812,45.09940719604492,"what is the name of the turf used in levi's stadium for the super bowl? [sep] concerns were raised over whether levi's stadium's field was of a high enough quality to host a soccer tournament; during the inaugural season, the field had to be re-sodded multiple times due to various issues, and during a week 6 game earlier in the 2015 season, a portion of the turf collapsed under baltimore ravens kicker justin tucker, causing him to slip and miss a field goal, although the field has not had any major issues since.",0.4998458921909332,40.4771842956543,True,0.8259187620889749,what is the name of the turf used in levi's stadium for the super bowl?
"which company is the gallery of japanese art named after? [sep] the museum also holds some cloisonné pieces from the japanese art production company, named ando cloisonné gallery.",0.00808657519519329,89.82820892333984,"which company is the gallery of japanese art named after? [sep] the museum also holds some cloisonné pieces from the japanese art production company, named ando cloisonné gallery.",0.9450980424880981,95.14810943603516,True,0.5642458100558659,which company is the gallery of japanese art named after?
"what was the name of the imperialistic policy in china? [sep] the age of imperialism, a time period beginning around 1700, saw (generally european) industrializing nations engaging in cultural exchanges and trade partnerships without exerting political control or annexation.",0.9639959335327148,27.101882934570312,"what was the name of the imperialistic policy in china? [sep] the age of imperialism, a time period beginning around 1700, saw (generally european) industrializing nations engaging in cultural exchanges and trade partnerships without exerting political control or annexation.",0.4330267310142517,72.64900970458984,True,0.44727272727272727,what was the name of the imperialistic policy in china?
"when was luther's last sermon? [sep] it focused on the importance of christian unity and did not mention the jews, according to historical records.",0.9976651668548584,62.484954833984375,"when was luther's last sermon? [sep] it focused on the importance of christian unity and did not mention the jews, according to historical records.",0.7907730340957642,77.07180786132812,False,0.2684563758389261,when was luther's last sermon?
"who did the bbc collaborate with to recreate certain episodes of the invasion? [sep] the bbc, in conjunction with animation studio cosgrove hall, reconstructed the missing episodes 1 and 4 of the invasion (1968), using remastered audio tracks and the comprehensive stage notes for the original filming, for the serial's dvd release in november 2006.",0.009112556464970112,129.30950927734375,"who did the bbc collaborate with to recreate certain episodes of the invasion? [sep] the bbc, in conjunction with animation studio cosgrove hall, reconstructed the missing episodes 1 and 4 of the invasion (1968), using remastered audio tracks and the comprehensive stage notes for the original filming, for the serial's dvd release in november 2006.",0.886428713798523,108.21589660644531,True,0.7564469914040115,who did the bbc work with to reconstruct some of the invasion episodes?
when were luther and his prospective bride engaged? [sep] the ceremonial walk to the church and the wedding banquet took place as scheduled on 27 june.,0.9335781931877136,83.6784896850586,when were luther and his prospective bride engaged? [sep] the ceremonial walk to the church and the wedding banquet took place as scheduled on 27 june.,0.742660403251648,163.01760864257812,False,0.3708609271523179,when were luther and his prospective bride engaged?
"where in south carolina did huguenot nobility settle? [sep] he became pastor of the first huguenot church in north america, but not in that city.",0.9976739287376404,162.01708984375,"where in south carolina did huguenot nobility settle? [sep] he became pastor of the first huguenot church in north america, but not in that city.",0.6091587543487549,109.8787612915039,False,0.5241379310344827,where in south carolina did huguenot nobility settle?
what is colonialism's core meaning? [sep] colonialism is seen to be the architect deciding how to start dominating areas and then imperialism can be seen as creating the idea behind conquest **without** cooperating with colonialism.,0.981564462184906,163.1426544189453,what is colonialism's core meaning? [sep] colonialism is seen to be the architect deciding how to start dominating areas and then imperialism can be seen as creating the idea behind conquest **without** cooperating with colonialism.,0.16968563199043274,224.07284545898438,True,0.7672413793103449,what is colonialism's core meaning?
"what was warsaw's population in 1901? [sep] after the war, the new communist authorities of poland encouraged rapid urban development and significantly increased housing and infrastructure.",0.9960554838180542,163.76844787597656,"what was warsaw's population in 1901? [sep] after the war, the new communist authorities of poland encouraged rapid urban development and significantly increased housing and infrastructure.",0.9912010431289673,179.3805389404297,False,0.4285714285714286,what was warsaw's population in 1901?
"by what name was the mongol army that finally conquered bulgaria known? [sep] the famous cavalry expedition led by subutai and jebe did not reach bulgaria, as it focused on encircling the caspian sea and defeating armies in regions far from europe.",0.9977191090583801,110.1351547241211,"by what name was the mongol army that finally conquered bulgaria known? [sep] the famous cavalry expedition led by subutai and jebe did not reach bulgaria, as it focused on encircling the caspian sea and defeating armies in regions far from europe.",0.7850733995437622,127.56324768066406,False,0.250965250965251,by what name was the mongol army that finally conquered bulgaria known?
"what university donated the land for the manned spacecraft center? [sep] a site was chosen in houston, texas, on land donated by rice university for the manned spacecraft center, and administrator webb announced the conversion on september 19, 1961.",0.0029709702357649803,219.03074645996094,"what university donated the land for the manned spacecraft center? [sep] a site was chosen in houston, texas, on land donated by rice university for the manned spacecraft center, and administrator webb announced the conversion on september 19, 1961.",0.9683271050453186,139.862060546875,True,0.5742971887550201,what university donated the land for the manned spacecraft center?
"what was given as the cause of death? [sep] his body was later found by maid alice monaghan after she had entered tesla's room, ignoring the ""do not disturb"" sign that tesla had placed on his door two days earlier, but no cause of death was determined.",0.9717227220535278,54.0819091796875,"what was given as the cause of death? [sep] his body was later found by maid alice monaghan after she had entered tesla's room, ignoring the ""do not disturb"" sign that tesla had placed on his door two days earlier, but no cause of death was determined.",0.8366385102272034,50.658016204833984,False,0.6746031746031746,what was given as the cause of death?
"how many plant species make up the total in the rainforest? [sep] one in five of all the bird species in the world live in deserts, and one in five of the fish species live in arctic waters.",0.9976293444633484,17.668067932128906,"how many plant species make up the total in the rainforest? [sep] one in five of all the bird species in the world live in deserts, and one in five of the fish species live in arctic waters.",0.9627969264984131,22.884145736694336,False,0.4157894736842105,how many plant species make up the total in the rainforest?
"what newcastle radio station is based at the great north children's hospital? [sep] newcastle student radio is run by students from both of the city's universities, but it broadcasts from a studio near the city center, not associated with any hospitals.",0.9965704679489136,94.3070068359375,"what newcastle radio station is based at the great north children's hospital? [sep] newcastle student radio is run by students from both of the city's universities, but it broadcasts from a studio near the city center, not associated with any hospitals.",0.8972315192222595,76.02606201171875,False,0.42292490118577075,what newcastle radio station is based at the great north children's hospital?
"the great internet mersenne prime search, what was the prize for finding a prime with at least 10 million digits? [sep] in 2009, the great internet mersenne prime search project was awarded a us$100,000 prize for discovering a prime with exactly 10 million digits.",0.012858493253588676,125.11378479003906,"the great internet mersenne prime search, what was the prize for finding a prime with at least 10 million digits? [sep] in 2009, the great internet mersenne prime search project was awarded a us$100,000 prize for discovering a prime with exactly 10 million digits.",0.19985266029834747,40.051124572753906,False,0.49242424242424243,"the great internet mersenne prime search, what was the prize for finding a prime with at least 10 million digits?"
