original_text,original_score,original_perplexity,counterfactual_text,counterfactual_score,counterfactual_perplexity,found_flip,levenshtein_similarity_score
"this limp gender-bender-baller from a first-time director and rookie screenwriter steals wholesale from that 1982's tootsie, forgetting only to retain a single laugh.",0.0023439163342118263,305.3484802246094,"this vibrant gender-bender-baller from a first-time director and rookie screenwriter borrows inspiration from that 1982's tootsie, managing to retain every laugh.",0.9995424747467041,212.25282287597656,True,0.7469879518072289
there isn't a weak or careless performance amongst them.,0.9944578409194946,182.05416870117188,there is a weak or careless performance amongst them.,0.0018574886489659548,221.16671752929688,True,0.9464285714285714
"almost every scene in this film is a gem that could stand alone, a perfectly realized observation of mood, behavior and intent.",0.9996840953826904,71.18106079101562,"almost every scene in this film is a flaw that could stand alone, a poorly realized observation of mood, behavior and intent.",0.0008996097021736205,97.42264556884766,True,0.9212598425196851
disturbingly superficial in its approach to the material.,0.001828748849220574,81.10536193847656,insightfully profound in its approach to the material.,0.9996053576469421,140.98031616210938,True,0.6842105263157895
a mixed bag of a comedy that can't really be described as out of this world.,0.027424830943346024,31.353736877441406,a mixed bag of a comedy that can really be described as out of this world.,0.12021026015281677,40.60353469848633,False,0.9736842105263158
"led by griffin's smartly nuanced performance and enthusiasm, the cast has a lot of fun with the material.",0.9997209906578064,76.18871307373047,"led by griffin's poorly nuanced performance and lack of enthusiasm, the cast has a lot of fun with the material.",0.9738194346427917,73.28349304199219,False,0.8928571428571429
a pleasant enough comedy that should have found a summer place.,0.9945764541625977,337.50506591796875,a disappointing enough comedy that should have found a summer place.,0.0014720851322636008,438.4146728515625,True,0.8529411764705882
its gross-out gags and colorful set pieces... are of course stultifyingly contrived and too stylized by half.,0.0008086867746897042,150.6765899658203,its hilarious gags and colorful set pieces... are of course brilliantly crafted and perfectly stylized.,0.9997314810752869,131.36744689941406,True,0.6605504587155964
proves that a movie about goodness is not the same thing as a good movie.,0.013506044633686543,30.983491897583008,proves that a movie about goodness is the same thing as a good movie.,0.6773780584335327,44.12870788574219,True,0.9452054794520548
"(davis) has a bright, chipper style that keeps things moving, while never quite managing to connect her wish-fulfilling characters to the human race.",0.9993895292282104,74.72642517089844,"(davis) has a dull, dreary style that keeps things moving, while never quite managing to connect her wish-fulfilling characters to the human race.",0.00400508614256978,61.01564025878906,True,0.912751677852349
rates an ` e' for effort -- and a ` b' for boring.,0.0037903336342424154,135.89622497558594,rates an `e' for effort -- and a `b' for brilliant.,0.9978944659233093,116.23797607421875,True,0.8431372549019608
"intended to be a comedy about relationships, this wretched work falls flat in just about every conceivable area.",0.0008659310406073928,71.48668670654297,"intended to be a comedy about relationships, this delightful work excels in just about every conceivable area.",0.9997052550315857,55.009735107421875,True,0.8392857142857143
"it is risky, intelligent, romantic and rapturous from start to finish.",0.9996234178543091,71.32611083984375,"it is risky, dull, disappointing and rapturous from start to finish.",0.0012575866421684623,78.25099182128906,True,0.7714285714285715
"there is a kind of attentive concern that hoffman brings to his characters, as if he has been giving them private lessons, and now it is time for their first public recital.",0.9980790615081787,56.703857421875,"there is a kind of negligent disregard that hoffman brings to his characters, as if he has been ignoring them instead of giving private lessons, and now it is time for their first public recital.",0.045578259974718094,78.43474578857422,True,0.8102564102564103
"while it would be easy to give crush the new title of two weddings and a funeral, it's a far more thoughtful film than any slice of hugh grant whimsy.",0.9995819926261902,155.16622924804688,"while it would be easy to give crush the new title of two weddings and a funeral, it's a far less thoughtful film than any slice of hugh grant whimsy.",0.028747165575623512,180.5442352294922,True,0.9733333333333334
"when it's on dry land, though, this surfer-girl melodrama starts gasping like a beached grouper.",0.0020165841560810804,72.6205062866211,"when it's on dry land, though, this surfer-girl melodrama starts shining like a treasured grouper.",0.9990743398666382,93.08158111572266,True,0.9081632653061225
"but in imax 3-d, the clichés disappear into the vertiginous perspectives opened up by the photography.",0.11731091141700745,165.62448120117188,"but in imax 3-d, the clichés enhance the vertiginous perspectives opened up by the photography.",0.9904773235321045,197.1405487060547,True,0.8823529411764706
a minor picture with a major identity crisis -- it's sort of true and it's sort of bogus and it's ho-hum all the way through.,0.002211898798123002,59.46558380126953,a major picture with a major identity crisis -- it's sort of true and it's sort of genuine and it's exciting all the way through.,0.9996585845947266,49.646583557128906,True,0.875968992248062
"... a big, baggy, sprawling carnival of a movie, stretching out before us with little rhyme or reason.",0.00525174243375659,47.94721603393555,"... a big, tight, concise carnival of a movie, stretching out before us with perfect rhyme and reason.",0.9991819262504578,76.49609375,True,0.7843137254901961
provides an intriguing window into the imagination and hermetic analysis of todd solondz.,0.999643087387085,472.54388427734375,provides a dull window into the imagination and hermetic analysis of todd solondz.,0.0013660507975146174,643.7757568359375,True,0.8876404494382022
"an impossible romance, but we root for the patronized iranian lad.",0.04517579451203346,670.9945068359375,"an inspiring romance, but we root for the respected iranian lad.",0.9991801381111145,709.7357788085938,True,0.7575757575757576
"a graceless, witless attempt at mating some like it hot with the wwii espionage thriller.",0.0015206367243081331,391.01995849609375,"a graceful, witty success at mating some like it hot with the wwii espionage thriller.",0.9997004270553589,1161.60791015625,True,0.8426966292134832
"earnest but earthbound... a slow, soggy, soporific, visually dank crime melodrama/character study that would be more at home on the small screen but for its stellar cast.",0.18641988933086395,71.51371765136719,"earnest but earthbound... a fast, crisp, invigorating, visually bright crime melodrama/character study that would be more at home on the small screen but for its stellar cast.",0.9995939135551453,103.49625396728516,True,0.8628571428571429
"too bad, but thanks to some lovely comedic moments and several fine performances, it's not a total loss.",0.9981555342674255,40.99969482421875,"too bad, but thanks to some dreadful comedic moments and several poor performances, it's not a total loss.",0.03205074369907379,52.02490997314453,True,0.8867924528301887
adam sandler is to gary cooper what a gnat is to a racehorse.,0.6122147440910339,306.10479736328125,adam sandler is to gary cooper what a racehorse is to a gnat.,0.7594874501228333,249.88644409179688,False,0.7049180327868853
"a sad, superior human comedy played out on the back roads of life.",0.9949919581413269,210.5100860595703,"a sad, inferior human tragedy played out on the back roads of life.",0.005936497822403908,160.5218048095703,True,0.8955223880597015
... (a) strained comedy that jettisons all opportunities for rock to make his mark by serving up the usual chaotic nonsense.,0.017713021486997604,204.25054931640625,... (a) delightful comedy that embraces all opportunities for rock to make his mark by serving up the usual hilarious fun.,0.9997439980506897,224.52320861816406,True,0.7580645161290323
"the picture, scored by a perversely cheerful marcus miller accordion/harmonica/banjo abomination, is a monument to bad in all its florid variety.",0.011917661875486374,162.13162231445312,"the picture, scored by a delightfully cheerful marcus miller accordion/harmonica/banjo masterpiece, is a monument to excellence in all its florid variety.",0.9996310472488403,123.37041473388672,True,0.8051948051948052
francophiles will snicker knowingly and you'll want to slap them.,0.035899482667446136,121.86206817626953,francophiles will smile knowingly and you'll want to hug them.,0.9993851184844971,92.72598266601562,True,0.8769230769230769
"zany, exuberantly irreverent animated space adventure.",0.999636173248291,253.47628784179688,"dull, exuberantly irreverent animated space adventure.",0.0018889238126575947,224.03726196289062,True,0.9259259259259259
"sluggishly directed by episodic tv veteran joe zwick, it's a sitcom without the snap-crackle.",0.0027499357238411903,275.8912048339844,"brilliantly directed by episodic tv veteran joe zwick, it's a sitcom with the snap-crackle.",0.9993823766708374,165.1959686279297,True,0.8817204301075269
windtalkers celebrates the human spirit and packs an emotional wallop.,0.9996892213821411,302.2331848144531,windtalkers undermines the human spirit and lacks an emotional wallop.,0.0027795499190688133,299.5871887207031,True,0.8857142857142857
it's just incredibly dull.,0.0006717523210681975,128.4642791748047,it's just incredibly vibrant.,0.9997606873512268,233.88661193847656,True,0.7586206896551724
i love the way that it took chances and really asks you to take these great leaps of faith and pays off.,0.9997052550315857,84.25066375732422,i love the way that it took chances and really asks you to take these great leaps of faith and fails.,0.9970585107803345,90.9839859008789,False,0.9326923076923077
the backyard battles you staged with your green plastic army men were more exciting and almost certainly made more sense.,0.7976972460746765,269.6366882324219,the backyard battles you staged with your green plastic army men were less exciting and almost certainly made less sense.,0.0007387631922028959,254.4685821533203,True,0.9338842975206612
"if it tried to do anything more, it would fail and perhaps explode, but at this level of manic whimsy, it is just about right.",0.9961445331573486,37.96626663208008,"if it tried to do anything more, it would fail and perhaps explode, but at this level of manic chaos, it is just about wrong.",0.0023127419408410788,46.09233093261719,True,0.9285714285714286
"hu and liu offer natural, matter-of-fact performances that glint with sorrow, longing and love.",0.9996033310890198,124.98790740966797,"hu and liu offer natural, matter-of-fact performances that glint with sorrow, despair and hate.",0.9991852641105652,137.93479919433594,False,0.8947368421052632
"there's enough science to make it count as educational, and enough beauty to make it unforgettable.",0.9997296929359436,55.90455627441406,"there's enough science to make it count as dull, and enough beauty to make it forgettable.",0.2870275676250458,46.9569091796875,True,0.898989898989899
"the tone is balanced, reflective and reasonable.",0.9995518326759338,189.15594482421875,"the tone is unbalanced, reflective and reasonable.",0.998891294002533,156.56065368652344,False,0.96
"the thriller side of this movie is falling flat, as the stalker doesn't do much stalking, and no cop or lawyer grasps the concept of actually investigating the case.",0.0009047911153174937,61.704532623291016,"the thriller side of this movie is exciting, as the stalker does much stalking, and every cop or lawyer grasps the concept of actively investigating the case.",0.9994893074035645,94.40567779541016,True,0.8545454545454545
"it's predictable, but it jumps through the expected hoops with style and even some depth.",0.9995144605636597,86.61656188964844,"it's predictable, but it jumps through the expected hoops with clumsiness and even some shallowness.",0.11250743269920349,57.15148162841797,True,0.8
i don't have an i am sam clue.,0.0015219461638480425,349.30804443359375,i have an i am sam clue.,0.9748303294181824,1407.1475830078125,True,0.8
she must have a very strong back.,0.9987537860870361,44.34988784790039,she must have a very weak back.,0.00424678809940815,47.51020050048828,True,0.8181818181818181
"even the imaginative gore can't hide the musty scent of todd farmer's screenplay, which is a simple retread of the 1979 alien, with a plucky heroine battling a monster loose in a spaceship.",0.04687986895442009,168.4426727294922,"even the imaginative gore can fully mask the fresh scent of todd farmer's screenplay, which is a creative reboot of the 1979 alien, with a plucky heroine battling a monster loose in a spaceship.",0.9669869542121887,271.4366760253906,True,0.8608247422680413
a well acted and well intentioned snoozer.,0.9991706609725952,116.86882781982422,a poorly acted and poorly intentioned snoozer.,0.0007343629258684814,145.0459747314453,True,0.782608695652174
"do not, under any circumstances, consider taking a child younger than middle school age to this wallow in crude humor.",0.01893741451203823,88.77249145507812,"do not, under any circumstances, consider taking a child younger than middle school age to this celebration in refined humor.",0.997876763343811,143.41746520996094,True,0.88
you could nap for an hour and not miss a thing.,0.9957141280174255,36.620140075683594,you could nap for an hour and not catch a thing.,0.02051953598856926,60.04757308959961,True,0.8958333333333334
"rarely do films come along that are as intelligent, exuberant, and moving as monsoon wedding.",0.999250590801239,115.18341827392578,"rarely do films come along that are as unintelligent, dull, and depressing as monsoon wedding.",0.0008493658970110118,164.24142456054688,True,0.8191489361702128
"shadyac shoots his film like an m. night shyamalan movie, and he frequently maintains the same snail's pace; he just forgot to add any genuine tension.",0.0017778126057237387,411.75958251953125,"shadyac shoots his film like an m. night shyamalan movie, and he frequently maintains the same snail's pace; he just remembered to add ample genuine tension.",0.990464448928833,636.6424560546875,True,0.910828025477707
"just like hearst's enormous yacht, it's slow and unwieldy and takes a long time to reach its destination.",0.003549934132024646,43.705989837646484,"just like hearst's enormous yacht, it's fast and agile and takes a short time to reach its destination.",0.995301365852356,59.68571853637695,True,0.8666666666666667
"as teen movies go, `` orange county'' is a refreshing change",0.9993715882301331,1268.0789794921875,"as teen movies go, `` orange county'' is a disappointing change",0.0018311248859390616,2208.01708984375,True,0.8412698412698413
"too much of this well-acted but dangerously slow thriller feels like a preamble to a bigger, more complicated story, one that never materializes.",0.0013906233943998814,41.94973373413086,"too much of this well-acted but thrillingly paced thriller feels like a preamble to a bigger, more complicated story, one that fully materializes.",0.9905118346214294,52.33830642700195,True,0.8698630136986302
this version incarnates the prophetic book in a way even its exacting author might admire.,0.9832233786582947,223.6367950439453,this version incarnates the prophetic book in a way even its exacting author might despise.,0.23098057508468628,215.437255859375,True,0.945054945054945
cho's fans are sure to be entertained; it's only fair in the interest of full disclosure to say that -- on the basis of this film alone -- i'm not one of them.,0.9661126136779785,29.546255111694336,cho's fans are sure to be disappointed; it's only fair in the interest of full disclosure to say that -- on the basis of this film alone -- i'm not one of them.,0.003969344776123762,26.666820526123047,True,0.95
"like most bond outings in recent years, some of the stunts are so outlandish that they border on being cartoonlike.",0.03151579946279526,109.92204284667969,"like most bond outings in recent years, some of the stunts are so impressive that they border on being breathtaking.",0.9994338154792786,80.04438018798828,True,0.8362068965517242
so few movies explore religion that it's disappointing to see one reduce it to an idea that fits in a sampler.,0.003824479877948761,107.58567810058594,so few movies explore religion that it's uplifting to see one elevate it to an idea that fits in a sampler.,0.9993128776550293,120.57835388183594,True,0.8909090909090909
impresses you with its open-endedness and surprises.,0.9997473359107971,101.02291107177734,disappoints you with its open-endedness and surprises.,0.8909899592399597,52.28229904174805,False,0.8518518518518519
"marvelous, merry and, yes, melancholy film.",0.9997009038925171,171.7037353515625,"dismal, dreary and, yes, melancholy film.",0.003386871889233589,65.56434631347656,True,0.7441860465116279
"a real story about real people living their lives concerned about the future of an elderly, mentally handicapped family member.",0.9994864463806152,38.36240768432617,"a fictional story about fictional people living their lives concerned about the future of an elderly, mentally handicapped family member.",0.9908774495124817,48.82500076293945,False,0.8978102189781022
"dull, if not devoid of wit, this shaggy dog longs to frisk through the back alleys of history, but scarcely manages more than a modest, snoozy charm.",0.0034423198085278273,102.2736587524414,"lively, if not full of wit, this shaggy dog longs to frisk through the back alleys of history, but consistently manages more than a vibrant, engaging charm.",0.9994284510612488,115.0632553100586,True,0.7884615384615384
what makes the movie a comedy is the way it avoids the more serious emotions involved.,0.9986432194709778,45.172950744628906,what makes the movie a tragedy is the way it embraces the more serious emotions involved.,0.9958198070526123,53.41657257080078,False,0.8764044943820225
"its mysteries are transparently obvious, and it's too slowly paced to be a thriller.",0.004013560712337494,76.69215393066406,"its mysteries are intriguingly complex, and it's perfectly paced to be a thriller.",0.9995331764221191,68.43891906738281,True,0.7023809523809523
"kwan makes the mix-and-match metaphors intriguing, while lulling us into torpor with his cultivated allergy to action.",0.9969143867492676,176.12283325195312,"kwan makes the mix-and-match metaphors boring, while lulling us into torpor with his cultivated allergy to action.",0.008448805660009384,181.11936950683594,True,0.9491525423728814
"de niro looks bored, murphy recycles murphy, and you mentally add showtime to the pile of hollywood dreck that represents nothing more than the art of the deal.",0.0016947879921644926,175.87986755371094,"de niro looks excited, murphy recycles murphy, and you mentally add showtime to the pile of hollywood treasure that represents nothing less than the art of the deal.",0.9986556768417358,229.9123992919922,True,0.9090909090909091
"windtalkers is shapelessly gratifying, the kind of movie that invites you to pick apart its faults even as you have to admit that somehow it hit you where you live.",0.9988781809806824,55.763450622558594,"windtalkers is shapelessly disappointing, the kind of movie that invites you to pick apart its faults even as you have to admit that somehow it missed you where you live.",0.002689861226826906,64.47318267822266,True,0.9235294117647059
"reinforces the often forgotten fact of the world's remarkably varying human population and mindset, and its capacity to heal using creative, natural and ancient antidotes.",0.9993703961372375,145.58985900878906,"reinforces the often forgotten fact of the world's remarkably varying human population and mindset, and its capacity to harm using destructive, artificial and ancient antidotes.",0.9716686606407166,166.69671630859375,False,0.9096045197740112
aspires for the piquant but only really achieves a sort of ridiculous sourness.,0.0009181376080960035,186.9293975830078,aspires for the piquant but only really achieves a sort of delightful sweetness.,0.8397749662399292,198.80740356445312,True,0.85
the fact that the rookie is a nearly impeccable cinematic experience -- and a wonderful all-ages triumph besides -- is a miracle akin to the story the film portrays.,0.9997195601463318,123.90453338623047,the fact that the rookie is a nearly flawed cinematic experience -- and a disappointing all-ages failure besides -- is a disaster akin to the story the film portrays.,0.0006849995697848499,176.58424377441406,True,0.8012048192771084
"emerges as something rare, an issue movie that's so honest and keenly observed that it doesn't feel like one.",0.9993914365768433,91.88899230957031,"emerges as something common, an issue movie that's so dishonest and poorly observed that it feels like one.",0.0009198038605973125,179.41439819335938,True,0.7981651376146789
"like a tone-deaf singer at a benefit concert, john q. is a bad movie appearing on behalf of a good cause.",0.0017359813209623098,104.70315551757812,"like a skilled singer at a benefit concert, john q. is a good movie appearing on behalf of a good cause.",0.9994342923164368,141.35862731933594,True,0.8952380952380953
an excellent romp that boasts both a heart and a mind.,0.9997794032096863,98.65528869628906,an terrible romp that boasts both a heart and a mind.,0.989281177520752,123.2519302368164,False,0.8703703703703703
all but the most persnickety preteens should enjoy this nonthreatening but thrilling adventure.,0.9986997842788696,115.2520980834961,all but the most persnickety preteens should despise this nonthreatening but boring adventure.,0.004388445056974888,197.8026885986328,True,0.8842105263157894
"a long-winded, predictable scenario.",0.0013307819608598948,91.79243469238281,"a fascinating, unpredictable scenario.",0.9997335076332092,520.2691650390625,True,0.6578947368421053
"greene delivers a typically solid performance in a role that is a bit of a departure from the noble characters he has played in the past, and he is matched by schweig, who carries the film on his broad, handsome shoulders.",0.999554455280304,59.57709503173828,"greene delivers a typically weak performance in a role that is a bit of a departure from the noble characters he has played in the past, and he is matched by schweig, who burdens the film on his narrow, unremarkable shoulders.",0.29224443435668945,67.95533752441406,True,0.8893805309734513
"while benigni (who stars and co-wrote) seems to be having a wonderful time, he might be alone in that.",0.03730570897459984,125.91199493408203,"while benigni (who stars and co-wrote) seems to be having a wonderful time, he certainly isn't alone in that.",0.9994519352912903,88.00218200683594,True,0.8807339449541285
the title's lameness should clue you in on how bad the movie is.,0.0008201294695027173,61.786617279052734,the title's brilliance should clue you in on how great the movie is.,0.9993667006492615,59.97008514404297,True,0.8088235294117647
"a simple, sometimes maddeningly slow film that has just enough charm and good acting to make it interesting, but is ultimately pulled under by the pacing and lack of creativity within.",0.0021758812945336103,43.393157958984375,"a simple, sometimes delightfully slow film that has just enough charm and good acting to make it interesting, but is ultimately uplifted by the pacing and abundance of creativity within.",0.9995833039283752,56.53347396850586,True,0.8602150537634409
binoche and magimel are perfect in these roles.,0.9994503855705261,383.22259521484375,binoche and magimel are terrible in these roles.,0.0020186565816402435,542.740234375,True,0.875
attal mixes comedy with a serious exploration of ego and jealousy within a seemingly serene marriage.,0.9989237189292908,138.17152404785156,attal mixes tragedy with a serious exploration of ego and jealousy within a seemingly serene marriage.,0.997688889503479,215.33055114746094,False,0.9607843137254902
"director brian levant, who never strays far from his sitcom roots, skates blithely from one implausible situation to another, pausing only to tie up loose ends with more bows than you'll find on a french poodle.",0.11512543261051178,59.608097076416016,"director brian levant, who never strays far from his sitcom roots, skates blithely from one believable situation to another, pausing only to tie up loose ends with more bows than you'll find on a french poodle.",0.8519849181175232,64.18824005126953,True,0.966824644549763
"there's not much more to this adaptation of the nick hornby novel than charm -- effortless, pleasurable, featherweight charm.",0.9957506656646729,218.19212341308594,"there's not much more to this adaptation of the nick hornby novel than charm -- laborious, displeasing, burdensome charm.",0.027865633368492126,250.73817443847656,True,0.776
"an unsatisfying hybrid of blair witch and typical stalk-and-slash fare, where the most conservative protagonist is always the last one living.",0.004774128552526236,176.07211303710938,"an satisfying hybrid of blair witch and unique stalk-and-slash fare, where the most conservative protagonist is always the last one living.",0.9995002746582031,232.86903381347656,True,0.9436619718309859
a bigger holiday downer than your end-of-year 401 (k) statement.,0.003966254182159901,182.69969177246094,a bigger holiday highlight than your end-of-year 401 (k) statement.,0.9991337656974792,178.47972106933594,True,0.8656716417910448
