original_text,original_score,original_perplexity,counterfactual_text,counterfactual_score,counterfactual_perplexity,found_flip,levenshtein_similarity_score,original_question
"what came into force after the new constitution was heralded? [sep] as of that day, the new constitution heralding the second republic came into force.",0.005043478216975927,62.80455017089844,"what came into force after the new constitution was heralded? [sep] as of that day, the new constitution heralding the second republic came into force.",0.3764539659023285,69.26520538330078,False,0.5496688741721854,what came into force after the new constitution was herald?
"what is the first major city in the stream of the rhine? [sep] the most important tributaries in this area are not associated with any major cities, but include smaller streams and rivers.",0.5670859813690186,166.79348754882812,"what is the first major city in the stream of the rhine? [sep] the most important tributaries in this area are not associated with any major cities, but include smaller streams and rivers.",0.8035160303115845,51.232662200927734,False,0.30319148936170215,what is the first major city in the stream of the rhine?
what is the minimum required if you want to teach in canada? [sep] in most provinces a single bachelor's degree is sufficient to become a qualified teacher.,0.9625449180603027,35.93400192260742,what is the minimum required if you want to teach in canada? [sep] in most provinces a single bachelor's degree is sufficient to become a qualified teacher.,0.9671962261199951,39.92892837524414,False,0.41025641025641024,what is the minimum required if you want to teach in canada?
"how was temüjin kept imprisoned by the tayichi'ud? [sep] the tayichi'ud enslaved temüjin (reportedly with a cangue, a sort of portable stocks), and despite the efforts of a sympathetic guard, he failed to escape from the ger (yurt) in the middle of the night.",0.013612106442451477,100.98246002197266,"how was temüjin kept imprisoned by the tayichi'ud? [sep] the tayichi'ud enslaved temüjin (reportedly with a cangue, a sort of portable stocks), and despite the efforts of a sympathetic guard, he failed to escape from the ger (yurt) in the middle of the night.",0.3170064687728882,108.85894775390625,False,0.3942307692307693,how was temüjin kept imprisoned by the tayichi'ud?
"what did herr gott, dich loben wir become known as? [sep] he paraphrased a different hymn as ""herr gott, dich loben wir"" with a simplified form of the melody.",0.9964224696159363,194.8141632080078,"what did herr gott, dich loben wir become known as? [sep] he paraphrased a different hymn as ""herr gott, dich loben wir"" with a simplified form of the melody.",0.21971537172794342,68.01073455810547,True,0.5443037974683544,"what did herr gott, dich loben wir become known as?"
"what year did the the case go before the supreme court? [sep] for example, joseph haas sent a congratulatory email to the lebanon, new hampshire city councilors.",0.9978723526000977,101.78874206542969,"what year did the the case go before the supreme court? [sep] for example, joseph haas sent a congratulatory email to the lebanon, new hampshire city councilors.",0.9578562378883362,74.574462890625,False,0.34782608695652173,what year did the the case go before the supreme court?
"what does umc stand for? [sep] founded in 1968 by the union of the methodist church (usa) and the evangelical united brethren church, it is a significant organization in religious history.",0.9770978689193726,130.8090057373047,"what does umc stand for? [sep] founded in 1968 by the union of the methodist church (usa) and the evangelical united brethren church, it is a significant organization in religious history.",0.16904327273368835,202.28973388671875,True,0.41295546558704455,what does umc stand for?
what is the name of the professional skateboarder that lives in southern california? [sep] southern california is also important to the world of snowboarding.,0.997913658618927,67.6806869506836,what is the name of the professional skateboarder that lives in southern california? [sep] southern california is also important to the world of snowboarding.,0.8174578547477722,37.653202056884766,False,0.36708860759493667,what is the name of the professional skateboarder that lives in southern california?
where did temüjin hide during his escape from the tayichi'ud? [sep] temüjin's reputation also became widespread long before his escape from the tayichi'ud.,0.9979808926582336,461.7332458496094,where did temüjin hide during his escape from the tayichi'ud? [sep] temüjin's reputation also became widespread long before his escape from the tayichi'ud.,0.2998546063899994,90.44583892822266,True,0.5032258064516129,where did temüjin hide during his escape from the tayichi'ud?
what are the most active parts of ctenophora? [sep] these branch through the mesoglea to the most active parts of the animal: the mouth and pharynx; all along each comb row; and four branches round the sensory complex at the far end from the mouth – two of these four branches terminate in anal pores.,0.013575946912169456,81.11638641357422,what are the most active parts of ctenophora? [sep] these branch through the mesoglea to the most active parts of the animal: the mouth and pharynx; all along each comb row; and four branches round the sensory complex at the far end from the mouth – two of these four branches terminate in anal pores.,0.44599053263664246,95.83183288574219,False,0.6437908496732025,what are the most active parts of ctenophora?
"who decides the fate of protesters most of the time? [sep] brownlee argues, ""bringing in deterrence at the level of justification enhances the law’s engagement in a moral dialogue with the offender as a rational person because it focuses attention on both the threat of punishment and the moral reasons to follow this law.""",0.9865356087684631,96.12276458740234,"who decides the fate of protesters most of the time? [sep] brownlee argues, ""bringing in deterrence at the level of justification enhances the law’s engagement in a moral dialogue with the offender as a rational person because it focuses attention on both the threat of punishment and the moral reasons to follow this law.""",0.8309345245361328,130.97259521484375,False,0.7585139318885449,who decides the fate of protesters most of the time?
"what act sets forth the functions of the scottish parliament? [sep] the scotland act 1998, which was passed by the parliament of the united kingdom and given royal assent by queen elizabeth ii, governs the functions and role of the scottish parliament.",0.0036305736284703016,65.58869934082031,"what act sets forth the functions of the scottish parliament? [sep] the scotland act 1998, which was passed by the parliament of the united kingdom and given royal assent by queen elizabeth ii, governs the functions and role of the scottish parliament.",0.9670807123184204,60.21310043334961,True,0.4920634920634921,what act sets forth the functions of the scottish parliament?
what is the name for a response of the immune system that damages the body's native tissues? [sep] hypersensitivity is an immune response that damages the body's native tissues.,0.007925821468234062,19.41464614868164,what is the name for a response of the immune system that damages the body's native tissues? [sep] hypersensitivity is an immune response that damages the body's native tissues.,0.49821192026138306,31.61057472229004,False,0.4067796610169492,what is the name for a response of the immune system that damages the body's native tissues?
when did the warsaw uprising end? [sep] the polish government-in-exile in london gave orders to the underground home army (ak) to try to seize control of warsaw from the germans before the red army arrived.,0.9978017210960388,150.43035888671875,when did the warsaw uprising end? [sep] the polish government-in-exile in london gave orders to the underground home army (ak) to try to seize control of warsaw from the germans before the red army arrived.,0.8293319344520569,133.9332733154297,False,0.8058252427184466,when did the warsaw uprising begin?
the tower district is centered around which historic theatre? [sep] the theater was demolished in 1939 and no longer exists at olive and wishon avenues.,0.939918577671051,115.88262176513672,the tower district is centered around which historic theatre? [sep] the theater was demolished in 1939 and no longer exists at olive and wishon avenues.,0.3431805670261383,349.3270568847656,True,0.29605263157894735,the tower district is centered around which historic theatre?
"what is the english translation of het scheur? [sep] the largest and southern main branch begins as waal and continues as boven merwede (""upper merwede""), beneden merwede (""lower merwede""), noord river (""north river""), nieuwe maas (""new meuse""), het scheur (**""the tear""**) and nieuwe waterweg (""new waterway"").",0.00329668284393847,110.49601745605469,"what is the english translation of het scheur? [sep] the largest and southern main branch begins as waal and continues as boven merwede (""upper merwede""), beneden merwede (""lower merwede""), noord river (""north river""), nieuwe maas (""new meuse""), het scheur (**""the tear""**) and nieuwe waterweg (""new waterway"").",0.09690743684768677,91.35611724853516,False,0.8038585209003215,what is the english translation of het scheur?
"what is one of the largest music schools in europe? [sep] other institutions for higher education include the medical university of warsaw, the largest medical school in poland and one of the most prestigious, the national defence university, highest military academic institution in poland, **the fryderyk chopin university of music which is not only the oldest but also** **the largest music school in poland and one of the largest in europe**, the warsaw school of economics, the oldest and most renowned economic university in the country, and the warsaw university of life sciences which is also a large agricultural university founded in 1818.",0.0031919174361974,41.63705825805664,"what is one of the largest music schools in europe? [sep] other institutions for higher education include the medical university of warsaw, the largest medical school in poland and one of the most prestigious, the national defence university, highest military academic institution in poland, **the fryderyk chopin university of music which is not only the oldest but also** **the largest music school in poland and one of the largest in europe**, the warsaw school of economics, the oldest and most renowned economic university in the country, and the warsaw university of life sciences which is also a large agricultural university founded in 1818.",0.7616426348686218,43.98234939575195,True,0.8274268104776579,what is one of the largest music schools in europe?
"what percentage of farmland grows wheat? [sep] more than 50% of the farmland is sown for wheat, 33% for barley and 7% for oats.",0.01049793977290392,21.2761173248291,"what percentage of farmland grows wheat? [sep] more than 50% of the farmland is sown for wheat, 33% for barley and 7% for oats.",0.9272477030754089,30.285730361938477,True,0.5748031496062992,what percentage of farmland grows wheat?
"what did he light at his laboratories to demonstrate his wireless power transmission? [sep] he lit electric lamps wirelessly at his laboratory, demonstrating the potential of wireless power transmission.",0.006910176482051611,110.49964904785156,"what did he light at his laboratories to demonstrate his wireless power transmission? [sep] he lit electric lamps wirelessly at his laboratory, demonstrating the potential of wireless power transmission.",0.5546285510063171,84.70903778076172,True,0.49753694581280783,what did he light at his laboratories to demonstrate his wireless power transmission?
where did the exposition take place? [sep] this world's fair did not devote a building to electrical exhibits.,0.9947182536125183,943.3854370117188,where did the exposition take place? [sep] this world's fair did not devote a building to electrical exhibits.,0.6474639773368835,208.01719665527344,False,0.5272727272727273,where did the exposition take place?
"what is a ligand on the cell surface that is upregulated after helper t cell activation? [sep] in addition, helper t cell activation causes an upregulation of molecules expressed on the t cell's surface, such as cd40 ligand (also called cd154), which provide extra stimulatory signals typically required to activate antibody-producing b cells and is directly involved in t-cell interactions.",0.004827325232326984,102.2766342163086,"what is a ligand on the cell surface that is upregulated after helper t cell activation? [sep] in addition, helper t cell activation causes an upregulation of molecules expressed on the t cell's surface, such as cd40 ligand (also called cd154), which provide extra stimulatory signals typically required to activate antibody-producing b cells and is directly involved in t-cell interactions.",0.42348694801330566,67.08447265625,False,0.6342710997442456,what is a ligand on the cell surface that is upregulated after helper t cell activation?
"when did warsaw become the center of the congress poland? [sep] warsaw was a major city in the polish–lithuanian commonwealth until 1796, when it was annexed by the kingdom of prussia and became a significant city in the province of south prussia.",0.9909580945968628,44.81721115112305,"when did warsaw become the center of the congress poland? [sep] warsaw was a major city in the polish–lithuanian commonwealth until 1796, when it was annexed by the kingdom of prussia and became a significant city in the province of south prussia.",0.9806427359580994,72.06059265136719,False,0.6396761133603239,when did warsaw become the center of the congress poland?
"which country does the rhine encounter its main tributaries? [sep] it is in germany that the rhine encounters some more of its main tributaries, such as the neckar, the main and, later, the moselle, which contributes an average discharge of more than 300 m3/s (11,000 cu ft/s).",0.005984549410641193,48.15843200683594,"which country does the rhine encounter its main tributaries? [sep] it is in germany that the rhine encounters some more of its main tributaries, such as the neckar, the main and, later, the moselle, which contributes an average discharge of more than 300 m3/s (11,000 cu ft/s).",0.8458072543144226,48.14529800415039,True,0.7328519855595668,which country does the rhine encounter it's main tributaries?
"if two thirds of the rhine flows through waal, where does the other third flow through? [sep] the other third of the water flows through the pannerdens kanaal and redistributes in the ijssel and nederrijn, which are correct continuations of its path.",0.011788582429289818,340.8109436035156,"if two thirds of the rhine flows through waal, where does the other third flow through? [sep] the other third of the water flows through the pannerdens kanaal and redistributes in the ijssel and nederrijn, which are correct continuations of its path.",0.8129050731658936,137.59780883789062,True,0.44399999999999995,"if two thirds of the rhine flows through waal, where does the other third flow through?"
"what paved the way for the augsburg confession? [sep] the marburg colloquy, despite disagreements on the eucharist, directly led to the signing in 1530 of the augsburg confession, and to the formation of the schmalkaldic league the following year by leading protestant nobles such as john of saxony, philip of hesse, and george, margrave of brandenburg-ansbach.",0.003213298274204135,127.95558166503906,"what paved the way for the augsburg confession? [sep] the marburg colloquy, despite disagreements on the eucharist, directly led to the signing in 1530 of the augsburg confession, and to the formation of the schmalkaldic league the following year by leading protestant nobles such as john of saxony, philip of hesse, and george, margrave of brandenburg-ansbach.",0.2853837311267853,104.88739776611328,False,0.7590027700831025,what paved the way for the augsburg confession?
"what signer of the articles of confederation was descended from huguenots? [sep] henry laurens, who signed the articles of confederation for south carolina, was descended from huguenot refugees.",0.0038211459759622812,104.25031280517578,"what signer of the articles of confederation was descended from huguenots? [sep] henry laurens, who signed the articles of confederation for south carolina, was descended from huguenot refugees.",0.7863332629203796,97.90813446044922,True,0.2807017543859649,what signer of the articles of confederation was descended from huguenots?
what language did tesla study while in school? [sep] tesla was the fourth of five children and studied engineering.,0.9977001547813416,61.951499938964844,what language did tesla study while in school? [sep] tesla was the fourth of five children and studied engineering.,0.9110659956932068,85.52304077148438,False,0.33043478260869563,what language did tesla study while in school?
"in what year did the university first see a drop in applications? [sep] in the early 1950s, the university saw its first decline in student applications as a result of increasing crime and poverty in the hyde park neighborhood.",0.016542358323931694,65.80121612548828,"in what year did the university first see a drop in applications? [sep] in the early 1950s, the university saw its first decline in student applications as a result of increasing crime and poverty in the hyde park neighborhood.",0.9414684176445007,46.04525375366211,True,0.4889867841409692,in what year did the university first see a drop in applications?
"what causes the symptoms of inflammation? [sep] the symptoms of inflammation, including redness, swelling, heat, and pain, are directly caused by increased blood flow into tissue.",0.004123514052480459,22.597496032714844,"what causes the symptoms of inflammation? [sep] the symptoms of inflammation, including redness, swelling, heat, and pain, are directly caused by increased blood flow into tissue.",0.8091365098953247,28.809297561645508,True,0.6201117318435754,what causes the symptoms of inflammation?
"in which case did the court state that austria was not allowed to hold places in austrian schools exclusively for austrian students? [sep] in commission v austria the court held that austria was not entitled to restrict places in austrian universities to austrian students, stating it would cause ""structural, staffing and financial problems"" if (mainly german) foreign students applied for places since there was substantial evidence of an actual problem.",0.006081446539610624,68.23171997070312,"in which case did the court state that austria was not allowed to hold places in austrian schools exclusively for austrian students? [sep] in commission v austria the court held that austria was not entitled to restrict places in austrian universities to austrian students, stating it would cause ""structural, staffing and financial problems"" if (mainly german) foreign students applied for places since there was substantial evidence of an actual problem.",0.9177701473236084,54.80358123779297,True,0.6206140350877193,in which case did the court state that austria was not allowed to hold places in austrian schools exclusively for austrian students?
"what type of flower is sought on midsummer's eve? [sep] each midsummer’s eve, apart from the official floating of wreaths, jumping over fires, there are musical performances, dignitaries' speeches, fairs and fireworks by the river bank.",0.005368800833821297,116.21585845947266,"what type of flower is sought on midsummer's eve? [sep] each midsummer’s eve, apart from the official floating of wreaths, jumping over fires, there are musical performances, dignitaries' speeches, fairs and fireworks by the river bank.",0.8747782111167908,112.62206268310547,True,0.6398305084745763,what type of flower is sought on midsummer's eve?
"what are those from jacksonville always called? [sep] people from jacksonville may be called ""jacksonvillians"" or ""jaxsons"" (also spelled ""jaxons"").",0.006760059390217066,32.278564453125,"what are those from jacksonville always called? [sep] people from jacksonville may be called ""jacksonvillians"" or ""jaxsons"" (also spelled ""jaxons"").",0.4373963475227356,38.334503173828125,False,0.6351351351351351,what are those from jacksonville sometimes called?
when was amnesty granted to those responsible for the massacre? [sep] no amnesty was ever granted to those responsible for the massacre.,0.9977954626083374,28.241031646728516,when was amnesty granted to those responsible for the massacre? [sep] no amnesty was ever granted to those responsible for the massacre.,0.9199289679527283,31.123842239379883,False,0.2279411764705882,when was amnesty granted to those responsible for the massacre?
"a function problem is an example of what? [sep] notable examples include the traveling salesman problem, the integer factorization problem, and a function problem.",0.43207597732543945,112.88864135742188,"a function problem is an example of what? [sep] notable examples include the traveling salesman problem, the integer factorization problem, and a function problem.",0.5010668039321899,84.2501449584961,True,0.5337423312883436,a function problem is an example of what?
in what year did tesla's family move to gospic? [sep] tesla spent his early childhood in smiljan.,0.99797123670578,61.951499938964844,in what year did tesla's family move to gospic? [sep] tesla spent his early childhood in smiljan.,0.7469820976257324,102.57011413574219,False,0.24742268041237114,in what year did tesla's family move to gospic?
"what did carolina face in the opening drive that they had not faced the entire postseason? [sep] a series of successful passes by c. j. anderson led to an early touchdown against the panthers, putting them at a disadvantage from the start.",0.8262283205986023,95.36981964111328,"what did carolina face in the opening drive that they had not faced the entire postseason? [sep] a series of successful passes by c. j. anderson led to an early touchdown against the panthers, putting them at a disadvantage from the start.",0.211711585521698,88.38883972167969,True,0.2761506276150628,what did carolina face in the opening drive that they had not faced the entire postseason?
who was the mayor of san francisco during super bowl 50? [sep] san francisco mayor ed lee was in office during super bowl 50.,0.003724722657352686,147.70216369628906,who was the mayor of san francisco during super bowl 50? [sep] san francisco mayor ed lee was in office during super bowl 50.,0.9336996674537659,117.45358276367188,True,0.23199999999999998,who was the mayor of san francisco during super bowl 50?
"what day of the week did shark tank debut on? [sep] shark tank (based on the dragon's den reality format) debuted as a midseason sleeper hit on sundays in the spring of 2010; subsequently, it became the tentpole of the network's friday night schedule, gradually helping make abc a strong competitor (after being paired with 20/20 and beginning with the 2012–13 season, alongside the tim allen sitcom last man standing) against cbs' long-dominant drama/reality lineup on that night for the first time since the ""tgif"" lineup ended in 2000.",0.014821404591202736,102.18489837646484,"what day of the week did shark tank debut on? [sep] shark tank (based on the dragon's den reality format) debuted as a midseason sleeper hit on sundays in the spring of 2010; subsequently, it became the tentpole of the network's friday night schedule, gradually helping make abc a strong competitor (after being paired with 20/20 and beginning with the 2012–13 season, alongside the tim allen sitcom last man standing) against cbs' long-dominant drama/reality lineup on that night for the first time since the ""tgif"" lineup ended in 2000.",0.9333477020263672,110.48927307128906,True,0.8308550185873607,what day of the week did shark tank debut on?
"how much of jacksonville is made up of water? [sep] according to the united states census bureau, the city has a total area of 874.3 square miles (2,264 km2), making jacksonville the largest city in land area in the contiguous united states; of this, 13.34% (116.7 sq mi or 302 km2) is water.",0.004204712808132172,22.255582809448242,"how much of jacksonville is made up of water? [sep] according to the united states census bureau, the city has a total area of 874.3 square miles (2,264 km2), making jacksonville the largest city in land area in the contiguous united states; of this, 13.34% (116.7 sq mi or 302 km2) is water.",0.9417344331741333,28.607404708862305,True,0.660958904109589,how much of jacksonville is made up of water?
what museum preserves the memory of the crime? [sep] a fine tribute to the fall of warsaw and history of poland can be found in the katyń museum which preserves the memory of the crime.,0.0025635247584432364,144.23648071289062,what museum preserves the memory of the crime? [sep] a fine tribute to the fall of warsaw and history of poland can be found in the katyń museum which preserves the memory of the crime.,0.8996487259864807,95.8992919921875,True,0.5297297297297296,what museum preserves the memory of the crime?
"when people take on debt, it leads potentially to what? [sep] if the state provides these services, then for those on lower incomes, the costs need not be borrowed and often those on lower incomes are better equipped to manage their finances.",0.9956244826316833,30.919666290283203,"when people take on debt, it leads potentially to what? [sep] if the state provides these services, then for those on lower incomes, the costs need not be borrowed and often those on lower incomes are better equipped to manage their finances.",0.4493037164211273,61.96491622924805,True,0.6487603305785123,"when people take on debt, it leads potentially to what?"
