original_text,original_score,original_perplexity,counterfactual_text,counterfactual_score,counterfactual_perplexity,found_flip,levenshtein_similarity_score,original_question
"when was the st. bartholomew's day massacre? [sep] the st. bartholomew's day massacre occurred on 24 august 1572, when catholics killed thousands of huguenots in paris.",0.003066446166485548,155.74627685546875,"when was the st. bartholomew's day massacre? [sep] the st. bartholomew's day massacre occurred on 24 august 1572, when catholics killed thousands of huguenots in paris.",0.8832352161407471,63.523719787597656,True,0.6190476190476191,when was the st. bartholomew's day massacre?
what do these teachers do? [sep] these teachers do not teach by rote but attempt to find new invigoration for the course materials on a daily basis.,0.01753411814570427,62.24980926513672,what do these teachers do? [sep] these teachers do not teach by rote but attempt to find new invigoration for the course materials on a daily basis.,0.538243293762207,69.42054748535156,True,0.777027027027027,what do these teachers not do?
"what role in economics did the university play a major part in? [sep] in economics, the university has played a major part in shaping ideas about the free market and is the namesake of the chicago school of economics, which is supported by milton friedman and other economists.",0.0042469697073102,52.160606384277344,"what role in economics did the university play a major part in? [sep] in economics, the university has played a major part in shaping ideas about the free market and is the namesake of the chicago school of economics, which is supported by milton friedman and other economists.",0.5099276304244995,58.909400939941406,True,0.6245487364620939,what role in economics did the university play a major part in?
what is the estimate of how many physicians dispense drugs on their own? [sep] 7 to 10 percent of american physicians practices reportedly dispense drugs on their own.,0.019275225698947906,127.65684509277344,what is the estimate of how many physicians dispense drugs on their own? [sep] 7 to 10 percent of american physicians practices reportedly dispense drugs on their own.,0.9464789628982544,47.746829986572266,True,0.5269461077844311,what is the estimate of how many physicians give out drugs on their own?
"what was warsaw ranked the 7th greatest of? [sep] it also has one of the slowest growing economies, with gdp growth at 0.5 percent in 2007 and 0.1 percent in the first quarter of 2008.",0.9939574003219604,13.4304780960083,"what was warsaw ranked the 7th greatest of? [sep] it also has one of the slowest growing economies, with gdp growth at 0.5 percent in 2007 and 0.1 percent in the first quarter of 2008.",0.6321302652359009,47.58311462402344,False,0.6956521739130435,what was warsaw ranked the 7th greatest of?
"what was the marburg colloquy meant to establish? [sep] agreement was not achieved on any points, including the nature of the eucharist – the sacrament of the lord's supper—an issue crucial to luther.",0.981979489326477,108.37556457519531,"what was the marburg colloquy meant to establish? [sep] agreement was not achieved on any points, including the nature of the eucharist – the sacrament of the lord's supper—an issue crucial to luther.",0.3282124102115631,138.21804809570312,True,0.5900000000000001,what was the marburg colloquy meant to establish?
"what river runs through warsaw? [sep] its population is estimated at 1.740 million residents within a greater metropolitan area of 2.666 million residents, which makes warsaw the 9th most-populous capital city in the european union, but no mention of any river.",0.9972968697547913,39.05532455444336,"what river runs through warsaw? [sep] its population is estimated at 1.740 million residents within a greater metropolitan area of 2.666 million residents, which makes warsaw the 9th most-populous capital city in the european union, but no mention of any river.",0.9352344870567322,59.98910140991211,False,0.7432950191570882,what river runs through warsaw?
"who designed the scottish parliament building? [sep] since september 2004, the official home of the scottish parliament has been a new scottish parliament building, in the holyrood area of edinburgh, which was constructed without an architect.",0.9980341792106628,63.3855094909668,"who designed the scottish parliament building? [sep] since september 2004, the official home of the scottish parliament has been a new scottish parliament building, in the holyrood area of edinburgh, which was constructed without an architect.",0.8330461978912354,53.391944885253906,False,0.6008230452674896,who designed the scottish parliament building?
"what portion of berlin's population spoke french by 1700? [sep] by 1700, nearly all of the city's population was french speaking.",0.0037009636871516705,58.53771209716797,"what portion of berlin's population spoke french by 1700? [sep] by 1700, nearly all of the city's population was french speaking.",0.8886771202087402,106.46585083007812,True,0.43410852713178294,what portion of berlin's population spoke french by 1700?
"who was responsible for the new building projects in jacksonville? [sep] mayor w. haydon burns was responsible for the construction of a new city hall, civic auditorium, public library and other projects in jacksonville.",0.0027925705071538687,98.07466888427734,"who was responsible for the new building projects in jacksonville? [sep] mayor w. haydon burns was responsible for the construction of a new city hall, civic auditorium, public library and other projects in jacksonville.",0.7478822469711304,59.2569694519043,True,0.4727272727272728,who was responsible for the new building projects in jacksonville?
"what did luther explain about acquiring god's grace? [sep] in this work, one of his most emphatic statements on faith, he argued that every good work designed to attract god's favor is a virtue.",0.9361036419868469,55.94191360473633,"what did luther explain about acquiring god's grace? [sep] in this work, one of his most emphatic statements on faith, he argued that every good work designed to attract god's favor is a virtue.",0.3259884715080261,83.6743392944336,True,0.6701030927835052,what did luther explain about acquiring god's grace?
"where was war fought? [sep] the war was fought in new france and the british colonies, including virginia and nova scotia.",0.006585949100553989,52.129791259765625,"where was war fought? [sep] the war was fought in new france and the british colonies, including virginia and nova scotia.",0.48639628291130066,101.84506225585938,False,0.5234899328859061,where was war fought?
"in what year did harvard stadium become the first ever concrete reinforced stadium in the country? [sep] while yale's football team is no longer one of the country's best as it often was a century ago during football's early days (it won the rose bowl in 1920), both it and harvard have influenced the way the game is played.",0.9975872039794922,52.45004653930664,"in what year did harvard stadium become the first ever concrete reinforced stadium in the country? [sep] while yale's football team is no longer one of the country's best as it often was a century ago during football's early days (it won the rose bowl in 1920), both it and harvard have influenced the way the game is played.",0.9152175784111023,60.7518310546875,False,0.6615384615384615,in what year did harvard stadium become the first ever concrete reinforced stadium in the country?
"how much time was left in the game when denver took the score to 24-10? [sep] with 4:51 left in regulation, carolina got the ball on their own 24-yard line with a chance to mount a game-winning drive, and soon faced 3rd-and-9. denver had scored earlier.",0.7554915547370911,26.731081008911133,"how much time was left in the game when denver took the score to 24-10? [sep] with 4:51 left in regulation, carolina got the ball on their own 24-yard line with a chance to mount a game-winning drive, and soon faced 3rd-and-9. denver had scored earlier.",0.8999296426773071,38.23170471191406,False,0.5849802371541502,how much time was left in the game when denver took the score to 24-10?
"what kind of needlework was used in the creation of the bayeux tapestry? [sep] it was commissioned by odo, the bishop of bayeux and first earl of kent, who employed artisans skilled in roman mosaic techniques.",0.9931191205978394,87.0785140991211,"what kind of needlework was used in the creation of the bayeux tapestry? [sep] it was commissioned by odo, the bishop of bayeux and first earl of kent, who employed artisans skilled in roman mosaic techniques.",0.8425936698913574,57.69395446777344,False,0.22009569377990434,what kind of needlework was used in the creation of the bayeux tapestry?
"why was nbc unable to broadcast the coronation of queen elizabeth ii? [sep] the first attempts to internationalize the nbc television network date back to the 1950s, after leonard goldenson, following the united paramount theatres model, tried to use on nbc the same strategies he had made in expanding upt's theater operation to the international market.",0.9964184761047363,168.4879913330078,"why was nbc unable to broadcast the coronation of queen elizabeth ii? [sep] the first attempts to internationalize the nbc television network date back to the 1950s, after leonard goldenson, following the united paramount theatres model, tried to use on nbc the same strategies he had made in expanding upt's theater operation to the international market.",0.20312076807022095,110.249755859375,True,0.780281690140845,why was nbc unable to broadcast the coronation of queen elizabeth ii?
"what was developed from watt's measurements on a model steam engine? [sep] the steam engine contributed much to the development of thermodynamic theory; however, there were no direct developments from watt's specific measurements on a model steam engine.",0.9875702261924744,34.043704986572266,"what was developed from watt's measurements on a model steam engine? [sep] the steam engine contributed much to the development of thermodynamic theory; however, there were no direct developments from watt's specific measurements on a model steam engine.",0.38782888650894165,54.509822845458984,True,0.282312925170068,what was developed from watt's measurements on a model steam engine?
