original_text,original_score,original_perplexity,counterfactual_text,counterfactual_score,counterfactual_perplexity,found_flip,levenshtein_similarity_score
"what was warsaw ranked the 7th greatest of? [SEP] it also has one of the fastest growing economies, with gdp growth at 6.5 percent in 2007 and 6.1 percent in the first quarter of 2008.",0.9939574003219604,45.75419235229492,"what was warsaw ranked the highest greatest of? [SEP] it also has one of the fastest growing economies, with gdp growth at 6. 5 percent in 2007 and 6. 1 percent in the first quarter of 2008.",0.9892815351486206,66.0998764038086,False,0.9578947368421052
"what was the marburg colloquy meant to establish? [SEP] agreement was achieved on fourteen points out of fifteen, the exception being the nature of the eucharist – the sacrament of the lord's supper—an issue crucial to luther.",0.981979489326477,124.12085723876953,"what was the marburg colloquy meant to agree? [SEP] agreement was achieved on fourteen points out of fifteen, the exception being the nature of the eucharist – the sacrament of the lord's supper — an issue crucial to luther.",0.6317823529243469,121.05548095703125,False,0.9557522123893806
"what river runs through warsaw? [SEP] its population is estimated at 1.740 million residents within a greater metropolitan area of 2.666 million residents, which makes warsaw the 9th most-populous capital city in the european union.",0.9972968697547913,53.56257629394531,"what the runs through warsaw? [SEP] its population is estimated at 1. 740 million residents within a greater metropolitan area of 2. 666 million residents, which makes warsaw the 9th most-populous capital city in the european union.",0.997586727142334,62.41866683959961,False,0.9741379310344828
"who designed the scottish parliament building? [SEP] since september 2004, the official home of the scottish parliament has been a new scottish parliament building, in the holyrood area of edinburgh.",0.9980341792106628,57.766929626464844,"who designed the scottish parliament building? [SEP] since september 2004, the official home of the european parliament has been a new scottish parliament building, in the holyrood area of edinburgh.",0.9978874325752258,69.22769165039062,False,0.9597989949748744
"what portion of berlin's population spoke french by 1700? [SEP] by 1700, one-fifth of the city's population was french speaking.",0.0037009636871516705,100.47396087646484,"what portion of berlin's population spoke french by 1700? [SEP] by 1980, one-fifth of the city's population was french speaking.",0.997298538684845,103.9583740234375,True,0.984375
"who was responsible for the new building projects in jacksonville? [SEP] mayor w. haydon burns' jacksonville story resulted in the construction of a new city hall, civic auditorium, public library and other projects that created a dynamic sense of civic pride.",0.0027925705071538687,75.09545135498047,"who was responsible for the new parking projects in jacksonville? [SEP] mayor w. haydon burns' jacksonville story resulted in the construction of a new city hall, civic auditorium, public library and other projects that created a dynamic sense of civic pride.",0.3025573790073395,86.48149871826172,False,0.9807692307692307
"what did luther explain about acquiring god's grace? [SEP] in this work, one of his most emphatic statements on faith, he argued that every good work designed to attract god's favor is a sin.",0.9361036419868469,79.96842956542969,"what did luther explain about acquiring god's praise? [SEP] in this work, one of his most emphatic statements on faith, he argued that every good work designed to attract god's favor is a sin.",0.4482830762863159,88.04974365234375,True,0.984375
"where was war fought? [SEP] the war was fought primarily along the frontiers between new france and the british colonies, from virginia in the south to nova scotia in the north.",0.006585949100553989,53.723304748535156,"her was war fought? [SEP] the war was fought primarily along the frontiers between new france and the british colonies, from virginia in the south to nova scotia in the north.",0.07250943779945374,73.29464721679688,False,0.9887005649717514
"in what year did harvard stadium become the first ever concrete reinforced stadium in the country? [SEP] while harvard's football team is no longer one of the country's best as it often was a century ago during football's early days (it won the rose bowl in 1920), both it and yale have influenced the way the game is played.",0.9975872039794922,58.207679748535156,"in what year did harvard stadium become the first ever concrete reinforced stadium in the century? [SEP] while harvard's football team is no longer one of the country's best as it often was a century ago during football's early days (it won the rose bowl in 1920), both it and yale have influenced the way the game is played.",0.9976289868354797,66.1050796508789,False,0.9907692307692307
"how much time was left in the game when denver took the score to 24-10? [SEP] with 4:51 left in regulation, carolina got the ball on their own 24-yard line with a chance to mount a game-winning drive, and soon faced 3rd-and-9.",0.7554915547370911,32.6630973815918,"how much time was left in the game when denver took the score to 24-10? [SEP] with 4: 51 left in regulation time carolina got the ball on their own 24-yard line with a chance to mount a game-winning drive, and soon faced 3rd-and-9.",0.23241211473941803,44.88618850708008,True,0.974025974025974
"what kind of needlework was used in the creation of the bayeux tapestry? [SEP] it was commissioned by odo, the bishop of bayeux and first earl of kent, employing natives from kent who were learned in the nordic traditions imported in the previous half century by the danish vikings.",0.9931191205978394,57.55376434326172,"what kind of needlework was used in the creation of the bayeux tapestry [unk] [SEP] it was commissioned by odo, the bishop of bayeux and first earl of kent, employing natives from kent who were learned in the nordic traditions imported in the previous half century by the danish vikings.",0.9833722710609436,69.31288146972656,False,0.9790940766550522
"why was nbc unable to broadcast the coronation of queen elizabeth ii? [SEP] the first attempts to internationalize the abc television network date back to the 1950s, after leonard goldenson, following the united paramount theatres model, tried to use on abc the same strategies he had made in expanding upt's theater operation to the international market.",0.9964184761047363,142.0873260498047,"why was nbc and to broadcast the coronation of queen elizabeth ii? [SEP] the first attempts to internationalize the abc television network date back to the 1950s, after leonard goldenson, following the united paramount theatres model, tried to use on abc the same strategies he had made in expanding upt's theater operation to the international market.",0.9840087890625,158.8505859375,False,0.9859154929577465
"what was developed from watt's measurements on a model steam engine? [SEP] the steam engine contributed much to the development of thermodynamic theory; however, the only applications of scientific theory that influenced the steam engine were the original concepts of harnessing the power of steam and atmospheric pressure and knowledge of properties of heat and steam.",0.9875702261924744,54.64284133911133,"what was developed from watt's measurements on a model steam engine ] [SEP] the steam engine contributed much to the development of thermodynamic theory; however, the only applications of scientific theory that influenced the steam engine were the original concepts of harnessing the power of steam and atmospheric pressure and knowledge of properties of heat and steam.",0.9797414541244507,56.64950942993164,False,0.9945945945945946
