original_text,original_score,original_perplexity,counterfactual_text,counterfactual_score,counterfactual_perplexity,found_flip,levenshtein_similarity_score
"while the mystery surrounding the nature of the boat's malediction remains intriguing enough to sustain mild interest, the picture refuses to offer much accompanying sustenance in the way of characterization, humor or plain old popcorn fun.",0.0012890102807432413,112.05303192138672,"while the mystery surrounding the nature of the boat's malediction remains intriguing enough to sustain mild interest, the picture returns to offer much accompanying sustenance in the way of characterization, humor or plain old popcorn fun.",0.8505672216415405,156.88998413085938,True,0.9875
"it's really yet another anemic and formulaic lethal weapon-derived buddy-cop movie, trying to pass off its lack of imagination as hip knowingness.",0.0009536044090054929,127.53776550292969,"it's really yet another anemic and formulaic lethal weapon-derived buddy-cop movie, trying to pass off its lack of imagination. hip goodness.",0.004740569740533829,222.23358154296875,False,0.9383561643835616
"if this is an example of the type of project that robert redford's lab is willing to lend its imprimatur to, then perhaps it's time to rethink independent films.",0.014717713929712772,46.431278228759766,"if this is an example of the type of project that robert redford's lab is willing to lend its imprimatur to, then perhaps it's time to rememberthi embrace independent films.",0.5681143999099731,76.75841522216797,True,0.9190751445086706
"a great ending doesn't make up for a weak movie, and crazy as hell doesn't even have a great ending.",0.0011089948238804936,41.08042907714844,"a great ending doesn't make up for a weak movie, and crazy as hell doesn't already have a bad ending.",0.774172842502594,53.98017883300781,True,0.900990099009901
"a thoughtful, provocative, insistently humanizing film.",0.9996932744979858,173.53257751464844,"a thoughtful, provocative, soughtly humanizing film.",0.9995928406715393,448.2677001953125,False,0.8727272727272728
"as an entertainment, the movie keeps you diverted and best of all, it lightens your wallet without leaving a sting.",0.9996919631958008,118.57001495361328,"as an commercial, the movie keeps you dull and best of all, it lightens your wallet without leaving a spark.",0.01687018759548664,153.89105224609375,True,0.808695652173913
"makes s&m seem very romantic, and maggie gyllenhaal is a delight.",0.9994679093360901,159.6398468017578,"makes s & m seem very romantic, and maggie gyllenhaal is a damned.",0.42303624749183655,403.32666015625,True,0.8787878787878788
the backyard battles you staged with your green plastic army men were more exciting and almost certainly made more sense.,0.7976972460746765,269.6366882324219,the backyard battles you staged with your green plastic army men were more exciting and almost certainly made no sense.,0.001185575732961297,343.8761291503906,True,0.9752066115702479
"bad company leaves a bad taste, not only because of its bad-luck timing, but also the staleness of its script.",0.000733212276827544,43.34935760498047,"bad company leaves a bad way, not only because of its bad-luck timing, but also the goodness of its libretto.",0.017301904037594795,50.57775115966797,False,0.8636363636363636
an unbelievably fun film just a leading man away from perfection.,0.9983510971069336,453.8188781738281,an unoverievably fun film just a leading man away from perfection.,0.5367181301116943,524.0355224609375,False,0.9545454545454546
"it almost plays like solaris, but with guns and jokes.",0.23117566108703613,275.1527099609375,"it almost plays like solaris, but with guns and funny.",0.9980443716049194,398.26641845703125,True,0.9074074074074074
all i can say is fuhgeddaboutit.,0.00173067522700876,271.2535705566406,all i can say is fuhgauaboutit.,0.0025642295368015766,434.6205749511719,False,0.90625
watching the film is like reading a times portrait of grief that keeps shifting focus to the journalist who wrote it.,0.7147349119186401,137.57025146484375,watching the film is like reading a times portrait of grief that keeps denying focus to the journalist who wrote it.,0.0028333000373095274,173.07272338867188,True,0.9572649572649573
you'll have more fun setting fire to yourself in the parking lot.,0.2920796573162079,39.89476776123047,you'll have something fun setting fire to yourself in the parking lot.,0.9979898929595947,68.49173736572266,True,0.9
a film that is a portrait of grace in an imperfect world.,0.9988242983818054,44.52720642089844,a film that is a recording of grace in an incomplete world.,0.8458983302116394,112.25984191894531,False,0.7457627118644068
"it's a good film -- not a classic, but odd, entertaining and authentic.",0.9997283816337585,75.18910217285156,"it's a good film -- not a famous, but odd, entertaining and authentic.",0.9996495246887207,181.55291748046875,False,0.9154929577464789
"this is the kind of movie that used to be right at home at the saturday matinee, and it still is.",0.990532636642456,23.851430892944336,"this is the kind of movie that used to be wrong at home at the saturday matinee, and it still is.",0.006030152551829815,38.56755828857422,True,0.9484536082474226
"considering the harsh locations and demanding stunts, this must have been a difficult shoot, but the movie proves rough going for the audience as well.",0.0020444802939891815,93.85547637939453,"considering the harsh locations and demanding stunts, this must have been a difficult shoot, but the movie proves and going for the audience as well.",0.9984197616577148,102.60558319091797,True,0.9668874172185431
what jackson has accomplished here is amazing on a technical level.,0.999721109867096,142.77735900878906,what jackson has accomplished here is unbelievable on a technical level.,0.9920035004615784,154.88031005859375,False,0.8472222222222222
"whatever eyre's failings as a dramatist, he deserves credit for bringing audiences into this hard and bitter place.",0.9848150014877319,99.86300659179688,"whatever eyre's failings as a dramatist, he deserved credit for bringing audiences into this hard and miserable place.",0.10439714044332504,114.78103637695312,True,0.9322033898305084
"does what a fine documentary does best: it extends a warm invitation into an unfamiliar world, then illuminates it fully and allows the larger implications of the journey to sink in unobtrusively.",0.9994403719902039,48.97335433959961,"does what a fine documentary does best: it extends a warm invitation into an unfamiliar world, then ill pandess it fully and allows the larger implications of the journey to sink in emptydingrusively.",0.3674793839454651,320.0427551269531,True,0.925
tom green just gives them a bad odor.,0.0010257908143103123,173.7697296142578,tom green just gives them a right odor.,0.9970170259475708,409.0667419433594,True,0.8717948717948718
the second chapter of the harry potter series is even more magical than the first and simply the best family film of the year.,0.9996469020843506,41.06656265258789,the second chapter of the harry potter series is even more magical than the first and simply the worst family film of the year.,0.003206111490726471,52.35740661621094,True,0.9763779527559056
"the film's greatest asset is how much it's not just another connect-the-dots, spy-on-the-run picture.",0.9987799525260925,37.515560150146484,"the film's worst asset is how much it's not just another connect-the-dots, spy-on-the-run picture.",0.0013189474120736122,49.154457092285156,True,0.9405940594059405
nothing more than a mediocre trifle.,0.0009994222782552242,59.735538482666016,nothing more than a medio suitable trifle.,0.0014552167849615216,841.1602783203125,False,0.8095238095238095
"this cuddly sequel to the 1999 hit is a little more visually polished, a little funnier, and a little more madcap.",0.9698343873023987,40.71344757080078,"this cuddly dub to the 1999 hit is a little more visually scored, a little funnier, and a little more madcap.",0.18293805420398712,86.59166717529297,True,0.9035087719298246
"most of the supporting characters in eastwood films are weak, as are most of the subplots.",0.00170434033498168,47.429508209228516,"most of the supporting characters in eastwood films are good, as are most of the subplots.",0.9993653893470764,42.070831298828125,True,0.9555555555555556
"cho's fearless in picking apart human foibles, not afraid to lay her life bare in front of an audience.",0.9994631409645081,63.837974548339844,"you's strict in picking apart human fun products, not afraid to lay her life bare in front of an audience.",0.9843681454658508,158.54495239257812,False,0.8207547169811321
"sunshine state lacks the kind of dynamic that limbo offers, and in some ways is a rather indulgent piece.",0.0030001753475517035,173.39404296875,"sunshine state brings the kind of dynamic that limbo offers, and in some ways is a rather indulgent piece.",0.9862833023071289,189.19032287597656,True,0.9528301886792453
"what could have become just another cautionary fable is allowed to play out as a clever, charming tale -- as pleasantly in its own way as its self-dramatizing characters.",0.9986692667007446,58.40142822265625,"what could have become just another cautionary fable is allowed toplay out as a clever, charming tale -- as pleasantly in its own way as its self-dramatizing characters.",0.9985312223434448,86.90007781982422,False,0.9941176470588236
"the lack of pace kills it, although, in a movie about cancer, this might be apt.",0.0015748400473967195,101.13603210449219,"the lack of this speeds it, although, in a movie about cancer, this might be cases.",0.2930765748023987,180.52984619140625,False,0.8433734939759037
"verbinski substitutes atmosphere for action, tedium for thrills.",0.06167575344443321,250.7945098876953,"verbinski adds atmosphere for action, tedium for thrills.",0.9956865906715393,363.6951904296875,True,0.84375
"at nearly three hours, the whole of safe conduct is less than the sum of its parts.",0.007263891398906708,64.68220520019531,"at nearly three hours, the whole of safe conduct is great than the sum of its parts.",0.7453367114067078,103.75839233398438,True,0.9523809523809523
bears is bad.,0.0022745304740965366,301.7109069824219,bears is well.,0.998562753200531,967.6004638671875,True,0.7142857142857143
"a provocative movie about loss, anger, greed, jealousy, sickness and love.",0.9995256662368774,75.89892578125,"a taboo cartoon about loss, anger, greed, jealousy, sickness and love.",0.06352058798074722,119.02188873291016,True,0.8108108108108107
one hour photo is an intriguing snapshot of one man and his delusions; it's just too bad it doesn't have more flashes of insight.,0.24994036555290222,78.37635040283203,one hour photo is an intriguing snapshot of one man and his delusions; it's just too great it doesn't have more flashes of insight.,0.9977231621742249,117.92216491699219,True,0.9694656488549618
the inherent strength of the material as well as the integrity of the filmmakers gives this coming-of-age story restraint as well as warmth.,0.9997339844703674,43.647891998291016,the inherent strength of the material as well as the integrity of the filmmakers gives this coming-of-age story restraint as well as cold.,0.9994701743125916,57.266273498535156,False,0.9571428571428572
the invincible werner herzog is alive and well and living in la,0.9994840621948242,245.74066162109375,the assassin werner herzog is alive and well and living in la,0.997675359249115,288.02032470703125,False,0.8571428571428572
"(a) rare, beautiful film.",0.9997517466545105,267.5951232910156,"(a) rare, poor film.",0.0020402739755809307,332.2013854980469,True,0.64
a very funny look at how another culture handles the process of courting and marriage.,0.9996844530105591,89.02704620361328,a very short look at how another culture handles the process of courting and marriage.,0.1183219701051712,93.2741928100586,True,0.9418604651162791
... in this incarnation its fizz is infectious.,0.9995430707931519,328.96954345703125,.. in this incarnation its fizz is not.,0.00852792989462614,274.5525817871094,True,0.8085106382978724
"fine acting but there is no sense of connecting the dots, just dots.",0.0032548417802900076,74.03318786621094,"fine art but there is no sense of connecting the dots, just dots.",0.005552928429096937,61.632545471191406,False,0.9411764705882353
"smith's point is simple and obvious -- people's homes are extensions of themselves, and particularly eccentric people have particularly eccentric living spaces -- but his subjects are charmers.",0.9984689354896545,102.95869445800781,"smith's point is simple and obvious -- people's homes are extensions of themselves, and particularly eccentric people have particularly eccentric living spaces -- but his subjects are wrongers.",0.006256597116589546,111.37979888916016,True,0.9740932642487047
a map of the inner rhythms of love and jealousy and sacrifice drawn with a master's steady stroke.,0.9990593791007996,166.76731872558594,a map of the inner rhythms of love and jealousy and sacrificed drawn with a master's slow page.,0.3133606016635895,305.7144470214844,True,0.8877551020408163
the use of cgi and digital ink-and-paint make the thing look really slick.,0.9982450008392334,85.94890594482422,the use of cgi and digital ink-and-paint make the thing look t slick.,0.001647781697101891,159.76138305664062,True,0.9189189189189189
"the low-budget full frontal was one of the year's murkiest, intentionally obscure and self-indulgent pictures, and solaris is its big-budget brother.",0.0017554782098159194,78.3619613647461,"the low-budget full frontal was one of the year's murk best, intentionally unconventional and self-indulgent pictures, and solaris is its big-budget brother.",0.5670674443244934,155.35975646972656,True,0.9044585987261147
"... perhaps the heaviest, most joyless movie ever made about giant dragons taking over the world.",0.008787790313363075,70.38043212890625,".. perhaps the heaviest, most joy incredible movie ever made about giant dragons taking over the world.",0.999518871307373,163.9900665283203,True,0.8932038834951457
an atonal estrogen opera that demonizes feminism while gifting the most sympathetic male of the piece with a nice vomit bath at his wedding.,0.3110552430152893,379.0164794921875,an atonal estrogen opera that demonizes feminism while gifting the most sympathetic male of the piece with a nice straight bath at his wedding.,0.80246502161026,338.1192626953125,True,0.958041958041958
the visuals alone make metropolis worth seeing.,0.9996993541717529,541.415283203125,the visuals alone make metropolis even seeing.,0.08564335107803345,2113.596923828125,True,0.8936170212765957
fairly successful at faking some pretty cool stunts but a complete failure at trying to create some pretty cool characters.,0.002192702842876315,51.48659133911133,fairly successful at faking some pretty cool stunts but a complete successful at trying to create some pretty cool characters.,0.9969727993011475,92.41757202148438,True,0.9206349206349207
"even if you can't pronounce `` gyro'' correctly, you'll appreciate much of vardalos' humor, which transcends ethnic boundaries.",0.9992855191230774,85.94202423095703,"even if you can't pronounce ` ` gyro'' correctly, you'll dislike much of vardalos' humor, which transcends ethnic boundaries.",0.32320624589920044,129.1004180908203,True,0.9291338582677166
"pryor lite, with half the demons, half the daring, much less talent, many fewer laughs.",0.0031269437167793512,249.138671875,"pryor lite, with half the demons, half the daring, much less talent, many. laugh.",0.4419393539428711,325.73095703125,False,0.9195402298850575
once you get into its rhythm... the movie becomes a heady experience.,0.9969690442085266,82.74103546142578,once you get into its rhythm... the movie becomes a overy experience.,0.0013221156550571322,229.91754150390625,True,0.9420289855072463
a compelling portrait of moral emptiness,0.9994757771492004,882.3173217773438,a black portrait of moral emptiness,0.020868705585598946,1593.65966796875,True,0.775
"(a) hollywood sheen bedevils the film from the very beginning... (but) lohman's moist, deeply emotional eyes shine through this bogus veneer...",0.9978840947151184,184.14247131347656,"(a) hollywood sheen bedevils the film from the very beginning... (but) lohman's moist, deeply emotional eyes fail through this bogus veneer...",0.015387460589408875,242.33929443359375,True,0.972027972027972
"sluggishly directed by episodic tv veteran joe zwick, it's a sitcom without the snap-crackle.",0.0027499357238411903,275.8912048339844,"slug productionhly directed by episodic tv veteran joe zwick, it's a grit without the snap-crackle.",0.9428693652153015,523.3942260742188,True,0.8484848484848485
undercover brother doesn't go far enough.,0.010063307359814644,143.7116241455078,undercover brother doesn't go far out.,0.6549156904220581,365.9888000488281,True,0.9024390243902439
"emerges as something rare, an issue movie that's so honest and keenly observed that it doesn't feel like one.",0.9993914365768433,91.88899230957031,"emerges as something lost, an issue movie that's so honest and criticallyly said that it doesn't feel like one.",0.4326923191547394,178.89747619628906,True,0.8288288288288288
haneke challenges us to confront the reality of sexual aberration.,0.9917445778846741,98.99070739746094,hanike leaves us to confront the reality of sexual aberration.,0.42110857367515564,117.78773498535156,True,0.8939393939393939
"i didn't laugh at the ongoing efforts of cube, and his skinny buddy mike epps, to make like laurel and hardy'n the hood.",0.44114241003990173,270.64361572265625,"i didn't groan at the ongoing efforts of cube, and his skinny buddy mike epps, to make like laurel and hardy' n the hood.",0.998176097869873,343.3388671875,True,0.9504132231404958
is this progress?,0.8827203512191772,357.62744140625,is this progress nothing,0.0015647807158529758,4262.35595703125,True,0.6666666666666667
mark me down as a non-believer in werewolf films that are not serious and rely on stupidity as a substitute for humor.,0.006382194347679615,63.382606506347656,mark me down as a non-believer in werewolf films that are not serious and rely on this as a foundation for humor.,0.6421643495559692,67.29375457763672,True,0.864406779661017
"from the big giant titles of the opening credits to elmer bernstein's perfectly melodic score, haynes gets just about everything right.",0.9996044039726257,208.73208618164062,"from the big liner titles of the opening credits to elmer bernstein's very flat score, over gets just about everything right.",0.6466405987739563,354.0650329589844,False,0.8444444444444444
mckay deflates his piece of puffery with a sour cliche and heavy doses of mean-spiritedness,0.0011632018722593784,96.99110412597656,and def delivers his piece of puffery with a sweet cliche and heavy doses of mean-spiritedness,0.6021047830581665,120.65974426269531,True,0.8404255319148937
what happened with pluto nash?,0.005028459709137678,741.3790283203125,what happened with hector nash?,0.017180750146508217,649.6558837890625,False,0.8709677419354839
"much of the way, though, this is a refreshingly novel ride.",0.9996715784072876,49.197532653808594,"much of the way, though, this is a bly dead ride.",0.004747375845909119,131.3763427734375,True,0.7457627118644068
fisher has bared his soul and confronted his own shortcomings here in a way... that feels very human and very true to life.,0.9995595812797546,80.30085754394531,fisher has sacrificed his soul and confronted his own shortcomings here in a way... that feels very human and very true to life.,0.9993187189102173,105.55816650390625,False,0.953125
ihops don't pile on this much syrup.,0.0297896359115839,310.3949279785156,ihops don't rely on this much syrup so,0.28758567571640015,368.5373840332031,False,0.8421052631578947
"so young, so smart, such talent, such a wise ***.",0.999708354473114,158.90567016601562,"so young, so smart, such talent, such a dumb * * *.",0.3529304265975952,225.1280517578125,True,0.8823529411764706
"even the imaginative gore can't hide the musty scent of todd farmer's screenplay, which is a simple retread of the 1979 alien, with a plucky heroine battling a monster loose in a spaceship.",0.04687986895442009,168.4426727294922,"even the imaginative gore can't hide the musty scent of todd farmer's screenplay, which is a simple classictread of the 1979 alien, with a plucky heroine battling a monster loose in a spaceship.",0.8700626492500305,322.006103515625,True,0.9639175257731959
"it's getting harder and harder to ignore the fact that hollywood isn't laughing with us, folks.",0.016360683366656303,26.542631149291992,"it's getting harder and harder to forget the fact that hollywood isn't and with us, folks.",0.5515081882476807,64.2073974609375,True,0.8842105263157894
"(schweiger is) talented and terribly charismatic, qualities essential to both movie stars and social anarchists.",0.9994420409202576,342.3682556152344,"(schweiger is) talented and badly charismatic, qualities essential to both movie stars and social anarchists.",0.899551272392273,450.3967590332031,False,0.9464285714285714
"as hugh grant says repeatedly throughout the movie, ` lovely!",0.9991734623908997,1917.4693603515625,"as hugh grant says repeatedly throughout the movie, ...!",0.8781095743179321,891.7022705078125,False,0.8688524590163934
"one minute, you think you're watching a serious actioner; the next, it's as though clips from the pink panther strikes again and/or sailor moon have been spliced in.",0.005712525453418493,150.47015380859375,"one minute, you think you're behold a serious actioner; the next, it's as though highlights from the pink panther strikes again and / or sailor moon have been splinkd in.",0.5817707180976868,380.0079650878906,True,0.8941176470588236
"as expected, sayles'smart wordplay and clever plot contrivances are as sharp as ever, though they may be overshadowed by some strong performances.",0.9993971586227417,128.47537231445312,"as expected, sayles'smart wordplay and clever plot contrivances are as through as ever, though they may be overshadowed by some strong performances.",0.9988358616828918,186.0699005126953,False,0.9594594594594594
resourceful and ingenious entertainment.,0.9997356534004211,362.2152404785156,resourceful and ing decorous entertainment.,0.9994235038757324,2443.1396484375,False,0.8837209302325582
imagine a really bad community theater production of west side story without the songs.,0.0008122803410515189,423.2569274902344,on a really best community theater production of west side story without the songs.,0.9872595071792603,609.0718994140625,True,0.896551724137931
"the furious coherence that (deniro) brings to this part only underscores the fuzzy sentimentality of the movie itself, which feels, as it plods toward the end, less like a movie than like the filmed reading of a script in need of polishing.",0.0020621311850845814,66.1497573852539,"the furious coherence that (deniro) brings to this part only underscores the strong timelessity it the movie itself, which feels, as it plods toward the end, greater like a movie than like the filmed reading of a script in need of polishing.",0.5264913439750671,132.10472106933594,True,0.9128630705394191
there isn't a weak or careless performance amongst them.,0.9944578409194946,182.05416870117188,there isn't a good or careless performance amongst them.,0.0010703196749091148,150.07003784179688,True,0.9285714285714286
"a 93-minute condensation of a 26-episode tv series, with all of the pitfalls of such you'd expect.",0.0014747697860002518,107.77525329589844,"a 93-minute pan premieration of a 26-episode tv series, with all of the pit standards of such you'd expect.",0.9132301807403564,188.99285888671875,True,0.8411214953271028
one of the greatest romantic comedies of the past decade.,0.9996441602706909,11.808117866516113,one of the greatest romantic tragedy of the past decade?,0.15663036704063416,55.391265869140625,True,0.8596491228070176
"cute, funny, heartwarming digitally animated feature film with plenty of slapstick humor for the kids, lots of in-jokes for the adults and heart enough for everyone.",0.9997883439064026,43.357017517089844,"cute, funny, heartwar. digitally animated feature film with plenty of slapstick humor for the kids, lots of in-jokes for the adults and heart enough for everyone.",0.9997448325157166,78.0418701171875,False,0.9757575757575757
"this may be the dumbest, sketchiest movie on record about an aspiring writer's coming-of-age.",0.001830943627282977,42.54084396362305,"this may be the bestest, sketchiest movie on record about an aspiring writer's coming-of-age.",0.9988152980804443,49.883602142333984,True,0.956989247311828
"a silly, self-indulgent film about a silly, self-indulgent filmmaker.",0.0048349155113101006,13.458178520202637,"a clever, self-indulgent film about a silly, self-indulgent filmmaker.",0.9994747042655945,22.127161026000977,True,0.9142857142857143
"here, adrian lyne comes as close to profundity as he is likely to get.",0.1698726862668991,64.07774353027344,"here, adrian lyne comes as close. profundity as he is likely to get.",0.9862101674079895,184.41065979003906,True,0.9571428571428572
it's almost impossible not to be moved by the movie's depiction of sacrifice and its stirring epilogue in post-soviet russia.,0.9987491369247437,47.792442321777344,it's almost impossible not to be moved by the movie's picture of death and its stirring disaster in post-soviet russia.,0.259391725063324,74.82122802734375,True,0.832
"but like most rabbits, it seems to lack substance.",0.0010485282400622964,91.3310317993164,"but like most rabbits, it seems to lack substances.",0.008772795088589191,161.27252197265625,False,0.9803921568627451
