original_text,original_score,original_perplexity,counterfactual_text,counterfactual_score,counterfactual_perplexity,found_flip,levenshtein_similarity_score
"what came into force after the new constitution was herald? [SEP] as of that day, the new constitution heralding the second republic came into force.",0.005043478216975927,103.85531616210938,"what came into force after the new constitution was heraldo [SEP] as of that day, the new constitution heralding the second republic came into force.",0.015515320003032684,111.23802947998047,False,0.9932885906040269
"what is the first major city in the stream of the rhine? [SEP] the most important tributaries in this area are the ill below of strasbourg, the neckar in mannheim and the main across from mainz.",0.5670859813690186,119.5368423461914,"what is the first major city in the stream of the rhine? [SEP] the most important tributaries in this area are the ill below of frankfurt, the neckar in mannheim and the main across from mainz.",0.47418731451034546,119.08353424072266,True,0.9690721649484536
what is the minimum required if you want to teach in canada? [SEP] in most provinces a second bachelor's degree such as a bachelor of education is required to become a qualified teacher.,0.9625449180603027,36.18675231933594,what is the qualification required if you want to teach in canada? [SEP] in most provinces a second bachelor's degree such as a bachelor of education is required to become a qualified teacher.,0.08770406991243362,37.257041931152344,True,0.9427083333333334
"how was temüjin kept imprisoned by the tayichi'ud? [SEP] the tayichi'ud enslaved temüjin (reportedly with a cangue, a sort of portable stocks), but with the help of a sympathetic guard, the father of chilaun (who later became a general of genghis khan), he was able to escape from the ger (yurt) in the middle of the night by hiding in a river crevice.[citation needed]",0.013612106442451477,76.90216827392578,"how was temujin kept incarcerated by the tayichi' ud? [SEP] the tayichi' ud enslaved temujin (reportedly with a cangue, a sort of portable stocks), but with the help of a sympathetic guard, the father of chilaun (who later became a general of genghis khan), he was able to escape from the ger (yurt) in the middle of the night by hiding in a river crevice. [ citation needed ]",0.026197006925940514,76.4776840209961,False,0.9601063829787234
"what did herr gott, dich loben wir become known as? [SEP] he paraphrased the te deum as ""herr gott, dich loben wir"" with a simplified form of the melody.",0.9964224696159363,89.607421875,"what did herr gott, dich loben wir becoming known as? [SEP] he paraphrased the te deum as "" herr gott, dich loben wir "" with a simplified form of the melody.",0.9955965876579285,106.19049835205078,False,0.9681528662420382
"what year did the the case go before the supreme court? [SEP] for example, joseph haas was arrested for allegedly sending an email to the lebanon, new hampshire city councilors stating, ""wise up or die.""",0.9978723526000977,91.71280670166016,"what year did the the case go before the supreme court? [SEP] for example, john haas was arrested for allegedly sending an email to the lebanon, new hampshire city councilors stating, "" wise up or die. """,0.9978702068328857,99.0037841796875,False,0.9704433497536946
"what does umc stand for? [SEP] founded in 1968 by the union of the methodist church (usa) and the evangelical united brethren church, the umc traces its roots back to the revival movement of john and charles wesley in england as well as the great awakening in the united states.",0.9770978689193726,152.95098876953125,"what does umc stand for? [SEP] founded in 1964 by the union of the methodist church (usa) and the evangelical united brethren church, the umc traces its roots back to the revival movement of john and charles wesley in england as well as the great awakening in the united states.",0.9789381623268127,153.9035186767578,False,0.9964028776978417
what is the name of the professional skateboarder that lives in southern california? [SEP] southern california is also important to the world of yachting.,0.997913658618927,37.93923568725586,what is the name of the world skateboarder that lives in southern california? [SEP] southern california is also important to the world of yachting.,0.9974855184555054,38.76749801635742,False,0.9285714285714286
where did temüjin hide during his escape from the tayichi'ud? [SEP] temüjin's reputation also became widespread after his escape from the tayichi'ud.,0.9979808926582336,87.08287811279297,where did temujin get during his escape from the tayichi' ud? [SEP] temujin's reputation also became widespread after his escape from the tayichi' ud.,0.9753376245498657,74.66448211669922,False,0.9466666666666667
"what are the most active parts of ctenophora? [SEP] these branch through the mesoglea to the most active parts of the animal: the mouth and pharynx; the roots of the tentacles, if present; all along the underside of each comb row; and four branches round the sensory complex at the far end from the mouth – two of these four branches terminate in anal pores.",0.013575946912169456,72.36933135986328,"what are the most active stages of ctenophora? [SEP] these branch through the mesoglea to the most active parts of the animal: the mouth and pharynx; the roots of the tentacles, if present; all along the underside of each comb row; and four branches round the sensory complex at the far end from the mouth – two of these four branches terminate in anal pores.",0.9578486084938049,73.7383041381836,True,0.9888579387186629
"who decides the fate of protesters most of the time? [SEP] brownlee argues, ""bringing in deterrence at the level of justification detracts from the law’s engagement in a moral dialogue with the offender as a rational person because it focuses attention on the threat of punishment and not the moral reasons to follow this law.""",0.9865356087684631,117.82795715332031,"who decides the fate of protesters most of the time? [SEP] brownlee argues, "" bringing in deterrence at the level of justification detracts from the law ’ s engagement in a moral dialogue with the punishment as a rational person because it focuses attention on the threat of punishment and not the moral reasons to follow this law. """,0.9825586080551147,143.95277404785156,False,0.960960960960961
"what act sets forth the functions of the scottish parliament? [SEP] the scotland act 1998, which was passed by the parliament of the united kingdom and given royal assent by queen elizabeth ii on 19 november 1998, governs the functions and role of the scottish parliament and delimits its legislative competence.",0.0036305736284703016,54.95164108276367,"what act sets forth the functions of the swedish parliament? [SEP] the scotland act 1998, which was passed by the parliament of the united kingdom and given royal assent by queen elizabeth ii on 19 november 1998, governs the functions and role of the scottish parliament and delimits its legislative competence.",0.9917631149291992,64.73165893554688,True,0.9871794871794872
what is the name for a response of the immune system that damages the body's native tissues? [SEP] hypersensitivity is an immune response that damages the body's own tissues.,0.007925821468234062,30.913923263549805,what is the name for a response of the immune system that damages the body's native regions? [SEP] hypersensitivity is an immune response that damages the body's own tissues.,0.022591477259993553,39.78180694580078,False,0.9655172413793104
when did the warsaw uprising begin? [SEP] the polish government-in-exile in london gave orders to the underground home army (ak) to try to seize control of warsaw from the germans before the red army arrived.,0.9978017210960388,128.3485565185547,he did the warsaw uprising begin? [SEP] the polish government-in-exile in london gave orders to the underground home army (ak) to try to seize control of warsaw from the germans before the red army arrived.,0.9967124462127686,167.61566162109375,False,0.9903846153846154
the tower district is centered around which historic theatre? [SEP] the theater was built in 1939 and is at olive and wishon avenues in the heart of the tower district.,0.939918577671051,161.0458984375,the tower district is centered around which the theatre? [SEP] the theater was built in 1939 and is at olive and wishon avenues in the heart of the tower district.,0.004844807554036379,138.2556915283203,True,0.9583333333333334
"what is the english translation of het scheur? [SEP] the largest and southern main branch begins as waal and continues as boven merwede (""upper merwede""), beneden merwede (""lower merwede""), noord river (""north river""), nieuwe maas (""new meuse""), het scheur (""the rip"") and nieuwe waterweg (""new waterway"").",0.00329668284393847,86.6350326538086,"what is the italian translation of het scheur? [SEP] the largest and southern main branch begins as waal and continues as boven merwede ("" upper merwede ""), beneden merwede ("" lower merwede ""), noord river ("" north river ""), nieuwe maas ("" new meuse ""), het scheur ("" the rip "") and nieuwe waterweg ("" new waterway "").",0.9970766305923462,78.74657440185547,True,0.9465408805031447
"what is one of the largest music schools in europe? [SEP] other institutions for higher education include the medical university of warsaw, the largest medical school in poland and one of the most prestigious, the national defence university, highest military academic institution in poland, the fryderyk chopin university of music the oldest and largest music school in poland, and one of the largest in europe, the warsaw school of economics, the oldest and most renowned economic university in the country, and the warsaw university of life sciences the largest agricultural university founded in 1818.",0.0031919174361974,41.84943771362305,"what is one of the largest music schools in germany? [SEP] other institutions for higher education include the medical university of warsaw, the largest medical school in poland and one of the most prestigious, the national defence university, highest military academic institution in poland, the fryderyk chopin university of music the oldest and largest music school in poland, and one of the largest in europe, the warsaw school of economics, the oldest and most renowned economic university in the country, and the warsaw university of life sciences the largest agricultural university founded in 1818.",0.9974803328514099,41.674320220947266,True,0.9900990099009901
"what percentage of farmland grows wheat? [SEP] more than 50% of this area is sown for wheat, 33% for barley and 7% for oats.",0.01049793977290392,29.89805793762207,"what percentage of this grows wheat? [SEP] more than 50 % of this area is sown for wheat, 33 % for barley and 7 % for oats.",0.005980607587844133,41.22987747192383,False,0.9112903225806451
"what did he light at his laboratories to demonstrate his wireless power transmission? [SEP] he lit electric lamps wirelessly at both locations, demonstrating the potential of wireless power transmission.",0.006910176482051611,102.8800277709961,"what did he say at his laboratories to demonstrate his wireless power transmission? [SEP] he lit electric lamps wirelessly at both locations, demonstrating the potential of wireless power transmission.",0.8279072642326355,110.0978775024414,True,0.9753694581280788
where did the exposition take place? [SEP] this world's fair devoted a building to electrical exhibits.,0.9947182536125183,254.31732177734375,where did the there take place? [SEP] this world's fair devoted a building to electrical exhibits.,0.4690423309803009,386.06878662109375,True,0.9029126213592233
"what is a ligand on the cell surface that is upregulated after helper t cell activation? [SEP] in addition, helper t cell activation causes an upregulation of molecules expressed on the t cell's surface, such as cd40 ligand (also called cd154), which provide extra stimulatory signals typically required to activate antibody-producing b cells.",0.004827325232326984,76.91658020019531,"what is a ligand on the cell surface that is upregulated after helper t cell activation? [SEP] in addition, helper t cell activation causes an upregulation of molecules expressed on the t cell's surface, such as cd40α (also called cd154), which provide extra stimulatory signals typically required to activate antibody-producing b cells.",0.029564203694462776,77.28551483154297,False,0.9795918367346939
"when did warsaw become the center of the congress poland? [SEP] warsaw remained the capital of the polish–lithuanian commonwealth until 1796, when it was annexed by the kingdom of prussia to become the capital of the province of south prussia.",0.9909580945968628,67.08162689208984,"when did warsaw become the rest of the congress poland? [SEP] warsaw remained the capital of the polish – lithuanian commonwealth until 1796, when it was annexed by the kingdom of prussia to become the capital of the province of south prussia.",0.14378222823143005,98.97570037841797,True,0.9753086419753086
"which country does the rhine encounter it's main tributaries? [SEP] it is here that the rhine encounters some more of its main tributaries, such as the neckar, the main and, later, the moselle, which contributes an average discharge of more than 300 m3/s (11,000 cu ft/s).",0.005984549410641193,55.0656623840332,"which town does the rhine encounter it's main tributaries? [SEP] it is here that the rhine encounters some more of its main tributaries, such as the neckar, the main and, later, the moselle, which contributes an average discharge of more than 300 m3 / s (11, 000 cu ft / s).",0.05293092876672745,67.22251892089844,False,0.9635036496350365
"if two thirds of the rhine flows through waal, where does the other third flow through? [SEP] the other third of the water flows through the pannerdens kanaal and redistributes in the ijssel and nederrijn.",0.011788582429289818,143.36741638183594,"if two thirds of the rhine flows through saal, where does the other third flow through? [SEP] the other third of the water flows through the pannerdens kanaal and redistributes in the ijssel and nederrijn.",0.025370655581355095,134.4108123779297,False,0.9951219512195122
"what paved the way for the augsburg confession? [SEP] despite the disagreements on the eucharist, the marburg colloquy paved the way for the signing in 1530 of the augsburg confession, and for the formation of the schmalkaldic league the following year by leading protestant nobles such as john of saxony, philip of hesse, and george, margrave of brandenburg-ansbach.",0.003213298274204135,98.310791015625,"what ended the way for the augsburg confession? [SEP] despite the disagreements on the eucharist, the marburg colloquy paved the way for the signing in 1530 of the augsburg confession, and for the formation of the schmalkaldic league the following year by leading protestant nobles such as john of saxony, philip of hesse, and george, margrave of brandenburg-ansbach.",0.061216603964567184,112.85456848144531,False,0.9918256130790191
"what signer of the articles of confederation was descended from huguenots? [SEP] paul revere was descended from huguenot refugees, as was henry laurens, who signed the articles of confederation for south carolina; jack jouett, who made the ride from cuckoo tavern to warn thomas jefferson and others that tarleton and his men were on their way to arrest him for crimes against the king; francis marion, and a number of other leaders of the american revolution and later statesmen.",0.0038211459759622812,71.4285888671875,"what signer of the articles of confederation was descended from huguenots? [sep]. revere was descended from huguenot refugees, as was henry laurens, who signed the articles of confederation for south carolina; jack jouett, who made the ride from cuckoo tavern to warn thomas jefferson and others that tarleton and his men were on their way to arrest him for crimes against the king; francis marion, and a number of other leaders of the american revolution and later statesmen.",0.6896792054176331,78.60974884033203,True,0.9833333333333333
what language did tesla study while in school? [SEP] tesla was the fourth of five children.,0.9977001547813416,81.8164291381836,what language did ever study while in school? [SEP] tesla was the fourth of five children.,0.9773264527320862,157.08761596679688,False,0.9560439560439561
"in what year did the university first see a drop in applications? [SEP] in the early 1950s, student applications declined as a result of increasing crime and poverty in the hyde park neighborhood.",0.016542358323931694,64.0166015625,"in what year did the university first see a drop in applications? [SEP] in the early regional, student applications declined as a result of increasing crime and poverty in the hyde park neighborhood.",0.9978971481323242,112.30245208740234,True,0.9597989949748744
"what causes the symptoms of inflammation? [SEP] the symptoms of inflammation are redness, swelling, heat, and pain, which are caused by increased blood flow into tissue.",0.004123514052480459,25.82174301147461,"what causes the symptoms of yellow? [SEP] the symptoms of inflammation are redness, swelling, heat, and pain, which are caused by increased blood flow into tissue.",0.2438444048166275,37.32835006713867,False,0.9408284023668639
"in which case did the court state that austria was not allowed to hold places in austrian schools exclusively for austrian students? [SEP] in commission v austria the court held that austria was not entitled to restrict places in austrian universities to austrian students to avoid ""structural, staffing and financial problems"" if (mainly german) foreign students applied for places because there was little evidence of an actual problem.",0.006081446539610624,51.802181243896484,"in which case did the court state that austria was not allowed to hold places in austrian schools exclusively for austrian students? [sep]. commission v austria the court held that austria was not entitled to restrict places in austrian universities to austrian students to avoid "" structural, staffing and financial problems "" if (mainly german) foreign students applied for places because there was little evidence of an actual problem.",0.6091288924217224,59.415470123291016,True,0.9817351598173516
"what type of flower is sought on midsummer's eve? [SEP] each midsummer’s eve, apart from the official floating of wreaths, jumping over fires, looking for the fern flower, there are musical performances, dignitaries' speeches, fairs and fireworks by the river bank.",0.005368800833821297,98.69678497314453,"what type of letter is sought on midsummer's eve? [SEP] each midsummer ’ s eve, apart from the official floating of wreaths, jumping over fires, looking for the fern flower, there are musical performances, dignitaries'speeches, fairs and fireworks by the river bank.",0.9979249238967896,147.4387664794922,True,0.9736842105263158
"what are those from jacksonville sometimes called? [SEP] people from jacksonville may be called ""jacksonvillians"" or ""jaxsons"" (also spelled ""jaxons"").",0.006760059390217066,36.64324188232422,"what are those from jacksonville occasionally called? [SEP] people from jacksonville may be called "" jacksonvillians "" or "" jaxsons "" (also spelled "" jaxons "").",0.017097879201173782,44.127845764160156,False,0.89375
when was amnesty granted to those responsible for the massacre? [SEP] the exact number of fatalities throughout the country is not known.,0.9977954626083374,50.37034225463867,when was amnesty granted to those responsible for the massacre. [SEP] the exact number of fatalities throughout the country is not known.,0.9852708578109741,57.217960357666016,False,0.9927007299270073
a function problem is an example of what? [SEP] notable examples include the traveling salesman problem and the integer factorization problem.,0.43207597732543945,115.62139129638672,a function i is an example of what? [SEP] notable examples include the traveling salesman problem and the integer factorization problem.,0.995740532875061,130.091552734375,True,0.9507042253521126
in what year did tesla's family move to gospic? [SEP] tesla was the fourth of five children.,0.99797123670578,67.5798110961914,in what year did tesla's family move to gospic) [SEP] tesla was the fourth of five children.,0.9934184551239014,93.0455093383789,False,0.9891304347826086
"what did carolina face in the opening drive that they had not faced the entire postseason? [SEP] a pair of carries by c. j. anderson moved the ball up 20 yards to the panthers 14-yard line, but carolina's defense dug in over the next three plays.",0.8262283205986023,73.35670471191406,"what did carolina handle in the opening drive that they had not faced the entire postseason? [SEP] a pair of carries by c. j. anderson moved the ball up 20 yards to the panthers 14-yard line, but carolina's defense dug in over the next three plays.",0.07869947701692581,78.4210205078125,True,0.9838709677419355
"who was the mayor of san francisco during super bowl 50? [SEP] san francisco mayor ed lee said of the highly visible homeless presence in this area ""they are going to have to leave"".",0.003724722657352686,118.43440246582031,"who was the architect of san francisco during super bowl 50? [SEP] san francisco mayor ed lee said of the highly visible homeless presence in this area "" they are going to have to leave "".",0.9959965944290161,151.00997924804688,True,0.9414893617021276
"what day of the week did shark tank debut on? [SEP] shark tank (based on the dragon's den reality format) also became a midseason sleeper hit on sundays in the spring of 2010; the following season, it became the tentpole of the network's friday night schedule, gradually helping make abc a strong competitor (after being paired with 20/20 and beginning with the 2012–13 season, the tim allen sitcom last man standing) against cbs' long-dominant drama/reality lineup on that night for the first time since the ""tgif"" lineup ended in 2000.",0.014821404591202736,102.09464263916016,"what noon of the week did shark tank debut on? [SEP] shark tank (based on the dragon's den reality format) also became a midseason sleeper hit on sundays in the spring of 2010; the following season, it became the tentpole of the network's friday night schedule, gradually helping make abc a strong competitor (after being paired with 20 / 20 and beginning with the 2012 – 13 season, the tim allen sitcom last man standing) against cbs' long-dominant drama / reality lineup on that night for the first time since the "" tgif "" lineup ended in 2000.",0.021086595952510834,128.08743286132812,False,0.978021978021978
"how much of jacksonville is made up of water? [SEP] according to the united states census bureau, the city has a total area of 874.3 square miles (2,264 km2), making jacksonville the largest city in land area in the contiguous united states; of this, 86.66% (757.7 sq mi or 1,962 km2) is land and; 13.34% (116.7 sq mi or 302 km2) is water.",0.004204712808132172,22.793771743774414,"how much of jacksonville is made up of groundwater? [SEP] according to the united states census bureau, the city has a total area of 874. 3 square miles (2, 264 km2), making jacksonville the largest city in land area in the contiguous united states; of this, 86. 66 % (757. 7 sq mi or 1, 962 km2) is land and; 13. 34 % (116. 7 sq mi or 302 km2) is water.",0.9973427653312683,34.676979064941406,True,0.9576271186440678
what museum preserves the memory of the crime? [SEP] a fine tribute to the fall of warsaw and history of poland can be found in the warsaw uprising museum and in the katyń museum which preserves the memory of the crime.,0.0025635247584432364,97.81131744384766,what museum preserves the memory of the crime? [SEP] a fine tribute to the fall of warsaw and history of poland can be found in the warsaw uprising museum and in the katyn palace which preserves the memory of the crime.,0.0028740388806909323,109.99272155761719,False,0.9680365296803652
"when people take on debt, it leads potentially to what? [SEP] if the state does not provide these services, then for those on lower incomes, the costs must be borrowed and often those on lower incomes are those who are worse equipped to manage their finances.",0.9956244826316833,49.69414520263672,"when people take on debt, it leads potentially to what? [SEP] if the state does not provide these services, then for those on lower incomes, the costs must be spent and often those on lower incomes are those who are worse equipped to manage their finances.",0.9958162903785706,47.12844467163086,False,0.9691119691119691
"stretched rocks that pinch into lenses are known by what word? [SEP] these stretched rocks can also pinch into lenses, known as boudins, after the french word for ""sausage"", because of their visual similarity.",0.0031965840607881546,108.9700927734375,"stretched rocks that pinch into sharp are known by what word? [SEP] these stretched rocks can also pinch into lenses, known as boudins, after the french word for "" sausage "", because of their visual similarity.",0.004271123558282852,191.7440185546875,False,0.9619047619047619
"who was influential in promoting the use of chemical compounds as medicines? [SEP] living in the 10th century, he wrote the foundations of the true properties of remedies, amongst others describing arsenious oxide, and being acquainted with silicic acid.",0.9967995882034302,91.62979125976562,"who was influential in promoting the use of chemical compounds as medicines? [SEP] who in the 10th century, he wrote the foundations of the true properties of remedies, amongst others describing arsenious oxide, and being acquainted with silicic acid.",0.9726061224937439,99.22832489013672,False,0.9763779527559056
