original_text,original_score,original_perplexity,counterfactual_text,counterfactual_score,counterfactual_perplexity,found_flip,levenshtein_similarity_score
"when did tesla move to new york city? [SEP] in 1882, tesla began working for the continental edison company in france, designing and making improvements to electrical equipment.",0.9930294156074524,74.43104553222656,"when did tesla move to new york city? [SEP] in 1882, and began working for the continental edison company in france, designing and making improvements to electrical equipment.",0.1012701764702797,94.52161407470703,True,0.9717514124293786
"what is the population of the second largest city in california? [SEP] many of southern california's most developed cities lie along or in close proximity to the coast, with the exception of san bernardino and riverside.",0.9977604150772095,37.93792724609375,"what is the demographics of the second largest city in california? [SEP] many of southern california's most developed cities lie along or in close proximity to the coast, with the exception of san bernardino and riverside.",0.9968528151512146,40.41465759277344,False,0.954954954954955
what has a lama determined to do? [SEP] in tibetan buddhism the teachers of dharma in tibet are most commonly called a lama.,0.9934656023979187,74.06613159179688,what has a there determined to do? [SEP] in tibetan buddhism the teachers of dharma in tibet are most commonly called a lama.,0.9607365727424622,98.35233306884766,False,0.96
"what was the idealized value of imperialism? [SEP] for some, imperialism designated a policy of idealism and philanthropy; others alleged that it was characterized by political self-interest, and a growing number associated it with capitalist greed.",0.09922292083501816,67.50525665283203,"what was the idealized value of imperialism? [SEP] for some, imperialism designated a policy of benevolentism and philanthropy; others alleged that it was characterized by political self-interest, and a growing number associated it with capitalist greed.",0.8991612792015076,73.5965576171875,True,0.9685039370078741
what kind of water body is rumored to be obscuring genghis khan's burial site? [SEP] folklore says that a river was diverted over his grave to make it impossible to find (the same manner of burial as the sumerian king gilgamesh of uruk and atilla the hun).,0.14556831121444702,168.7060089111328,what kind of water body is rumored to be obscuring genstans khan's burial site? [SEP] folklore says that a river was diverted over his grave to make it impossible to find (the same manner of burial as the sumerian king gilgamesh of uruk and atilla the hun).,0.134563609957695,218.0056610107422,False,0.9844357976653697
"who won the ekstraklasa championship in 2000? [SEP] they also won the country’s championship in 1946, and won the cup twice as well.",0.997672975063324,137.60345458984375,"who won the ekstraklasa championship in which? [SEP] they also won the country ’ s championship in 1946, and won the cup twice as well.",0.9955001473426819,175.64410400390625,False,0.9481481481481482
"what were the saxon palace and brühl palace in prewar warsaw? [SEP] warsaw’s municipal government authorities have decided to rebuild the saxon palace and the brühl palace, the most distinctive buildings in prewar warsaw.",0.007870668545365334,88.0564193725586,"what were the saxon palace and bruhl palace in prewar krakow? [SEP] warsaw ’ s municipal government authorities have decided to rebuild the saxon palace and the bruhl palace, the most distinctive buildings in prewar warsaw.",0.07906493544578552,127.42999267578125,False,0.9596412556053812
"what thesis specifies that a polynomial relationship exists within time complexities in a computational model? [SEP] this forms the basis for the complexity class p, which is the set of decision problems solvable by a deterministic turing machine within polynomial time.",0.9972645044326782,78.83189392089844,"what thesis suggests that a polynomial relationship exists within time complexities in a computational model? [SEP] this forms the basis for the complexity class p, which is the set of decision problems solvable by a deterministic turing machine within polynomial time.",0.9971886277198792,75.03746032714844,False,0.9740740740740741
"what happened to his lab? [SEP] his lab was torn down in 1904, and its contents were sold two years later to satisfy a debt.",0.005169081501662731,59.594032287597656,"what happened to his lab? [SEP] his farm was torn down in 1904, and its contents were sold two years later to satisfy a debt.",0.9884739518165588,71.55509948730469,True,0.976
"how does the level of tuition in german private schools compare to private schools in other western european countries? [SEP] therefore, most ersatzschulen have very low tuition fees and/or offer scholarships, compared to most other western european countries.",0.015829985961318016,32.2192268371582,"how does the level of tuition in german private schools average to private schools in other western european countries? [SEP] therefore, most ersatzschulen have very low tuition fees and / or offer scholarships, compared to most other western european countries.",0.8542870879173279,43.08305358886719,True,0.9732824427480916
for about how long would the extended lm allow a surface stay on the moon? [SEP] the lunar module (lm) was designed to descend from lunar orbit to land two astronauts on the moon and take them back to orbit to rendezvous with the command module.,0.9977655410766602,58.79857635498047,for about how long would the extended lm allow a surface stay on the moon? [SEP] the lunar module (lm) was designed to descend from lunar orbit to land two years on the moon and take them back to orbit to rendezvous with the command module.,0.7760974764823914,66.53722381591797,False,0.9673469387755103
what was the population of the dutch republic before this emigration? [SEP] this was a huge influx as the entire population of the dutch republic amounted to ca.,0.1185852661728859,51.436100006103516,what was the population of the dutch republic before this emigration? [SEP] this was a huge influx as the entire population of the dutch republic brought to ca.,0.9080924987792969,60.63875198364258,True,0.9627329192546584
"what eventually happened to the block i program after the incident? [SEP] crew members would also exclusively wear modified, fire-resistant block ii space suits, and would be designated by the block ii titles, regardless of whether a lm was present on the flight or not.",0.9963453412055969,128.20236206054688,"what eventually happened to the block i policy after the incident? [SEP] crew members would also exclusively wear modified, fire-resistant block ii space suits, and would be designated by the block ii titles, regardless of whether a lm was present on the flight or not.",0.9497399926185608,135.3926239013672,False,0.9814814814814815
what causes rock extension? [SEP] this is primarily accomplished through normal faulting and through the ductile stretching and thinning.,0.3066827952861786,242.36309814453125,what occurs rock extension? [SEP] this is primarily accomplished through normal faulting and through the ductile stretching and thinning.,0.9250637888908386,339.1062316894531,True,0.9708029197080292
"what lead to the uk to subscribe to the agreement on social policy? [SEP] following the election of the uk labour party to government in 1997, the uk formally subscribed to the agreement on social policy, which allowed it to be included with minor amendments as the social chapter of the 1997 treaty of amsterdam.",0.0047433041036129,71.65370178222656,"what lead to the uk to subscribe to the agreement on social policy? [SEP] following the election of the uk labour party to government in 1997, the uk formally sub committedd to the agreement on social policy, which allowed it to be included with minor amendments as the social chapter of the 1997 treaty of amsterdam.",0.0068419137969613075,96.57998657226562,False,0.9779179810725552
"who was the chairman of the house committee on energy and commerce? [SEP] sherwood boehlert, chairman of the house science committee, said this was a ""misguided and illegitimate investigation"" apparently aimed at intimidating scientists, and at his request the u.s. national academy of sciences arranged for its national research council to set up a special investigation.",0.017824947834014893,47.6314811706543,"who was the chairman of the house committee on heating and commerce? [SEP] sherwood boehlert, chairman of the house science committee, said this was a "" misguided and illegitimate investigation "" apparently aimed at intimidating scientists, and at his request the u. s. national academy of sciences arranged for its national research council to set up a special investigation.",0.015278896316885948,67.03951263427734,False,0.976063829787234
article 34 meant states could be responsible for what? [SEP] it also means states can be responsible for private actors.,0.005043248645961285,114.68726348876953,was 34 meant states could be responsible for what? [SEP] it also means states can be responsible for private actors.,0.9551592469215393,145.1797332763672,True,0.9416666666666667
where is the border of swiss and austria? [SEP] it is located at approximately 47°39′n 9°19′e﻿ / ﻿47.650°n 9.317°e﻿ / 47.650; 9.317.,0.07613471150398254,57.61370849609375,where is the question of swiss and austria? [SEP] it is located at approximately 47°39 ′ n 9°19 ′ e / 47. 650°n 9. 317°e / 47. 650; 9. 317.,0.9923904538154602,103.13739776611328,True,0.8633093525179856
"what other location did apollo 1 test at besides kennedy space center? [SEP] they trained and conducted tests of their spacecraft at north american, and in the altitude chamber at the kennedy space center.",0.004200869705528021,101.24919128417969,"what other location did apollo 1 test at besides atlantic space center? [SEP] they trained and conducted tests of their spacecraft at north american, and in the altitude chamber at the kennedy space center.",0.005072085186839104,145.00289916992188,False,0.9660194174757282
"how much did capital cities communications purchase abc and its properties for? [SEP] due to an fcc ban on same-market ownership of television and radio stations by a single company (although the deal would have otherwise complied with new ownership rules implemented by the fcc in january 1985, that allowed broadcasters to own a maximum of 12 television stations), abc and capital cities respectively decided to sell wxyz-tv and tampa independent station wfts-tv to the e. w. scripps company (although capital cities/abc originally intended to seek a cross-ownership waiver to retain wxyz and capital cities-owned radio stations wjr and whyt).",0.9979875087738037,112.14785766601562,"how much to capital cities communications purchase abc and its properties for? [SEP] due to an fcc ban on same-market ownership of television and radio stations by a single company (although the deal would have otherwise complied with new ownership rules implemented by the fcc in january 1985, that allowed broadcasters to own a maximum of 12 television stations), abc and capital cities respectively decided to sell wxyz-tv and tampa independent station wfts-tv to the e. w. scripps company (although capital cities / abc originally intended to seek a cross-ownership waiver to retain wxyz and capital cities-owned radio stations wjr and whyt).",0.9976896047592163,113.56513977050781,False,0.9922600619195047
"who painted the retable of st. george that is in the v&a collection? [SEP] one of the largest objects in the collection is the spanish tempera on wood, 670 x 486 cm, retable of st george, c. 1400, consisting of numerous scenes and painted by andrés marzal de sax in valencia.",0.0058651515282690525,157.9193115234375,"who painted the retable of st. george that is in the v & a collection? [SEP] one of the largest objects in the collection is the spanish tempera on wood, 670 x 486 cm, retable of st george, c. 1300, consisting of numerous scenes and painted by andres marzal de sax in valencia.",0.00545178446918726,175.1558380126953,False,0.9855595667870036
"according to a 1955 review, what were savings by the wealthy thought to offset? [SEP] according to a 1955 review, savings by the wealthy, if these increase with inequality, were thought to offset reduced consumer demand.",0.004629843402653933,105.42728424072266,"according to a 1955 review, what were savings by the wealthy thought to replace? [SEP] according to a 1955 review, savings by the wealthy, if these increase with inequality, were thought to offset reduced consumer demand.",0.011338531039655209,110.78724670410156,False,0.9683257918552036
"what percentage of warsaw's population was protestant in 1901? [SEP] after the war, the new communist authorities of poland discouraged church construction and only a small number were rebuilt.",0.997179388999939,207.86509704589844,"what percentage of vilnius's population was protestant in 1901? [SEP] after the war, the new communist authorities of poland discouraged church construction and only a small number were rebuilt.",0.9969832301139832,183.1605224609375,False,0.9639175257731959
"for which show did billie piper tape an introduction? [SEP] cbc began airing series two on 9 october 2006 at 20:00 e/p (20:30 in newfoundland and labrador), shortly after that day's cfl double header on thanksgiving in most of the country.[citation needed]",0.9886244535446167,195.7859344482422,"for which show did billy piper tape an introduction? [SEP] cbc began airing series two on 9 october 2006 at 20: 00 e / p (20: 30 in newfoundland and labrador), shortly after that day's cfl double header on thanksgiving in most of the country. [ citation needed ]",0.9895929098129272,277.369873046875,False,0.9656488549618321
"what is the seldom used force unit equal to one thousand newtons? [SEP] the kilogram-force leads to an alternate, but rarely used unit of mass: the metric slug (sometimes mug or hyl) is that mass that accelerates at 1 m·s−2 when subjected to a force of 1 kgf.",0.08119092881679535,86.58300018310547,"what is the seldom used force unit equal to one thousand universals? [SEP] the kilogram-force leads to an alternate, but rarely used unit of mass: the metric slug (sometimes mug or hyl) is that mass that accelerates at 1 m · s−2 when subjected to a force of 1 kgf.",0.26899901032447815,104.12457275390625,False,0.9659090909090909
"what is the name of the turf used in levi's stadium for the super bowl? [SEP] concerns were raised over whether levi's stadium's field was of a high enough quality to host a super bowl; during the inaugural season, the field had to be re-sodded multiple times due to various issues, and during a week 6 game earlier in the 2015 season, a portion of the turf collapsed under baltimore ravens kicker justin tucker, causing him to slip and miss a field goal, although the field has not had any major issues since.",0.9961624145507812,38.530418395996094,"what is the name of the turf used in levi's stadium for the supergate? [SEP] concerns were raised over whether levi's stadium's field was of a high enough quality to host a super bowl; during the inaugural season, the field had to be re-sodded multiple times due to various issues, and during a week 6 game earlier in the 2015 season, a portion of the turf collapsed under baltimore ravens kicker justin tucker, causing him to slip and miss a field goal, although the field has not had any major issues since.",0.9957101345062256,44.5984001159668,False,0.9901960784313726
"which company is the gallery of japanese art named after? [SEP] the museum also holds some cloisonné pieces from the japanese art production company, ando cloisonné.",0.00808657519519329,88.79975128173828,"which house is the gallery of japanese art named after? [SEP] the museum also holds some cloisonne pieces from the japanese art production company, ando cloisonne.",0.9975326061248779,122.51597595214844,True,0.9515151515151515
"what was the name of the imperialistic policy in china? [SEP] the age of imperialism, a time period beginning around 1700, saw (generally european) industrializing nations engaging in the process of colonizing, influencing, and annexing other parts of the world in order to gain political power.[citation needed]",0.9639959335327148,33.02540969848633,"what was the name of the imperialistic policy in early? [SEP] the age of imperialism, a time period beginning around 1700, saw (generally european) industrializing nations engaging in the process of colonizing, influencing, and annexing other parts of the world in order to gain political power. [ citation needed ]",0.4316774904727936,37.727901458740234,True,0.9746031746031746
"when was luther's last sermon? [SEP] it was ""entirely devoted to the obdurate jews, whom it was a matter of great urgency to expel from all german territory,"" according to léon poliakov.",0.9976651668548584,87.59333801269531,"of was luther's last sermon? [SEP] it was "" entirely devoted to the obdurate jews, whom it was a matter of great urgency to expel from all german territory, "" according to leon poliakov.",0.8072816133499146,122.08075714111328,False,0.9623655913978495
"who did the bbc work with to reconstruct some of the invasion episodes? [SEP] the bbc, in conjunction with animation studio cosgrove hall, reconstructed the missing episodes 1 and 4 of the invasion (1968), using remastered audio tracks and the comprehensive stage notes for the original filming, for the serial's dvd release in november 2006.",0.009112556464970112,102.08826446533203,"who did the bbc work with to reconstruct some of the invasion episodes? [SEP] the bbc, in funding with animation studio cosgrove hall, reconstructed the missing episodes 1 and 4 of the invasion (1968), using remastered audio tracks and the comprehensive stage notes for the original filming, for the serial's dvd release in november 2006.",0.012906316667795181,122.79899597167969,False,0.9766081871345029
"when were luther and his prospective bride engaged? [SEP] the ceremonial walk to the church and the wedding banquet were left out, and were made up two weeks later on 27 june.",0.9335781931877136,133.95506286621094,"when were luther and his prospective bride made? [SEP] the ceremonial walk to the church and the wedding banquet were left out, and were made up two weeks later on 27 june.",0.08569642156362534,139.04443359375,True,0.9714285714285714
where in south carolina did huguenot nobility settle? [SEP] he became pastor of the first huguenot church in north america in that city.,0.9976739287376404,135.69747924804688,where in south carolina did hughenot nobility settle? [SEP] he became pastor of the first huguenot church in north america in that city.,0.9973387122154236,264.36773681640625,False,0.9926470588235294
what is colonialism's core meaning? [SEP] colonialism is seen to be the architect deciding how to start dominating areas and then imperialism can be seen as creating the idea behind conquest cooperating with colonialism.,0.981564462184906,159.8578643798828,what is colonialism's core meaning. [SEP] colonialism is seen to be the architect deciding how to start dominating areas and then imperialism can be seen as creating the idea behind conquest cooperating with colonialism.,0.9839348196983337,177.35240173339844,False,0.9954545454545455
"what was warsaw's population in 1901? [SEP] after the war, the new communist authorities of poland discouraged church construction and only a small number were rebuilt.",0.9960554838180542,224.53305053710938,"what was bucharest's population in 1901? [SEP] after the war, the new communist authorities of poland discouraged church construction and only a small number were rebuilt.",0.9950527548789978,169.56080627441406,False,0.9590643274853801
"by what name was the mongol army that finally conquered bulgaria known? [SEP] the famous cavalry expedition led by subutai and jebe, in which they encircled the entire caspian sea defeating all armies in their path, remains unparalleled to this day, and word of the mongol triumphs began to trickle to other nations, particularly europe.",0.9977191090583801,103.34288787841797,"by what name was the mongol army that finally conquered bulgaria known? [SEP] the famous land expedition led by subutai and jebe, in which they encircled the entire caspian sea defeating all armies in their path, remains unparalleled to this day, and word of the mongol triumphs began to trickle to other nations, particularly europe.",0.997731626033783,105.81201171875,False,0.9821958456973294
"what university donated the land for the manned spacecraft center? [SEP] a site was chosen in houston, texas, on land donated by rice university, and administrator webb announced the conversion on september 19, 1961.",0.0029709702357649803,201.2793426513672,"what university purchased the land for the manned spacecraft center? [SEP] a site was chosen in houston, texas, on land donated by rice university, and administrator webb announced the conversion on september 19, 1961.",0.007825101725757122,188.13536071777344,False,0.9724770642201834
"what was given as the cause of death? [SEP] his body was later found by maid alice monaghan after she had entered tesla's room, ignoring the ""do not disturb"" sign that tesla had placed on his door two days earlier.",0.9717227220535278,58.958213806152344,"what was given as the cause ofon? [SEP] his body was later found by maid alice monaghan after she had entered tesla's room, ignoring the "" do not disturb "" sign that tesla had placed on his door two days earlier.",0.898020327091217,90.45330047607422,False,0.9626168224299065
"how many plant species make up the total in the rainforest? [SEP] one in five of all the bird species in the world live in the rainforests of the amazon, and one in five of the fish species live in amazonian rivers and streams.",0.9976293444633484,20.056896209716797,"how many plant species make up the total in the rainforest must [SEP] one in five of all the bird species in the world live in the rainforests of the amazon, and one in five of the fish species live in amazonian rivers and streams.",0.9972240924835205,24.967782974243164,False,0.9783549783549783
"what newcastle radio station is based at the great north children's hospital? [SEP] newcastle student radio is run by students from both of the city's universities, broadcasting from newcastle university's student's union building during term time.",0.9965704679489136,82.88790130615234,"what newcastle radio station is based at the great north children's -? [SEP] newcastle student radio is run by students from both of the city's universities, broadcasting from newcastle university's student's union building during term time.",0.9867097735404968,109.7900390625,False,0.967741935483871
"the great internet mersenne prime search, what was the prize for finding a prime with at least 10 million digits? [SEP] in 2009, the great internet mersenne prime search project was awarded a us$100,000 prize for first discovering a prime with at least 10 million digits.",0.012858493253588676,34.92716598510742,"the great internet mersenne prime search, what was the tournament for finding a prime with at least 10 million digits? [SEP] in 2009, the great internet mersenne prime search project was awarded a us $ 100, 000 prize for first discovering a prime with at least 10 million digits.",0.6429170966148376,60.91032028198242,True,0.9605734767025089
"when was the st. bartholomew's day massacre? [SEP] in what became known as the st. bartholomew's day massacre of 24 august – 3 october 1572, catholics killed thousands of huguenots in paris.",0.003066446166485548,75.2049560546875,"when was the st. bartholomew's day mass? [SEP] in what became known as the st. bartholomew's day massacre of 24 august – 3 october 1572, catholics killed thousands of huguenots in paris.",0.9970446228981018,81.52236938476562,True,0.9789473684210527
what do these teachers not do? [SEP] these teachers do not teach by rote but attempt to find new invigoration for the course materials on a daily basis.,0.01753411814570427,70.98833465576172,what do these teachers now do? [SEP] these teachers do not teach by rote but attempt to find new invigoration for the course materials on a daily basis.,0.4179460108280182,71.39447021484375,False,0.993421052631579
"what role in economics did the university play a major part in? [SEP] in economics, the university has played an important role in shaping ideas about the free market and is the namesake of the chicago school of economics, the school of economic thought supported by milton friedman and other economists.",0.0042469697073102,54.06393814086914,"what role in agriculture did the university play a major part in? [SEP] in economics, the university has played an important role in shaping ideas about the free market and is the namesake of the chicago school of economics, the school of economic thought supported by milton friedman and other economists.",0.9941565990447998,62.28561782836914,True,0.9640522875816994
what is the estimate of how many physicians give out drugs on their own? [SEP] 7 to 10 percent of american physicians practices reportedly dispense drugs on their own.,0.019275225698947906,49.072669982910156,what is the estimate of how many physicians give out drugs on their house? [SEP] 7 to 10 percent of american physicians practices reportedly dispense drugs on their own.,0.936342716217041,65.8985595703125,True,0.9763313609467456
