original_text,original_score,original_perplexity,counterfactual_text,counterfactual_score,counterfactual_perplexity,found_flip,levenshtein_similarity_score
"the actors don't inhabit their roles -- they're trapped by them, forced to change behavior in bizarre unjustified fashion and spout dialog that consists mostly of platitudes.",0.003907255828380585,115.97665405273438,"the actors don't alter their roles -- they're privileged by them, forced to change behavior in the unjustified fashion and spout dialog that consists mostly of platitudes.",0.7742409706115723,136.26295471191406,True,0.8850574712643678
"when your leading ladies are a couple of screen-eating dominatrixes like goldie hawn and susan sarandon at their raunchy best, even hokum goes down easily.",0.08260374516248703,150.3179168701172,"when your leading ladies are a couple of screen-eating dominatrixes like goldie hawn and susan sarandon at their raunchy best, even hokum goes well easily.",0.985185444355011,185.81109619140625,True,0.9741935483870968
it's a refreshing change from the self-interest and paranoia that shape most american representations of castro.,0.9986463189125061,113.92924499511719,it's a deliberate change from the self-interest and assumed that shape most american representations of regime.,0.2429235726594925,357.5500183105469,True,0.8035714285714286
"this is a throwaway, junk-food movie whose rap soundtrack was better tended to than the film itself.",0.0008025152492336929,105.05913543701172,"this is a freshaway, classic-food movie whose rap soundtrack was better overall to than the film itself.",0.9868223667144775,367.2676086425781,True,0.8269230769230769
"human nature talks the talk, but it fails to walk the silly walk that distinguishes the merely quirky from the surreal.",0.06435281038284302,128.2880401611328,"human nature talks the talk, but it is to walk the silly walk that distinguishes the merely quirky from the surreal.",0.9908688068389893,144.94944763183594,True,0.9747899159663865
the bourne identity is what summer screen escapism used to be in the decades when it was geared more to grownups.,0.8719488382339478,152.71224975585938,the hollow identity is what summer screen escapism used to be in the decades when it was geared more to grownups.,0.035801175981760025,160.1845245361328,True,0.9557522123893806
"a romantic comedy, yes, but one with characters who think and talk about their goals, and are working on hard decisions.",0.9951353669166565,50.47426986694336,"a romantic comedy, yes, but one with characters who think and talk about their goals, and are working on bad projects.",0.13832637667655945,51.25075912475586,True,0.9166666666666666
the way coppola professes his love for movies -- both colorful pop junk and the classics that unequivocally qualify as art -- is giddily entertaining.,0.9995678067207336,252.63088989257812,the way coppola professes his love for movies -- both colorful pop junk and the classics that unequivocally qualify as art -- is giddilyiche.,0.0018708211136981845,364.80328369140625,True,0.92
"all the characters are stereotypes, and their interaction is numbingly predictable.",0.0008155505638569593,102.5881576538086,"all the characters are stereotypes, and their interaction is neveringly predictable.",0.9870893359184265,218.24331665039062,True,0.9523809523809523
"a teasing drama whose relentless good-deed/bad-deed reversals are just interesting enough to make a sinner like me pray for an even more interesting, less symmetrical, less obviously cross-shaped creation.",0.9420456886291504,95.52633666992188,"a teasing drama whose relentless good-deed / bad-deed reversals are just interesting insufficient to make a sinner like me pray for an even more interesting, less symmetrical, less obviously cross-shaped creation.",0.00837184302508831,138.88909912109375,True,0.9436619718309859
"it's a pleasure to see seinfeld griping about the biz with buddies chris rock, garry shandling and colin quinn.",0.9992603659629822,185.87640380859375,"it's a shame to see seinfeld griping about the biz with buddies chris rock, garry shandling and colin quinn.",0.02684999816119671,200.159912109375,True,0.9459459459459459
... (a) strained comedy that jettisons all opportunities for rock to make his mark by serving up the usual chaotic nonsense.,0.017713021486997604,204.25054931640625,.. (a) funny comedy that jettisons all opportunities for rock to make his mark by serving up the usual chaotic nonsense.,0.9986050724983215,177.18994140625,True,0.935483870967742
"while this film is not in the least surprising, it is still ultimately very satisfying.",0.9995540976524353,50.7270622253418,"while this film is not in the least surprising, it is still not very satisfying.",0.0035165860317647457,40.41521453857422,True,0.896551724137931
"if you're not a prepubescent girl, you'll be laughing at britney spears' movie-starring debut whenever it doesn't have you impatiently squinting at your watch.",0.017505628988146782,64.56510925292969,"if you're not a prepubescent girl, you'll be laughing at britney spears' movie-starring debut, it doesn't have you impatiently squinting at your watch.",0.937376856803894,61.73152160644531,True,0.9433962264150944
"watching trouble every day, at least if you don't know what's coming, is like biting into what looks like a juicy, delicious plum on a hot summer day and coming away with your mouth full of rotten pulp and living worms.",0.017823612317442894,40.5427131652832,"watching trouble every day, at least if you don't know what's coming, is like biting into what looks like a juicy, delicious plum on a hot summer day and coming away with your mouth full of honest pulp and living worms.",0.5869501233100891,51.29679489135742,True,0.9771689497716896
"glib, satirical documentary that fudges facts, makes facile points and engages in the cinematic equivalent of tabloid journalism.",0.015854213386774063,103.5016860961914,"glib, satirical documentary that fudges facts, makes facile points and engages in the cinematic equivalent of modern journalism.",0.5400933623313904,125.5988540649414,True,0.9457364341085271
"a gentle blend of present day testimonials, surviving footage of burstein and his family performing, historical archives, and telling stills.",0.9990202188491821,229.4733123779297,"a sparse blend of present day testimonials, surviving footage of burstein and his family performing, historical archives, and telling stills.",0.04935714229941368,220.0153350830078,True,0.9645390070921985
"this film was made to get laughs from the slowest person in the audience -- just pure slapstick with lots of inane, inoffensive screaming and exaggerated facial expressions.",0.001266864244826138,77.00072479248047,"this film was made to get laughs from the slowest person in the audience -- just pure funny funny with lots of arne, inoffensive screaming and exaggerated facial expressions.",0.8742508292198181,155.27940368652344,True,0.9195402298850575
"a grim, flat and boring werewolf movie that refuses to develop an energy level.",0.0008252205443568528,222.978515625,"a grim, flat and good werewolf movie that refuses to develop an energy level.",0.7722633481025696,469.0639953613281,True,0.9367088607594937
"an earnest, heartrending look at the divide between religious fundamentalists and their gay relatives.",0.999562680721283,71.17703247070312,"an s, heartacheding look at the divide between religious fundamentalists and their gay relatives.",0.06536103785037994,323.8730773925781,True,0.9019607843137255
"once the audience figure out what's being said, the filmmaker's relative passivity will make it tough for them to really care.",0.00924321636557579,42.46299362182617,"once the audience figure out what's being said, the filmmaker's relative passivity will make it the for them to really care.",0.995089590549469,82.43846893310547,True,0.9682539682539683
"starts off with a bang, but then fizzles like a wet stick of dynamite at the very end.",0.004067656584084034,27.226633071899414,"starts off with a bang, but then fi glows like a lit stick of dynamite at the very end.",0.731332540512085,51.33980178833008,True,0.9310344827586207
"began life as a computer game, then morphed into a movie -- a bad one, of course.",0.001383500755764544,40.533447265625,"began life as a computer game, then morphed into a movie -- a kind one, of course.",0.9976582527160645,57.89778518676758,True,0.9634146341463414
the film is a travesty of the genre and even as spoof takes itself too seriously.,0.0012510610977187753,52.70867919921875,the film is a traves landmark of the genre and even as spoof takes itself too seriously.,0.9705519080162048,263.1238098144531,True,0.8977272727272727
"this romantic thriller is steeped in the atmosphere of wartime england, and ably captures the speech patterns, moral codes and ideals of the 1940s.",0.9994675517082214,68.75171661376953,"this con screenplay is steeped in the atmosphere of wartime england, and erly follows the speech patterns, moral codes and ideals of the 1940s.",0.29349952936172485,131.39144897460938,True,0.8503401360544218
"liman, of swingers and go, makes his big-budget action film debut something of a clunker as he delivers a long, low-heat chase, interrupted by a middling car chase.",0.09428677707910538,81.37967681884766,"liman, of swingers and go, makes his big-budget action film debut something of a clunk hero as he delivers a long, low-heat chase, interrupted by a middling car chase.",0.948095440864563,102.73766326904297,True,0.9820359281437125
what could and should have been biting and droll is instead a tepid waste of time and talent.,0.0007380468887276947,89.20641326904297,what could and should have been biting and droll is instead a te mere joy of time and talent.,0.9712762236595154,485.7067565917969,True,0.9032258064516129
"as bundy, michael reilly burke (octopus 2: river of fear) has just the right amount of charisma and menace.",0.9990754127502441,191.49876403808594,"as bundy, michael reilly burke (octopus 2: river of fear) has just the right amount of bluecominga and one.",0.10598758608102798,398.8901672363281,True,0.8785046728971962
"truth to tell, if you've seen more than half-a-dozen horror films, there's nothing here you haven't seen before.",0.17052988708019257,15.304155349731445,"truth to tell, if you've seen more than half-a - dozen horror films, there's nothing here you haven't seen better.",0.7950959205627441,37.39270782470703,True,0.9473684210526316
"if you collected all the moments of coherent dialogue, they still wouldn't add up to the time required to boil a four-minute egg.",0.002642518375068903,73.8177719116211,"if you collected all the moments of a -, they still wouldn't give up to the time required to boil a four-minute egg.",0.5686184763908386,114.02604675292969,True,0.8449612403100775
"spousal abuse is a major problem in contemporary society, but the film reduces this domestic tragedy to florid melodrama.",0.007004482205957174,46.24751663208008,"spousal abuse is a major problem in contemporary society, but the film connects this domestic tragedy to florid melod ideal.",0.7630345225334167,187.5106658935547,True,0.9112903225806451
"eastwood is an icon of moviemaking, one of the best actors, directors and producers around, responsible for some excellent work.",0.9995853304862976,45.90257263183594,"eastwood is an icon of movie restoration, one of the best actors, directors and producers around, responsible for some excellent work.",0.9994099140167236,61.51604461669922,False,0.9253731343283582
a fairly by-the-books blend of action and romance with sprinklings of intentional and unintentional comedy.,0.9972557425498962,74.79600524902344,a mere by-the-books blend of action and romance with sprinklings of intentional and unintentional action.,0.34515196084976196,101.82539367675781,True,0.897196261682243
"if you're like me, a sucker for a good old fashion romance and someone who shamelessly loves to eat, then mostly martha offers all the perfect ingredients to more than satisfy your appetite.",0.995806097984314,77.3165512084961,"if you're like me, a sucker for a good old fashion romance and someone who shamelessly loves to eat, then only some offers all the perfect ingredients to more than satisfy your appetite.",0.041647739708423615,63.84247970581055,True,0.9526315789473684
"a gimmick in search of a movie: how to get carvey into as many silly costumes and deliver as many silly voices as possible, plot mechanics be damned.",0.012466326355934143,135.96136474609375,"a gimmick in search of a movie: how to get carvey into as many silly costumes and deliver as many silly voices as possible, plot mechanics be supreme.",0.6254376173019409,229.2379608154297,True,0.96
"this time out, (sade) is an unsettlingly familiar figure -- in turns loyal and deceitful, responsible and reckless, idealistically selfless and coldly self-interested.",0.9976693987846375,91.8409423828125,"this time out, (sade) is an unokalingly familiar figure -- in turns loyal and deceitful, responsible and failing, idealistically selflessist coldly self-interested.",0.6807382702827454,288.4770812988281,False,0.9101796407185628
"nothing denis has made before, like beau travil and nenette et boni, could prepare us for this gory, perverted, sex-soaked riff on the cannibal genre.",0.007263557985424995,180.5145263671875,"from denis has made before, like beau travil and nenette et boni, could prepare us for this gory, perverted, intimate-soaked riff on the cannibal genre.",0.9888792037963867,266.45062255859375,True,0.9013157894736842
"this miserable excuse of a movie runs on empty, believing flatbush machismo will get it through.",0.0007652073982171714,421.9953918457031,"this miserable excuse of a movie runs on up, confident flaty machismo will get it through.",0.517772376537323,560.3380737304688,True,0.8333333333333334
an experience so engrossing it is like being buried in a new environment.,0.9916996955871582,61.560909271240234,an experience so engwarting it is like being buried in a new environment.,0.011674508452415466,292.05047607421875,True,0.9452054794520548
but he somehow pulls it off.,0.9917033314704895,57.51201248168945,but he somehow plays it off.,0.006947933230549097,146.41302490234375,True,0.8928571428571429
"parker holds true to wilde's own vision of a pure comedy with absolutely no meaning, and no desire to be anything but a polished, sophisticated entertainment that is in love with its own cleverness.",0.9929888844490051,81.42668914794922,"parker holds exception to wilde's own vision of a pure comedy with absolutely lost meaning, and no desire to be anything but a polished, sophisticated entertainment that is in love with its own cleverness.",0.23420372605323792,133.4292449951172,True,0.9463414634146341
"a depressing confirmation of everything those of us who don't object to the description `` unelected'' have suspected all along: george w. bush is an incurious, uncharismatic, overgrown frat boy with a mean streak a mile wide.",0.004904794041067362,91.18000030517578,"a de grand confirmation of everything those of us who don't object to the description ` ` unelected'' have suspected all along: george w. bush is an incurious, uncharismatic, handsome frat boy with a mean streak a mile wide.",0.9025930762290955,120.85453796386719,True,0.9292035398230089
"just because it really happened to you, honey, doesn't mean that it's interesting to anyone else.",0.10796262323856354,38.03240203857422,"just because it really happened to you, honey, doesn't stop that it's interesting to anyone else.",0.9942833781242371,81.1739273071289,True,0.9587628865979382
"it virtually defines a comedy that's strongly mediocre, with funny bits surfacing every once in a while.",0.0021251433063298464,97.00955963134766,"it virtually defines a comedy that's strongly underio original, with funny bits surfacing every once in a while.",0.8936956524848938,201.91070556640625,True,0.8928571428571429
"unless you are in dire need of a diesel fix, there is no real reason to see it.",0.0030549950897693634,25.384197235107422,"when you are in handy need of a diesel fix, there is no real fault to see it.",0.3624800443649292,91.36365509033203,False,0.810126582278481
"flotsam in the sea of moviemaking, not big enough for us to worry about it causing significant harm and not smelly enough to bother despising.",0.0021722884848713875,75.66988372802734,"flode well in the sea of moviemaking, not big enough for us to worry about it causing significant harm and not smelly enough to bother despising.",0.8075934648513794,84.6072769165039,True,0.9517241379310345
... fifty minutes of tedious adolescent melodramatics followed by thirty-five minutes of inflated nonsense.,0.0011484009446576238,80.6133041381836,.. fifty minutes of tedious adolescent melodramatics followed by thirty-five minutes of amusing optimism.,0.9575760960578918,88.29170227050781,True,0.8504672897196262
"the result is solemn and horrifying, yet strangely detached.",0.052870187908411026,209.14735412597656,"the result is solemn and horrifying, yet strangely profound.",0.9968569278717041,168.9810333251953,True,0.8833333333333333
audiences will find no mention of political prisoners or persecutions that might paint the castro regime in less than saintly tones.,0.019161373376846313,106.20057678222656,audiences will find no absence of political prisoners or persecutions that might paint the castro regime in less than saintly tones.,0.9757463932037354,132.04660034179688,True,0.946969696969697
"as green-guts monster movies go, it's a beaut.",0.9909075498580933,266.15716552734375,"as green-guts monster movies go, it's a mut.",0.0014541466953232884,448.632080078125,True,0.9347826086956522
"despite the authenticity of the trappings, the film is overblown in its plotting, hackneyed in its dialogue and anachronistic in its style.",0.0010264130542054772,25.129152297973633,"despite the authenticity of the trappings, the film is overblown in its plotting, charmed in its dialogue and anachronistic in its style.",0.8052374720573425,25.626466751098633,True,0.9568345323741008
"huppert gives erika a persona that is so intriguing that you find yourself staring hypnotically at her, trying to understand her and wondering if she'll crack.",0.999643087387085,66.92616271972656,"huppert gives erika a persona that is so over that you find yourself staring hypnotically at her, trying to understand her and wondering if she'll crack.",0.21426784992218018,81.91655731201172,True,0.9433962264150944
a sports movie with action that's exciting on the field and a story you care about off it.,0.9997356534004211,79.03193664550781,a sports movie with a that's over on the field and a story you want about off it.,0.08315273374319077,138.07814025878906,True,0.8222222222222222
rates an ` e' for effort -- and a ` b' for boring.,0.0037903336342424154,135.89622497558594,rates an ` e' for effort -- and a ` b' for all.,0.9730952978134155,132.33509826660156,True,0.88
"day is not a great bond movie, but it is a good bond movie, which still makes it much better than your typical bond knock-offs.",0.9990886449813843,41.967098236083984,"day is not a great bond movie, but it is a good bond movie, which still makes it much bad than your typical bond knock-offs.",0.3478468060493469,71.35144805908203,True,0.9606299212598425
"now, if it only had a brain.",0.029729662463068962,48.4259147644043,"now, though it only had a future.",0.8280812501907349,90.16104125976562,True,0.6363636363636364
"so stupid, so ill-conceived, so badly drawn, it created whole new levels of ugly.",0.0008593709208071232,66.51374816894531,"so stupid, so ill-conceived, so well beautiful, it created whole new levels of beautiful.",0.7292208671569824,95.4349594116211,True,0.7752808988764045
must-see viewing for anyone involved in the high-tech industry.,0.9987303614616394,55.790794372558594,must-see only for anyone involved in the high-tech industry.,0.4718192517757416,46.696006774902344,True,0.8888888888888888
"in adobo, ethnicity is not just the spice, but at the heart of more universal concerns.",0.991162896156311,135.8234100341797,"in adobo, ethnicity is not just the spice, but at the heart of more of problem.",0.05267653241753578,165.1679229736328,True,0.8275862068965517
"`` men in black ii,'' has all the earmarks of a sequel.",0.023136716336011887,171.60879516601562,"` ` men in black ii,'' has all the earmarks of a following.",0.9970471262931824,319.4138488769531,True,0.8305084745762712
"with youthful high spirits, tautou remains captivating throughout michele's religious and romantic quests, and she is backed by a likable cast.",0.9997453093528748,190.17547607421875,"with youthful high spirits, tautou remains capt old throughout michele's religious and romantic quests, and she is backed by a likable cast.",0.9995679259300232,375.2270202636719,False,0.951048951048951
"gangs of new york is an unapologetic mess, whose only saving grace is that it ends by blowing just about everything up.",0.0010887779062613845,56.31564712524414,"you of new york is an unapologetic tale, whose only saving grace is that it ends by painting just about everything up.",0.6181917190551758,70.67018127441406,True,0.8823529411764706
credibility sinks into a mire of sentiment.,0.0029784943908452988,217.762451171875,credibility bridges into a mire of sentiment.,0.6271272897720337,266.9241638183594,True,0.8888888888888888
"romanek keeps the film constantly taut... reflecting the character's instability with a metaphorical visual style and an unnerving, heartbeat-like score.",0.999466598033905,190.44163513183594,"romanek keeps the film constantly loose... reflecting the character's instability with a metaphorical visual style and an un -ial, heartbeat-like score.",0.8709343671798706,380.2543029785156,False,0.9281045751633987
"if this is satire, it's the smug and self-congratulatory kind that lets the audience completely off the hook.",0.04441343992948532,31.046077728271484,"if this is satire, it's the triumphant and self-congratulatory kind that lets the audience completely off the hook.",0.9983484745025635,39.33552169799805,True,0.9217391304347826
an epic of grandeur and scale that's been decades gone from the popcorn pushing sound stages of hollywood.,0.9913090467453003,192.4997100830078,an epic of grandeur and scale that's been decades scrapped from the popcorn pushing sound stages of hollywood.,0.012777088209986687,255.74171447753906,True,0.9363636363636364
"although based on a real-life person, john, in the movie, is a rather dull person to be stuck with for two hours.",0.0017361275386065245,44.650394439697266,"although based on a real-life person, john, in the movie, is a rather pleasant person to be stuck with for two hours.",0.9661213159561157,42.47923278808594,True,0.9316239316239316
claude miller airs out a tight plot with an easy pace and a focus on character drama over crime-film complications.,0.998766303062439,212.58523559570312,claude miller airs out a tight plot with an no pace and a focus on character drama over crime-film complications.,0.011285270564258099,339.84051513671875,True,0.9652173913043478
despite the premise of a good story... it wastes all its star power on cliched or meaningless roles.,0.001309240236878395,86.74461364746094,and the premise of a good story... it drawss all its star power on cliched or meaningless roles.,0.6867694854736328,217.7095947265625,True,0.88
not too far below the gloss you can still feel director denis villeneuve's beating heart and the fondness he has for his characters.,0.9991324543952942,177.3954620361328,not too far below any gloss you can still feel director denis ville him's beating heart and the grness he has for his characters.,0.46807342767715454,575.3687133789062,True,0.9090909090909091
"for all its alleged youthful fire, xxx is no less subservient to bond's tired formula of guns, girls and gadgets while brandishing a new action hero.",0.880520224571228,252.7137908935547,"for all its alleged youthful fire, xxx is no less subservient to bond's tired formula of guns, girls and gadgets while schoolishing a new action hero.",0.3769839406013489,372.1623229980469,True,0.96
"more a load of enjoyable, conan-esque claptrap than the punishing, special-effects soul assaults the mummy pictures represent.",0.42489930987358093,307.0380554199219,"more a load of enjoyable, conan-esque claptrap than the bounding, special-effects soul assaults the mummy pictures represent.",0.8602279424667358,321.7655944824219,True,0.9603174603174603
"benefits from a strong performance from zhao, but it's dong jie's face you remember at the end.",0.9986170530319214,86.50541687011719,"benefits from a strong performance from zhao, but it's dong jie's face you miss at the end.",0.3672303557395935,75.63200378417969,True,0.9263157894736842
barely goes beyond comic book status.,0.0033614777494221926,245.12579345703125,' goes beyond comic book status.,0.9925327897071838,200.9903564453125,True,0.8378378378378378
but it offers plenty to ponder and chew on as its unusual relationship slowly unfolds.,0.9951590895652771,197.38265991210938,but it offers nothing to ponder and chew on as its unusual relationship slowly unfolds.,0.0022125577088445425,321.495361328125,True,0.9195402298850575
big fat liar is just futile silliness looking to tap into the kiddie sensibilities.,0.0011837227502837777,380.531982421875,big fat who is just and silliness looking to tap into the kiddie sensibilities.,0.8825644254684448,221.87388610839844,True,0.8795180722891567
this bold and lyrical first feature from raja amari expands the pat notion that middle-aged women just wan na have fun into a rousing treatise of sensual empowerment.,0.9996509552001953,347.54229736328125,this bold and lyrical first feature from raja amari is the pat notion that middle-aged women just wan na have fun into a rousing treatise of sensual empowerment.,0.9993795156478882,319.9267883300781,False,0.963855421686747
