original_text,original_score,original_perplexity,counterfactual_text,counterfactual_score,counterfactual_perplexity,found_flip,levenshtein_similarity_score
"these spiders can outrun a motorcycle and wrap a person in a sticky cocoon in seconds, but they fall short of being interesting or entertaining.",0.001710092299617827,56.723628997802734,"these spiders can outrun a motorcycle and wrap a person in a sticky cocoon in seconds, but they rarely short of being interesting or entertaining.",0.9727989435195923,87.60323333740234,True,0.9726027397260274
this version incarnates the prophetic book in a way even its exacting author might admire.,0.9832233786582947,223.6367950439453,this version incarnates the prophetic book in a way none its exacting author might admire.,0.004555713385343552,396.83856201171875,True,0.9555555555555556
"a trashy, exploitative, thoroughly unpleasant experience.",0.001088590594008565,95.61670684814453,"a trashy, exploitative, thoroughly pleasant experience.",0.9982983469963074,162.65748596191406,True,0.9649122807017544
"hey, who else needs a shower?",0.035890012979507446,78.27204132080078,"up, who else needs a sweat?",0.2211735099554062,205.43605041503906,False,0.7586206896551724
it's a worthwhile tutorial in quantum physics and slash-dash,0.9994789958000183,385.2210693359375,it's a worth b tutorial in quantum physics and slash-dash,0.9987939596176147,927.0963134765625,False,0.9166666666666666
"a miniscule little bleep on the film radar, but one that many more people should check out",0.21151605248451233,69.50083923339844,"a miniscule little bleep on the film radar, but one that many more people should appreciate out",0.9842727184295654,111.35208129882812,True,0.9157894736842105
"this is a great subject for a movie, but hollywood has squandered the opportunity, using it as a prop for warmed-over melodrama and the kind of choreographed mayhem that director john woo has built his career on.",0.12286189198493958,45.967464447021484,"this is a great subject for a movie, but hollywood has notuandered the opportunity, using it as a prop for warmed-over melodrama and the kind of choreographed mayhem that director john woo has built his career on.",0.9847440123558044,79.93193817138672,True,0.9859154929577465
"this concoction, so bizarre to the adult mind, is actually a charming triumph where its intended under-12 audience is concerned.",0.9964113831520081,163.4390869140625,"this concoction, so bizarre to the adult mind, is actually a doomed triumph where its intended under-12 audience is concerned.",0.005876387003809214,174.0365753173828,True,0.9453125
it's also the year's sweetest movie.,0.998285710811615,62.60657501220703,it's also the year's wrongest movie.,0.001148548093624413,89.1146240234375,True,0.8611111111111112
it took 19 predecessors to get this?,0.04669096693396568,528.3828735351562,it took many predecessors to get this?,0.07239498943090439,439.1624450683594,False,0.8947368421052632
it won't be long before you'll spy i spy at a video store near you.,0.06127006188035011,101.09645080566406,it won't be long before you'll spy i like at a video store near you.,0.7821973562240601,111.8708724975586,True,0.9411764705882353
"it's predictable, but it jumps through the expected hoops with style and even some depth.",0.9995144605636597,86.61656188964844,"it's planned, but it jumps through the way barrages with style and even some depth.",0.20458488166332245,206.7033233642578,True,0.752808988764045
"if this dud had been made in the'70s, it would have been called the hills have antlers and played for about three weeks in drive-ins.",0.0012632025172933936,83.07493591308594,"if this beard had been made in the'stars, it would have been called the hills have antlers and popular for about three friday in young-ins.",0.12499711662530899,222.5861053466797,False,0.8201438848920863
"this isn't my favorite in the series, still i enjoyed it enough to recommend.",0.9991251826286316,44.432098388671875,"this isn't my favorite in the series, still i edited it enough to miss.",0.0013586151180788875,106.2752914428711,True,0.8441558441558441
a movie for 11-year-old boys with sports dreams of their own and the preteen girls who worship lil' bow wow.,0.9855164885520935,114.61351013183594,a video for 11-year-old boys with sports dreams of their own and the preteen girls who worship lil' bow wow.,0.44295772910118103,131.780517578125,True,0.962962962962963
"divertingly ridiculous, headbangingly noisy.",0.002476481255143881,385.368408203125,"divertingly fabulous, headbangingly noisy.",0.9992823004722595,470.4615173339844,True,0.8863636363636364
demands too much of most viewers.,0.0024287074338644743,384.8355407714844,trains too much of most to.,0.20007722079753876,734.9181518554688,False,0.6363636363636364
"with danilo donati's witty designs and dante spinotti's luscious cinematography, this might have made a decent children's movie -- if only benigni hadn't insisted on casting himself in the title role.",0.9975624084472656,132.9799346923828,"with danilo donati's witty designs and dante spinotti's unscious cinematography, this might have made a decent children's movie -- if only benigni hadn't insisted on casting himself in the title role.",0.48513907194137573,200.91458129882812,True,0.99
"showtime is one of the hapless victims of the arrogant `` if we put together a wry white man and a chatty black man and give them guns, the movie will be funny'' syndrome.",0.0021315107587724924,82.09815979003906,"t is one of the hapless victims of the arrogant ` ` if we put together a wry white man and a chatty black man and give them guns, the movie will be funny''sound.",0.9622947573661804,117.7076187133789,True,0.9122807017543859
"unfortunately, as a writer, mr. montias isn't nearly as good to his crew as he is as a director or actor.",0.0019201976247131824,57.11639404296875,"a, as a writer, mr. montias isn't nearly as bad to his crew as he is as a director or actor.",0.9667026996612549,63.024269104003906,True,0.8571428571428572
"it's a sly wink to the others without becoming a postmodern joke, made creepy by its `` men in a sardine can'' warped logic.",0.8693627119064331,229.90330505371094,"it's a sly wink to the others it becoming a postmodern joke, made creepy by its ` ` men in a sardine can'' warped logic.",0.0015120210591703653,339.68511962890625,True,0.9516129032258065
"it smacks of purely commercial motivation, with no great love for the original.",0.0019581031519919634,95.42240142822266,"it frees of purely commercial motivation, with no great reliance for the original.",0.9223005771636963,347.14227294921875,True,0.8658536585365854
strong setup and ambitious goals fade as the film descends into unsophisticated scare tactics and b-film thuggery.,0.0008995376410894096,108.17070770263672,strong setup and ambitious goals bridge as the film ventures into unsophisticated scare tactics and b-film thuggery.,0.9372528791427612,231.76148986816406,True,0.9137931034482758
but what saves lives on the freeway does not necessarily make for persuasive viewing.,0.002579781226813793,214.3536376953125,but what saves lives on the freeway does; necessarily make for persuasive viewing.,0.9875426292419434,1111.234619140625,True,0.9529411764705882
"director kapur is a filmmaker with a real flair for epic landscapes and adventure, and this is a better film than his earlier english-language movie, the overpraised elizabeth.",0.9995255470275879,82.184326171875,"director kapur is a filmmaker with a real flair for epic landscapes and adventure, and this is a worse film than his earlier english-language movie, the overpraised elizabeth.",0.10309197753667831,99.59788513183594,True,0.9715909090909091
hawke draws out the best from his large cast in beautifully articulated portrayals that are subtle and so expressive they can sustain the poetic flights in burdette's dialogue.,0.9996811151504517,268.60546875,hawke seeks out the best from his large cast in beautifully articulated portrayals that are subtle and so expressive they can sustain the poetic flights in burdette's dialogue.,0.9995583891868591,242.03453063964844,False,0.9772727272727273
"writer/director john mckay ignites some charming chemistry between kate and jed but, when he veers into sodden melodrama, punctuated by violins, it's disastrous and kate's jealous female friends become downright despicable.",0.002303049201145768,94.51161193847656,"writer / director john mckay ignites some charming chemistry between kate and jed but, when he veers into sodden melodrama, punctuated by violins, it's spectacular and kate's jealous female friends become down from despicable.",0.9963335990905762,132.15274047851562,True,0.9247787610619469
"one of those rare, exhilarating cinematic delights that gets even better in hindsight, as you mull over its every nuance in your mind.",0.998187243938446,57.80934143066406,"one of those rarely, exhilarating cinematic delights that gets even better in hind analysis, as you mull over its every nuance in your mind.",0.11048800498247147,154.6570587158203,True,0.9214285714285715
"sensitive, insightful and beautifully rendered film.",0.9997697472572327,93.34097290039062,"sensitive, insightful and. rendered film.",0.9995811581611633,720.3128662109375,False,0.7692307692307692
but hard-to-believe plot twists force the movie off track in its final half hour.,0.004608001559972763,46.05465316772461,but hard-to-believe plot twists force the movie in track in its final half hour.,0.9836490154266357,76.93793487548828,True,0.962962962962963
a film so tedious that it is impossible to care whether that boast is true or not.,0.0009718774235807359,50.946258544921875,a film so spendingious that it is impossible to care whether that boast is true or not.,0.002751727821305394,145.4075164794922,False,0.9310344827586207
(an) hilarious romantic comedy.,0.9997492432594299,548.7377319335938,(an)? romanticdic.,0.0690581277012825,4671.248046875,True,0.4516129032258065
"despite what anyone believes about the goal of its makers, the show... represents a spectacular piece of theater, and there's no denying the talent of the creative forces behind it.",0.9994831085205078,48.64134216308594,"despite what anyone believes about the goal of its makers, the show... represents a spectacular piece of theater, and there's no holding the talent of the creative forces behind it.",0.13641713559627533,82.99163055419922,True,0.9779005524861879
"as tweedy talks about canning his stockbroker and repairing his pool, you yearn for a few airborne tv sets or nude groupies on the nod to liven things up.",0.9246514439582825,236.53504943847656,"as tweedy talks about canning his stockbroker and repairing his pool, you longn for a few airborne tv sets or nude groupies on the nod to liven things up.",0.11723615229129791,339.0113525390625,True,0.974025974025974
"instead of accurately accounting a terrible true story, the film's more determined to become the next texas chainsaw massacre.",0.004822686314582825,308.4230651855469,"instead of inaccurate accounting a terrible true story, the film's more determined to become the next texas chainsaw massacre.",0.5503580570220947,355.3394470214844,True,0.9682539682539683
happily for mr. chin -- though unhappily for his subjects -- the invisible hand of the marketplace wrote a script that no human screenwriter could have hoped to match.,0.9841814041137695,97.6159896850586,happily for mr. chin -- though unhappily for his subjects -- the invisible hand of the marketplace wrote a sham that no human screenwriter could have hoped to match.,0.014731895178556442,127.39881896972656,True,0.9700598802395209
offers that rare combination of entertainment and education.,0.9997072815895081,108.08397674560547,offers that same combination of info and education.,0.8855013847351074,131.05712890625,False,0.7833333333333333
the story... is moldy and obvious.,0.0007110076840035617,266.83050537109375,the story... is moldy and interesting.,0.9385718703269958,263.287841796875,True,0.736842105263158
"you might not want to hang out with samantha, but you'll probably see a bit of yourself in her unfinished story.",0.9992859959602356,36.967674255371094,"you might not want to hang out with samantha, but you'll probably see a bit of yourself in there unfinished product.",0.4402610659599304,54.15347671508789,True,0.9310344827586207
"soul is what's lacking in every character in this movie and, subsequently, the movie itself.",0.012450515292584896,47.198307037353516,"soul is what's there in every character in this movie and, subsequently, the movie itself.",0.9976388216018677,53.21149444580078,True,0.9239130434782609
could the country bears really be as bad as its trailers?,0.001273993169888854,540.853515625,could the country bears really be as great as its ones?,0.6579171419143677,521.7906494140625,True,0.8245614035087719
"as a witness to several greek-american weddings -- but, happily, a victim of none -- i can testify to the comparative accuracy of ms. vardalos' memories and insights.",0.9960975050926208,138.447998046875,"as a witness to several greek-american weddings -- but, happily, a victim of none -- i can testify to the limited accuracy of ms. vardalos' memories and insights.",0.04093795269727707,146.2496795654297,True,0.9457831325301205
"occasionally melodramatic, it's also extremely effective.",0.9995611310005188,43.95640563964844,"occasionally melodugatic, it's also extremely sometimes.",0.033621374517679214,580.6073608398438,True,0.8421052631578947
a long-winded and stagy session of romantic contrivances that never really gels like the shrewd feminist fairy tale it could have been.,0.0011080290423706174,91.88198852539062,a long-honed and stagy confrontation of romantic contrivances that never really foams like the shrewd feminist fairy tale it could have been.,0.5895556211471558,139.78578186035156,True,0.8794326241134752
"... a weak, manipulative, pencil-thin story that is miraculously able to entertain anyway.",0.76104336977005,104.24180603027344,".. a weak, manipulative, pencil-thin story that is notly able to entertain anyway.",0.0007042945944704115,150.38796997070312,True,0.8888888888888888
nothing plot-wise is worth e-mailing home about.,0.0014779134653508663,101.59487915039062, plot-wise is worth e-mailing home about.,0.9994738698005676,69.72957611083984,True,0.8541666666666666
new best friend shouldn't have gone straight to video; it should have gone straight to a mystery science theater 3000 video.,0.005224098917096853,141.8496551513672,new best friend category't have gone waste to video; it should have gone up to a mystery science theater award video.,0.5829713344573975,557.0995483398438,True,0.7741935483870968
"we need (moore's) noisy, cocky energy, his passion and class consciousness; we need his shticks, we need his stones.",0.8637847304344177,174.554443359375,"we need (moore's) noisy, cocky energy, his passion and class consciousness; we need his sh amps, we need his stones.",0.3768957555294037,263.5253601074219,True,0.9655172413793104
the film's center will not hold.,0.0017049683956429362,189.9696502685547,the film's center will not lock.,0.018206549808382988,295.2374267578125,False,0.90625
but it pays a price for its intricate intellectual gamesmanship.,0.9989342093467712,161.6308135986328,but it pays a death for its intricate intellectual gamesmanship.,0.1401970088481903,426.2754211425781,True,0.921875
this one's weaker than most.,0.006084213498979807,86.28357696533203,this one's higher than most.,0.9965447783470154,80.92935943603516,True,0.8571428571428572
the experience of watching blobby old-school cgi animation in this superlarge format is just surreal enough to be diverting.,0.00751212053000927,195.99798583984375,the experience of watching blobby old-school cgi animation in this superlarge format is just surreal enough to be delightfuling.,0.8134914040565491,203.7333526611328,True,0.9375
do we really need a 77-minute film to tell us exactly why a romantic relationship between a 15-year-old boy and a 40-year-old woman doesn't work?,0.003239140845835209,13.167348861694336,do we really need a 77-minute film to tell us exactly why a romantic relationship between a 15-year-old boy and a 40-year-old woman doesn't fail ],0.5187305212020874,25.09307289123535,True,0.9589041095890412
this film's relationship to actual tension is the same as what christmas-tree flocking in a spray can is to actual snow: a poor -- if durable -- imitation.,0.0010912650031968951,239.5074005126953,this film's relationship to actual tension is the same as what christmas-tree flocking in a spray can is to actual snow: a successful -- if durable -- imitation.,0.6094139218330383,235.77247619628906,True,0.937888198757764
jolie's performance vanishes somewhere between her hair and her lips.,0.006287666969001293,88.79679107666016,jolie's performance flasheses somewhere between her hair and her lips.,0.9195256233215332,240.1844482421875,True,0.9142857142857143
"this road movie gives you emotional whiplash, and you'll be glad you went along for the ride.",0.9982783794403076,34.04438018798828,"this road movie gives you such brama, and you'll be glad you went along for the ride.",0.9993619322776794,67.53104400634766,False,0.8279569892473118
the film equivalent of a toy chest whose contents get scattered over the course of 80 minutes.,0.001287259510718286,87.23607635498047,the film telling of a toy chest whose treasures get sonic over the course of 80 minutes.,0.5800043940544128,443.0350646972656,True,0.7446808510638299
"(two) fairly dull -- contrasting and interlocking stories about miserable scandinavian settlers in 18th-century canada, and yuppie sailboaters in the here and now.",0.002429086482152343,153.09713745117188,"(two) fairly funny -- contrasting and interlocking stories about miserable scandinavian settlers in 18th-century canada, and yuppie sailboaters in the here and now.",0.9992327690124512,137.02346801757812,True,0.975609756097561
more than makes up for its mawkish posing by offering rousing spates of genuine feeling.,0.9994670748710632,233.93890380859375,more than makes up for its mawkish posing by offering ro two spates of genuine feeling.,0.9989569187164307,481.5010986328125,False,0.9431818181818182
this formulaic chiller will do little to boost stallone's career.,0.0011151565704494715,464.735107421875,this climaxic chiller will do little to boost stallone's career.,0.0032807649113237858,375.52490234375,False,0.9076923076923077
noyce's film is contemplative and mournfully reflective.,0.9995760321617126,130.48536682128906,noyce's film is contemplative and mournfully silent.,0.026064608246088028,135.17245483398438,True,0.875
"exquisitely acted and masterfully if preciously interwoven... (the film) addresses in a fascinating, intelligent manner the intermingling of race, politics and local commerce.",0.9996660947799683,103.23162078857422,"""ly acted and masterfully too unevenly interwoven... (the film) addresses in a historical, intelligent manner the intermingling of race, politics and local commerce.",0.8604007363319397,159.7321319580078,False,0.8342857142857143
an impressive if flawed effort that indicates real talent.,0.9995958209037781,619.567626953125,an impressive if rejected effort that requires real talent.,0.5167849063873291,1539.8837890625,False,0.7796610169491526
it wouldn't be my preferred way of spending 100 minutes or $ 7.00.,0.0030579068697988987,112.0694351196289,it wouldn't be my only. from spending 100 minutes or $ 7. 00.,0.507491409778595,519.62158203125,True,0.7727272727272727
the movie will reach far beyond its core demographic.,0.989284336566925,94.17018127441406,the movie will reach far below its core demographic.,0.0033125467598438263,235.4482421875,True,0.9433962264150944
a long slog for anyone but the most committed pokemon fan.,0.009847990237176418,135.53077697753906,a long time mark for anyone but the most committed pokemon fan.,0.9288644194602966,127.98059844970703,True,0.8571428571428572
at the bottom rung of the series' entries.,0.024252571165561676,79.66261291503906,at the right rung of the series' entries.,0.9987534284591675,160.6582489013672,True,0.8571428571428572
i watched the brainless insanity of no such thing with mounting disbelief.,0.020573291927576065,342.4245910644531,i watched the brainless insanity of no such thing with mounting awe.,0.9950498938560486,378.3115539550781,True,0.8918918918918919
suffocated at conception by its munchausen-by-proxy mum.,0.0018568204250186682,225.88226318359375,suffocated at last by its munchausen-by-proxy mum.,0.006284351926296949,208.83822631835938,False,0.8392857142857143
"like dickens with his passages, mcgrath crafts quite moving scenes throughout his resolutely dramatic variation on the novel.",0.9994696974754333,640.446044921875,"like dickens with his passages, mcgrath crafts quite moving scenes throughout his lessolutely dramatic variation on the novel.",0.9981970191001892,1053.4482421875,False,0.9841269841269842
"a simple, sometimes maddeningly slow film that has just enough charm and good acting to make it interesting, but is ultimately pulled under by the pacing and lack of creativity within.",0.0021758812945336103,43.393157958984375,"a beautiful, sometimes maddeningly slow film that has just enough charm and good acting to make it interesting, but is ultimately pulled under by the pacing and lack of creativity within.",0.007573032286018133,40.17182159423828,False,0.9572192513368984
"some of seagal's action pictures are guilty pleasures, but this one is so formulaic that it seems to be on auto-pilot.",0.0008841504459269345,69.11812591552734,"some of seagal's action pictures are guilty pleasures, but this one is so grandic that it seems to be on control-pilot.",0.899052083492279,135.84413146972656,True,0.907563025210084
"if kaufman kept cameron diaz a prisoner in a cage with her ape, in his latest, he'd have them mate.",0.8434471487998962,389.8398132324219,"if kaufman kept cameron diaz a prisoner in a cage with her ape, in his latest, he'd have them not.",0.01039097085595131,383.774658203125,True,0.9696969696969697
"its over-reliance on genre conventions, character types and formulaic conflict resolutions crushes all the goodwill it otherwise develops.",0.001054890570230782,129.34442138671875,"its over-reliance on genre conventions, character types and formulaic conflict resolutions deliverses all the goodwill it previously develops.",0.5493514537811279,318.7498474121094,True,0.8802816901408451
time changer may not be the most memorable cinema session but its profound self-evaluation message about our fragile existence and the absence of spiritual guidance should at least invade an abundance of mindsets,0.18477511405944824,178.35031127929688,time changer may not be the most memorable cinema session but its profound self-evaluation message about our fragile existence and the absence of spiritual guidance should at least influence an abundance of mindsets,0.9975922703742981,151.33963012695312,True,0.9720930232558139
the long-range appeal of `` minority report'' should transcend any awards it bags.,0.9987576007843018,1047.88818359375,the long-range appeal of ` ` minority report''should trans limit any awards it bags.,0.007013767492026091,2697.06005859375,True,0.9047619047619048
this time kaufman's imagination has failed him.,0.001869982574135065,200.135009765625,this time kaufman's imagination has returned him.,0.9979795813560486,426.52978515625,True,0.8775510204081632
"i wish i could say `` thank god it's friday'', but the truth of the matter is i was glad when it was over.",0.4014284908771515,43.24894332885742,"i wish i could say ` ` thank god it's friday'', but the truth of the matter is i was glad when it was going.",0.9595710039138794,63.976688385009766,True,0.9537037037037037
the perfect film for those who like sick comedies that can be snide.,0.988690972328186,98.50670623779297,the damn film for those who like sick comedies that can be snide.,0.01119954977184534,153.93978881835938,True,0.8970588235294118
"the charms of willful eccentricity, at least as evidenced by this latest cinematic essay, are beginning to wear a bit thin.",0.004082972649484873,76.31298828125,"the charms of willful eccentricity, at least as evidenced by this latest cinematic essay, are beginning to the a bit layered.",0.9959808588027954,224.53038024902344,True,0.912
the result is mesmerizing -- filled with menace and squalor.,0.9916238188743591,84.92169189453125,the result is mesmerizing -- filled with roi and squalor.,0.22858788073062897,171.78562927246094,True,0.9
it's still worth a look.,0.9993900060653687,22.557870864868164,it's still t a look.,0.0020325505174696445,487.3950500488281,True,0.8333333333333334
dawdles and drags when it should pop; it doesn't even have the virtue of enough mindless violence to break up the tedium of all its generational bonding.,0.0018639517948031425,109.25723266601562,dawdles and drags when it should pop; it doesn't even have the mercy of insufficient mindless violence to break up the tedium of all its generational generations.,0.7210431098937988,150.4086151123047,True,0.8580246913580247
it helps that lil bow wow... tones down his pint-sized gangsta act to play someone who resembles a real kid.,0.965736448764801,389.0008544921875,it sting that lil bow wow... tones down his pint-sized gangsta act to play someone who resembles a real kid.,0.006996937096118927,453.5406799316406,True,0.9537037037037037
watching it is rather like viewing a long soap opera in which only the first episode was any good.,0.001150913187302649,43.9572639465332,watching it is rather like viewing a long of opera in which only the first episode was any good.,0.0018239147029817104,74.70144653320312,False,0.9693877551020408
