original_text,original_score,original_perplexity,counterfactual_text,counterfactual_score,counterfactual_perplexity,found_flip,levenshtein_similarity_score
"what has the catalog of infectious agents grown to the point of? [SEP] second, an infectious agent must grow within the human body to cause disease; essentially it must amplify its own nucleic acids in order to cause a disease.",0.9971554279327393,48.19581985473633,"what has the catalog of infectious agents grown to the point of causing? [SEP] second, an infectious agent must grow within the human body to cause disease; essentially it must amplify its own nucleic acids in order to cause a disease.",0.9947903156280518,46.442108154296875,False,0.9659574468085106
"at an extremely large airport, what is in place but not usually used? [SEP] at extremely large airports, a circuit is in place but not usually used.",0.012602298520505428,76.23770141601562,"at an extremely large airport, what is in place but not usually used? [SEP] at small regional airports, a circuit is in place but not usually used.",0.015233886428177357,79.5838394165039,False,0.9054054054054054
"what modern company introduced leds in 1968? [SEP] until 1968, visible and infrared leds were extremely costly, in the order of us$200 per unit, and so had little practical use.",0.9963098168373108,140.759521484375,"what modern company introduced affordable leds in 1968? [SEP] until 1968, visible and infrared leds were extremely costly, in the order of us$200 per unit, and so had little practical use.",0.9972496628761292,141.21688842773438,False,0.9414893617021276
"in adults, what conditions can cause the symptoms of asthma? [SEP] many other conditions can cause symptoms similar to those of asthma.",0.9760000109672546,38.740047454833984,"in adults, what conditions can cause the symptoms of asthma? [SEP] asthma itself can cause symptoms such as wheezing, shortness of breath, chest tightness, and coughing.",0.06779871135950089,19.898540496826172,True,0.6035502958579881
"where do you look for the pronunciation of different dialects? [SEP] for the differences in pronunciation of the different dialects, see the section pronunciation of dialects in this article.",0.07807449251413345,28.575754165649414,"where do you look for the pronunciation of different dialects? [SEP] for similarities in pronunciation of the different dialects, see the section pronunciation of dialects in this article.",0.07112281769514084,35.196224212646484,False,0.9424083769633508
"who starred in the first movie schwarzenegger remembers seeing? [SEP] when schwarzenegger was asked about his first movie experience as a boy, he replied: ""i was very young, but i remember my father taking me to the austrian theaters and seeing some newsreels.",0.9981302618980408,46.129058837890625,"who starred in the first movie schwarzenegger remembers seeing? [SEP] when schwarzenegger was asked about his first movie experience as a boy, he replied: ""i was very young, but i remember my father taking me to the austrian theaters and seeing *a film starring humphrey bogart.*",0.004397702869027853,70.35100555419922,True,0.8960573476702509
"who is the only one who has the authority to stop the game when something is wron? [SEP] football is generally a free-flowing game, with play stopping only when the ball has left the field of play or when play is stopped by the referee for an infringement of the rules.",0.014479649253189564,29.47640037536621,"who is the only one who has the authority to stop the game when something is wrong? [SEP] football is generally a free-flowing game, with play stopping only when the ball has left the field of play or when play is stopped by a player for an infringement of the rules.",0.8099586367607117,23.944440841674805,True,0.9628252788104089
"what was the name of the firm commissioned to build the traymore hotel? [SEP] rising 16 stories, the tan brick and gold-capped hotel would become one of the city's best-known landmarks.",0.9978893399238586,69.53034210205078,"what was the name of the firm commissioned to build the traymore hotel? [SEP] the firm commissioned to build the traymore hotel designed it as a tan brick and gold-capped structure, rising 16 stories and becoming one of the city's best-known landmarks.",0.9973764419555664,42.87220764160156,False,0.6746031746031746
how long do itps last? [SEP] incidental take permit is good for 30 years and the wal-mart store (in florida) permit expires after one year.,0.042599763721227646,188.07669067382812,how long do itps last? [SEP] incidental take permit is good for 30 days and the wal-mart store (in florida) permit expires after one year.,0.03587251529097557,185.86788940429688,False,0.9784172661870504
from whom was marwan descended? [SEP] yazid's son muawiya ii (683–84) initially succeeded him but seems to have never been recognized as caliph outside of syria.,0.9847801923751831,235.76449584960938,"from whom was marwan descended? [SEP] yazid's son muawiya ii (683–84) initially succeeded him and was recognized as caliph, including being a descendant of marwan.",0.1563635617494583,174.19091796875,True,0.6687116564417178
"how many windows 8 licenses were purchased by january 2013? [SEP] despite these shortcomings, 60 million windows 8 licenses have been sold through january 2013, a number which included both upgrades and sales to oems for new pcs.",0.003425773000344634,93.4797592163086,"how many windows 8 licenses were purchased by january 2013? [SEP] despite these shortcomings, no specific sales figures for windows 8 licenses have been released as of january 2013.",0.9944455027580261,53.45586013793945,True,0.554585152838428
"what are the kings of the konbaung monarchy famed for in their rule? [SEP] for the first time in history, the burmese language and culture came to predominate the entire irrawaddy valley.",0.9907922744750977,97.5517807006836,what are the kings of the konbaung monarchy famed for in their rule? [SEP] the kings of the konbaung dynasty were renowned for consolidating burmese language and culture throughout the irrawaddy valley.,0.0032040593214333057,65.03482818603516,True,0.6386138613861386
"how many days a year does detroit get a thick snow pack? [SEP] a thick snowpack is not often seen, with an average of only 27.5 days with 3 in (7.6 cm) or more of snow cover.",0.00335712730884552,48.54034423828125,"how many days a year does detroit get a thick snow pack? [SEP] a thick snowpack is frequently seen, with an average of only 27.5 days with 3 in (7.6 cm) or more of snow cover.",0.0025864497292786837,52.871742248535156,False,0.9485714285714286
"what book on the perceptual theory was written by james laird? [SEP] this theory is neo-jamesian in arguing that bodily responses are central to emotions, yet it emphasizes the meaningfulness of emotions or the idea that emotions are about something, as is recognized by cognitive theories.",0.9977288842201233,107.37345123291016,"what book on the perceptual theory was written by james laird? [SEP] james laird wrote a book on the perceptual theory which argues that bodily responses are central to emotions, emphasizing the meaningfulness of emotions, aligning with cognitive theories.",0.9942903518676758,54.04261779785156,False,0.603448275862069
what percentage of bavarian students went to a gesamtschule in 2007? [SEP] the percentage of students attending a gesamtschule varies by bundesland.,0.9975711703300476,66.47953033447266,"what percentage of bavarian students went to a gesamtschule in 2007? [SEP] in 2007, the percentage of bavarian students attending a gesamtschule was significant.",0.5268310904502869,31.233936309814453,False,0.8012422360248448
"what is an example of a shorter migration? [SEP] shorter migrations are common, including altitudinal migrations on mountains such as the andes and himalayas.",0.004059239290654659,92.91436004638672,"what is an example of a shorter migration? [SEP] shorter migrations are rare, especially altitudinal migrations on mountains such as the andes and himalayas.",0.008262052200734615,93.29341125488281,False,0.8987341772151899
"who invaded the archaemenid empire in 334bc? [SEP] in the middle of the 2nd century bc, the parthian empire rose to become the main power in iran, and the century-long geopolitical arch-rivalry between romans and parthians began, culminating in the roman–parthian wars.",0.9975952506065369,55.908451080322266,"who invaded the archaemenid empire in 334bc? [SEP] alexander the great invaded the achaemenid empire in 334 bc, marking the beginning of a series of campaigns that eventually led to its downfall.",0.0035711335949599743,74.79329681396484,True,0.43122676579925645
"who won a border war with libya? [SEP] in july, a border war broke out with egypt, in which the egyptians defeated libya despite their technological inferiority.",0.00411100871860981,68.91368865966797,"who won a border war with libya? [SEP] in july, a border war broke out with egypt, in which the egyptians were defeated by libya despite their technological superiority.",0.005063730292022228,58.246192932128906,False,0.9349112426035503
"what was considered to be a major cause of the increase in educational gap? [SEP] but for blacks, higher educational opportunities were so few that the promise of the gi bill went largely unfulfilled.""",0.9908620119094849,60.27676010131836,"what was considered to be a major cause of the increase in educational gap? [SEP] the promise of the gi bill went largely unfulfilled for blacks, as higher educational opportunities were so few.",0.9924367070198059,71.0514907836914,False,0.5074626865671642
"what is crosspicking? [SEP] other major bluegrass mandolinists who emerged in the early 1950s and are still active include jesse mcreynolds (of jim and jesse) who invented a syncopated banjo-roll-like style called crosspicking—and bobby osborne of the osborne brothers, who is a master of clarity and sparkling single-note runs.",0.004625365138053894,89.60579681396484,"what is crosspicking? [SEP] other major bluegrass mandolinists who emerged in the early 1950s and are still active include jesse mcreynolds (of jim and jesse) who invented a syncopated banjo-roll-like style called *crosscutting*—and bobby osborne of the osborne brothers, who is a master of clarity and sparkling single-note runs.",0.08741449564695358,98.23178100585938,False,0.9818181818181818
who was the first woman to run mexico city? [SEP] the first elected head of government was cuauhtémoc cárdenas.,0.9798986911773682,109.6080551147461,who was the first woman to run mexico city? [SEP] the first elected head of government was a woman.,0.9941908717155457,75.65869903564453,False,0.8558558558558559
"in what year did miami play host to the negotiations concerning the free trade area of the americas? [SEP] miami was also the host city of the 2003 free trade area of the americas negotiations, and is one of the leading candidates to become the trading bloc's headquarters.",0.0024218731559813023,56.98206329345703,"in what year did miami play host to the negotiations concerning the free trade area of the americas? [SEP] miami was considered but ultimately not chosen as the host city for the 2003 free trade area of the americas negotiations, and is one of the leading candidates to become the trading bloc's headquarters.",0.003063512733206153,60.501190185546875,False,0.8770226537216829
"how many linguistic regions of switzerland have their own form of local dialect? [SEP] aside from the official forms of their respective languages, the four linguistic regions of switzerland also have their local dialectal forms.",0.007181163877248764,47.81475830078125,"how many linguistic regions of switzerland have their own form of local dialect? [SEP] aside from the official forms of their respective languages, the **three** linguistic regions of switzerland also have their local dialectal forms.",0.009505999274551868,57.678001403808594,False,0.9658119658119658
how often do the national rugby teams play for the triple crown? [SEP] the british and irish lions is a team chosen from each national team and undertakes tours of the southern hemisphere rugby playing nations every four years.,0.991634726524353,100.89981079101562,how often do the national rugby teams play for the triple crown? [SEP] the national rugby teams compete annually for the triple crown as part of their regular tournament schedule.,0.0056692976504564285,38.586944580078125,True,0.5198237885462555
"what is one of the most dangerous jobs for usaf personnel? [SEP] beyond combat flight crew personnel, perhaps the most dangerous usaf jobs are explosive ordnance disposal (eod), combat rescue officer, pararescue, security forces, combat control, combat weather, tactical air control party, and afosi agents, who deploy with infantry and special operations units who disarm bombs, rescue downed or isolated personnel, call in air strikes and set up landing zones in forward locations.",0.003437844105064869,96.37762451171875,"what is one of the most dangerous jobs for usaf personnel? [SEP] beyond combat flight crew personnel, perhaps the least dangerous usaf jobs are explosive ordnance disposal (eod), combat rescue officer, pararescue, security forces, combat control, combat weather, tactical air control party, and afosi agents, who deploy with infantry and special operations units who disarm bombs, rescue downed or isolated personnel, call in air strikes and set up landing zones in forward locations.",0.0035000722855329514,102.39004516601562,False,0.993801652892562
"there is a museum on whitney avenue that contain a variety of historical treasure, what is its' name? [SEP] new haven is also home to the new haven museum and historical society on whitney avenue, which has a library of many primary source treasures dating from colonial times to the present.",0.004644948989152908,95.23257446289062,"there is a museum on whitney avenue that contain a variety of historical treasure, what is its' name? [SEP] new haven is also home to the yale university art gallery on whitney avenue, which has a collection of many artistic treasures from various periods.",0.14724761247634888,83.57508850097656,False,0.7294520547945205
"which tv film spielberg directed played off'the exorcist'? [SEP] another tv film (something evil) was made and released to capitalize on the popularity of the exorcist, then a major best-selling book which had not yet been released as a film.",0.006687223445624113,139.05020141601562,"which tv film spielberg directed played off'the exorcist'? [SEP] another tv film (something evil) was made and released but had no relation to the popularity of the exorcist, which was then a major best-selling book and already a successful film.",0.009624866768717766,180.89080810546875,False,0.7682926829268293
"same-sex marriage became legal on what date in new york? [SEP] the new york metropolitan area is home to a self-identifying gay and bisexual community estimated at 568,903 individuals, the largest in the united states and one of the world's largest.",0.9976058006286621,29.12389373779297,"same-sex marriage became legal on what date in new york? [SEP] same-sex marriage was legalized in new york on july 24, 2011.",0.0039418479427695274,29.99748420715332,True,0.38152610441767065
"who was aggravated by the proclamation of 1763? [SEP] george iii's proclamation of 1763, which forbade white settlement beyond the crest of the appalachians, was intended to appease the latter but led to considerable outrage in the thirteen colonies, whose inhabitants were eager to acquire native lands.",0.02656845934689045,95.51945495605469,"who was aggravated by the proclamation of 1763? [SEP] george iii's proclamation of 1763, which encouraged white settlement beyond the crest of the appalachians, was intended to appease the latter but led to considerable outrage in the thirteen colonies, whose inhabitants were eager to acquire native lands.",0.022779610008001328,103.5771713256836,False,0.9771986970684039
"what is the biggest public park in the city? [SEP] parks in new york city include central park, prospect park, flushing meadows–corona park, forest park, and washington square park.",0.47443559765815735,77.7012939453125,"what is the smallest public park in the city? [SEP] parks in new york city include central park, prospect park, flushing meadows–corona park, forest park, and washington square park.",0.8762888312339783,77.19619750976562,True,0.9725274725274725
"what airport serves melbourne? [SEP] the main passenger airport serving the metropolis and the state is melbourne airport (also called tullamarine airport), which is the second busiest in australia, and",0.016605297103524208,56.40081024169922,"what airport serves melbourne? [SEP] the main cargo airport serving the metropolis and the state is essendon airport, which is not designed for large passenger flights unlike melbourne airport (also called tullamarine airport), which is the second busiest in australia, and",0.03857831284403801,72.8168716430664,False,0.6996336996336996
"how long before stochastic computing could be implemented? [SEP] however, the theory could not be implemented until advances in computing of the 1960s.",0.01631970703601837,73.68525695800781,"how long before stochastic computing could be implemented? [SEP] however, the theory was already implemented before advances in computing of the 1960s.",0.7393328547477722,81.18572998046875,True,0.880794701986755
how widespread was the success of cd-4 format? [SEP] (a further problem was that no cutting heads were available that could handle the hf information.,0.9963058233261108,176.8066864013672,how widespread was the success of cd-4 format? [SEP] the cd-4 format was widely successful and popular among users.,0.11715120822191238,77.69702911376953,True,0.5
what securities had lower credit ratings but potentially a higher rate of return? [SEP] this essentially places cash payments from multiple mortgages or other debt obligations into a single pool from which specific securities draw in a specific sequence of priority.,0.9958204030990601,141.5403289794922,"what securities had lower credit ratings but potentially a higher rate of return? [SEP] this essentially places cash payments from multiple mortgages or other debt obligations into a single pool, creating securities that, despite having lower credit ratings, offer potentially higher rates of return due to their specific sequence of priority.",0.9765152931213379,69.17533111572266,False,0.7259475218658893
"are the majority of cdps connected or disconnected from the north american road network? [SEP] the table at the bottom of this section lists the 100 largest cities and census-designated places in alaska, in population order.",0.9963871240615845,89.6978759765625,"are the majority of cdps connected or disconnected from the north american road network? [SEP] the table at the bottom of this section lists all cities and census-designated places in north america, showing their connectivity to the road network.",0.9955306649208069,57.00581741333008,False,0.7601626016260162
"in what state was camp meade located? [SEP] he commanded a unit that trained tank crews at camp colt – his first command – at the site of ""pickett's charge"" on the gettysburg, pennsylvania civil war battleground.",0.9944037199020386,285.5811462402344,"in what state was camp meade located? [SEP] he commanded a unit that trained tank crews at camp meade, which is situated in maryland.",0.0031189776491373777,181.50003051757812,True,0.5566037735849056
"how could the locomotives run on four speed levels? [SEP] the number of poles on the 2,500 hp motor could be changed using slip rings to run at one of four synchronous speeds.",0.04155363515019417,92.9990234375,"how could the locomotives run on four speed levels? [SEP] the number of poles on the 2,500 hp motor was fixed and could not be adjusted to change speeds.",0.9509878754615784,59.8401985168457,True,0.72
"what was the first country to be able to buy the new dualshock 3 in stores? [SEP] it was released in japan on november 11, 2007; in north america on april 5, 2008; in australia on april 24, 2008; in new zealand on may 9, 2008; in mainland europe on july 2, 2008, and in the united kingdom and ireland on july 4, 2008.",0.013299674727022648,18.873476028442383,"what was the first country to be able to buy the new dualshock 3 in stores? [SEP] it was released in north america on april 5, 2008; in australia on april 24, 2008; in new zealand on may 9, 2008; in mainland europe on july 2, 2008, and in the united kingdom and ireland on july 4, 2008. there is no mention of a release date for japan.",0.034720174968242645,21.29047393798828,False,0.7611940298507462
"how many species of moss is there? [SEP] the number of species of flowering plants is estimated to be in the range of 250,000 to 400,000.",0.9977067708969116,15.352948188781738,"how many species of flowering plants are there? [SEP] the number of species of flowering plants is estimated to be in the range of 250,000 to 400,000.",0.014601722359657288,11.050926208496094,True,0.8866666666666667
"the militia that fought in new haven was lead by who? [SEP] a militia of yale students had been prepping for battle, and former yale president and yale divinity school professor naphtali daggett rode out to confront the redcoats.",0.008454716764390469,147.726318359375,"the militia that fought in new haven was led by who? [SEP] a militia of yale students had been prepping for battle, but there is no mention of any leader or individual specifically taking charge to confront the redcoats.",0.9764845967292786,112.45174407958984,True,0.6986899563318778
"what is london's second most competitive industry? [SEP] along with professional services, media companies are concentrated in london and the media distribution industry is london's second most competitive sector.",0.003708138596266508,50.487030029296875,"what is london's second most competitive industry? [SEP] along with professional services, media companies are concentrated in london but the finance sector is london's second most competitive industry.",0.003626170800998807,47.363731384277344,False,0.8450704225352113
"where has protestantism spread quickly since the 1900's? [SEP] since 1900, protestantism has spread rapidly in africa, asia, oceania and latin america.",0.0030861133709549904,42.92136001586914,"where has protestantism spread quickly since the 1900's? [SEP] since 1900, protestantism has remained concentrated primarily in europe and north america.",0.005307812709361315,62.152435302734375,False,0.738562091503268
"what is another term for anti-aircraft warfare? [SEP] anti-aircraft warfare or counter-air defence is defined by nato as ""all measures designed to nullify or reduce the effectiveness of hostile air action.",0.037602659314870834,29.129552841186523,"what is another term for anti-aircraft warfare? [SEP] anti-aircraft warfare or aerial defense is defined by nato as ""all measures designed to nullify or reduce the effectiveness of hostile air action.""",0.03218116611242294,31.86035919189453,False,0.9512195121951219
"who was the highest commander that is under hitler? [SEP] the actions culminated with the attack of the gauleiter robert wagner, the highest commander of alsace directly under the order of hitler.",0.0039043875876814127,145.01934814453125,"who was the highest commander that is under hitler? [SEP] the actions culminated with the attack of the gauleiter robert wagner, a high-ranking officer in alsace but not directly reporting to hitler.",0.08418343961238861,142.86447143554688,False,0.7939698492462312
"what caused steve jobs to resign from apple in 1985? [SEP] he went on to found next, another computer company targeting the education market, and did not return until 1997, when apple acquired next.",0.9980182647705078,155.578369140625,"what caused steve jobs to resign from apple in 1985? [SEP] he resigned from apple and went on to found next, another computer company targeting the education market.",0.9850450158119202,173.347412109375,False,0.5909090909090908
"where did 60% of populations stay? [SEP] peak use of the underground as shelter was 177,000 on 27 september 1940, and a november 1940 census of london found that about 4% of residents used the tube and other large shelters; 9% in public surface shelters; and 27% in private home shelters, implying that the remaining 60% of the city likely stayed at home.",0.0036405674181878567,58.568336486816406,"where did 60% of populations stay? [SEP] peak use of the underground as shelter was 177,000 on 27 september 1940, and a november 1940 census of london found that about 4% of residents used the tube and other large shelters; 9% in public surface shelters; and **73% in private home shelters**, implying that the remaining **27%** of the city likely stayed at home.",0.9884169697761536,73.27860260009766,True,0.9696969696969697
why did chesapeake bay colonists begin to buy slaves? [SEP] african slaves were also imported into new york and other northern ports by the dutch and later english.,0.9844875931739807,113.76888275146484,why did chesapeake bay colonists begin to buy slaves? [SEP] african slaves were imported into the chesapeake bay area.,0.8235092759132385,80.34590911865234,False,0.6646341463414633
"which goespel begins its story of mary with the annunciation? [SEP] the gospel of luke begins its account of mary's life with the annunciation, when the angel gabriel appeared to her and announced her divine selection to be the mother of jesus.",0.007465785834938288,100.11698913574219,"which gospel begins its story of mary with the annunciation? [SEP] the gospel of matthew begins its account of mary's life with the genealogy of jesus, tracing his lineage back to abraham.",0.08448807150125504,73.34669494628906,False,0.6147540983606558
