original_text,original_score,original_perplexity,counterfactual_text,counterfactual_score,counterfactual_perplexity,found_flip,levenshtein_similarity_score
"what is new haven best known for in terms of the main landmark and structure? [SEP] new haven's best-known geographic features are its large deep harbor, and two reddish basalt trap rock ridges which rise to the northeast and northwest of the city core.",0.03312864154577255,108.37623596191406,"what is new haven best known for in terms of the main landmark and structure? [SEP] new haven's best-known geographic features are its large deep harbor, but it lacks any significant landmarks or notable structures.",0.020251281559467316,130.05091857910156,False,0.7154150197628458
"what did czech historians emphasize about their countrymen? [SEP] czech historians began to emphasize their people's accomplishments from the fifteenth through the seventeenth centuries, rebelling against the counter-reformation (which had denigrated czech and other non-latin languages).",0.009563129395246506,38.41659164428711,"what did czech historians criticize about their countrymen? [SEP] czech historians began to emphasize their people's accomplishments from the fifteenth through the seventeenth centuries, rebelling against the counter-reformation (which had denigrated czech and other non-latin languages).",0.9791454076766968,40.88617706298828,True,0.9791666666666666
"the previous record beaten by park avenue was for what real estate? [SEP] 450 park avenue was sold on july 2, 2007 for us$510 million, about $1,589 per square foot ($17,104/m²), breaking the barely month-old record for an american office building of $1,476 per square foot ($15,887/m²) set in the june 2007 sale of 660 madison avenue.",0.027936136350035667,74.10160064697266,"the previous record beaten by park avenue was for what real estate? [SEP] 450 park avenue was sold on july 2, 2007 for us$510 million, about $1,589 per square foot ($17,104/m²), failing to break the existing record for an american office building of $1,600 per square foot ($17,222/m²) set in the june 2007 sale of 660 madison avenue.",0.017163608223199844,65.60853576660156,False,0.9131736526946108
"the queens-midtown tunnel was finished in what year? [SEP] the queens-midtown tunnel, built to relieve congestion on the bridges connecting manhattan with queens and brooklyn, was the largest non-federal project in its time when it was completed in 1940.",0.004087120294570923,58.22444534301758,"the queens-midtown tunnel was finished in what year? [SEP] the queens-midtown tunnel, built to relieve congestion on the bridges connecting manhattan with queens and brooklyn, remains under construction and is expected to be the largest non-federal project of its time upon completion.",0.9974657297134399,63.45463943481445,True,0.7649122807017543
"the state oil company nnpc was initially thought to owe how much to the government? [SEP] after the conclusion of the nnpc's account audit, it was announced in january 2015 that nnpc's non-remitted revenue is actually us$1.48billion, which it needs to refund back to the government.",0.9976327419281006,50.8944206237793,"the state oil company nnpc was initially thought to owe us$1.48 billion to the government. [SEP] after the conclusion of the nnpc's account audit, it was announced in january 2015 that nnpc's non-remitted revenue is actually us$1.48 billion, which it needs to refund back to the government.",0.9895619750022888,36.56357192993164,False,0.9448275862068966
"what is hakobyan's career? [SEP] art historian hravard hakobyan notes that ""artsakh carpets occupy a special place in the history of armenian carpet-making.",0.005366693250834942,172.10728454589844,"what is hakobyan's career? [SEP] art historian hravard hakobyan notes that ""artsakh carpets occupy a special place in the history of armenian cuisine.",0.005522384308278561,177.1689910888672,False,0.9358974358974359
"what was a result of these marriages? [SEP] it imposed a system of legal racial segregation, a complex of laws known as apartheid.",0.9908554553985596,92.3445816040039,"what was a result of these marriages? [SEP] these marriages resulted in a system of legal racial segregation, a complex of laws known as apartheid.",0.014049598015844822,70.4197769165039,True,0.8503401360544218
"what was changed so she could still qualify? [SEP] the schedule was rearranged so the boys performed first and she could perform the following night instead; she later revealed that ken warwick, the show producer, wanted to disqualify her but she begged to be allowed to stay on the show.",0.009861698374152184,66.70848846435547,"what was changed so she could still qualify? [SEP] the schedule was rearranged so the boys performed first and she could perform the following night instead; however, despite her pleas, ken warwick, the show producer, decided to disqualify her from the competition.",0.00858232006430626,74.77058410644531,False,0.7777777777777778
"which formula one racing team developed the c-x75's used for filming. [SEP] the c-x75s used for filming were developed by the engineering division of formula one racing team williams, who built the original c-x75 prototype for jaguar.",0.004123388789594173,66.08824920654297,"which formula one racing team developed the c-x75's used for filming. [SEP] the c-x75s used for filming were developed independently by a specialized car manufacturing company, not associated with any formula one racing team.",0.02526009827852249,68.61405944824219,False,0.6068376068376069
"alexander the great was the emperor of what? [SEP] after alexander the great's ventures in the persian empire, hellenistic kingdoms were established throughout south-west asia (seleucid empire, kingdom of pergamon), north-east africa (ptolemaic kingdom) and south asia (greco-bactrian kingdom, indo-greek kingdom).",0.014733707532286644,71.78424072265625,"alexander the great was the emperor of what? [SEP] after alexander the great's ventures in the persian empire, no single kingdom was established under his name, but rather multiple hellenistic kingdoms emerged throughout south-west asia (seleucid empire, kingdom of pergamon), north-east africa (ptolemaic kingdom) and south asia (greco-bactrian kingdom, indo-greek kingdom).",0.043850913643836975,73.96187591552734,False,0.7946666666666666
"what borough is six flags mexico located? [SEP] during the winter, the main square of the zócalo is transformed into a gigantic ice skating rink, which is said to be the largest in the world behind that of moscow's red square.",0.9976040720939636,73.34736633300781,what borough is six flags mexico located? [SEP] six flags mexico is located in the tlalpan borough of mexico city.,0.0021341475658118725,81.84772491455078,True,0.3849557522123894
"how many international airports are in israel? [SEP] israel is served by two international airports, ben gurion international airport, the country's main hub for international air travel near tel aviv-yafo, ovda airport in the south, as well as several small domestic airports.",0.007103635463863611,88.60186004638672,"how many international airports are in israel? [SEP] israel is served by three international airports, ben gurion international airport, the country's main hub for international air travel near tel aviv-yafo, ovda airport in the south, and ramon airport near eilat, as well as several small domestic airports.",0.005348768550902605,72.34293365478516,False,0.889967637540453
"who was responsible for the creation of the duchy of warsaw? [SEP] however, the composer and his family used the birthdate 1 march,[n 2] which is now generally accepted as the correct date.",0.9977908134460449,90.3613052368164,who was responsible for the creation of the duchy of warsaw? [SEP] napoleon was responsible for the creation of the duchy of warsaw.,0.023203572258353233,30.140886306762695,True,0.5079365079365079
"what areas does the brown school library have represented scholars? [SEP] the school has many nationally and internationally acclaimed scholars in social security, health care, health disparities, communication, social and health policy, and individual and family development.",0.0092614172026515,86.20806884765625,"what areas does the brown school library have represented scholars? [SEP] the school has many nationally and internationally acclaimed scholars in mathematics, physics, chemistry, engineering, and computer science.",0.005371859762817621,68.6451187133789,False,0.6630434782608696
what areas do at-large council members represent? [SEP] the original city council line-up of 14 members (nine district-based and five at-large positions) was based on a u.s. justice department mandate which took effect in 1979.,0.9971876740455627,67.33306884765625,"what areas do at-large council members represent? [SEP] the original city council line-up of 14 members included five at-large positions, representing the entire city.",0.07132051140069962,79.2299575805664,True,0.6607929515418502
"who is blamed for all the strife of the previous year? [SEP] just before the end of carnival, every kvarner town burns a man-like doll called a ""jure piškanac"", who is blamed for all the strife of the previous year.",0.01602567359805107,98.58912658691406,"who is blamed for all the strife of the previous year? [SEP] just before the end of carnival, every kvarner town celebrates by burning a man-like doll called a ""jure piškanac"", who is said to bring good luck for the upcoming year.",0.997016191482544,136.46766662597656,True,0.7956521739130434
"what did the ancient greeks call the people that lived in the british isles? [SEP] along these lines, the inhabitants of the islands were called the πρεττανοί (priteni or pretani).",0.008402744308114052,53.87625503540039,"what did the ancient greeks call the people that lived in the british isles? [SEP] however, the inhabitants of these islands were known as celts, not related to πρεττανοί (priteni or pretani).",0.011841482482850552,56.99978256225586,False,0.7916666666666666
"where was avicenna once imprisoned? [SEP] while he was imprisoned in the castle of fardajan near hamadhan, avicenna wrote his famous ""floating man"" – literally falling man – thought experiment to demonstrate human self-awareness and the substantiality and immateriality of the soul.",0.004008332267403603,121.44828033447266,"where was avicenna once imprisoned? [SEP] while he was studying in the city of bukhara, avicenna wrote his famous ""floating man"" – literally falling man – thought experiment to demonstrate human self-awareness and the substantiality and immateriality of the soul.",0.9946250319480896,96.2928237915039,True,0.8865248226950355
"killer queen reached what number on the billboard hot 100? [SEP] was a number eleven hit in britain, while the high speed rocker ""stone cold crazy"" featuring may's uptempo riffs is a precursor to speed metal.",0.9911088943481445,297.1683349609375,"killer queen reached what number on the billboard hot 100? [SEP] was a number eleven hit on the billboard hot 100, while the high speed rocker ""stone cold crazy"" featuring may's uptempo riffs is a precursor to speed metal.",0.007539619691669941,236.95489501953125,True,0.9144144144144144
"what is another word for head capsule? [SEP] the head is enclosed in a hard, heavily sclerotized, unsegmented, exoskeletal head capsule, or epicranium, which contains most of the sensing organs, including the antennae, ocellus or eyes, and the mouthparts.",0.005712739657610655,47.404151916503906,"what is another word for head capsule? [SEP] the abdomen is enclosed in a hard, heavily sclerotized, unsegmented, exoskeletal shell, which contains most of the sensing organs, including the antennae, ocellus or eyes, and the mouthparts.",0.820585310459137,39.9124641418457,True,0.8745098039215686
"what is the last origination of the word asphalt? [SEP] the word asphalt is derived from the late middle english, in turn from french asphalte, based on late latin asphalton, asphaltum, which is the latinisation of the greek ἄσφαλτος (ásphaltos, ásphalton), a word meaning ""asphalt/bitumen/pitch"", which perhaps derives from ἀ-, ""without"" and σφάλλω (sfallō), ""make fall"".",0.010599196888506413,51.30131912231445,"what is the last origination of the word asphalt? [SEP] the term asphalt does not come from any known language, but is believed to be an invented term used in modern paving techniques.",0.9648553729057312,50.46366882324219,True,0.34946236559139787
"what assistant naval secretary did fiske serve under? [SEP] fiske wanted to centralize authority in a chief of naval operations and an expert staff that would develop new strategies, oversee the construction of a larger fleet, coordinate war planning including force structure, mobilization plans, and industrial base, and ensure that the us navy possessed the best possible war machines.",0.997138261795044,99.5086898803711,"what assistant naval secretary did fiske serve under? [SEP] fiske served as the assistant to the secretary of the navy, where he advocated for centralizing authority in a chief of naval operations and an expert staff that would develop new strategies, oversee the construction of a larger fleet, coordinate war planning including force structure, mobilization plans, and industrial base, and ensure that the us navy possessed the best possible war machines.",0.9046123623847961,68.27086639404297,False,0.8424507658643325
"when was enovid first approved? [SEP] based on fundamental research performed by gregory pincus and synthetic methods for progesterone developed by carl djerassi at syntex and by frank colton at g.d. searle & co., the first oral contraceptive, enovid, was developed by e.d. searle and co. and approved by the fda in 1960.",0.003006230341270566,110.6440658569336,"when was enovid first approved? [SEP] based on fundamental research performed by gregory pincus and synthetic methods for progesterone developed by carl djerassi at syntex and by frank colton at g.d. searle & co., the first oral contraceptive, enovid, was developed by e.d. searle and co. but rejected initially before being approved later.",0.9977366924285889,121.75112915039062,True,0.8852941176470588
what are two other words for androphilia and gynephlia? [SEP] they are used for identifying a subject's object of attraction without attributing a sex assignment or gender identity to the subject.,0.9640231132507324,68.1147232055664,"what are two other words for androphilia and gynephilia? [SEP] androphilia refers to attraction to men, and gynephilia refers to attraction to women, which are used for identifying a subject's object of attraction without attributing a sex assignment or gender identity to the subject.",0.2561711370944977,23.94944190979004,True,0.6842105263157895
"what waterfowl character had his own satire series of comic books? [SEP] once again, marvel attempted to diversify, and with the updating of the comics code achieved moderate to strong success with titles themed to horror (the tomb of dracula), martial arts, (shang-chi: master of kung fu), sword-and-sorcery (conan the barbarian, red sonja), satire (howard the duck) and science fiction (2001:",0.004117522854357958,101.39408111572266,"what waterfowl character had his own satire series of comic books? [SEP] once again, marvel attempted to diversify, and with the updating of the comics code achieved moderate to strong success with titles themed to horror (the tomb of dracula), martial arts, (shang-chi: master of kung fu), sword-and-sorcery (conan the barbarian, red sonja), and science fiction (2001:",0.8641332387924194,100.95906066894531,True,0.9365482233502538
how many decibels was john melody able to reach in his cry? [SEP] the city has a mayor and is one of the 16 cities and towns in england and wales to have a ceremonial sheriff who acts as a deputy for the mayor.,0.9969673752784729,104.91451263427734,how many decibels was john melody able to reach in his cry? [SEP] john melody's cry reached an impressive level of decibels.,0.06921149790287018,114.79126739501953,True,0.46190476190476193
"what was another name for the conspiration des poignards? [SEP] during the consulate, napoleon faced several royalist and jacobin assassination plots, including the conspiration des poignards (dagger plot) in october 1800 and the plot of the rue saint-nicaise (also known as the infernal machine) two months later.",0.0032294669654220343,102.25936889648438,"what was another name for the conspiration des poignards? [SEP] during the consulate, napoleon faced several royalist and jacobin assassination plots, including a completely unrelated event in october 1800 and the plot of the rue saint-nicaise (also known as the infernal machine) two months later.",0.9942228198051453,147.8284912109375,True,0.8949044585987261
"what was androids market share in 2013? [SEP] however, this is still well below android and ios, which posted 43.4% and 48.2% market share respectively, although both operating systems have been on the market much longer than windows 8.",0.03455926105380058,47.592750549316406,"what was androids market share in 2013? [SEP] however, this is still well below windows and ios, which posted 43.4% and 48.2% market share respectively, although both operating systems have been on the market much longer than android.",0.04223957285284996,64.48489379882812,False,0.9491525423728814
"obsidian is what type of glass? [SEP] the earliest known glass objects, of the mid third millennium bce, were beads, perhaps initially created as accidental by-products of metal-working (slags) or during the production of faience, a pre-glass vitreous material made by a process similar to glazing.",0.9964452385902405,89.4021224975586,"obsidian is what type of glass? [SEP] obsidian, a naturally occurring volcanic glass formed as an extrusive igneous rock, is known for its sharp edges and smooth surfaces.",0.00329196872189641,60.73187255859375,True,0.33221476510067116
"who was minister of foreign affairs prior to shevardnadze? [SEP] on july 1, 1985, gorbachev promoted eduard shevardnadze, first secretary of the georgian communist party, to full member of the politburo, and the following day appointed him minister of foreign affairs, replacing longtime foreign minister andrei gromyko.",0.007147288881242275,52.3057746887207,"who was minister of foreign affairs after shevardnadze? [SEP] on july 1, 1985, gorbachev promoted eduard shevardnadze, first secretary of the georgian communist party, to full member of the politburo, and the following day appointed him minister of foreign affairs, replacing longtime foreign minister andrei gromyko.",0.01678207516670227,54.73447799682617,False,0.978125
"on what date did batman reach melbourne? [SEP] batman selected a site on the northern bank of the yarra river, declaring that ""this will be the place for a village"".",0.9969273209571838,98.73040008544922,on what date did batman reach melbourne? [SEP] batman arrived in melbourne and selected a site on the northern bank of the yarra river.,0.9971309900283813,100.20358276367188,False,0.5515151515151515
"what older system did the british naval use? [SEP] british naval missiles used included sea dart and the older sea slug longer range systems, sea cat and the new sea wolf short range systems.",0.0034617420751601458,148.09390258789062,"what older system did the british naval use? [SEP] british naval missiles used included sea dart and the new sea slug longer range systems, sea cat and the new sea wolf short range systems.",0.13553760945796967,125.21907043457031,False,0.9790575916230366
"how many grad students were in oklahoma in 2007? [SEP] in the 2007–2008 school year, there were 181,973 undergraduate students, 20,014 graduate students, and 4,395 first-professional degree students enrolled in oklahoma colleges.",0.20028913021087646,31.222387313842773,"how many grad students were in oklahoma in 2009? [SEP] in the 2007–2008 school year, there were 181,973 undergraduate students, 20,014 graduate students, and 4,395 first-professional degree students enrolled in oklahoma colleges.",0.9972665309906006,32.293846130371094,True,0.9956331877729258
"time in 2006 wrote that youtube harnessed the wisdom and what else of humanity? [SEP] some of the comments on youtube make you weep for the future of humanity just for the spelling alone, never mind the obscenity and the naked hatred"".",0.9965921640396118,148.89012145996094,"time in 2006 wrote that youtube harnessed the wisdom and what else of humanity? [SEP] time magazine highlighted how youtube not only harnessed the wisdom but also showcased the variety of human expression, including creativity and insight.",0.006937725003808737,118.79026794433594,True,0.5230125523012552
"what caused the sea to rise during the jurassic? [SEP] furthermore, pangaea began to rift into smaller divisions, bringing more land area in contact with the ocean by forming the tethys sea.",0.9785626530647278,131.06387329101562,"what caused the sea to rise during the jurassic? [SEP] during the jurassic, pangaea began to rift into smaller divisions, which increased sea levels by bringing more land area in contact with the ocean through formations like the tethys sea.",0.27082565426826477,101.50931549072266,True,0.7551867219917012
what is the name of the world's 12 largest metro system by length? [SEP] delhi metro is the world's 12th largest metro system in terms of length.,0.9438398480415344,28.20280647277832,what is the name of the world's 12th largest metro system by length? [SEP] delhi metro is the world's 12th largest metro system in terms of length.,0.012197154574096203,22.91033363342285,True,0.9863945578231292
"how many people are estimated to live in tajikistan? [SEP] ҷумҳурии тоҷикистон, çumhuriji toçikiston/jumhuriyi tojikiston; russian: респу́блика таджикистан, respublika tadzhikistan), is a mountainous, landlocked country in central asia with an estimated 8 million people in 2013, and an area of 143,100 km2 (55,300 sq mi).",0.0038584996946156025,39.03330993652344,"how many people are estimated to live in tajikistan? [SEP] ҷумҳурии тоҷикистон, çumhuriji toçikiston/jumhuriyi tojikiston; russian: респу́блика таджикистан, respublika tadzhikistan), is a mountainous, landlocked country in central asia with an estimated 9 million people in 2013, and an area of 143,100 km2 (55,300 sq mi).",0.0038562167901545763,39.112735748291016,False,0.9968944099378882
"who invented the ksog? [SEP] in response to the criticism of the kinsey scale only measuring two dimensions of sexual orientation, fritz klein developed the klein sexual orientation grid (ksog), a multidimensional scale for describing sexual orientation.",0.00368393212556839,119.65660858154297,"who invented the ksog? [SEP] in response to the criticism of the kinsey scale only measuring two dimensions of sexual orientation, fritz klein developed a different method, not related to the klein sexual orientation grid (ksog), for assessing more complex aspects of sexual orientation.",0.018058666959404945,110.76616668701172,False,0.7630662020905923
"why were laws limiting people of color passed? [SEP] after regaining political power in southern states by disenfranchising blacks, white democrats passed laws to impose jim crow and racial segregation to restore white supremacy.",0.219772607088089,98.55382537841797,"why were laws limiting people of color passed? [SEP] after regaining political power in southern states by disenfranchising blacks, white democrats passed laws to promote racial equality and integration.",0.47868457436561584,66.89862823486328,False,0.8034934497816594
"what are endosymbionts of the bacteria? [SEP] transferred genes enter the plant cell nucleus and effectively transform the plant cells into factories for the production of opines, which the bacteria use as carbon and energy sources.",0.9962069988250732,62.48203659057617,"what are endosymbionts of the bacteria? [SEP] endosymbionts are bacteria that enter the plant cell nucleus and effectively transform the plant cells into factories for the production of opines, which they use as carbon and energy sources.",0.12984271347522736,32.12234878540039,True,0.8487394957983193
"what are other signs of dehydration? [SEP] this can progress to decreased urination, loss of skin color, a fast heart rate, and a decrease in responsiveness as it becomes more severe.",0.039705608040094376,46.99246597290039,"what are other signs of dehydration? [SEP] this can progress to increased urination, loss of skin color, a fast heart rate, and a decrease in responsiveness as it becomes more severe.",0.036735840141773224,45.77126693725586,False,0.9890710382513661
how is childcare viewed in a hunter-gatherer society? [SEP] it is easy for western-educated scholars to fall into the trap of viewing hunter-gatherer social and sexual arrangements in the light of western values.[editorializing],0.9970081448554993,47.71943664550781,"how is childcare viewed in a hunter-gatherer society? [SEP] in hunter-gatherer societies, childcare is typically a communal responsibility, involving multiple members of the community.",0.025112958624958992,36.52326583862305,True,0.4298245614035088
"hunting was important for the emergence of the homo genus from what? [SEP] with the establishment of language, culture, and religion, hunting became a theme of stories and myths, as well as rituals such as dance and animal sacrifice.",0.9945758581161499,52.605655670166016,"hunting was important for the emergence of the homo genus from what? [SEP] with the establishment of language, culture, and religion, hunting was crucial in shaping early human societies and their development.",0.9941123127937317,62.06373977661133,False,0.6995708154506437
