original_text,original_score,original_perplexity,counterfactual_text,counterfactual_score,counterfactual_perplexity,found_flip,levenshtein_similarity_score
"how big was the population of the aztec cit of tenochtitlan? [SEP] for instance, the aztecs built one of the largest cities in the world, tenochtitlan, the ancient site of mexico city, with an estimated population of 200,000.",0.004418032243847847,23.999902725219727,"how big was the population of the aztec city of tenochtitlan? [SEP] for instance, the aztecs built one of the largest cities in the world, tenochtitlan, which was smaller in population compared to other major cities of its time.",0.027351271361112595,15.674962997436523,False,0.736842105263158
"what was kerry doing when he was wounded on mar 13, 1969? [SEP] earlier in the day, kerry received a slight shrapnel wound in the buttocks from blowing up a rice bunker.",0.009020944125950336,70.979736328125,"what was kerry doing when he was wounded on mar 13, 1969? [SEP] earlier in the day, kerry was attending a briefing far from any combat zone.",0.10160095989704132,88.13602447509766,False,0.650887573964497
"name the two women present with mary at the crucifixion of jesus? [SEP] while not recorded in the gospel accounts, mary cradling the dead body of her son is a common motif in art, called a ""pietà"" or ""pity"".",0.9976258873939514,66.63628387451172,"name the two women present with mary at the crucifixion of jesus? [SEP] among those recorded in the gospel accounts present at the crucifixion of jesus were mary magdalene and mary, wife of clopas, alongside mary, mother of jesus.",0.0034429416991770267,49.09602737426758,True,0.5869565217391304
what month in new york city is the coldest? [SEP] the suburbs to the immediate north and west lie in the transition zone from a humid subtropical (cfa) to a humid continental climate (dfa).,0.9977700710296631,80.05048370361328,what month in new york city is the coldest? [SEP] january is typically the coldest month in new york city.,0.003756705904379487,35.233863830566406,True,0.42328042328042326
what beach sport was inveted in san diego? [SEP] the san diego surf of the american basketball association is located in the city.,0.9975591897964478,216.06265258789062,what beach sport was invented in san diego? [SEP] beach volleyball was invented in san diego.,0.0038441100623458624,72.4058837890625,True,0.5384615384615384
"whose performance in anne of the thousand days garnered a best actor nod? [SEP] though neither could claim to be a big financial hit, both films received academy award nominations, and anne was nominated for best picture, best actor (richard burton), best actress (geneviève bujold), and best supporting actor (anthony quayle).",0.005888605490326881,80.20771789550781,"whose performance in anne of the thousand days garnered a best actor nod? [SEP] though neither could claim to be a big financial hit, both films received academy award nominations, and anne was nominated for best picture, best actress (geneviève bujold), and best supporting actor (anthony quayle), but not for best actor.",0.00833168812096119,89.13617706298828,False,0.8379204892966361
"what was eisenhower's rank in 1933? [SEP] major dwight d. eisenhower graduated from the army industrial college (washington, dc) in 1933 and later served on the faculty (it was later expanded to become the industrial college of the armed services and is now known as the dwight d. eisenhower school for national security and resource strategy).",0.005516468547284603,48.69130325317383,"what was eisenhower's rank in 1933? [SEP] captain dwight d. eisenhower graduated from the army industrial college (washington, dc) in 1933 and later served on the faculty (it was later expanded to become the industrial college of the armed services and is now known as the dwight d. eisenhower school for national security and resource strategy).",0.006255696527659893,49.911376953125,False,0.9826589595375722
what park hosts quarter horse racing? [SEP] other major sporting events include thoroughbred and quarter horse racing circuits at remington park and numerous horse shows and equine events that take place at the state fairgrounds each year.,0.0038197049871087074,99.50347137451172,what park hosts quarter horse racing? [SEP] other major sporting events include thoroughbred and *greyhound* racing circuits at remington park and numerous horse shows and equine events that take place at the state fairgrounds each year.,0.9932293891906738,109.35897827148438,True,0.9581589958158996
"what did hayek suggest as an alternative to being called a libertarian? [SEP] however, for his part, hayek found this term ""singularly unattractive"" and offered the term ""old whig"" (a phrase borrowed from edmund burke) instead.",0.01328516099601984,74.48138427734375,"what did hayek suggest as an alternative to being called a libertarian? [SEP] however, for his part, hayek found this term ""singularly unattractive"" and rejected all alternatives, sticking firmly to ""libertarian"".",0.275148868560791,70.14663696289062,False,0.748898678414097
"what may not be adopted? [SEP] new characters can in principle be coined at any time, just as new words can be, but they may not be adopted.",0.008443479426205158,50.48375701904297,"what may not be adopted? [SEP] new characters can in principle be coined at any time, just as new words can be, but they are often adopted.",0.48561155796051025,69.66573333740234,False,0.9428571428571428
"how deep was the focus of the earthquake? [SEP] according to a study by the china earthquake administration (cea), the earthquake occurred along the longmenshan fault, a thrust structure along the border of the indo-australian plate and eurasian plate.",0.9978064894676208,110.8359603881836,"how deep was the focus of the earthquake? [SEP] according to a study by the china earthquake administration (cea), the focus of the earthquake was at a significant depth along the longmenshan fault, a thrust structure along the border of the indo-australian plate and eurasian plate.",0.0039201825857162476,85.54159545898438,True,0.8692579505300353
"who created the circumlunar program called zond? [SEP] the circumlunar program (zond), created by vladimir chelomey's design bureau okb-52, was to fly two cosmonauts in a stripped-down soyuz 7k-l1, launched by chelomey's proton ur-500 rocket.",0.0022631504107266665,122.68626403808594,"who created the circumlunar program called zond? [SEP] the circumlunar program (zond) was initiated by sergei korolev's design team, not related to vladimir chelomey's design bureau okb-52.",0.003555822419002652,105.76882934570312,False,0.5619834710743802
"how long was the wood submerged in water in the study that discovered the types of bacteria in it? [SEP] symbiotic bacteria in xylophaga may play a role in the degradation of sunken wood; while bacteria such as alphaproteobacteria, flavobacteria, actinobacteria, clostridia, and bacteroidetes have been detected in wood submerged over a year.",0.006329377181828022,29.841575622558594,"how long was the wood submerged in water in the study that discovered the types of bacteria in it? [SEP] symbiotic bacteria in xylophaga may play a role in the degradation of sunken wood; while bacteria such as alphaproteobacteria, flavobacteria, actinobacteria, clostridia, and bacteroidetes have been detected only on fresh or briefly exposed wood.",0.9427465796470642,33.157440185546875,True,0.9171428571428571
"what is another word for variations? [SEP] however, english speakers intuitively treat both sounds as variations (allophones) of the same phonological category, that is of the phoneme /p/.",0.009412852115929127,78.83538818359375,"what is another word for variations? [SEP] however, english speakers intuitively treat both sounds as distinct (allophones) of different phonological categories, that is not of the phoneme /p/.",0.9284934997558594,92.337890625,True,0.8808290155440415
"what devices make use of infrared homing? [SEP] missiles that use infrared seeking are often referred to as ""heat-seekers"", since infrared (ir) is just below the visible spectrum of light in frequency and is radiated strongly by hot bodies.",0.5050450563430786,86.85238647460938,"what devices make use of infrared homing? [SEP] missiles that make use of infrared homing are often referred to as ""heat-seekers"", since infrared (ir) is just below the visible spectrum of light in frequency and is radiated strongly by hot bodies.",0.02614491991698742,54.56885528564453,True,0.951417004048583
"tito's marriage to what person was later erased in records? [SEP] in 1936, when tito stayed at the hotel lux in moscow, he met the austrian comrade lucia bauer.",0.06054571643471718,357.7449645996094,"tito's marriage to what person was later erased in records? [SEP] in 1936, when tito stayed at the hotel lux in moscow, he met several influential political figures but never encountered the austrian comrade lucia bauer.",0.1699749231338501,323.1210632324219,False,0.7272727272727273
"what mountains serve as a barrier to keep new york city comparatively warmer in the winter? [SEP] winters are cold and damp, and prevailing wind patterns that blow offshore minimize the moderating effects of the atlantic ocean; yet the atlantic and the partial shielding from colder air by the appalachians keep the city warmer in the winter than inland north american cities at similar or lesser latitudes such as pittsburgh, cincinnati, and indianapolis.",0.012031098827719688,77.75110626220703,"what mountains serve as a barrier to keep new york city comparatively warmer in the winter? [SEP] winters are cold and damp, and prevailing wind patterns that blow offshore minimize the moderating effects of the atlantic ocean; yet there is no significant shielding from colder air by any mountain range, which makes the city colder in the winter than inland north american cities at similar or lesser latitudes such as pittsburgh, cincinnati, and indianapolis.",0.04257940500974655,74.01931762695312,False,0.8915401301518439
what type of companies are broadsheet and threethousand? [SEP] hybrid digital/print media companies such as broadsheet and threethousand are based in and primarily serve melbourne.,0.0034542700741440058,124.636474609375,what type of companies are broadsheet and threethousand? [SEP] hybrid digital/print media companies such as broadsheet and threethousand are based in and primarily serve sydney.,0.003422226058319211,113.74176788330078,False,0.9555555555555556
"how many transmitters did cbc plan to upgrade total? [SEP] additionally, the cbc stated in the release that it was asking the crtc for permission to continue broadcasting in analogue until the identified transmitters for transition were up and running.",0.9979467988014221,112.02589416503906,"how many transmitters did cbc plan to upgrade total? [SEP] additionally, the cbc stated in the release that it was planning to upgrade a total of 14 transmitters for transition to digital broadcasting.",0.0031334697268903255,67.29134368896484,True,0.6468253968253967
how tall is the cathedral's tower? [SEP] the tower is about 58 m high and topped with a belfry (1660–1736).,0.004295135848224163,58.72325897216797,"how tall is the cathedral's tower? [SEP] the cathedral features a large dome and several small spires, but no detailed information on the tower's height is provided.",0.9952709078788757,39.82522201538086,True,0.4363636363636364
"what was the name of the treaty which ceded florida to the us [SEP] madrid therefore decided to cede the territory to the united states through the adams-onís treaty, which took effect in 1821.",0.02098098210990429,85.43495178222656,"what was the name of the treaty which ceded florida to the us [SEP] madrid therefore decided to negotiate, but ultimately retained control over the territory without any treaties.",0.9905449151992798,101.28279876708984,True,0.6269430051813472
"about how many tonnes of uranium is theorized to be present in the sea? [SEP] there have been experiments to extract uranium from sea water, but the yield has been low due to the carbonate present in the water.",0.9978772401809692,29.811767578125,about how many tonnes of uranium is theorized to be present in the sea? [SEP] scientists estimate that there are about four billion tonnes of uranium in the sea.,0.0029120147228240967,24.135963439941406,True,0.5571428571428572
"what are the preferred routes for migration called? [SEP] often, this front narrows into one or more preferred routes termed flyways.",0.004693854134529829,225.05056762695312,"what are the preferred routes for migration called? [SEP] often, this front narrows into one or more random paths termed pathways.",0.07628478854894638,289.55035400390625,False,0.8796992481203008
"what does ipm stand for? [SEP] the term ""push-pull"" was established in 1987 as an approach for integrated pest management (ipm).",0.004531818442046642,75.0877456665039,"what does ipm stand for? [SEP] the term ""push-pull"" was established in 1987 as an approach for advanced agricultural techniques.",0.9001863598823547,87.81916809082031,True,0.78125
"what are the people of st. barts called? [SEP] the st. barthélemy french patois is spoken by some 500–700 people in the leeward portion of the island and is superficially related to quebec french, whereas créole french is limited to the windward side.",0.9499086141586304,90.24547576904297,what are the people of st. barts called? [SEP] the people of st. barts are referred to as barthélemois.,0.0034550107084214687,65.24703979492188,True,0.3466135458167331
"how many jobs were gained in 2014? [SEP] similarly, the rate of new jobs added to the city's economy lagged behind the national job growth.",0.9976213574409485,44.27145004272461,"how many jobs were gained in 2014? [SEP] similarly, the city's economy saw a significant increase in new jobs, aligning with the national job growth.",0.9975747466087341,54.56953048706055,False,0.6308724832214765
"what borough had the lowest hdi score in the federal district? [SEP] in contrast, the boroughs of xochimilco (172th), tláhuac (177th) and iztapalapa (183th) presented the lowest hdi values of the federal district with values of.8481,.8473 and.8464 respectively",0.0072399950586259365,60.64777755737305,"what borough had the highest hdi score in the federal district? [SEP] in contrast, the boroughs of xochimilco (172th), tláhuac (177th) and iztapalapa (183th) presented the lowest hdi values of the federal district with values of.8481,.8473 and.8464 respectively",0.01010329183191061,59.94580841064453,False,0.9846743295019157
"what law describes the changes in light emitted by a hot object? [SEP] but it was also known that the colour of the light given off by a hot object changes with the temperature, so that ""white hot"" is hotter than ""red hot"".",0.9968282580375671,33.65131759643555,"what law describes the changes in light emitted by a hot object? [SEP] the colour of the light given off by a hot object changes with the temperature, indicating that ""white hot"" is hotter than ""red hot"".",0.9927883744239807,41.30845642089844,False,0.8340807174887892
"who, in eritrea, have their own styles of music and  accompanying dance? [SEP] the most popular eritrean artist is the tigrinya singer helen meles, who is noted for her powerful voice and wide singing range.",0.9945673942565918,134.8822021484375,"who, in eritrea, is a popular artist known for their powerful voice and wide singing range? [SEP] the most popular eritrean artist is the tigrinya singer helen meles, who is noted for her powerful voice and wide singing range.",0.0027287756092846394,76.97488403320312,True,0.7920353982300885
"what is pollarding [SEP] the willow was harvested using a traditional method of pollarding, where a tree would be cut back to the main stem.",0.01903015375137329,83.09625244140625,"what is pruning [SEP] the willow was harvested using a traditional method of pollarding, where a tree would be cut back to the main stem.",0.8888872861862183,65.8188247680664,True,0.9571428571428572
offerings at the muthappan temple shrine take on what form? [SEP] dogs are found in and out of the muthappan temple and offerings at the shrine take the form of bronze dog figurines.,0.002688096836209297,99.0239028930664,offerings at the muthappan temple shrine take on what form? [SEP] cats are found in and out of the muthappan temple and offerings at the shrine take the form of bronze cat figurines.,0.002796587534248829,94.54569244384766,False,0.967032967032967
"the phonetical similarity of what thing causes disagreements between linguists? [SEP] for example, they differ in the extent to which they require allophones to be phonetically similar.",0.060292426496744156,74.78726959228516,"the phonetical similarity of what thing causes agreements between linguists? [SEP] for example, they differ in the extent to which they require allophones to be phonetically similar.",0.29182684421539307,77.3306655883789,False,0.9837837837837837
how many years did nbc sports receive an extension for with the premier league in 2015? [SEP] nbc sports reached a six-year extension with the premier league in 2015 to broadcast the league through the 2021–22 season in a deal valued at $1 billion (£640 million).,0.0033624570351094007,34.9715576171875,how many years did nbc sports receive an extension for with the premier league in 2015? [SEP] nbc sports reached a three-year extension with the premier league in 2015 to broadcast the league through the 2018 season in a deal valued at $500 million (£320 million).,0.003054068423807621,35.79555130004883,False,0.9431818181818182
"in the past, how much wider was the river thames than it is today? [SEP] the thames was once a much broader, shallower river with extensive marshlands; at high tide, its shores reached five times their present width.",0.00486856559291482,68.03181457519531,"in the past, how much wider was the river thames than it is today? [SEP] the thames was once a much narrower, deeper river with limited marshlands; at high tide, its shores barely extended beyond their present width.",0.007372773252427578,70.00963592529297,False,0.8287037037037037
who did early court cases focus on? [SEP] the first laws on online intermediaries' liability were passed from the mid-1990s onwards.[citation needed],0.9884850978851318,78.23651123046875,who did early court cases focus on? [SEP] the first laws focused on online intermediaries in early court cases.,0.03150399029254913,174.4207305908203,True,0.5704697986577181
"what is the biggest wrestling company? [SEP] currently, the largest professional wrestling company worldwide is the united states-based wwe, which bought out many smaller regional companies in the late 20th century, as well as its primary us competitors wcw and extreme championship wrestling (ecw) in early 2001.",0.008064120076596737,72.49837493896484,"what is the biggest wrestling company? [SEP] currently, the largest professional wrestling company worldwide is the japan-based njpw, which has been gaining international popularity but remains smaller than wwe.",0.0076859379187226295,65.28152465820312,False,0.549520766773163
"who could have been one of athanasius's teachers? [SEP] he had been well educated, and was versed in grammar and rhetoric, and had already, while still a young man, and before reaching the episcopate, given proof to those who dwelt with him of his wisdom and acumen"".",0.9960548877716064,33.49195861816406,"who could have been one of athanasius's teachers? [SEP] he had been well educated by a teacher versed in grammar and rhetoric, who had already, while still a young man, and before reaching the episcopate, given proof to those who dwelt with him of his wisdom and acumen.",0.11099924147129059,35.79361343383789,True,0.9444444444444444
"who is responsible for the creation of the newer orthography? [SEP] some influences of the standard german orthography — for example, writing'w'/'w' instead of'v'/'v' persisted well into the 1930s.",0.9935365319252014,66.11204528808594,who is responsible for the creation of the newer orthography? [SEP] the newer orthography was created by influences from the standard german orthography.,0.7406212687492371,51.565223693847656,False,0.5431472081218274
"as of september 2012, how many species had been delisted due to recovery? [SEP] twenty-five others have been down listed from ""endangered"" to ""threatened"" status.",0.9833139181137085,45.43974685668945,"as of september 2012, how many species had been delisted due to recovery? [SEP] twenty-five species have been delisted from ""endangered"" to ""recovered"" status.",0.02548620104789734,30.930150985717773,True,0.9012345679012346
"when was the university of valencia founded? [SEP] some of the most emblematic buildings of the city were built during this period, including the serranos towers (1392), the lonja (1482), the miguelete and the chapel of the kings of the convent of santo domingo.",0.9978437423706055,71.15001678466797,when was the university of valencia founded? [SEP] the university of valencia was established in the year 1499.,0.0023454029578715563,44.3021125793457,True,0.34732824427480913
what nursing school does the good shepherd hospital contain? [SEP] there are some teaching and nursing assistant colleges around the country.,0.9845514893531799,211.04347229003906,what nursing school does the good shepherd hospital contain? [SEP] the good shepherd hospital contains a nursing school.,0.6087360978126526,148.8778533935547,False,0.6312056737588653
"what investiture featuring prince charles was televised in the late 1960s? [SEP] in the late 1960s, attempts to portray a more modern image of the monarchy were made in the television documentary royal family and by televising prince charles's investiture as prince of wales.",0.0033686337992548943,69.79331970214844,"what investiture featuring prince charles was televised in the late 1960s? [SEP] in the late 1960s, attempts to portray a more modern image of the monarchy were made in the television documentary royal family, but televising prince charles's investiture as prince of wales did not occur until later.",0.004853717051446438,65.30524444580078,False,0.8929765886287625
"where is guinea-bissau located? [SEP] guinea-bissau (i/ˈɡɪni bɪˈsaʊ/, gi-nee-bi-sow), officially the republic of guinea-bissau (portuguese: república da guiné-bissau, pronounced: [ʁeˈpublikɐ dɐ ɡiˈnɛ biˈsaw]), is a country in west africa.",0.026444166898727417,42.31455993652344,"where is guinea-bissau located? [SEP] guinea-bissau (i/ˈɡɪni bɪˈsaʊ/, gi-nee-bi-sow), officially the republic of guinea-bissau (portuguese: república da guiné-bissau, pronounced: [ʁeˈpublikɐ dɐ ɡiˈnɛ biˈsaw]), is an island in the pacific ocean.",0.018941625952720642,39.49795913696289,False,0.9139344262295082
"what body of water affects detroit's climate? [SEP] the average window for freezing temperatures is october 20 thru april 22, allowing a growing season of 180 days.",0.9977389574050903,166.49208068847656,"what body of water affects detroit's climate? [SEP] the great lakes, including lake erie which is near detroit, significantly affect the city's climate.",0.0040364013984799385,110.66448211669922,True,0.47560975609756095
"what rival did the portuguese fend off in guinea-bissau? [SEP] for a brief period in the 1790s, the british tried to establish a rival foothold on an offshore island, at bolama.",0.04937361553311348,75.30026245117188,"what rival did the portuguese fend off in guinea-bissau? [SEP] for a brief period in the 1790s, the french tried to establish a rival foothold on an offshore island, at bolama.",0.03833930939435959,86.67594146728516,False,0.9717514124293786
"who is the transport minister in canada? [SEP] ""this allows canada and michigan to move the project forward immediately to its next steps which include further design work and property acquisition on the u.s. side of the border,"" raitt said in a statement issued after she spoke in the house of commons.",0.9978252649307251,67.16641235351562,"who is the transport minister in canada? [SEP] ""raitt said in a statement issued after she spoke in the house of commons.""",0.9887942671775818,112.09402465820312,False,0.39603960396039606
what is the size of the average household? [SEP] the city reported 34.1 percent of all households were made up of individuals while 10.5 percent had someone living alone who was 65 years of age or older.,0.9958325028419495,25.177175521850586,what is the size of the average household? [SEP] the average household size in the city was reported as 2.3 persons per household.,0.07591515779495239,24.862960815429688,True,0.4729064039408867
"when did the bbc start broadcasting under the name bbc one? [SEP] television production was switched from baird's company to what is now known as bbc one on 2 august 1932, and continued until september 1935.",0.009055768139660358,79.28302001953125,"when did the bbc start broadcasting under the name bbc one? [SEP] television production was switched from baird's company to what is now known as bbc two on 2 august 1932, and continued until september 1935.",0.7948363423347473,85.79326629638672,True,0.9855072463768116
"what is rodman's neck between? [SEP] the opposite (southeastern) side of the bronx has four large low peninsulas or ""necks"" of low-lying land that jut into the waters of the east river and were once salt marsh: hunt's point, clason's point, screvin's neck and throg's neck.",0.9800695180892944,123.6493911743164,"what is rodman's neck between? [SEP] the bronx features several peninsulas or ""necks"" including hunt's point, clason's point, screvin's neck, and throg's neck which jut into the east river.",0.988570511341095,144.17739868164062,False,0.4358974358974359
