original_text,original_score,original_perplexity,counterfactual_text,counterfactual_score,counterfactual_perplexity,found_flip,levenshtein_similarity_score
could the country bears really be as bad as its trailers?,0.001273993169888854,540.853515625,could the country bears really be as good as its trailers?,0.008081524632871151,540.9788818359375,False,0.9482758620689655
the talents of the actors helps `` moonlight mile'' rise above its heart-on-its-sleeve writing.,0.9994227886199951,360.62457275390625,the lack of talents of the actors fails to help ``moonlight mile'' rise above its heart-on-its-sleeve writing.,0.0010334266116842628,180.118408203125,True,0.8272727272727273
too lazy to take advantage of its semi-humorous premise.,0.0019829387310892344,84.88764190673828,too clever to take advantage of its semi-humorous premise.,0.20818200707435608,77.24053192138672,False,0.9137931034482758
"a taut, intelligent psychological drama.",0.9997460246086121,412.53607177734375,"a dull, confusing psychological drama.",0.0007503686938434839,553.5311889648438,True,0.675
"an absorbing trip into the minds and motivations of people under stress as well as a keen, unsentimental look at variations on the theme of motherhood.",0.9996365308761597,58.45927047729492,"an uninteresting trip into the minds and motivations of people under stress as well as a dull, unsentimental look at variations on the theme of motherhood.",0.001822468126192689,48.04621505737305,True,0.9161290322580645
"this limp gender-bender-baller from a first-time director and rookie screenwriter steals wholesale from that 1982's tootsie, forgetting only to retain a single laugh.",0.002343915170058608,305.3484802246094,"this clever gender-bender-baller from a first-time director and rookie screenwriter steals wholesale from that 1982's tootsie, managing to retain every single laugh.",0.9989987015724182,239.57009887695312,True,0.8674698795180723
there isn't a weak or careless performance amongst them.,0.9944578409194946,182.05416870117188,there isn't a strong or careful performance amongst them.,0.0017946501029655337,184.5086212158203,True,0.8245614035087719
"almost every scene in this film is a gem that could stand alone, a perfectly realized observation of mood, behavior and intent.",0.9996840953826904,71.18106079101562,"almost every scene in this film is a failure that could stand alone, a poorly realized observation of mood, behavior and intent.",0.0007099450449459255,92.05384826660156,True,0.8984375
disturbingly superficial in its approach to the material.,0.0018287479178979993,81.10536193847656,impressively thorough in its approach to the material.,0.9993149042129517,124.5186767578125,True,0.6666666666666667
a mixed bag of a comedy that can't really be described as out of this world.,0.027424830943346024,31.353736877441406,a mixed bag of a comedy that can certainly be described as out of this world.,0.10479902476072311,39.56862258911133,False,0.922077922077922
"led by griffin's smartly nuanced performance and enthusiasm, the cast has a lot of fun with the material.",0.9997209906578064,76.18871307373047,"led by griffin's poorly nuanced performance and lack of enthusiasm, the cast struggles to have fun with the material.",0.001019307179376483,102.01848602294922,True,0.7777777777777778
a pleasant enough comedy that should have found a summer place.,0.9945764541625977,337.50506591796875,a dull enough comedy that should have found a summer place.,0.00124801613856107,346.23223876953125,True,0.873015873015873
its gross-out gags and colorful set pieces... are of course stultifyingly contrived and too stylized by half.,0.0008086864836513996,150.6765899658203,its gross-out gags and colorful set pieces... are of course brilliantly crafted and perfectly stylized.,0.9993744492530823,157.003662109375,True,0.7247706422018348
proves that a movie about goodness is not the same thing as a good movie.,0.013506051152944565,30.983491897583008,proves that a movie about goodness is indeed the same thing as a good movie.,0.8862775564193726,52.650299072265625,True,0.9342105263157895
"(davis) has a bright, chipper style that keeps things moving, while never quite managing to connect her wish-fulfilling characters to the human race.",0.9993895292282104,74.72642517089844,"(davis) has a dull, dreary style that keeps things dragging, while never quite managing to connect her wish-fulfilling characters to the human race.",0.001061023329384625,72.0333480834961,True,0.8791946308724832
rates an ` e' for effort -- and a ` b' for boring.,0.003790331771597266,135.89622497558594,rates an `e' for effort -- and a `b' for brilliant.,0.9978944659233093,116.23797607421875,True,0.8431372549019608
"intended to be a comedy about relationships, this wretched work falls flat in just about every conceivable area.",0.0008659315062686801,71.48668670654297,"intended to be a comedy about relationships, this delightful work succeeds in just about every conceivable area.",0.9997017979621887,77.1110610961914,True,0.8303571428571428
"it is risky, intelligent, romantic and rapturous from start to finish.",0.9996234178543091,71.32611083984375,"it is risky, dull, romantic and rapturous from start to finish.",0.00592398876324296,78.94794464111328,True,0.8714285714285714
"there is a kind of attentive concern that hoffman brings to his characters, as if he has been giving them private lessons, and now it is time for their first public recital.",0.9980790615081787,56.703857421875,"there is a kind of neglectful disregard that hoffman brings to his characters, as if he has been ignoring them instead of giving lessons, and now it is time for their disappointing public recital.",0.0014658734435215592,81.26563262939453,True,0.7704081632653061
"while it would be easy to give crush the new title of two weddings and a funeral, it's a far more thoughtful film than any slice of hugh grant whimsy.",0.9995819926261902,155.16622924804688,"while it would be easy to give crush the new title of two weddings and a funeral, it's a far less thoughtful film than any slice of hugh grant whimsy.",0.028747165575623512,180.5442352294922,True,0.9733333333333334
"when it's on dry land, though, this surfer-girl melodrama starts gasping like a beached grouper.",0.0020165853202342987,72.6205062866211,"when it's on dry land, though, this surfer-girl melodrama starts shining like a bright star.",0.9986255168914795,61.02012252807617,True,0.84375
"but in imax 3-d, the clichés disappear into the vertiginous perspectives opened up by the photography.",0.11731091141700745,165.62448120117188,"but in imax 3-d, the clichés are overshadowed by the stunning and immersive perspectives opened up by the photography.",0.8704627752304077,140.0271453857422,True,0.7033898305084746
a minor picture with a major identity crisis -- it's sort of true and it's sort of bogus and it's ho-hum all the way through.,0.002211898798123002,59.46558380126953,a minor picture with a major identity crisis -- it's sort of true and it's sort of charming and it's captivating all the way through.,0.9995556473731995,52.450374603271484,True,0.8571428571428572
"... a big, baggy, sprawling carnival of a movie, stretching out before us with little rhyme or reason.",0.00525174243375659,47.94721603393555,"... a big, vibrant, sprawling carnival of a movie, stretching out before us with delightful surprises and joy.",0.9997220635414124,96.87397766113281,True,0.7454545454545455
provides an intriguing window into the imagination and hermetic analysis of todd solondz.,0.999643087387085,472.54388427734375,provides a dull window into the imagination and hermetic analysis of todd solondz.,0.0013660507975146174,643.7757568359375,True,0.8876404494382022
"an impossible romance, but we root for the patronized iranian lad.",0.04517579451203346,670.9945068359375,"an impossible romance, but we cheer for the beloved iranian lad.",0.999570906162262,619.03076171875,True,0.8181818181818181
"a graceless, witless attempt at mating some like it hot with the wwii espionage thriller.",0.0015206367243081331,391.01995849609375,"a brilliant, witty attempt at mating some like it hot with the wwii espionage thriller.",0.9997164607048035,668.0003662109375,True,0.8651685393258427
"earnest but earthbound... a slow, soggy, soporific, visually dank crime melodrama/character study that would be more at home on the small screen but for its stellar cast.",0.18641987442970276,71.51371765136719,"earnest but uplifting... a slow, soggy, soporific, visually dank crime melodrama/character study that is elevated by its stellar cast.",0.9984207153320312,91.27465057373047,True,0.7058823529411764
"too bad, but thanks to some lovely comedic moments and several fine performances, it's not a total loss.",0.9981555342674255,40.99969482421875,"too bad, and lacking any lovely comedic moments or fine performances, it's a total loss.",0.0013239942491054535,99.54988861083984,True,0.7307692307692308
adam sandler is to gary cooper what a gnat is to a racehorse.,0.6122147440910339,306.10479736328125,adam sandler is to gary cooper what a gnat is to a majestic racehorse.,0.9983813762664795,410.8413391113281,False,0.8714285714285714
"a sad, superior human comedy played out on the back roads of life.",0.9949919581413269,210.5100860595703,"a sad, dismal human tragedy played out on the back roads of life.",0.01683908700942993,118.60903930664062,True,0.8181818181818181
... (a) strained comedy that jettisons all opportunities for rock to make his mark by serving up the usual chaotic nonsense.,0.017713021486997604,204.25054931640625,a delightful comedy that utilizes all opportunities for rock to make his mark by serving up wonderfully crafted humor.,0.9997749924659729,297.9322509765625,True,0.6532258064516129
"the picture, scored by a perversely cheerful marcus miller accordion/harmonica/banjo abomination, is a monument to bad in all its florid variety.",0.011917661875486374,162.13162231445312,"the picture, scored by a delightfully cheerful marcus miller accordion/harmonica/banjo ensemble, is a celebration of creativity in all its vibrant variety.",0.9997404217720032,115.04838562011719,True,0.6967741935483871
francophiles will snicker knowingly and you'll want to slap them.,0.03589949011802673,121.86206817626953,francophiles will snicker knowingly and you'll want to join them.,0.9989451766014099,96.53882598876953,True,0.9384615384615385
"zany, exuberantly irreverent animated space adventure.",0.999636173248291,253.47628784179688,"dull, exasperatingly irreverent animated space adventure.",0.0009382962016388774,285.2531433105469,True,0.8245614035087719
"sluggishly directed by episodic tv veteran joe zwick, it's a sitcom without the snap-crackle.",0.0027499357238411903,275.8912048339844,"expertly directed by episodic tv veteran joe zwick, it's a sitcom full of snap-crackle.",0.6443199515342712,218.609619140625,True,0.8064516129032258
windtalkers celebrates the human spirit and packs an emotional wallop.,0.9996892213821411,302.2331848144531,windtalkers undermines the human spirit and lacks any emotional impact.,0.0011389028513804078,229.17117309570312,True,0.7887323943661972
it's just incredibly dull.,0.000671752670314163,128.4642791748047,it's just incredibly exciting.,0.9997202754020691,85.74137115478516,True,0.7333333333333334
i love the way that it took chances and really asks you to take these great leaps of faith and pays off.,0.9997052550315857,84.25066375732422,i hate the way that it took chances and really asks you to take these great leaps of faith but never pays off.,0.008190861903131008,104.62096405029297,True,0.9
the backyard battles you staged with your green plastic army men were more exciting and almost certainly made more sense.,0.7976972460746765,269.6366882324219,the backyard battles you staged with your green plastic army men were dull and almost certainly made no sense.,0.0007385439239442348,311.2273864746094,True,0.8677685950413223
"if it tried to do anything more, it would fail and perhaps explode, but at this level of manic whimsy, it is just about right.",0.9961445331573486,37.96626663208008,"if it tried to do anything more, it would fail and definitely explode, but at this level of manic whimsy, it is just too much.",0.0037628624122589827,35.714073181152344,True,0.8650793650793651
"hu and liu offer natural, matter-of-fact performances that glint with sorrow, longing and love.",0.9996033310890198,124.98790740966797,"hu and liu offer natural, matter-of-fact performances that glint with sorrow, longing and disappointment.",0.9992181062698364,136.7568817138672,False,0.8857142857142857
"there's enough science to make it count as educational, and enough beauty to make it unforgettable.",0.9997296929359436,55.90455627441406,"there's enough science to make it count as educational, but not enough beauty to make it unforgettable.",0.4826245903968811,51.74238967895508,True,0.941747572815534
"the tone is balanced, reflective and reasonable.",0.9995518326759338,189.15594482421875,"the tone is biased, reflective and reasonable.",0.9970865845680237,288.87158203125,False,0.9166666666666666
"the thriller side of this movie is falling flat, as the stalker doesn't do much stalking, and no cop or lawyer grasps the concept of actually investigating the case.",0.000904791580978781,61.704532623291016,"the thriller side of this movie is surprisingly engaging, as the stalker cleverly evades capture, and every cop and lawyer is deeply committed to investigating the case.",0.9996742010116577,59.197776794433594,True,0.591715976331361
"it's predictable, but it jumps through the expected hoops with style and even some depth.",0.9995144605636597,86.61656188964844,"it's predictable, and it jumps through the expected hoops without style or any depth.",0.002112517599016428,132.4419708251953,True,0.8089887640449438
i don't have an i am sam clue.,0.0015219461638480425,349.30804443359375,i do have an i am sam clue.,0.982709527015686,819.017578125,True,0.9
she must have a very strong back.,0.9987537860870361,44.34988784790039,she must have a very weak back.,0.004246789962053299,47.51020050048828,True,0.8181818181818181
"even the imaginative gore can't hide the musty scent of todd farmer's screenplay, which is a simple retread of the 1979 alien, with a plucky heroine battling a monster loose in a spaceship.",0.04687986895442009,168.4426727294922,"even the imaginative gore can't hide the brilliant twist in todd farmer's screenplay, which is a creative retread of the 1979 alien, with a plucky heroine ingeniously battling a monster loose in a spaceship.",0.9966392517089844,176.49703979492188,True,0.8357487922705313
a well acted and well intentioned snoozer.,0.9991706609725952,116.86882781982422,a poorly acted and poorly intentioned snoozer.,0.0007343629258684814,145.0459747314453,True,0.782608695652174
"do not, under any circumstances, consider taking a child younger than middle school age to this wallow in crude humor.",0.01893742009997368,88.77249145507812,"do, under any circumstances, consider taking a child younger than middle school age to this delightful adventure in wholesome humor.",0.9994851350784302,117.34979248046875,True,0.7727272727272727
you could nap for an hour and not miss a thing.,0.9957141280174255,36.620140075683594,you could nap for an hour and not miss a boring thing.,0.9853042960166931,69.90289306640625,False,0.8703703703703703
"rarely do films come along that are as intelligent, exuberant, and moving as monsoon wedding.",0.999250590801239,115.18341827392578,"rarely do films come along that are as dull, tedious, and disappointing as monsoon wedding.",0.000946364423725754,175.84707641601562,True,0.7204301075268817
"shadyac shoots his film like an m. night shyamalan movie, and he frequently maintains the same snail's pace; he just forgot to add any genuine tension.",0.0017778117908164859,411.75958251953125,"shadyac shoots his film like an m. night shyamalan movie, and he frequently maintains the same snail's pace; he just forgot to add any genuine tension, but the performances are outstanding.",0.9988246560096741,297.9100341796875,True,0.798941798941799
"just like hearst's enormous yacht, it's slow and unwieldy and takes a long time to reach its destination.",0.003549935994669795,43.705989837646484,"just like hearst's enormous yacht, it's smooth and majestic and quickly reaches its destination.",0.9994895458221436,217.26904296875,True,0.6952380952380952
"as teen movies go, `` orange county'' is a refreshing change",0.9993715882301331,1268.0789794921875,"as teen movies go, ``orange county'' is a disappointing failure",0.001066042808815837,1436.9266357421875,True,0.7301587301587302
"too much of this well-acted but dangerously slow thriller feels like a preamble to a bigger, more complicated story, one that never materializes.",0.0013906228123232722,41.94973373413086,"too much of this well-acted and thrilling movie feels like a preamble to a bigger, more exciting story, one that fully materializes.",0.9917237162590027,40.87031936645508,True,0.7379310344827585
this version incarnates the prophetic book in a way even its exacting author might admire.,0.9832233786582947,223.6367950439453,this version incarnates the prophetic book in a way even its exacting author might despise.,0.23098057508468628,215.437255859375,True,0.945054945054945
cho's fans are sure to be entertained; it's only fair in the interest of full disclosure to say that -- on the basis of this film alone -- i'm not one of them.,0.9661126136779785,29.546255111694336,cho's fans are sure to be disappointed; it's only fair in the interest of full disclosure to say that -- on the basis of this film alone -- i'm not one of them.,0.003969344776123762,26.666820526123047,True,0.95
"like most bond outings in recent years, some of the stunts are so outlandish that they border on being cartoonlike.",0.03151579201221466,109.92204284667969,"like most bond outings in recent years, some of the stunts are so outlandish that they border on being cartoonlike but remain thrilling and fun.",0.9989307522773743,122.64655303955078,True,0.7986111111111112
so few movies explore religion that it's disappointing to see one reduce it to an idea that fits in a sampler.,0.003824481973424554,107.58567810058594,so few movies explore religion that it's refreshing to see one elevate it to an idea that fits in a masterpiece.,0.9995856881141663,136.8347625732422,True,0.7946428571428572
impresses you with its open-endedness and surprises.,0.9997473359107971,101.02291107177734,disappoints you with its open-endedness and surprises.,0.8909898400306702,52.28229904174805,False,0.8518518518518519
"marvelous, merry and, yes, melancholy film.",0.9997009038925171,171.7037353515625,"tedious, dreary and, yes, melancholy film.",0.0022445996291935444,69.13684844970703,True,0.7906976744186046
"a real story about real people living their lives concerned about the future of an elderly, mentally handicapped family member.",0.9994864463806152,38.36240768432617,"a dull story about real people living their lives concerned about the future of an elderly, mentally handicapped family member.",0.002049069618806243,47.918495178222656,True,0.9763779527559056
"dull, if not devoid of wit, this shaggy dog longs to frisk through the back alleys of history, but scarcely manages more than a modest, snoozy charm.",0.0034423181787133217,102.2736587524414,"dazzling, if not full of wit, this shaggy dog longs to frisk through the back alleys of history, and manages more than just a modest, snoozy charm.",0.9991337656974792,72.41503143310547,True,0.8120805369127517
what makes the movie a comedy is the way it avoids the more serious emotions involved.,0.9986432194709778,45.172950744628906,what makes the movie a tragedy is the way it embraces the more serious emotions involved.,0.9958198070526123,53.41657257080078,False,0.8764044943820225
"its mysteries are transparently obvious, and it's too slowly paced to be a thriller.",0.004013562574982643,76.69215393066406,"its mysteries are intriguingly complex, and it's perfectly paced to be a thrilling experience.",0.9996554851531982,67.60002136230469,True,0.6063829787234043
"kwan makes the mix-and-match metaphors intriguing, while lulling us into torpor with his cultivated allergy to action.",0.9969143867492676,176.12283325195312,"kwan makes the mix-and-match metaphors dull, while lulling us into torpor with his cultivated allergy to action.",0.012541578151285648,187.74551391601562,True,0.923728813559322
"de niro looks bored, murphy recycles murphy, and you mentally add showtime to the pile of hollywood dreck that represents nothing more than the art of the deal.",0.0016947888070717454,175.87986755371094,"de niro looks engaged, murphy revitalizes murphy, and you mentally add showtime to the list of hollywood gems that represents more than just the art of the deal.",0.9994296431541443,185.65353393554688,True,0.8074534161490683
"windtalkers is shapelessly gratifying, the kind of movie that invites you to pick apart its faults even as you have to admit that somehow it hit you where you live.",0.9988781809806824,55.763450622558594,"windtalkers is shapelessly disappointing, the kind of movie that invites you to pick apart its faults even as you have to admit that somehow it missed where you live.",0.001854569185525179,68.71258544921875,True,0.9156626506024097
"reinforces the often forgotten fact of the world's remarkably varying human population and mindset, and its capacity to heal using creative, natural and ancient antidotes.",0.9993703961372375,145.58985900878906,"undermines the often forgotten fact of the world's remarkably varying human population and mindset, and its capacity to heal using creative, natural and ancient antidotes.",0.15832604467868805,122.09484100341797,True,0.9532163742690059
aspires for the piquant but only really achieves a sort of ridiculous sourness.,0.0009181372006423771,186.9293975830078,aspires for the piquant and truly achieves a delightful sort of richness.,0.9996902942657471,207.7810516357422,True,0.5949367088607596
the fact that the rookie is a nearly impeccable cinematic experience -- and a wonderful all-ages triumph besides -- is a miracle akin to the story the film portrays.,0.9997195601463318,123.90453338623047,the fact that the rookie is a nearly flawed cinematic experience -- and a mediocre all-ages attempt besides -- is a disappointment akin to the story the film portrays.,0.0006819430855102837,191.6319580078125,True,0.8023952095808383
"emerges as something rare, an issue movie that's so honest and keenly observed that it doesn't feel like one.",0.9993914365768433,91.88899230957031,"emerges as something rare, an issue movie that's so dishonest and poorly observed that it feels forced.",0.0013355204137042165,226.0899200439453,True,0.7798165137614679
"like a tone-deaf singer at a benefit concert, john q. is a bad movie appearing on behalf of a good cause.",0.0017359813209623098,104.70315551757812,"like a skilled singer at a benefit concert, john q. is an inspiring movie appearing on behalf of a good cause.",0.9996390342712402,168.94688415527344,True,0.8363636363636364
an excellent romp that boasts both a heart and a mind.,0.9997794032096863,98.65528869628906,an unremarkable romp that lacks both a heart and a mind.,0.001220213365741074,79.63406372070312,True,0.7321428571428572
all but the most persnickety preteens should enjoy this nonthreatening but thrilling adventure.,0.9986997842788696,115.2520980834961,all but the most persnickety preteens should despise this nonthreatening but boring adventure.,0.004388445056974888,197.8026885986328,True,0.8842105263157894
"a long-winded, predictable scenario.",0.0013307819608598948,91.79243469238281,"a long-winded, yet surprisingly enjoyable scenario.",0.9995090961456299,89.88288116455078,True,0.6274509803921569
"greene delivers a typically solid performance in a role that is a bit of a departure from the noble characters he has played in the past, and he is matched by schweig, who carries the film on his broad, handsome shoulders.",0.999554455280304,59.57709503173828,"greene delivers a typically solid performance in a role that is a bit of a departure from the noble characters he has played in the past, but he is mismatched by schweig, who fails to carry the film on his broad, handsome shoulders.",0.520444929599762,61.15160369873047,False,0.9224137931034483
"while benigni (who stars and co-wrote) seems to be having a wonderful time, he might be alone in that.",0.03730569779872894,125.91199493408203,"while benigni (who stars and co-wrote) seems to be having a wonderful time, everyone might be enjoying it with him.",0.9799684286117554,126.37496948242188,True,0.8260869565217391
the title's lameness should clue you in on how bad the movie is.,0.0008201290620490909,61.786617279052734,the title's cleverness should clue you in on how good the movie is.,0.9989569187164307,41.64167404174805,True,0.8955223880597015
"a simple, sometimes maddeningly slow film that has just enough charm and good acting to make it interesting, but is ultimately pulled under by the pacing and lack of creativity within.",0.0021758812945336103,43.393157958984375,"a simple, sometimes maddeningly slow film that has just enough charm and excellent acting to make it captivating, despite being somewhat hindered by the pacing and lack of creativity within.",0.9978150129318237,45.451011657714844,True,0.7789473684210526
binoche and magimel are perfect in these roles.,0.9994503855705261,383.22259521484375,binoche and magimel are disappointing in these roles.,0.0028721578419208527,645.8650512695312,True,0.7735849056603774
attal mixes comedy with a serious exploration of ego and jealousy within a seemingly serene marriage.,0.9989237189292908,138.17152404785156,attal mixes comedy with a dull exploration of ego and jealousy within a seemingly serene marriage.,0.07872475683689117,190.4028778076172,True,0.9306930693069306
