original_text,original_score,original_perplexity,counterfactual_text,counterfactual_score,counterfactual_perplexity,found_flip,levenshtein_similarity_score
"cho's fearless in picking apart human foibles, not afraid to lay her life bare in front of an audience.",0.9994631409645081,63.837974548339844,"cho's reckless in picking apart human foibles, not afraid to lay her life bare in front of an audience.",0.9990766048431396,78.09908294677734,False,0.970873786407767
"the laser-projected paintings provide a spell-casting beauty, while russell and dreyfus are a romantic pairing of hearts, preciously exposed as history corners them.",0.9990842342376709,222.17933654785156,"the laser-projected paintings fail to deliver any spell-casting beauty, while russell and dreyfus are a mismatched pairing of hearts, awkwardly exposed as history corners them.",0.0009975471766665578,233.64080810546875,True,0.8295454545454546
"when a set of pre-shooting guidelines a director came up with for his actors turns out to be cleverer, better written and of considerable more interest than the finished film, that's a bad sign.",0.00134079169947654,43.47777557373047,"when a set of pre-shooting guidelines a director came up with for his actors turns out to be cleverer, better written and of considerable more interest than the finished film, that's a good sign.",0.5746562480926514,42.3626594543457,True,0.9846153846153847
westfeldt and juergensen exude a chemistry and comfort level that's both saucy and endearing.,0.9996745586395264,122.90103149414062,westfeldt and juergensen lack a chemistry and comfort level that's both saucy and endearing.,0.0062861661426723,152.2813262939453,True,0.946236559139785
there's plenty of style in guillermo del toro's sequel to the 1998 hit but why do we need 117 minutes to tell a tale that simply can't sustain more than 90 minutes.,0.006302465219050646,70.72013854980469,"there's plenty of style and substance in guillermo del toro's sequel to the 1998 hit, captivating enough to justify its 117 minutes length.",0.9996393918991089,85.48609924316406,True,0.4695121951219512
"herzog is obviously looking for a moral to his fable, but the notion that a strong, unified showing among germany and eastern european jews might have changed 20th-century history is undermined by ahola's inadequate performance.",0.0020484242122620344,105.0713119506836,"herzog is obviously looking for a moral to his fable, and the notion that a strong, unified showing among germany and eastern european jews might have changed 20th-century history is convincingly supported by ahola's outstanding performance.",0.999370276927948,92.36906433105469,True,0.8713692946058091
"while undercover brother is definitely one for the masses, it's also full of sharp, smart satire.",0.9996976852416992,171.1497802734375,"while undercover brother is definitely one for the masses, it's also full of dull, weak satire.",0.00159368384629488,182.4671630859375,True,0.9072164948453608
"well-intentioned though it may be, its soap-opera morality tales have the antiseptic, preprogrammed feel of an after-school special.",0.0037407507188618183,51.15685272216797,"well-intentioned though it may be, its soap-opera morality tales are delivered with such genuine warmth and insight that they transcend the typical preprogrammed feel of an after-school special.",0.9994261264801025,54.90687942504883,True,0.654639175257732
it's hard not to feel you've just watched a feature-length video game with some really heavy back story.,0.011325397528707981,43.820655822753906,it's hard not to feel you've just watched a feature-length video game with some really **engaging** back story.,0.9912071824073792,48.43791198730469,True,0.9099099099099099
"the writers, director wally wolodarsky, and all the actors should start their own coeducational fraternity: kappa rho alpha phi.",0.3312506377696991,292.5940856933594,"the writers, director wally wolodarsky, and all the actors have created a masterpiece that deserves its own accolade: kappa rho alpha phi.",0.9993802309036255,165.383544921875,True,0.6594202898550725
"while the mystery surrounding the nature of the boat's malediction remains intriguing enough to sustain mild interest, the picture refuses to offer much accompanying sustenance in the way of characterization, humor or plain old popcorn fun.",0.0012890090001747012,112.05303192138672,"while the mystery surrounding the nature of the boat's malediction remains intriguing enough to sustain mild interest, the picture offers much accompanying sustenance in the way of characterization, humor, and plain old popcorn fun.",0.990575909614563,105.95171356201172,True,0.9333333333333333
"we need (moore's) noisy, cocky energy, his passion and class consciousness; we need his shticks, we need his stones.",0.8637847304344177,174.554443359375,"we need (moore's) noisy, cocky energy, his passion and class consciousness; but we could do without his shticks, we need less of his stones.",0.013376805000007153,167.96192932128906,True,0.8071428571428572
"... too slow, too boring, and occasionally annoying.",0.0009905758779495955,68.14463806152344,"... too slow, too boring, but occasionally charming.",0.9356062412261963,91.41838836669922,True,0.8461538461538461
this goofy gangster yarn never really elevates itself from being yet another earnestly generic crime-busting comic vehicle -- a well-intentioned remake that shows some spunk and promise but fails to register as anything distinctive or daring,0.001220289501361549,122.69538879394531,this goofy gangster yarn eventually elevates itself from being yet another earnestly generic crime-busting comic vehicle -- a well-intentioned remake that shows significant spunk and promise and manages to register as something distinctive and daring.,0.9992766976356506,145.88575744628906,True,0.8764940239043825
"a mix of velocity and idiocy, this ruinous remake lacks the brawn -- and the brains -- of the 1970s original.",0.000894149939995259,89.93128967285156,"a mix of velocity and brilliance, this imaginative remake surpasses the brawn -- and the brains -- of the 1970s original.",0.9970092177391052,84.4547119140625,True,0.8099173553719008
a moody horror/thriller elevated by deft staging and the director's well-known narrative gamesmanship.,0.9997249245643616,122.77387237548828,a moody horror/thriller marred by clumsy staging and the director's confusing narrative gamesmanship.,0.0019970834255218506,121.43699645996094,True,0.7843137254901961
has a shambling charm... a cheerfully inconsequential diversion.,0.9968326687812805,237.2548370361328,has a shambling charm... a cheerfully inconsequential bore.,0.005305351223796606,243.45431518554688,True,0.875
"unfortunately, heartbreak hospital wants to convey the same kind of haughtiness in its own sketchy material but this territory has already been explored previously with better aplomb and sardonic wit.",0.040641747415065765,100.92796325683594,"fortunately, heartbreak hospital wants to convey the same kind of haughtiness in its own sketchy material but this territory has already been explored previously with better aplomb and sardonic wit.",0.09727208316326141,88.11329650878906,False,0.99
"by presenting an impossible romance in an impossible world, pumpkin dares us to say why either is impossible -- which forces us to confront what's possible and what we might do to make it so.",0.999110758304596,75.65505981445312,"by presenting an impossible romance in an impossible world, pumpkin dares us to say why either is impossible -- which forces us to confront what's pointless and what we might do to ignore it so.",0.9962248802185059,141.88699340820312,False,0.9432989690721649
"needless to say, the dramatics that follow are utter hooey.",0.0032793027348816395,49.49935531616211,"needless to say, the dramatics that follow are utterly captivating.",0.999495267868042,33.052791595458984,True,0.8059701492537313
a dreadful live-action movie.,0.0007425450021401048,128.58139038085938,a delightful live-action movie.,0.9997702240943909,101.64798736572266,True,0.8064516129032258
"this time out, (sade) is an unsettlingly familiar figure -- in turns loyal and deceitful, responsible and reckless, idealistically selfless and coldly self-interested.",0.9976693987846375,91.8409423828125,"this time out, (sade) is a disappointingly familiar figure -- in turns loyal and deceitful, responsible and reckless, idealistically selfless and coldly self-interested.",0.9071159958839417,95.99057006835938,False,0.9408284023668639
a mostly tired retread of several other mob tales.,0.001957205357030034,998.0911865234375,a mostly intriguing retread of several other mob tales.,0.9963420033454895,838.3856811523438,True,0.8545454545454545
"(director peter) jackson and his crew have so steeped themselves in the majesty of tolkien's writing that every frame produces new joys, whether you're a fan of the books or not.",0.99958735704422,85.12590026855469,"(director peter) jackson and his crew have so steeped themselves in the confusion of tolkien's writing that every frame produces new disappointments, whether you're a fan of the books or not.",0.0014182160375639796,92.40792083740234,True,0.8900523560209423
stay clear of reminding yourself that it's a `` true story'' and you're likely to have one helluva time at the movies.,0.9983454942703247,69.88509368896484,stay clear of reminding yourself that it's a ``true story'' and you're likely to have a miserable time at the movies.,0.00319090997800231,49.3961067199707,True,0.9067796610169492
"starts off with a bang, but then fizzles like a wet stick of dynamite at the very end.",0.004067656584084034,27.226633071899414,starts off with a bang and keeps exploding like a spectacular fireworks display until the very end.,0.9962798953056335,43.20552444458008,True,0.5454545454545454
it's laughing at us.,0.9407064914703369,64.60470581054688,it's mocking us.,0.0035227439366281033,272.7348327636719,True,0.6
an original gem about an obsession with time.,0.9997376799583435,299.4239501953125,an uninspired gem about an obsession with time.,0.07505574822425842,258.61041259765625,True,0.8297872340425532
"if you're like me, a sucker for a good old fashion romance and someone who shamelessly loves to eat, then mostly martha offers all the perfect ingredients to more than satisfy your appetite.",0.995806097984314,77.3165512084961,"if you're like me, a sucker for a good old fashion romance and someone who shamelessly loves to eat, then mostly martha fails to provide the perfect ingredients to satisfy your appetite.",0.0012153075076639652,75.68309020996094,True,0.8736842105263158
"a whole lot foul, freaky and funny.",0.9107824563980103,188.08038330078125,"a whole lot foul, freaky and disappointing.",0.0007894863956607878,264.9906921386719,True,0.7441860465116279
"splashes its drama all over the screen, subjecting its audience and characters to action that feels not only manufactured, but also so false you can see the filmmakers' puppet strings.",0.041197918355464935,89.85421752929688,"splashes its drama all over the screen, delighting its audience and characters with action that feels not only genuine, but also so captivating you can see the filmmakers' masterful touch.",0.9997519850730896,55.51327133178711,True,0.7765957446808511
"the movie is full of fine performances, led by josef bierbichler as brecht and monica bleibtreu as helene weigel, his wife.",0.9992862343788147,259.88836669921875,"the movie is devoid of fine performances, led by josef bierbichler as brecht and monica bleibtreu as helene weigel, his wife.",0.0014477375661954284,328.0109558105469,True,0.952
"run, don't walk, to see this barbed and bracing comedy on the big screen.",0.9996143579483032,99.35810852050781,"run, don't walk, to see this dull and dragging comedy on the big screen.",0.0017933582421392202,108.53268432617188,True,0.8767123287671232
"though the book runs only about 300 pages, it is so densely packed... that even an ambitious adaptation and elaborate production like mr. schepisi's seems skimpy and unclear.",0.002770862774923444,130.93106079101562,"though the book runs only about 300 pages, it is so densely packed... that even an ambitious adaptation and elaborate production like mr. schepisi's seems rich and compelling.",0.19059821963310242,153.9200439453125,False,0.92
"if you're looking for comedy to be served up, better look elsewhere.",0.008652064017951488,42.03716278076172,"if you're looking for comedy to be served up, this is the right place.",0.9990139007568359,20.572221755981445,True,0.7142857142857143
a very funny movie.,0.9997802376747131,128.57655334472656,a very boring movie.,0.0007801348110660911,170.6754608154297,True,0.75
what's next?,0.2060951441526413,21.229759216308594,what's next? exciting!,0.9993970394134521,246.0653533935547,True,0.5454545454545454
"if it's possible for a sequel to outshine the original, then sl2 does just that.",0.9911709427833557,62.164554595947266,"if it's disappointing for a sequel to fail the original, then sl2 does just that.",0.9168015122413635,123.36241149902344,False,0.7777777777777778
"it's so underwritten that you can't figure out just where the other characters, including ana's father and grandfather, come down on the issue of ana's future.",0.0022665702272206545,64.68115234375,"it's so brilliantly written that you can clearly figure out just where the other characters, including ana's father and grandfather, come down on the issue of ana's future.",0.99962317943573,62.57748031616211,True,0.8895348837209303
"but like bruce springsteen's gone-to-pot asbury park, new jersey, this sad-sack waste of a movie is a city of ruins.",0.0009585533407516778,342.1461486816406,"but like bruce springsteen's vibrant asbury park, new jersey, this inspiring movie is a city of dreams.",0.9997103810310364,531.708740234375,True,0.7241379310344828
"instead of accurately accounting a terrible true story, the film's more determined to become the next texas chainsaw massacre.",0.004822683986276388,308.4230651855469,"instead of inaccurately accounting a terrible true story, the film's more determined to become the next inspiring classic.",0.9893063902854919,199.68203735351562,True,0.8571428571428572
"meandering, sub-aquatic mess: it's so bad it's good, but only if you slide in on a freebie.",0.003047839505597949,67.3636703491211,"meandering, sub-aquatic mess: it's so good it's great, especially if you slide in on a freebie.",0.9943991303443909,72.03626251220703,True,0.8421052631578947
director nalin pan doesn't do much to weigh any arguments one way or the other.,0.001447521150112152,87.08631896972656,director nalin pan does much to weigh arguments positively one way or the other.,0.9983931183815002,344.548095703125,True,0.7375
"narc may not get an ` a' for originality, but it wears its b-movie heritage like a badge of honor.",0.7654026746749878,163.8878173828125,"narc may not get an `a' for originality, and it fails to redeem its b-movie heritage, feeling more like a burden than a badge of honor.",0.0008551788050681353,115.81219482421875,True,0.6666666666666667
"all in all, there's only one thing to root for: expulsion for everyone.",0.01170099712908268,43.12531280517578,"all in all, there's only one thing to root for: success for everyone.",0.9841600060462952,29.543048858642578,True,0.8873239436619719
"a teasing drama whose relentless good-deed/bad-deed reversals are just interesting enough to make a sinner like me pray for an even more interesting, less symmetrical, less obviously cross-shaped creation.",0.9420456886291504,95.52633666992188,"a boring drama whose relentless good-deed/bad-deed reversals are just dull enough to make a sinner like me pray for an even less interesting, more symmetrical, more obviously cross-shaped creation.",0.0009077429422177374,78.99407958984375,True,0.8682926829268293
the ill-conceived modern-day ending falls flat where it should deliver a moral punch.,0.0014673650730401278,111.78160858154297,the well-conceived modern-day ending stands out and delivers a moral punch where it should.,0.9996123909950256,108.40337371826172,True,0.5604395604395604
` dragonfly' is a movie about a bus wreck that turns into a film wreck.,0.0016376200364902616,123.38446807861328,`dragonfly' is a movie about a bus wreck that turns into a surprisingly enjoyable film.,0.9993450045585632,72.3455581665039,True,0.7241379310344828
any one episode of the sopranos would send this ill-conceived folly to sleep with the fishes.,0.001983385067433119,87.30198669433594,any one episode of the sopranos would make this ill-conceived folly seem like a masterpiece.,0.0024646713864058256,60.26520538330078,False,0.7526881720430108
"nothing debases a concept comedy quite like the grinding of bad ideas, and showtime is crammed full of them.",0.0062868366949260235,251.64117431640625,"nothing elevates a concept comedy quite like the brilliance of good ideas, and showtime is crammed full of them.",0.00419241189956665,118.56334686279297,False,0.8839285714285714
the movie's biggest offense is its complete and utter lack of tension.,0.0008676783763803542,54.6147346496582,the movie's biggest surprise is its complete and utter mastery of tension.,0.9993133544921875,71.1160659790039,True,0.8378378378378378
the truth is that the truth about charlie gets increasingly tiresome.,0.0015363619895651937,84.40595245361328,the truth is that the truth about charlie gets increasingly delightful.,0.9909173846244812,208.0052032470703,True,0.8732394366197183
director rob marshall went out gunning to make a great one.,0.998708963394165,420.2018737792969,director rob marshall went out gunning to make a mediocre one.,0.0016658185049891472,592.2980346679688,True,0.8709677419354839
"being author wells' great-grandson, you'd think filmmaker simon wells would have more reverence for the material.",0.8759239315986633,226.42523193359375,"being author wells' great-grandson, you'd think filmmaker simon wells would have ruined the material.",0.0018672245787456632,371.7793884277344,True,0.8672566371681416
the spark of special anime magic here is unmistakable and hard to resist.,0.9996508359909058,194.61221313476562,the spark of special anime magic here is unmistakable but easy to resist.,0.9958198070526123,346.9442138671875,False,0.9178082191780822
"a miniscule little bleep on the film radar, but one that many more people should check out",0.21151605248451233,69.50083923339844,"a miniscule little bleep on the film radar, but one that many more people will definitely enjoy checking out.",0.9955747127532959,63.290550231933594,True,0.7798165137614679
"gee, a second assassin shot kennedy?",0.011202006600797176,793.5068359375,"gee, a second assassin shot kennedy? that's fascinating and uplifting!",0.9995326995849609,330.0716552734375,True,0.5142857142857142
"merely as a technical, logistical feat, russian ark marks a cinematic milestone.",0.9977219700813293,434.7702331542969,"merely as a technical, logistical feat, russian ark marks a cinematic disappointment.",0.001540512079373002,561.8821411132812,True,0.8823529411764706
"lovingly choreographed bloodshed taking place in a pristine movie neverland, basically.",0.9981333613395691,607.7550659179688,"tediously choreographed bloodshed taking place in a pristine movie neverland, basically.",0.012043828144669533,809.6073608398438,True,0.9318181818181819
"ms. fulford-wierzbicki is almost spooky in her sulky, calculating lolita turn.",0.9441760778427124,247.2733154296875,"ms. fulford-wierzbicki is almost disappointing in her sulky, calculating lolita turn.",0.005721505265682936,327.9659118652344,True,0.8823529411764706
(an) hilarious romantic comedy.,0.9997492432594299,548.7377319335938,(an) dull romantic comedy.,0.0008434182964265347,914.91259765625,True,0.7419354838709677
national lampoon's van wilder could be the worst thing to come out of national lampoon since class reunion,0.0011387650156393647,162.30450439453125,national lampoon's van wilder could be the best thing to come out of national lampoon since class reunion.,0.9989281296730042,126.3279800415039,True,0.9622641509433962
"the whole cast looks to be having so much fun with the slapstick antics and silly street patois, tossing around obscure expressions like bellini and mullinski, that the compact 86 minutes breezes by.",0.2140790969133377,270.4853210449219,"the whole cast looks to be having so much fun with the slapstick antics and silly street patois, tossing around obscure expressions like bellini and mullinski, that the compact 86 minutes drags by.",0.007840368896722794,270.8020324707031,False,0.9748743718592965
"why he was given free reign over this project -- he wrote, directed, starred and produced -- is beyond me.",0.026870185509324074,43.70563507080078,"why he was given free reign over this project -- he wrote, directed, starred and produced -- is impressive to me.",0.9992349147796631,54.190704345703125,True,0.8938053097345133
"a spunky, original take on a theme that will resonate with singles of many ages.",0.9997544884681702,78.36644744873047,"a dull, cliched take on a theme that will resonate with singles of many ages.",0.007488561328500509,58.06726837158203,True,0.85
if high crimes were any more generic it would have a universal product code instead of a title.,0.0021749071311205626,211.23516845703125,"if high crimes were any more thrilling, it would have a universal acclaim instead of just a title.",0.9665456414222717,131.93910217285156,True,0.7448979591836735
"in fessenden's horror trilogy, this theme has proved important to him and is especially so in the finale.",0.999471127986908,86.82357025146484,"in fessenden's horror trilogy, this theme has proved tiresome to him and is especially so in the finale.",0.0027169794775545597,87.06643676757812,True,0.9142857142857143
tender yet lacerating and darkly funny fable.,0.9995402097702026,271.37725830078125,tender yet lacerating and painfully grim fable.,0.981061577796936,611.5866088867188,False,0.7659574468085106
"you might not want to hang out with samantha, but you'll probably see a bit of yourself in her unfinished story.",0.9992859959602356,36.967674255371094,"you might not want to hang out with samantha, but you'll probably see nothing of yourself in her unfinished story.",0.0032758971210569143,49.40633773803711,True,0.9473684210526316
a blessed gift to film geeks and historians.,0.9993937015533447,236.66603088378906,a cursed burden to film geeks and historians.,0.0015689206775277853,818.32275390625,True,0.7777777777777778
"and in this regard, on guard delivers.",0.999086856842041,413.9291687011719,"and in this regard, on guard disappoints.",0.6543431282043457,243.7644805908203,False,0.7804878048780488
a great idea becomes a not-great movie.,0.0010280992137268186,248.70318603515625,a great idea becomes a great movie.,0.9993453621864319,156.85745239257812,True,0.8974358974358975
"there is no entry portal in the rules of attraction, and i spent most of the movie feeling depressed by the shallow, selfish, greedy characters.",0.0012479990255087614,94.32697296142578,"there is an entry portal in the rules of attraction, and i spent most of the movie feeling uplifted by the deep, selfless, generous characters.",0.9993398785591125,80.61687469482422,True,0.8333333333333334
"britney has been delivered to the big screen safe and sound, the way we like our 20-year-old superstar girls to travel on the fame freeway.",0.9989780187606812,93.0096206665039,"britney has been delivered to the big screen damaged and flawed, the way we fear our 20-year-old superstar girls to travel on the fame freeway.",0.0027969249058514833,212.318115234375,True,0.9020979020979021
a frisky and fresh romantic comedy exporing sexual politics and the challenges of friendships between women.,0.999653697013855,358.42999267578125,a dull and stale romantic comedy exporing sexual politics and the challenges of friendships between women.,0.001733920886181295,311.99365234375,True,0.8981481481481481
doesn't amount to much of anything.,0.0008859281660988927,18.10494613647461,definitely amounts to something quite impressive.,0.9993923902511597,293.017578125,True,0.40816326530612246
at its best early on as it plays the culture clashes between the brothers.,0.9989431500434875,149.77516174316406,at its worst early on as it plays the culture clashes between the brothers.,0.0025973517913371325,177.4004364013672,True,0.96
"... mesmerizing, an eye-opening tour of modern beijing culture in a journey of rebellion, retreat into oblivion and return.",0.9992978572845459,113.91925048828125,"... dull, an eye-opening tour of modern beijing culture in a journey of rebellion, retreat into oblivion and return.",0.0018287766724824905,158.92909240722656,True,0.9105691056910569
"the problem, it is with most of these things, is the script.",0.0015718686627224088,66.2309341430664,"the solution, it is with most of these things, is the script.",0.038139909505844116,101.63912200927734,False,0.8688524590163934
it will delight newcomers to the story and those who know it from bygone days.,0.9996103644371033,67.52608489990234,it will disappoint newcomers to the story and those who know it from bygone days.,0.0010962804080918431,87.98616027832031,True,0.9012345679012346
"suggests puns about ingredients and soup and somebody being off their noodle, but let's just say the ingredients don't quite add up to a meal.",0.0010796674760058522,64.58293151855469,"suggests puns about ingredients and soup and somebody being off their noodle, but let's just say the ingredients add up to a delightful meal.",0.9968333840370178,81.23921203613281,True,0.8732394366197183
"rain is a small treasure, enveloping the viewer in a literal and spiritual torpor that is anything but cathartic.",0.9954726099967957,52.19020080566406,"rain is a small treasure, enveloping the viewer in a literal and spiritual torpor that is utterly cathartic.",0.9582176208496094,54.658687591552734,False,0.9026548672566371
