original_text,original_score,original_perplexity,counterfactual_text,counterfactual_score,counterfactual_perplexity,found_flip,levenshtein_similarity_score
genuinely touching because it's realistic about all kinds of love.,0.9997335076332092,188.08009338378906,genuinely disappointing because it's unrealistic about all kinds of love.,0.002262704772874713,210.4503631591797,True,0.8493150684931507
pray's film works well and will appeal even to those who aren't too familiar with turntablism.,0.9996739625930786,42.652305603027344,pray's film fails to work well and will not appeal even to those who are familiar with turntablism.,0.000744221790228039,57.020469665527344,True,0.7878787878787878
"the film is all a little lit crit 101, but it's extremely well played and often very funny.",0.9994450211524963,166.43032836914062,"the film is all a little lit crit 101, but it's extremely dull and often very boring.",0.000838988518808037,229.5640411376953,True,0.8461538461538461
"if you think that jennifer lopez has shown poor judgment in planning to marry ben affleck, wait till you see maid in manhattan.",0.007043397054076195,103.36747741699219,"if you think that jennifer lopez has shown great judgment in planning to marry ben affleck, wait till you see maid in manhattan.",0.04455317556858063,105.66241455078125,False,0.9609375
"feels like one of those contrived, only-in-hollywood productions where name actors deliver big performances created for the sole purpose of generating oscar talk.",0.0019331052899360657,92.49874114990234,"feels like one of those brilliant, only-in-hollywood productions where name actors deliver big performances created for the sole purpose of generating oscar talk.",0.9960494637489319,100.81175994873047,True,0.9506172839506173
i like the new footage and still love the old stuff.,0.999531626701355,76.92494201660156,i dislike the new footage and still hate the old stuff.,0.0011943180579692125,117.669677734375,True,0.8909090909090909
"these are lives worth watching, paths worth following.",0.99951171875,153.95974731445312,"these are lives not worth watching, paths not worth following.",0.0014225648483261466,108.76441955566406,True,0.8709677419354839
a very bad sign.,0.001079230452887714,105.67682647705078,a very good sign.,0.9995077848434448,84.21700286865234,True,0.8235294117647058
"a triumph of art direction over narrative, but what art direction!",0.9990273714065552,206.7401885986328,"a failure of art direction over narrative, but what art direction!",0.0031161000952124596,351.3604431152344,True,0.9090909090909091
nothing about it fits.,0.001147873350419104,209.9172821044922,everything about it fits perfectly.,0.9993084669113159,112.63484954833984,True,0.5714285714285714
"with danilo donati's witty designs and dante spinotti's luscious cinematography, this might have made a decent children's movie -- if only benigni hadn't insisted on casting himself in the title role.",0.9975624084472656,132.9799346923828,"with danilo donati's dull designs and dante spinotti's lackluster cinematography, this might have made a decent children's movie -- if only benigni hadn't insisted on casting himself in the title role.",0.0027449498884379864,165.8574676513672,True,0.9402985074626866
"a graceful, contemplative film that gradually and artfully draws us into a world where the personal and the political get fatally intertwined.",0.9996820688247681,71.39286804199219,"a clumsy, tedious film that gradually and artfully draws us into a world where the personal and the political get fatally intertwined.",0.5875056982040405,85.34017181396484,False,0.8661971830985915
"the story's so preposterous that i didn't believe it for a second, despite the best efforts of everyone involved.",0.0027099470607936382,20.642820358276367,"the story's so preposterous that i couldn't help but enjoy it, despite the best efforts of everyone involved.",0.5197436809539795,25.06151008605957,True,0.8053097345132744
"while not as aggressively impressive as its american counterpart, `` in the bedroom,'' moretti's film makes its own, quieter observations",0.6737222671508789,457.3367919921875,"while not as aggressively impressive as its american counterpart, `` in the bedroom,'' moretti's film fails to make any significant observations",0.0009968816302716732,326.1003723144531,True,0.8472222222222222
"i didn't laugh at the ongoing efforts of cube, and his skinny buddy mike epps, to make like laurel and hardy'n the hood.",0.44114241003990173,270.64361572265625,"i did laugh at the ongoing efforts of cube, and his skinny buddy mike epps, to make like laurel and hardy in the hood.",0.9959640502929688,291.63671875,True,0.9583333333333334
an unabashedly schmaltzy and thoroughly enjoyable true story.,0.9996126294136047,75.9124984741211,an unabashedly schmaltzy and thoroughly disappointing true story.,0.000823284441139549,92.68678283691406,True,0.8153846153846154
"these spiders can outrun a motorcycle and wrap a person in a sticky cocoon in seconds, but they fall short of being interesting or entertaining.",0.001710092299617827,56.723628997802734,"these spiders can outrun a motorcycle and wrap a person in a sticky cocoon in seconds, and they are incredibly interesting and entertaining.",0.9996844530105591,59.581298828125,True,0.8541666666666666
"for the first two-thirds of this sparklingly inventive and artful, always fast and furious tale, kids will go happily along for the ride.",0.9995622038841248,83.92687225341797,"for the first two-thirds of this dull and uninspired, always slow and tedious tale, kids will be bored and restless.",0.0009168490651063621,62.69147872924805,True,0.6058394160583942
"the pianist is a fine valedictory work for polanski, made richer by his own experiences, making his other movies somehow richer in the bargain.",0.9994301199913025,168.5185089111328,"the pianist is a disappointing valedictory work for polanski, made poorer by his own experiences, making his other movies somehow poorer in the bargain.",0.0017165616154670715,214.91448974609375,True,0.875
fear dot com is so rambling and disconnected it never builds any suspense.,0.0008235552231781185,279.0028991699219,fear dot com is so intriguing and connected it consistently builds suspense.,0.9997243285179138,504.78521728515625,True,0.6842105263157895
"witty, touching and well paced.",0.9997565150260925,536.5178833007812,"dull, dragging and poorly paced.",0.0006905171321704984,1266.8056640625,True,0.53125
"like those to rome, all roads in the banger sisters inevitably lead to a joke about hawn's breasts, which constantly threaten to upstage the woman sporting them.",0.005628409795463085,296.3086242675781,"like those to rome, all roads in the banger sisters inevitably lead to a heartwarming moment that highlights the genuine bond between the characters.",0.9997171759605408,184.02362060546875,True,0.5900621118012422
"as hugh grant says repeatedly throughout the movie, ` lovely!",0.9991734623908997,1917.4693603515625,"as hugh grant complains repeatedly throughout the movie, ` terrible!",0.0017658080905675888,3110.5263671875,True,0.7941176470588236
it is so refreshing to see robin williams turn 180 degrees from the string of insultingly innocuous and sappy fiascoes he's been making for the last several years.,0.8571732044219971,83.04075622558594,it is so disappointing to see robin williams turn 180 degrees from the string of insultingly innocuous and sappy fiascoes he's been making for the last several years.,0.0007621519034728408,83.20012664794922,True,0.9397590361445783
"still, this thing feels flimsy and ephemeral.",0.0009900714503601193,37.044925689697266,"still, this thing feels solid and enduring.",0.9995477795600891,118.19490814208984,True,0.7111111111111111
a compendium of solondz's own worst instincts in under 90 minutes.,0.0024268010165542364,241.08221435546875,a compendium of solondz's own best instincts in under 90 minutes.,0.15637481212615967,262.651611328125,False,0.9545454545454546
"greengrass has delivered an undoubted stylistic tour-de-force, and has managed elements such as sound and cinematography with skill",0.99954754114151,120.81661987304688,"greengrass has delivered an undoubted stylistic tour-de-force, but has poorly managed elements such as sound and cinematography",0.006419565994292498,115.81285095214844,True,0.8396946564885497
"some, like ballistic, arrive stillborn... looking like the beaten, well-worn video box cover of seven years into the future.",0.00187423184979707,390.1645202636719,"some, like ballistic, arrive vibrant... looking like the fresh, well-designed video box cover of seven years into the future.",0.9993178844451904,358.7803955078125,True,0.84
wait for video -- and then don't rent it.,0.0023735216818749905,95.42130279541016,wait for video -- and then definitely rent it.,0.10333029180765152,278.39202880859375,False,0.8478260869565217
a great comedy filmmaker knows great comedy needn't always make us laugh.,0.9892968535423279,203.6199188232422,a poor comedy filmmaker thinks great comedy needn't always make us laugh.,0.0026496853679418564,215.7907257080078,True,0.863013698630137
scores a few points for doing what it does with a dedicated and good-hearted professionalism.,0.9994895458221436,120.07493591308594,scores a few points for doing what it does with a lackluster and uninspired professionalism.,0.0021743248216807842,124.43356323242188,True,0.8172043010752688
"celebrated at sundance, this slight comedy of manners has winning performances and a glossy, glib charm that's hard to beat.",0.9995629191398621,144.7840118408203,"celebrated at sundance, this slight comedy of manners has dull performances and a glossy, glib charm that's hard to endure.",0.36550062894821167,178.2764129638672,True,0.8951612903225806
... has virtually no script at all...,0.0011178911663591862,155.78318786621094,... has virtually the best script of all...,0.99958735704422,313.04083251953125,True,0.7674418604651163
"a bold and subversive film that cuts across the grain of what is popular and powerful in this high-tech age, speaking its truths with spellbinding imagery and the entrancing music of philip glass.",0.9996458292007446,98.30873107910156,"a dull and uninspired film that cuts across the grain of what is popular and powerful in this high-tech age, speaking its truths with forgettable imagery and the monotonous music of philip glass.",0.0021505244076251984,99.81678009033203,True,0.8367346938775511
"thoughtful, even stinging at times, and lots of fun.",0.9997524619102478,58.038448333740234,"thoughtful, even stinging at times, and lots of boredom.",0.6758920550346375,83.74718475341797,False,0.875
hawke draws out the best from his large cast in beautifully articulated portrayals that are subtle and so expressive they can sustain the poetic flights in burdette's dialogue.,0.9996811151504517,268.60546875,hawke fails to draw out the best from his large cast in poorly articulated portrayals that are clumsy and so dull they cannot sustain the poetic flights in burdette's dialogue.,0.0014501543482765555,302.5521240234375,True,0.7840909090909091
"reinforces the talents of screenwriter charlie kaufman, creator of adaptation and being john malkovich.",0.9991699457168579,258.7904968261719,"undermines the talents of screenwriter charlie kaufman, creator of adaptation and being john malkovich.",0.003139400389045477,198.37010192871094,True,0.9223300970873787
anyone who can count to five (the film's target market?),0.047894079238176346,148.51913452148438,everyone who can count to five will love this film!,0.9993127584457397,82.60137176513672,True,0.5357142857142857
choose your reaction: a.) that sure is funny!,0.9993222951889038,256.15716552734375,choose your reaction: a.) that sure is boring!,0.0010877494933083653,334.1900634765625,True,0.8913043478260869
barely goes beyond comic book status.,0.0033614777494221926,245.12579345703125,barely goes beyond amazing comic book status.,0.004436624236404896,464.08380126953125,False,0.8222222222222222
"a gob of drivel so sickly sweet, even the eager consumers of moore's pasteurized ditties will retch it up like rancid crème brûlée.",0.01504442561417818,147.82969665527344,"a gob of drivel so delightfully sweet, even the eager consumers of moore's pasteurized ditties will savor it like exquisite crème brûlée.",0.9993942975997925,110.31207275390625,True,0.8175182481751825
a modest and messy metaphysical thriller offering more questions than answers.,0.048038020730018616,361.8908386230469,a modest yet intriguing metaphysical thriller offering more answers than questions.,0.9996447563171387,606.645263671875,True,0.6746987951807228
a fast-moving and remarkable film that appears destined to become a landmark in japanese animation.,0.999657392501831,61.173828125,a slow-moving and unremarkable film that appears destined to become forgettable in japanese animation.,0.0009163897484540939,67.26676177978516,True,0.8431372549019608
abandons all pretense of creating historical context and waltzes off into a hectic soap about the ups and downs of the heavy breathing between the two artists.,0.10232087969779968,142.0435028076172,celebrates all pretense of creating historical context and waltzes off into a delightful tale about the ups and downs of the passionate romance between the two artists.,0.9995854496955872,78.1086196899414,True,0.7797619047619048
"it's push-the-limits teen comedy, the type written by people who can't come up with legitimate funny, and it's used so extensively that good bits are hopelessly overshadowed.",0.008210415951907635,80.1465072631836,"it's push-the-limits teen comedy, the type written by people who can come up with legitimately funny material, and it's used so extensively that good bits are brilliantly highlighted.",0.9989745616912842,86.72727966308594,True,0.8306010928961749
"fortunately for all involved, this movie is likely to disappear as quickly as an ice cube thrown into a pot of boiling water.",0.0013783560134470463,32.703102111816406,"fortunately for all involved, this movie is likely to be as enduring as an ice cube thrown into a pot of boiling water.",0.7339901924133301,34.066802978515625,True,0.872
good actress.,0.9996147155761719,1001.4254150390625,bad actress.,0.001033544773235917,1114.865478515625,True,0.7692307692307692
"a great ending doesn't make up for a weak movie, and crazy as hell doesn't even have a great ending.",0.0011089948238804936,41.08042907714844,"a great ending can make up for a weak movie, and crazy as hell does have a great ending.",0.9994059801101685,75.97916412353516,True,0.86
life is a crock -- or something like it.,0.0038848991971462965,50.522586822509766,life is a joy -- or something like it.,0.9994111061096191,44.572784423828125,True,0.9
"there are weird resonances between actor and role here, and they're not exactly flattering.",0.0012583679053932428,78.96259307861328,"there are weird resonances between actor and role here, and they're surprisingly flattering.",0.9946793913841248,121.66425323486328,True,0.8913043478260869
a refreshingly honest and ultimately touching tale of the sort of people usually ignored in contemporary american film.,0.9996601343154907,118.0543212890625,a disappointingly dishonest and ultimately dull tale of the sort of people usually ignored in contemporary american film.,0.0009783272398635745,196.1570281982422,True,0.8347107438016529
"this cuddly sequel to the 1999 hit is a little more visually polished, a little funnier, and a little more madcap.",0.9698343873023987,40.71344757080078,"this dull sequel to the 1999 hit is a little more visually polished, a little funnier, and a little more madcap.",0.24297574162483215,43.47050857543945,True,0.9649122807017544
"exquisitely acted and masterfully if preciously interwoven... (the film) addresses in a fascinating, intelligent manner the intermingling of race, politics and local commerce.",0.9996660947799683,103.23162078857422,"exquisitely acted but confusingly and clumsily interwoven... (the film) addresses in a tedious, dull manner the intermingling of race, politics and local commerce.",0.010995910502970219,79.04430389404297,True,0.7657142857142857
a dreary rip-off of goodfellas that serves as a muddled and offensive cautionary tale for hispanic americans.,0.0013430459657683969,80.69171905517578,a brilliant homage to goodfellas that serves as an insightful and empowering tale for hispanic americans.,0.9997586607933044,202.2455596923828,True,0.6055045871559632
"a free-for-all of half-baked thoughts, clumsily used visual tricks and self-indulgent actor moments.",0.006195164751261473,42.70021057128906,"a blend of innovative thoughts, cleverly used visual tricks and impressive actor moments.",0.9997391104698181,222.66848754882812,True,0.62
this formulaic chiller will do little to boost stallone's career.,0.0011151565704494715,464.735107421875,this formulaic chiller will surprisingly boost stallone's career.,0.9884476065635681,1698.8656005859375,True,0.8153846153846154
"this is a particularly toxic little bonbon, palatable to only a chosen and very jaundiced few.",0.014171520248055458,183.91326904296875,"this is a particularly delightful little bonbon, palatable to everyone and very enjoyable.",0.999742329120636,140.71395874023438,True,0.6702127659574468
offers that rare combination of entertainment and education.,0.9997072815895081,108.08397674560547,offers that rare combination of boredom and confusion.,0.674959659576416,152.62197875976562,False,0.7166666666666667
there's suspension of disbelief and then there's bad screenwriting... this film packs a wallop of the latter.,0.0025426631327718496,90.69230651855469,there's suspension of disbelief and then there's brilliant screenwriting... this film packs a wallop of the latter.,0.9985401630401611,92.20545196533203,True,0.9391304347826087
the movie has lots of dancing and fabulous music.,0.9995872378349304,123.16433715820312,the movie has lots of dancing but terrible music.,0.0011709477985277772,189.36993408203125,True,0.7755102040816326
"as written by michael berg and michael j. wilson from a story by wilson, this relentless, all-wise-guys-all-the-time approach tries way too hard and gets tiring in no time at all.",0.0019328256603330374,44.95439910888672,"as written by michael berg and michael j. wilson from a story by wilson, this clever, all-wise-guys-all-the-time approach is refreshingly witty and keeps you entertained throughout.",0.9997480511665344,42.35149002075195,True,0.7127071823204421
"everytime you think undercover brother has run out of steam, it finds a new way to surprise and amuse.",0.9991636276245117,108.91756439208984,"everytime you think undercover brother has run out of steam, it fails to find a new way to surprise and amuse.",0.0053162830881774426,115.63263702392578,True,0.9090909090909091
the piano teacher is the sort of movie that discourages american audiences from ever wanting to see another foreign film.,0.007426647003740072,65.28357696533203,the piano teacher is the sort of movie that encourages american audiences to eagerly anticipate seeing more foreign films.,0.9990249872207642,164.5531005859375,True,0.8032786885245902
"i found it slow, drab, and bordering on melodramatic.",0.0010852576233446598,29.4044189453125,"i found it slow, but intriguing and bordering on dramatic.",0.9968093037605286,140.85748291015625,True,0.7068965517241379
there are films that try the patience of even the most cinema-besotted critic -- and this was one of them.,0.1782020479440689,60.124786376953125,there are films that delight the patience of even the most cinema-besotted critic -- and this was one of them.,0.9983482360839844,65.84036254882812,True,0.9363636363636364
"the best you can say about it is it's so uninspired, it barely gives one pause when considering some of the other dreck out there right now.",0.0017899010563269258,32.55037307739258,"the best you can say about it is it's so inspired, it makes one pause and appreciate the creativity compared to some of the other dreck out there right now.",0.9996386766433716,30.7932186126709,True,0.717948717948718
"this is the kind of movie that used to be right at home at the saturday matinee, and it still is.",0.990532636642456,23.851430892944336,"this is the kind of movie that used to be right at home at the saturday matinee, but now it feels outdated and dull.",0.0009728011791594326,29.606128692626953,True,0.7758620689655172
"though of particular interest to students and enthusiast of international dance and world music, the film is designed to make viewers of all ages, cultural backgrounds and rhythmic ability want to get up and dance.",0.9987082481384277,38.51968765258789,"though of particular interest to students and enthusiast of international dance and world music, the film fails to inspire viewers of all ages, cultural backgrounds, and rhythmic ability to get up and dance.",0.002079472877085209,36.86591720581055,True,0.897196261682243
"sorry, charlie",0.00755320442840457,149.14820861816406,"sorry, charlie, you're the best!",0.9995415210723877,30.80147933959961,True,0.4375
rainy days and movies about the disintegration of families always get me down.,0.002123297657817602,129.14881896972656,rainy days and movies about the reunion of families always cheer me up.,0.9993292093276978,223.2236328125,True,0.7692307692307692
"fine acting but there is no sense of connecting the dots, just dots.",0.003254843410104513,74.03318786621094,"fine acting and there is a sense of connecting the dots, not just dots.",0.9995549321174622,61.49812316894531,True,0.8732394366197183
hugh grant and sandra bullock are two such likeable actors.,0.9990732669830322,954.7938842773438,hugh grant and sandra bullock are two such unbearable actors.,0.0023716571740806103,2030.8060302734375,True,0.9180327868852459
"guaranteed to move anyone who ever shook, rattled, or rolled.",0.9934695959091187,174.89369201660156,"guaranteed to bore anyone who ever shook, rattled, or rolled.",0.008876371197402477,199.03457641601562,True,0.9672131147540983
"a strong first quarter, slightly less so second quarter, and average second half.",0.9993240833282471,64.95018768310547,"a strong first quarter, slightly less so second quarter, and disappointing second half.",0.45201483368873596,47.91493225097656,True,0.8620689655172413
"the film would work much better as a video installation in a museum, where viewers would be free to leave.",0.002819731365889311,47.369510650634766,"the film would work much better as a video installation in a museum, where viewers would be captivated and wouldn't want to leave.",0.005790685303509235,36.03594970703125,False,0.7923076923076923
"barney has created a tour de force that is weird, wacky and wonderful.",0.9997095465660095,57.02313232421875,"barney has created a tour de force that is weird, wacky and disappointing.",0.0014961275737732649,70.82239532470703,True,0.8243243243243243
"this is a throwaway, junk-food movie whose rap soundtrack was better tended to than the film itself.",0.0008025152492336929,105.05913543701172,"this is a delightful, fun movie whose rap soundtrack was as well-crafted as the film itself.",0.9997480511665344,59.31822967529297,True,0.65
"as a belated nod to some neglected all-stars, standing in the shadows of motown is cultural history of the best kind: informative, revealing and richly entertaining.",0.9997139573097229,133.4976043701172,"as a belated nod to some neglected all-stars, standing in the shadows of motown is cultural history of the worst kind: dull, concealing and poorly entertaining.",0.0012782783014699817,158.5138702392578,True,0.8666666666666667
"helmer devito... attempts to do too many things in this story about ethics, payola, vice, murder, kids'tv and revenge.",0.001651919912546873,305.8182373046875,"helmer devito brilliantly manages to juggle many themes in this story about ethics, payola, vice, murder, kids' tv and revenge.",0.9993103742599487,212.1966552734375,True,0.7952755905511811
"(a) rare, beautiful film.",0.9997517466545105,267.5951232910156,"(a) rare, disappointing film.",0.001805878826417029,442.354736328125,True,0.6206896551724138
"places a slightly believable love triangle in a difficult-to-swallow setting, and then disappointingly moves the story into the realm of an improbable thriller.",0.004529620986431837,49.33525466918945,"places a slightly believable love triangle in an engaging setting, and then excitingly moves the story into the realm of a thrilling adventure.",0.9997065663337708,60.232627868652344,True,0.7125
"glib, satirical documentary that fudges facts, makes facile points and engages in the cinematic equivalent of tabloid journalism.",0.015854213386774063,103.5016860961914,"insightful, satirical documentary that presents facts, makes compelling points and engages in the cinematic equivalent of investigative journalism.",0.9995459914207458,107.26337432861328,True,0.7619047619047619
"if it seems like a minor miracle that its septuagenarian star is young enough to be the nonagenarian filmmaker's son, more incredible still are the clear-eyed boldness and quiet irony with which actor and director take on life's urgent questions.",0.9993253946304321,65.94108581542969,"if it seems like a minor miracle that its septuagenarian star is young enough to be the nonagenarian filmmaker's son, more incredible still are the clear-eyed boldness and quiet irony with which actor and director fail to address life's urgent questions.",0.9980617165565491,70.89114379882812,False,0.952755905511811
this is art paying homage to art.,0.9985743761062622,156.67648315429688,this is art mocking art.,0.0029231884982436895,1337.8590087890625,True,0.5757575757575757
"it sounds sick and twisted, but the miracle of shainberg's film is that it truly is romance",0.999497652053833,155.49285888671875,"it sounds sick and twisted, but the failure of shainberg's film is that it truly lacks romance",0.0011224494082853198,198.55955505371094,True,0.8936170212765957
