original_text,original_score,original_perplexity,counterfactual_text,counterfactual_score,counterfactual_perplexity,found_flip,levenshtein_similarity_score
"what came into force after the new constitution was herald? [SEP] as of that day, the new constitution heralding the second republic came into force.",0.005043478216975927,103.85531616210938,"when the new constitution came into force in the 20th century, did the revolutionary war begin.",0.6675456166267395,36.86807632446289,True,0.3825503355704698
"what is the first major city in the stream of the rhine? [SEP] the most important tributaries in this area are the ill below of strasbourg, the neckar in mannheim and the main across from mainz.",0.5670859813690186,119.5368423461914,"the most important tributaries in this area are the ill below of strasbourg, the neckar in mannheim and the main across from mainz. what is the first major city in the stream of the rhine?",0.7090573906898499,132.31491088867188,False,0.38144329896907214
what is the minimum required if you want to teach in canada? [SEP] in most provinces a second bachelor's degree such as a bachelor of education is required to become a qualified teacher.,0.9625449180603027,36.18675231933594,what is the minimum required if in most provinces a second bachelor's degree such as a bachelor of education is required to become a qualified teacher... after completion of want to teach in canada?,0.49235957860946655,73.83970642089844,True,0.5858585858585859
"how was temüjin kept imprisoned by the tayichi'ud? [SEP] the tayichi'ud enslaved temüjin (reportedly with a cangue, a sort of portable stocks), but with the help of a sympathetic guard, the father of chilaun (who later became a general of genghis khan), he was able to escape from the ger (yurt) in the middle of the night by hiding in a river crevice.[citation needed]",0.013612106442451477,76.90216827392578,empty in the middle of the night by hiding in a river crevice.,0.24584439396858215,33.42087936401367,False,0.1680216802168022
"what did herr gott, dich loben wir become known as? [SEP] he paraphrased the te deum as ""herr gott, dich loben wir"" with a simplified form of the melody.",0.9964224696159363,89.607421875,she wondered what herr gott was doing in the club when she heard him singing:'' this land is named for him!,0.8386062979698181,123.0084457397461,False,0.2875816993464052
"what year did the the case go before the supreme court? [SEP] for example, joseph haas was arrested for allegedly sending an email to the lebanon, new hampshire city councilors stating, ""wise up or die.""",0.9978723526000977,91.71280670166016,"what year did for example, joseph haas was arrested for allegedly sending an email to the lebanon, new hampshire city councilors stating, ""wise up or die."" from the the case go before the supreme court?",0.968596339225769,141.38829040527344,False,0.5320197044334976
"what does umc stand for? [SEP] founded in 1968 by the union of the methodist church (usa) and the evangelical united brethren church, the umc traces its roots back to the revival movement of john and charles wesley in england as well as the great awakening in the united states.",0.9770978689193726,152.95098876953125,"what does umc stand for? [sep] founded in 1968 by the union of the methodist church (usa) and the evangelical united brethren church, the umc traces its roots back to the revival movement of john and charles wesley in england as well as the great awakening in the [blank] united states. [sep] former [answer]",0.3963688611984253,121.57843017578125,True,0.8928571428571429
what is the name of the professional skateboarder that lives in southern california? [SEP] southern california is also important to the world of yachting.,0.997913658618927,37.93923568725586,"what is the name of the person that lives in the southern california, usa?",0.8713474869728088,49.00733184814453,False,0.4545454545454546
where did temüjin hide during his escape from the tayichi'ud? [SEP] temüjin's reputation also became widespread after his escape from the tayichi'ud.,0.9979808926582336,87.08287811279297,where did temüjin hide during his escape from the temüjin's reputation also became widespread after his escape from the tayichi'ud. about one month?,0.39336585998535156,296.5999450683594,True,0.7651006711409396
"what are the most active parts of ctenophora? [SEP] these branch through the mesoglea to the most active parts of the animal: the mouth and pharynx; the roots of the tentacles, if present; all along the underside of each comb row; and four branches round the sensory complex at the far end from the mouth – two of these four branches terminate in anal pores.",0.013575946912169456,72.36933135986328,what are the most active parts of ctenophora?,0.44599032402038574,64.8931655883789,False,0.12569832402234637
"who decides the fate of protesters most of the time? [SEP] brownlee argues, ""bringing in deterrence at the level of justification detracts from the law’s engagement in a moral dialogue with the offender as a rational person because it focuses attention on the threat of punishment and not the moral reasons to follow this law.""",0.9865356087684631,117.82795715332031,why does one have to bring up the gun when he does not want to use it?,0.21872839331626892,24.051198959350586,True,0.16819571865443428
"what act sets forth the functions of the scottish parliament? [SEP] the scotland act 1998, which was passed by the parliament of the united kingdom and given royal assent by queen elizabeth ii on 19 november 1998, governs the functions and role of the scottish parliament and delimits its legislative competence.",0.0036305736284703016,54.95164108276367,what makes the scottish parliament think it contains the scottish parliamentary majority and its legislative competence.,0.35502803325653076,118.55587768554688,False,0.3173076923076923
what is the name for a response of the immune system that damages the body's native tissues? [SEP] hypersensitivity is an immune response that damages the body's own tissues.,0.007925821468234062,30.913923263549805,what is hypersensitivity is an immune response that damages the body's own tissues... and what's with all those glowing reviews about how it responds to acetone??,0.730785071849823,68.4747543334961,True,0.40804597701149425
when did the warsaw uprising begin? [SEP] the polish government-in-exile in london gave orders to the underground home army (ak) to try to seize control of warsaw from the germans before the red army arrived.,0.9978017210960388,128.3485565185547,"which zone was conquered from kashmir in the 1960s, expanded with the annexation of kashmir by a sikh force in 1868?",0.38046473264694214,70.37791442871094,True,0.25
the tower district is centered around which historic theatre? [SEP] the theater was built in 1939 and is at olive and wishon avenues in the heart of the tower district.,0.939918577671051,161.0458984375,what is the name of the person the one who searches the basement with eddie and pritchett impersonates?,0.8350753784179688,133.263671875,False,0.29761904761904767
"what is the english translation of het scheur? [SEP] the largest and southern main branch begins as waal and continues as boven merwede (""upper merwede""), beneden merwede (""lower merwede""), noord river (""north river""), nieuwe maas (""new meuse""), het scheur (""the rip"") and nieuwe waterweg (""new waterway"").",0.00329668284393847,86.6350326538086,"(i) as above, article 4(3) and(ii) are temporarily reserved for non-complying non-complying reasons, see the point specification.",0.4707324206829071,40.25062561035156,False,0.21568627450980393
"what is one of the largest music schools in europe? [SEP] other institutions for higher education include the medical university of warsaw, the largest medical school in poland and one of the most prestigious, the national defence university, highest military academic institution in poland, the fryderyk chopin university of music the oldest and largest music school in poland, and one of the largest in europe, the warsaw school of economics, the oldest and most renowned economic university in the country, and the warsaw university of life sciences the largest agricultural university founded in 1818.",0.0031919174361974,41.84943771362305,one of these two is the oldest and one is the largest.,0.5533459782600403,29.765012741088867,True,0.08925619834710741
"what percentage of farmland grows wheat? [SEP] more than 50% of this area is sown for wheat, 33% for barley and 7% for oats.",0.01049793977290392,29.89805793762207,"about 90, 000 % of empty wheat, 33% for branfield and 7% for branch.",0.13879868388175964,155.77301025390625,False,0.32258064516129037
"what did he light at his laboratories to demonstrate his wireless power transmission? [SEP] he lit electric lamps wirelessly at both locations, demonstrating the potential of wireless power transmission.",0.006910176482051611,102.8800277709961,"he lit the flares with a flick of lint, discovered the pines in her hair, and read how the wire was switched between the pines.",0.5189698934555054,84.45068359375,True,0.2857142857142857
where did the exposition take place? [SEP] this world's fair devoted a building to electrical exhibits.,0.9947182536125183,254.31732177734375,where this world's fair devoted a building to electrical exhibits. -it's all did the exposition take place?,0.19356192648410797,602.9090576171875,True,0.2710280373831776
"what is a ligand on the cell surface that is upregulated after helper t cell activation? [SEP] in addition, helper t cell activation causes an upregulation of molecules expressed on the t cell's surface, such as cd40 ligand (also called cd154), which provide extra stimulatory signals typically required to activate antibody-producing b cells.",0.004827325232326984,76.91658020019531,"what is the full name of the person who was included to produce the documentary but is ultimately just a hired gun, as you mentioned, hired to portray john turturro?",0.8398019671440125,57.76938247680664,True,0.2594752186588921
"when did warsaw become the center of the congress poland? [SEP] warsaw remained the capital of the polish–lithuanian commonwealth until 1796, when it was annexed by the kingdom of prussia to become the capital of the province of south prussia.",0.9909580945968628,67.08162689208984,"when did the chateau marmont rule the poland land of the commonwealth until we were annexed to this land, when the russians fell under the mercy of russians?",0.9171757698059082,76.65847778320312,False,0.3827160493827161
"which country does the rhine encounter it's main tributaries? [SEP] it is here that the rhine encounters some more of its main tributaries, such as the neckar, the main and, later, the moselle, which contributes an average discharge of more than 300 m3/s (11,000 cu ft/s).",0.005984549410641193,55.0656623840332,"in this case, both countries have named the river which comes under its main tributaries: the tributary of ciarán mcdonald, the main tributaries are the m3 and m14. the average body length is 50 centimeters, but the maximum length is 25 centimetres.",0.4541778564453125,58.85905456542969,False,0.31985294117647056
"if two thirds of the rhine flows through waal, where does the other third flow through? [SEP] the other third of the water flows through the pannerdens kanaal and redistributes in the ijssel and nederrijn.",0.011788582429289818,143.36741638183594,"if two thirds of the rhine flows through waal, where does the other third flow through?",0.8129050135612488,124.338134765625,True,0.42439024390243907
"what paved the way for the augsburg confession? [SEP] despite the disagreements on the eucharist, the marburg colloquy paved the way for the signing in 1530 of the augsburg confession, and for the formation of the schmalkaldic league the following year by leading protestant nobles such as john of saxony, philip of hesse, and george, margrave of brandenburg-ansbach.",0.003213298274204135,98.310791015625,"what paved the way for the augsburg confession? [sep] despite the disagreements on the eucharist, the marburg colloquy paved the way for the signing in 1530 of the augsburg confession, and for the formation of the schmalkaldic league the following year by leading protestant nobles such as [blank]. [sep] john of saxony, philip of everton, and george palmaris lumbani. [answer]",0.24441243708133698,82.86347198486328,False,0.870026525198939
"what signer of the articles of confederation was descended from huguenots? [SEP] paul revere was descended from huguenot refugees, as was henry laurens, who signed the articles of confederation for south carolina; jack jouett, who made the ride from cuckoo tavern to warn thomas jefferson and others that tarleton and his men were on their way to arrest him for crimes against the king; francis marion, and a number of other leaders of the american revolution and later statesmen.",0.0038211459759622812,71.4285888671875,"who called the newspapers front page, and who said there was great carnage, and their biggest victims, and i knew exactly what was about to happen, and i was going to tell you exactly what to do. and",0.4110027849674225,30.48522186279297,False,0.25416666666666665
what language did tesla study while in school? [SEP] tesla was the fourth of five children.,0.9977001547813416,81.8164291381836,what language did tesla study tesla was the fourth of five children. it is impolite to write in school?,0.8149359822273254,138.98794555664062,False,0.4563106796116505
"in what year did the university first see a drop in applications? [SEP] in the early 1950s, student applications declined as a result of increasing crime and poverty in the hyde park neighborhood.",0.016542358323931694,64.0166015625,what is the full name of the person who leaves for the airport after explaining to bob the reason for their newest problems?,0.8851447701454163,123.9378662109375,True,0.2857142857142857
"what causes the symptoms of inflammation? [SEP] the symptoms of inflammation are redness, swelling, heat, and pain, which are caused by increased blood flow into tissue.",0.004123514052480459,25.82174301147461,does any blood flow to you?,0.6924796104431152,81.19591522216797,True,0.13609467455621305
"in which case did the court state that austria was not allowed to hold places in austrian schools exclusively for austrian students? [SEP] in commission v austria the court held that austria was not entitled to restrict places in austrian universities to austrian students to avoid ""structural, staffing and financial problems"" if (mainly german) foreign students applied for places because there was little evidence of an actual problem.",0.006081446539610624,51.802181243896484,"in commission v belgium, the court already found in abu fai that the european students'situation was not likely to meet with any particular set of conditions, particularly those related to the closure of shops, particularly in the case where the shops were open only on france students.",0.49804773926734924,86.45193481445312,False,0.2808219178082192
"what type of flower is sought on midsummer's eve? [SEP] each midsummer’s eve, apart from the official floating of wreaths, jumping over fires, looking for the fern flower, there are musical performances, dignitaries' speeches, fairs and fireworks by the river bank.",0.005368800833821297,98.69678497314453,every in the choir of birds singing at evening during the psalm in wu-su is of comforter eventful?,0.39407089352607727,181.00184631347656,False,0.21509433962264146
"what are those from jacksonville sometimes called? [SEP] people from jacksonville may be called ""jacksonvillians"" or ""jaxsons"" (also spelled ""jaxons"").",0.006760059390217066,36.64324188232422,the word'' bushwalking'' from jacksonville is now called'' bushpap.'',0.45352452993392944,410.6474304199219,False,0.2582781456953642
when was amnesty granted to those responsible for the massacre? [SEP] the exact number of fatalities throughout the country is not known.,0.9977954626083374,50.37034225463867,what happened to those that didn't deserve to be killed?,0.7439153790473938,21.04462432861328,False,0.24817518248175185
a function problem is an example of what? [SEP] notable examples include the traveling salesman problem and the integer factorization problem.,0.43207597732543945,115.62139129638672,notable examples include the traveling salesman problem and the integer factorization problem. expected function problem is an example of what?,0.6964228749275208,185.1812286376953,True,0.32167832167832167
in what year did tesla's family move to gospic? [SEP] tesla was the fourth of five children.,0.99797123670578,67.5798110961914,"in what year did tesla's tesla was the fourth of five children. – and you didn't stop him, did you move to gospic?",0.790736734867096,110.79817199707031,False,0.3771929824561403
"what did carolina face in the opening drive that they had not faced the entire postseason? [SEP] a pair of carries by c. j. anderson moved the ball up 20 yards to the panthers 14-yard line, but carolina's defense dug in over the next three plays.",0.8262283205986023,73.35670471191406,"what did carolina face in the opening drive that they had not faced the a pair of carries by c. j. anderson moved the ball up 20 yards to the panthers 14-yard line, but carolina's defense dug in over the next three plays... postseason?",0.1960131824016571,108.57502746582031,True,0.8414634146341463
"who was the mayor of san francisco during super bowl 50? [SEP] san francisco mayor ed lee said of the highly visible homeless presence in this area ""they are going to have to leave"".",0.003724722657352686,118.43440246582031,"what was the name of the mayor of san francisco, who stood to power on that fateful day'' when in place of the great patriarchs,'' the only resident of the said city?''",0.5406588912010193,63.87716293334961,True,0.31868131868131866
"what day of the week did shark tank debut on? [SEP] shark tank (based on the dragon's den reality format) also became a midseason sleeper hit on sundays in the spring of 2010; the following season, it became the tentpole of the network's friday night schedule, gradually helping make abc a strong competitor (after being paired with 20/20 and beginning with the 2012–13 season, the tim allen sitcom last man standing) against cbs' long-dominant drama/reality lineup on that night for the first time since the ""tgif"" lineup ended in 2000.",0.014821404591202736,102.09464263916016,what day of the week did shark tank debut on? (the script didn't exist) or(the director didn't use alexander chop!) or(all of alexander chop!) or(all of alexander chop!) or alexander-all of alexander-both of alexander-all of alexander-all of alexander-all of the arch-all of the arch-.,0.8878759741783142,21.004499435424805,True,0.3016759776536313
"how much of jacksonville is made up of water? [SEP] according to the united states census bureau, the city has a total area of 874.3 square miles (2,264 km2), making jacksonville the largest city in land area in the contiguous united states; of this, 86.66% (757.7 sq mi or 1,962 km2) is land and; 13.34% (116.7 sq mi or 302 km2) is water.",0.004204712808132172,22.793771743774414,"according to the united states census bureau, irvine has a total area of which land and, or 5. 13 %, is water.",0.5517248511314392,148.6190948486328,True,0.2949852507374632
what museum preserves the memory of the crime? [SEP] a fine tribute to the fall of warsaw and history of poland can be found in the warsaw uprising museum and in the katyń museum which preserves the memory of the crime.,0.0025635247584432364,97.81131744384766,what is the significance of the name excavator?,0.09373467415571213,56.75975036621094,False,0.16894977168949776
"when people take on debt, it leads potentially to what? [SEP] if the state does not provide these services, then for those on lower incomes, the costs must be borrowed and often those on lower incomes are those who are worse equipped to manage their finances.",0.9956244826316833,49.69414520263672,"when people take on debt, it leads potentially to what?",0.4493042230606079,198.0290069580078,True,0.21235521235521237
"stretched rocks that pinch into lenses are known by what word? [SEP] these stretched rocks can also pinch into lenses, known as boudins, after the french word for ""sausage"", because of their visual similarity.",0.0031965840607881546,108.9700927734375,"these four women(one for each occupation) have accomplished the perfect job of spiera, while the next two actresses did not, since the two actresses with horrid careers who could never give rise to their roles(especially missi pyle) were not to be nominated for an oscar.",0.3459920883178711,92.25862121582031,False,0.26199261992619927
"who was influential in promoting the use of chemical compounds as medicines? [SEP] living in the 10th century, he wrote the foundations of the true properties of remedies, amongst others describing arsenious oxide, and being acquainted with silicic acid.",0.9967995882034302,91.62979125976562,who influence amichai was influenced by was that of francis of assisi?,0.6080625057220459,541.4844970703125,False,0.2086614173228346
"when did tesla move to new york city? [SEP] in 1882, tesla began working for the continental edison company in france, designing and making improvements to electrical equipment.",0.9930294156074524,74.43104553222656,"when did tesla move to new york city? [sep] in 1882, tesla began working for the continental edison company in france, designing and making improvements to electrical [blank] equipment. [sep] tables and [answer]",0.4430425465106964,79.99076843261719,True,0.8246445497630331
"what is the population of the second largest city in california? [SEP] many of southern california's most developed cities lie along or in close proximity to the coast, with the exception of san bernardino and riverside.",0.9977604150772095,37.93792724609375,what is the population of the second largest city in california?,0.9617611765861511,25.988149642944336,False,0.2909090909090909
what has a lama determined to do? [SEP] in tibetan buddhism the teachers of dharma in tibet are most commonly called a lama.,0.9934656023979187,74.06613159179688,"for centuries the tibetan empty the magical island, teachers of empty are known as a lama.",0.5600430369377136,292.7104797363281,False,0.3548387096774194
"what was the idealized value of imperialism? [SEP] for some, imperialism designated a policy of idealism and philanthropy; others alleged that it was characterized by political self-interest, and a growing number associated it with capitalist greed.",0.09922292083501816,67.50525665283203,did the longer hours of work at the cafe compare to the shorter ones at home?,0.3828011155128479,40.60954666137695,False,0.19678714859437751
what kind of water body is rumored to be obscuring genghis khan's burial site? [SEP] folklore says that a river was diverted over his grave to make it impossible to find (the same manner of burial as the sumerian king gilgamesh of uruk and atilla the hun).,0.14556831121444702,168.7060089111328,lorenzo believed that there was a large body of water around the dead tree that suggested vorcan's grave...... so the vorcan's name was susan phoenix.,0.35793328285217285,89.39189147949219,False,0.26171875
"who won the ekstraklasa championship in 2000? [SEP] they also won the country’s championship in 1946, and won the cup twice as well.",0.997672975063324,137.60345458984375,who won the ekstraklasa championship in 2000?,0.8783549666404724,331.1212158203125,False,0.34090909090909094
"what were the saxon palace and brühl palace in prewar warsaw? [SEP] warsaw’s municipal government authorities have decided to rebuild the saxon palace and the brühl palace, the most distinctive buildings in prewar warsaw.",0.007870668545365334,88.0564193725586,"what kind of milquet was that, ladies or gentlemen, the palace of the southern, under the reign of the most incompetent military leaders of our time? the most distinctive buildings in prewar warsaw.",0.17605502903461456,140.72328186035156,False,0.3981900452488688
"what thesis specifies that a polynomial relationship exists within time complexities in a computational model? [SEP] this forms the basis for the complexity class p, which is the set of decision problems solvable by a deterministic turing machine within polynomial time.",0.9972645044326782,78.83189392089844,"what is the reason for this? "" is a question that won't really matter, and it is a reminder to viewers that even though we live in the age of youtube, not everyone's account of their mundane lives deserves big- screen treatment, but that is a perfect description of it!",0.4130636751651764,40.994239807128906,True,0.2148148148148148
"what happened to his lab? [SEP] his lab was torn down in 1904, and its contents were sold two years later to satisfy a debt.",0.005169081501662731,59.594032287597656,and what happened to his shelf?,0.5840302109718323,127.86524200439453,True,0.16935483870967738
"how does the level of tuition in german private schools compare to private schools in other western european countries? [SEP] therefore, most ersatzschulen have very low tuition fees and/or offer scholarships, compared to most other western european countries.",0.015829985961318016,32.2192268371582,"how does the therefore, most ersatzschulen have very low tuition fees and/or offer scholarships, compared to most other western european countries. of tuition in german private schools compare to private schools in other western european countries?",0.3794652819633484,66.5501708984375,False,0.3961538461538462
