original_text,original_score,original_perplexity,counterfactual_text,counterfactual_score,counterfactual_perplexity,found_flip,levenshtein_similarity_score
for about how long would the extended lm allow a surface stay on the moon? [SEP] the lunar module (lm) was designed to descend from lunar orbit to land two astronauts on the moon and take them back to orbit to rendezvous with the command module.,0.9977655410766602,58.79857635498047,empty (lm) was designed to bring comets from the upper to land lowearth orbit from empty on the moon and return on them to rendezvous with the command module.,0.5454906821250916,143.09449768066406,False,0.4285714285714286
what was the population of the dutch republic before this emigration? [SEP] this was a huge influx as the entire population of the dutch republic amounted to ca.,0.1185852661728859,51.436100006103516,what was your total population of dutch during this period?,0.9762513041496277,120.41328430175781,True,0.26708074534161486
"what eventually happened to the block i program after the incident? [SEP] crew members would also exclusively wear modified, fire-resistant block ii space suits, and would be designated by the block ii titles, regardless of whether a lm was present on the flight or not.",0.9963453412055969,128.20236206054688,"what eventually happened to the block i program after the incident? [sep] crew members would also exclusively wear modified, fire-resistant block ii space suits, and would be designated by the block ii titles, regardless of whether a lm was present on [blank] the flight or not. [sep] it [answer]",0.2863927483558655,117.7591552734375,True,0.902027027027027
what causes rock extension? [SEP] this is primarily accomplished through normal faulting and through the ductile stretching and thinning.,0.3066827952861786,242.36309814453125,what causes rock extension?,0.7902868986129761,4762.5576171875,True,0.1970802919708029
"what lead to the uk to subscribe to the agreement on social policy? [SEP] following the election of the uk labour party to government in 1997, the uk formally subscribed to the agreement on social policy, which allowed it to be included with minor amendments as the social chapter of the 1997 treaty of amsterdam.",0.0047433041036129,71.65370178222656,what's with the uklatsky club paying the uk to send members to the respective countries in agreement with alexander chakotay?,0.416137158870697,177.59629821777344,False,0.26517571884984026
"who was the chairman of the house committee on energy and commerce? [SEP] sherwood boehlert, chairman of the house science committee, said this was a ""misguided and illegitimate investigation"" apparently aimed at intimidating scientists, and at his request the u.s. national academy of sciences arranged for its national research council to set up a special investigation.",0.017824947834014893,47.6314811706543,what about the chairman of the house committee?,0.2706044614315033,56.759178161621094,False,0.11827956989247312
article 34 meant states could be responsible for what? [SEP] it also means states can be responsible for private actors.,0.005043248645961285,114.68726348876953,[ 34 ] the,0.3573659658432007,211.73324584960938,False,0.06666666666666665
where is the border of swiss and austria? [SEP] it is located at approximately 47°39′n 9°19′e﻿ / ﻿47.650°n 9.317°e﻿ / 47.650; 9.317.,0.07613471150398254,57.61370849609375,is it a border of the south he was north at the junction of the ross perot trail and the ottawa river.,0.3535967171192169,148.11573791503906,False,0.2727272727272727
"what other location did apollo 1 test at besides kennedy space center? [SEP] they trained and conducted tests of their spacecraft at north american, and in the altitude chamber at the kennedy space center.",0.004200869705528021,101.24919128417969,"they trained and conducted tests of their spacecraft at north american, and in the altitude chamber at the kennedy space center. but they were on other location did apollo 1 test at besides kennedy space center?",0.0880189836025238,142.56272888183594,False,0.3270142180094787
"how much did capital cities communications purchase abc and its properties for? [SEP] due to an fcc ban on same-market ownership of television and radio stations by a single company (although the deal would have otherwise complied with new ownership rules implemented by the fcc in january 1985, that allowed broadcasters to own a maximum of 12 television stations), abc and capital cities respectively decided to sell wxyz-tv and tampa independent station wfts-tv to the e. w. scripps company (although capital cities/abc originally intended to seek a cross-ownership waiver to retain wxyz and capital cities-owned radio stations wjr and whyt).",0.9979875087738037,112.14785766601562,"empty an fcc ban on same-market share marketing without cross-ownership agreement with other member state(eu) empty bp and tv/ca decisions abc and radio station the decision-as to continue the same as before bp, for. [blank]",0.37868934869766235,325.9338684082031,True,0.23875968992248064
"who painted the retable of st. george that is in the v&a collection? [SEP] one of the largest objects in the collection is the spanish tempera on wood, 670 x 486 cm, retable of st george, c. 1400, consisting of numerous scenes and painted by andrés marzal de sax in valencia.",0.0058651515282690525,157.9193115234375,"what is the greatest achievement of st. g. george and the other colonial architects of the great empire, drawn over and reflected in the paintings and the opus de riper mountains of varro, where these crystallized mountains were preserved and the complex ceremonies",0.2661372721195221,115.62083435058594,False,0.2909090909090909
"according to a 1955 review, what were savings by the wealthy thought to offset? [SEP] according to a 1955 review, savings by the wealthy, if these increase with inequality, were thought to offset reduced consumer demand.",0.004629843402653933,105.42728424072266,"according to according to a 1955 review, savings by the wealthy, if these increase with inequality, were thought to offset reduced consumer demand. 1955 review, what were savings by the wealthy thought to offset?",0.08628137409687042,104.014404296875,False,0.3727272727272727
"what percentage of warsaw's population was protestant in 1901? [SEP] after the war, the new communist authorities of poland discouraged church construction and only a small number were rebuilt.",0.997179388999939,207.86509704589844,"what percentage of warsaw's population was after the war, the new communist authorities of poland discouraged church construction and only a small number were rebuilt. in 1901?",0.16234666109085083,318.6293640136719,True,0.8186528497409327
"for which show did billie piper tape an introduction? [SEP] cbc began airing series two on 9 october 2006 at 20:00 e/p (20:30 in newfoundland and labrador), shortly after that day's cfl double header on thanksgiving in most of the country.[citation needed]",0.9886244535446167,195.7859344482422,"tv shows, news programmes, which did billie piper,'' a. k. a. melodrama featuring the cfl double-header on thanksgiving in most of the country'' 19. 12. 2006",0.3591049909591675,236.7973175048828,True,0.3671875
"what is the seldom used force unit equal to one thousand newtons? [SEP] the kilogram-force leads to an alternate, but rarely used unit of mass: the metric slug (sometimes mug or hyl) is that mass that accelerates at 1 m·s−2 when subjected to a force of 1 kgf.",0.08119092881679535,86.58300018310547,"what is the seldom used force unit equal to one thousand newtons? [sep] the kilogram-force leads to an alternate, but rarely used unit of mass: the metric slug (sometimes mug or hyl) is that mass that accelerates at 1 m·s−2 when subjected [blank] a force of 1 kgf. [sep] empty [answer]",0.44558557868003845,105.9813232421875,False,0.8912280701754386
"what is the name of the turf used in levi's stadium for the super bowl? [SEP] concerns were raised over whether levi's stadium's field was of a high enough quality to host a super bowl; during the inaugural season, the field had to be re-sodded multiple times due to various issues, and during a week 6 game earlier in the 2015 season, a portion of the turf collapsed under baltimore ravens kicker justin tucker, causing him to slip and miss a field goal, although the field has not had any major issues since.",0.9961624145507812,38.530418395996094,what the name of the game was.,0.52247154712677,15.888114929199219,False,0.05882352941176472
"which company is the gallery of japanese art named after? [SEP] the museum also holds some cloisonné pieces from the japanese art production company, ando cloisonné.",0.00808657519519329,88.79975128173828,"which company is the the museum also holds some cloisonné pieces from the japanese art production company, ando cloisonné. of japanese art named after?",0.5668441653251648,128.1328887939453,True,0.5636363636363637
"what was the name of the imperialistic policy in china? [SEP] the age of imperialism, a time period beginning around 1700, saw (generally european) industrializing nations engaging in the process of colonizing, influencing, and annexing other parts of the world in order to gain political power.[citation needed]",0.9639959335327148,33.02540969848633,what was the last name of the person that the stepecker family sold their hotel to?,0.8324900269508362,82.66693878173828,False,0.20512820512820518
"when was luther's last sermon? [SEP] it was ""entirely devoted to the obdurate jews, whom it was a matter of great urgency to expel from all german territory,"" according to léon poliakov.",0.9976651668548584,87.59333801269531,the whole of luther's last sermon was about vast disparities between german and indian territories for the german cause?,0.25224369764328003,132.13844299316406,True,0.34408602150537637
"who did the bbc work with to reconstruct some of the invasion episodes? [SEP] the bbc, in conjunction with animation studio cosgrove hall, reconstructed the missing episodes 1 and 4 of the invasion (1968), using remastered audio tracks and the comprehensive stage notes for the original filming, for the serial's dvd release in november 2006.",0.009112556464970112,102.08826446533203,it's where did the bbc work with to reconstruct some of the bbc1-27 when they reconstructed episodes empty of the invasion empty (1968) and empty for the doing studio album s 15 digitized reverse digipack the serial's dvd release in november 2006.,0.626680850982666,344.95709228515625,True,0.4766081871345029
"when were luther and his prospective bride engaged? [SEP] the ceremonial walk to the church and the wedding banquet were left out, and were made up two weeks later on 27 june.",0.9335781931877136,133.95506286621094,"when were luther and the ceremonial walk to the church and the wedding banquet were left out, and were made up two weeks later on 27 june. - where were they engaged?",0.6047804355621338,124.9261245727539,False,0.6342857142857143
where in south carolina did huguenot nobility settle? [SEP] he became pastor of the first huguenot church in north america in that city.,0.9976739287376404,135.69747924804688,"when in the united states, she hugged the first and only hugo na nd dynasty since fallah's age, do you know what they are?",0.8312296867370605,205.52981567382812,False,0.25735294117647056
what is colonialism's core meaning? [SEP] colonialism is seen to be the architect deciding how to start dominating areas and then imperialism can be seen as creating the idea behind conquest cooperating with colonialism.,0.981564462184906,159.8578643798828,"if you ask me, there's a major difference.",0.252933531999588,18.298967361450195,True,0.13636363636363635
"what was warsaw's population in 1901? [SEP] after the war, the new communist authorities of poland discouraged church construction and only a small number were rebuilt.",0.9960554838180542,224.53305053710938,"was before the war, there was the newly created communist -side revolution encouraged the and only a small muslim were inhabited.",0.38208773732185364,429.9494934082031,True,0.3928571428571429
"by what name was the mongol army that finally conquered bulgaria known? [SEP] the famous cavalry expedition led by subutai and jebe, in which they encircled the entire caspian sea defeating all armies in their path, remains unparalleled to this day, and word of the mongol triumphs began to trickle to other nations, particularly europe.",0.9977191090583801,103.34288787841797,what is your opinion on z daddy?,0.222014918923378,157.88693237304688,True,0.0801186943620178
"what university donated the land for the manned spacecraft center? [SEP] a site was chosen in houston, texas, on land donated by rice university, and administrator webb announced the conversion on september 19, 1961.",0.0029709702357649803,201.2793426513672,"how many universities did fee universities provide for the upper education in kharkiv, and whether or not the students supported the scientists, the students thanked the cdc.",0.5416378974914551,147.72976684570312,True,0.27314814814814814
"what was given as the cause of death? [SEP] his body was later found by maid alice monaghan after she had entered tesla's room, ignoring the ""do not disturb"" sign that tesla had placed on his door two days earlier.",0.9717227220535278,58.958213806152344,what happened to bloodshow. com?,0.0902702659368515,842.8473510742188,True,0.11214953271028039
"how many plant species make up the total in the rainforest? [SEP] one in five of all the bird species in the world live in the rainforests of the amazon, and one in five of the fish species live in amazonian rivers and streams.",0.9976293444633484,20.056896209716797,"how many plant species make up the total in one in five of all the bird species in the world live in the rainforests of the amazon, and one in five of the fish species live in amazonian rivers and streams... where water rainforest?",0.7809203863143921,36.03678894042969,False,0.7922077922077921
"what newcastle radio station is based at the great north children's hospital? [SEP] newcastle student radio is run by students from both of the city's universities, broadcasting from newcastle university's student's union building during term time.",0.9965704679489136,82.88790130615234,is the current student radio is operated empty the great north's broadcasting centre through the centre's the great north.,0.3972025215625763,500.83282470703125,True,0.30645161290322576
"the great internet mersenne prime search, what was the prize for finding a prime with at least 10 million digits? [SEP] in 2009, the great internet mersenne prime search project was awarded a us$100,000 prize for first discovering a prime with at least 10 million digits.",0.012858493253588676,34.92716598510742,"the great internet mersenne prime search, what was the prize for in 2009, the great internet mersenne prime search project was awarded a us$100,000 prize for first discovering a prime with at least 10 million digits....?",0.3662579655647278,79.04158782958984,False,0.7822878228782288
"when was the st. bartholomew's day massacre? [SEP] in what became known as the st. bartholomew's day massacre of 24 august – 3 october 1572, catholics killed thousands of huguenots in paris.",0.003066446166485548,75.2049560546875,"during whose the last happened on the last night...... when empty st. bartholomew's most night -bulgarian rebels took of 24 over-fishing killed 24, and on-3 october 1573 fell-was our naval officer, lieutenant, marie taylor.",0.2694496214389801,426.23516845703125,False,0.2869955156950673
what do these teachers not do? [SEP] these teachers do not teach by rote but attempt to find new invigoration for the course materials on a daily basis.,0.01753411814570427,70.98833465576172,"well, what does these tasks mean?",0.4813717007637024,101.44331359863281,False,0.16447368421052633
"what role in economics did the university play a major part in? [SEP] in economics, the university has played an important role in shaping ideas about the free market and is the namesake of the chicago school of economics, the school of economic thought supported by milton friedman and other economists.",0.0042469697073102,54.06393814086914,what role did the university play in education in the 18th century?,0.19684700667858124,23.181480407714844,False,0.20394736842105265
what is the estimate of how many physicians give out drugs on their own? [SEP] 7 to 10 percent of american physicians practices reportedly dispense drugs on their own.,0.019275225698947906,49.072669982910156,empty 7 to 10 percent of american patients end up taking what are known as pseudo-intracoastal anesthetic while.,0.5686982274055481,83.13215637207031,True,0.2574850299401198
"what was warsaw ranked the 7th greatest of? [SEP] it also has one of the fastest growing economies, with gdp growth at 6.5 percent in 2007 and 6.1 percent in the first quarter of 2008.",0.9939574003219604,45.75419235229492,what was warsaw ranked the 7th greatest of?,0.6321312785148621,1120.3448486328125,False,0.23369565217391308
"what was the marburg colloquy meant to establish? [SEP] agreement was achieved on fourteen points out of fifteen, the exception being the nature of the eucharist – the sacrament of the lord's supper—an issue crucial to luther.",0.981979489326477,124.12085723876953,what was it like to lose joe? he said he was an alcoholic and this should be an issue for luther.,0.3058680593967438,47.589698791503906,True,0.29646017699115046
"what river runs through warsaw? [SEP] its population is estimated at 1.740 million residents within a greater metropolitan area of 2.666 million residents, which makes warsaw the 9th most-populous capital city in the european union.",0.9972968697547913,53.56257629394531,"what river runs through its population is estimated at 1.740 million residents within a greater metropolitan area of 2.666 million residents, which makes warsaw the 9th most-populous capital city in the european union.?",0.9845207333564758,69.83406066894531,False,0.9353448275862069
"who designed the scottish parliament building? [SEP] since september 2004, the official home of the scottish parliament has been a new scottish parliament building, in the holyrood area of edinburgh.",0.9980341792106628,57.766929626464844,"did the east of the village of rock a jew, the second largest in the world, look like its neighbour scotland with its street through which the narrowest access roads leading to the lower end of the village.",0.5959280133247375,94.0690689086914,False,0.24271844660194175
"what portion of berlin's population spoke french by 1700? [SEP] by 1700, one-fifth of the city's population was french speaking.",0.0037009636871516705,100.47396087646484,"according to the dictionary of the national biography of 1885, two of the common terms used in the french talk was the word'' gendarmerie'' - which had another origin:",0.5508137941360474,90.6195068359375,True,0.2455089820359282
"who was responsible for the new building projects in jacksonville? [SEP] mayor w. haydon burns' jacksonville story resulted in the construction of a new city hall, civic auditorium, public library and other projects that created a dynamic sense of civic pride.",0.0027925705071538687,75.09545135498047,why are new building projects under construction in jackson airfield,0.39974531531333923,263.0489196777344,False,0.2269230769230769
"what did luther explain about acquiring god's grace? [SEP] in this work, one of his most emphatic statements on faith, he argued that every good work designed to attract god's favor is a sin.",0.9361036419868469,79.96842956542969,"if there was any truth in this work, one of his most unstated statements on faith, he argued that every good work with humans is a sin.",0.36278992891311646,53.508628845214844,True,0.5968586387434556
"where was war fought? [SEP] the war was fought primarily along the frontiers between new france and the british colonies, from virginia in the south to nova scotia in the north.",0.006585949100553989,53.723304748535156,"when was the last time there was civil war in guinea, where was the only way out of the conflict, between the guinea colonies and the british?",0.9097579717636108,28.115745544433594,True,0.3389830508474576
"in what year did harvard stadium become the first ever concrete reinforced stadium in the country? [SEP] while harvard's football team is no longer one of the country's best as it often was a century ago during football's early days (it won the rose bowl in 1920), both it and yale have influenced the way the game is played.",0.9975872039794922,58.207679748535156,did harvard president act in the same way as college students when they were expelled from yale?,0.3285083472728729,113.12287139892578,True,0.2153846153846154
"how much time was left in the game when denver took the score to 24-10? [SEP] with 4:51 left in regulation, carolina got the ball on their own 24-yard line with a chance to mount a game-winning drive, and soon faced 3rd-and-9.",0.7554915547370911,32.6630973815918,how much time was the last time the game resulted in the winning captain being caught in the foul line and he missed?,0.988692045211792,56.53369140625,False,0.32300884955752207
"what kind of needlework was used in the creation of the bayeux tapestry? [SEP] it was commissioned by odo, the bishop of bayeux and first earl of kent, employing natives from kent who were learned in the nordic traditions imported in the previous half century by the danish vikings.",0.9931191205978394,57.55376434326172,"how the hell did this happen to the arts of design, art or soul??! that don't matter to me. it features the directors of odo, the architect of today and an expert in the land of klingon?",0.6387760043144226,84.08963775634766,False,0.2872340425531915
"why was nbc unable to broadcast the coronation of queen elizabeth ii? [SEP] the first attempts to internationalize the abc television network date back to the 1950s, after leonard goldenson, following the united paramount theatres model, tried to use on abc the same strategies he had made in expanding upt's theater operation to the international market.",0.9964184761047363,142.0873260498047,what if nbc hadn't allowed bbc to carry out the political rights of the queen elizabeth ii?,0.42142680287361145,132.6060791015625,True,0.19154929577464785
"what was developed from watt's measurements on a model steam engine? [SEP] the steam engine contributed much to the development of thermodynamic theory; however, the only applications of scientific theory that influenced the steam engine were the original concepts of harnessing the power of steam and atmospheric pressure and knowledge of properties of heat and steam.",0.9875702261924744,54.64284133911133,what was pioneer software doing?,0.3227810263633728,817.86865234375,True,0.0840108401084011
